TRIFID,LONGITUDE,LATITUDE,ESTIMATE,STATEFP,COUNTYFP,TRACTCE,STATEGEOID,COUNTYGEOID,TRACTGEOID,AFFGEOID,FACILITY_NAME,STREET,CITY,STUSPS,ZIP_CODE,FACILITY,FAC_CLOSED_IND,ASGN_FEDERAL_IND,BIA_CODE,EPA_REGISTRY_ID
99611CHVRNMILE2,-151.36700000000002,60.684,False,02,122,000200,02,02122,02122000200,1400000US02122000200,"CHEVRON USA INC., ALASKA REFY.",MILE 22.5 N. RD.,KENAI,AK,99611,"CHEVRON USA INC., ALASKA REFY..MILE 22.5 N. RD., KENAI ALASKA 99611 (KENAI PENINSULA BOROUGH)",1,C,,
99611NCLCHMILE2,-151.379,60.674,False,02,122,000200,02,02122,02122000200,1400000US02122000200,AGRIUM KENAI NITROGEN OPERATIO NS,MILE 21 KENAI SPUR HWY,KENAI,AK,99611,"AGRIUM KENAI NITROGEN OPERATIO NS.MILE 21 KENAI SPUR HWY, KENAI ALASKA 99611 (KENAI PENINSULA BOROUGH)",0,C,,110030488620
99611TSRLSMILE2,-151.36700000000002,60.684,False,02,122,000200,02,02122,02122000200,1400000US02122000200,TESORO ALASKA - KENAI REFINERY,3600 KENAI SPUR HWY,KENAI,AK,99611,"TESORO ALASKA - KENAI REFINERY.3600 KENAI SPUR HWY, KENAI ALASKA 99611 (KENAI PENINSULA BOROUGH)",0,C,,110017413299
99611KNPPLMILE2,-151.393,60.68600000000001,False,02,122,000200,02,02122,02122000200,1400000US02122000200,KENAI PIPE LINE COMPANY-KPL FACILITY,MILE 22.5 KENAI SPUR HWY,KENAI,AK,99611,"KENAI PIPE LINE COMPANY-KPL FACILITY.MILE 22.5 KENAI SPUR HWY, KENAI ALASKA 99611 (KENAI PENINSULA BOROUGH)",0,C,,110064436052
99611TSRLSMILE1,-151.388,60.678999999999995,False,02,122,000200,02,02122,02122000200,1400000US02122000200,TESORO LOGISTICS GP LLC-NIKISKI TERMINAL,MILE 19 KENAI SPUR HWY,KENAI,AK,99611,"TESORO LOGISTICS GP LLC-NIKISKI TERMINAL.MILE 19 KENAI SPUR HWY, KENAI ALASKA 99611 (KENAI PENINSULA BOROUGH)",0,C,,110007919547
99705MPCLS1100H,-147.34799999999998,64.737,False,02,090,001600,02,02090,02090001600,1400000US02090001600,FLINT HILLS RESOURCES ALASKA LLC,1100 H&H LN,NORTH POLE,AK,99705,"FLINT HILLS RESOURCES ALASKA LLC.1100 H&H LN, NORTH POLE ALASKA 99705 (FAIRBANKS NORTH STAR BOROUGH)",0,C,,110044875668
99705PTRST1200H,-147.345,64.733,False,02,090,001600,02,02090,02090001600,1400000US02090001600,PETRO STAR INC NORTH POLE REFINERY,1200 H & H LN,NORTH POLE,AK,99705,"PETRO STAR INC NORTH POLE REFINERY.1200 H & H LN, NORTH POLE ALASKA 99705 (FAIRBANKS NORTH STAR BOROUGH)",0,C,,110055089149
9970WGLDNV119HH,-147.349,64.736,False,02,090,001600,02,02090,02090001600,1400000US02090001600,GOLDEN VALLEY ELECTRIC ASSOC NORTH POLE POWER PLANT,1150 H & H LN,NORTH POLE,AK,99705,"GOLDEN VALLEY ELECTRIC ASSOC NORTH POLE POWER PLANT.1150 H & H LN, NORTH POLE ALASKA 99705 (FAIRBANKS NORTH STAR BOROUGH)",0,C,,110064086509
9970WMLSNP25HLL,-147.393,64.763,False,02,090,001600,02,02090,02090001600,1400000US02090001600,EMULSION PRODUCTS CO - NORTH POLE FACILITY,2500 HOLLAND AVIATION STREET,NORTH POLE,AK,99705,"EMULSION PRODUCTS CO - NORTH POLE FACILITY.2500 HOLLAND AVIATION STREET, NORTH POLE ALASKA 99705 (FAIRBANKS NORTH STAR BOROUGH)",0,C,,110039075489
99835LSKPLMILE6,-135.233,57.048,False,02,220,000100,02,02220,02220000100,1400000US02220000100,ALASKA PULP CORP,4600 SAWMILL CREEK RD,SITKA,AK,998359798,"ALASKA PULP CORP.4600 SAWMILL CREEK RD, SITKA ALASKA 99835 (SITKA)",0,C,,
99901KTCHKMILE7,-131.727,55.408,False,02,130,000100,02,02130,02130000100,1400000US02130000100,KETCHIKAN PULP CO,7559 N TONGASS HWY,KETCHIKAN,AK,99901,"KETCHIKAN PULP CO.7559 N TONGASS HWY, KETCHIKAN ALASKA 99901 (KETCHIKAN GATEWAY BOROUGH)",0,C,,
99692NSNCXPOUCH,-166.55200000000002,53.878,False,02,016,000200,02,00000,02016000200,1400000US02016000200,UNISEA INC,88 SALMON WAY,DUTCH HARBOR,AK,99692,"UNISEA INC.88 SALMON WAY, DUTCH HARBOR ALASKA 99692 (ALEUTIANS WEST CENSUS ARE)",0,C,,110064064408
99686PTRST25MIL,-146.251,61.083999999999996,False,02,261,000300,02,02261,02261000300,1400000US02261000300,PETRO STAR VALDEZ REFINERY,2.5 MILE DAYVILLE RD,VALDEZ,AK,99686,"PETRO STAR VALDEZ REFINERY.2.5 MILE DAYVILLE RD, VALDEZ ALASKA 99686 (VALDEZ-CORDOVA CENSUS AREA)",0,C,,110041977162
99693SDFNSWHITT,-148.725,60.778,False,02,261,000300,02,02261,02261000300,1400000US02261000300,U.S. DEFENSE LOGISTICS AGENCY WHITTIER FUEL SUPPORT POINT,WHITTIER TERMINAL,WHITTIER,AK,99693,"U.S. DEFENSE LOGISTICS AGENCY WHITTIER FUEL SUPPORT POINT.WHITTIER TERMINAL, WHITTIER ALASKA 99693 (VALDEZ-CORDOVA CENSUS AREA)",0,F,,
99501SDFNS1217P,-149.89,61.233999999999995,False,02,020,000500,02,02020,02020000500,1400000US02020000500,U.S. DEFENSE LOGISTICS AGENCY ANCHORAGE FUEL SUPPORT POINT,1217 PORT RD.,ANCHORAGE,AK,99501,"U.S. DEFENSE LOGISTICS AGENCY ANCHORAGE FUEL SUPPORT POINT.1217 PORT RD., ANCHORAGE ALASKA 99501 (ANCHORAGE MUNICIPALITY)",0,F,,
99501MPCLS1076O,-149.893,61.23,False,02,020,000500,02,02020,02020000500,1400000US02020000500,TESORO LOGISTICS GP LLC-ANCHORAGE TERMINAL,1076 OCEAN DOCK RD,ANCHORAGE,AK,99501,"TESORO LOGISTICS GP LLC-ANCHORAGE TERMINAL.1076 OCEAN DOCK RD, ANCHORAGE ALASKA 99501 (ANCHORAGE MUNICIPALITY)",0,C,,110000491735
99501NCHRG459WB,-149.888,61.231,False,02,020,000500,02,02020,02020000500,1400000US02020000500,CHEVRON PRODS CO ANCHORAGE TERMINAL,459 W BLUFF DR,ANCHORAGE,AK,99501,"CHEVRON PRODS CO ANCHORAGE TERMINAL.459 W BLUFF DR, ANCHORAGE ALASKA 99501 (ANCHORAGE MUNICIPALITY)",0,C,,
99501QLNNC1601T,-149.887,61.235,False,02,020,000500,02,02020,02020000500,1400000US02020000500,EQUILON ANCHORAGE TERMINAL,1601 TIDEWATER RD,ANCHORAGE,AK,99501,"EQUILON ANCHORAGE TERMINAL.1601 TIDEWATER RD, ANCHORAGE ALASKA 99501 (ANCHORAGE MUNICIPALITY)",2,C,,110000498131
99501TSRLS1522P,-149.893,61.23,False,02,020,000500,02,02020,02020000500,1400000US02020000500,PETROSTAR INC - PORT OF ALASKA TERMINAL,1522 PORT ROAD,ANCHORAGE,AK,99501,"PETROSTAR INC - PORT OF ALASKA TERMINAL.1522 PORT ROAD, ANCHORAGE ALASKA 99501 (ANCHORAGE MUNICIPALITY)",0,C,,110000491735
99506SDDSF11530,-149.7,61.258,False,02,020,000300,02,02020,02020000300,1400000US02020000300,US DOD USAF JOINT BASE ELMENDORF-RICHARDSON,6326 ARCTIC WARRIOR DR,JBER,AK,995063221,"US DOD USAF JOINT BASE ELMENDORF-RICHARDSON.6326 ARCTIC WARRIOR DR, JBER ALASKA 99506 (ANCHORAGE MUNICIPALITY)",0,F,,110060333928
99505SRMYF730QU,-149.7,61.258,False,02,020,000300,02,02020,02020000300,1400000US02020000300,US DOD USAF JOINT BASE ELMENDORF-RICHARDSON TRAINING RANGES,6326 ARCTIC WARRIOR DR,JBER,AK,995064500,"US DOD USAF JOINT BASE ELMENDORF-RICHARDSON TRAINING RANGES.6326 ARCTIC WARRIOR DR, JBER ALASKA 99506 (ANCHORAGE MUNICIPALITY)",0,F,,110060333928
99660NSBRGNWHAR,-170.275,57.128,False,02,016,000100,02,00000,02016000100,1400000US02016000100,UNISEA BARGE,N.W. HARBOR ARM VILLAGE COVE,SAINT PAUL ISLAND,AK,99660,"UNISEA BARGE.N.W. HARBOR ARM VILLAGE COVE, SAINT PAUL ISLAND ALASKA 99660 (ALEUTIANS WEST CENSUS ARE)",1,C,,
99660TRDNTSAINT,-170.28400000000002,57.123999999999995,False,02,016,000100,02,00000,02016000100,1400000US02016000100,TRIDENT SEAFOODS / ST PAUL,909 HARBOR VIEW DR,SAINT PAUL ISLAND,AK,99660,"TRIDENT SEAFOODS / ST PAUL.909 HARBOR VIEW DR, SAINT PAUL ISLAND ALASKA 99660 (ALEUTIANS WEST CENSUS ARE)",0,C,,110021284812
99506SRFRCEAREC,174.108,52.722,False,02,016,000100,02,00000,02016000100,1400000US02016000100,US DOD USAF EARECKSON AIR STATION,EARECKSON AIR STATION,SHEMYA ISLAND,AK,99666,"US DOD USAF EARECKSON AIR STATION.EARECKSON AIR STATION, SHEMYA ISLAND ALASKA 99666 (ALEUTIANS WEST CENSUS ARE)",0,F,,110012177429
9954WWSTRN1SUPP,-176.635,51.864,False,02,016,000100,02,00000,02016000100,1400000US02016000100,WESTERN STAR SEAFOODS INC - ADAK FACILITY,100 SUPPLY RD,ADAK,AK,99546,"WESTERN STAR SEAFOODS INC - ADAK FACILITY.100 SUPPLY RD, ADAK ALASKA 99546 (ALEUTIANS WEST CENSUS ARE)",0,C,,110055500266
99704SRFRC200AS,-149.162,64.292,False,02,068,000100,02,02068,02068000100,1400000US02068000100,US DOD USAF CLEAR AFS,200 A ST,CLEAR,AK,99704,"US DOD USAF CLEAR AFS.200 A ST, CLEAR ALASKA 99704 (DENALI BOROUGH)",0,F,,110002151340
99743HLYPW25MIL,-148.94899999999998,63.856,False,02,068,000100,02,02068,02068000100,1400000US02068000100,GOLDEN VALLEY ELECTRIC ASSOC HEALY POWER PLANT,25 HEALY SPUR RD,HEALY,AK,99743,"GOLDEN VALLEY ELECTRIC ASSOC HEALY POWER PLANT.25 HEALY SPUR RD, HEALY ALASKA 99743 (DENALI BOROUGH)",0,C,,110000602250
9974WSBLLC1RIVE,-148.936,63.908,False,02,068,000100,02,02068,02068000100,1400000US02068000100,USIBELLI COAL MINE INC,100 RIVER ROAD,HEALY,AK,99743,"USIBELLI COAL MINE INC.100 RIVER ROAD, HEALY ALASKA 99743 (DENALI BOROUGH)",0,C,,110002042897
9975WDNLNTPBX16,-148.921,63.733000000000004,False,02,068,000100,02,02068,02068000100,1400000US02068000100,DENALI NATIONAL PARK & PRESERVE,P.O. BOX 9,DENALI NATIONAL PARK,AK,997550009,"DENALI NATIONAL PARK & PRESERVE.P.O. BOX 9, DENALI NATIONAL PARK ALASKA 99755 (DENALI BOROUGH)",0,F,,110046371626
99741SRFRCGALEN,-156.946,64.73899999999999,False,02,290,000300,02,02290,02290000300,1400000US02290000300,U.S. AIR FORCE GALENA AIR STATION,BUILDING 1854  GALENA AIRPORT,GALENA,AK,99741,"U.S. AIR FORCE GALENA AIR STATION.BUILDING 1854  GALENA AIRPORT, GALENA ALASKA 99741 (YUKON-KOYUKUK)",0,F,,
99501LLNSC646W4,-157.924,64.038,False,02,290,000300,02,02020,02290000300,1400000US02290000300,ILLINOIS CREEK MINE,300 MILES N OF ANCHORAGE,ANCHORAGE,AK,99501,"ILLINOIS CREEK MINE.300 MILES N OF ANCHORAGE, ANCHORAGE ALASKA 99501 (ANCHORAGE MUNICIPALITY)",0,C,,
99613SRFRCKINGS,-156.671,58.693000000000005,False,02,060,000100,02,02060,02060000100,1400000US02060000100,CHUGACH DEVELOPMENT CORP US AIR FORCE KING SALMON,KING SALMON AIRPORT,KING SALMON,AK,99613,"CHUGACH DEVELOPMENT CORP US AIR FORCE KING SALMON.KING SALMON AIRPORT, KING SALMON ALASKA 99613 (BRISTOL BAY BOROUGH)",1,C,,
99613SRFRCKINGA,-156.671,58.693000000000005,False,02,060,000100,02,02060,02060000100,1400000US02060000100,U.S. AIR FORCE KING SALMON  AK,KING SALMON AIR STATION BLDG 603,KING SALMON,AK,99613,"U.S. AIR FORCE KING SALMON  AK.KING SALMON AIR STATION BLDG 603, KING SALMON ALASKA 99613 (BRISTOL BAY BOROUGH)",0,F,,
99515VNWTR590E1,-149.872,61.129,False,02,020,002712,02,02020,02020002712,1400000US02020002712,UNIVAR USA INC,590 E 100TH AVE,ANCHORAGE,AK,99515,"UNIVAR USA INC.590 E 100TH AVE, ANCHORAGE ALASKA 99515 (ANCHORAGE MUNICIPALITY)",0,C,,110000491762
99515NCHRG11155,-149.874,61.121,False,02,020,002712,02,02020,02020002712,1400000US02020002712,ANCHORAGE SAND & GRAVEL CO INC,11155 LANG ST,ANCHORAGE,AK,99515,"ANCHORAGE SAND & GRAVEL CO INC.11155 LANG ST, ANCHORAGE ALASKA 99515 (ANCHORAGE MUNICIPALITY)",0,C,,110031019975
99627NXNFR32MIL,-154.767,63.238,False,02,290,000400,02,02290,02290000400,1400000US02290000400,NIXON FORK PROJECT,32 MILES N.E. OF MCGRATH,MC GRATH,AK,99627,"NIXON FORK PROJECT.32 MILES N.E. OF MCGRATH, MC GRATH ALASKA 99627 (YUKON-KOYUKUK)",0,C,,
99707FRTKN1FORA,-147.358,65.0,False,02,090,001900,02,02090,02090001900,1400000US02090001900,FORT KNOX MINE,1 FORT KNOX RD,FAIRBANKS,AK,99712,"FORT KNOX MINE.1 FORT KNOX RD, FAIRBANKS ALASKA 99712 (FAIRBANKS NORTH STAR BOROUGH)",0,C,,110003037883
99712TRNRT1TWIN,-147.559,65.045,False,02,090,001900,02,02090,02090001900,1400000US02090001900,TRUE NORTH MINE,1 TWIN CREEK RD,FAIRBANKS,AK,99712,"TRUE NORTH MINE.1 TWIN CREEK RD, FAIRBANKS ALASKA 99712 (FAIRBANKS NORTH STAR BOROUGH)",0,C,,
99707FRTKN1FORT,-147.885,64.811,False,02,090,001000,02,02090,02090001000,1400000US02090001000,FLINT HILLS RESOURCES ALASKA LLC FAIRBANKS TERMINAL,5500 AIRPORT WAY,FAIRBANKS,AK,99709,"FLINT HILLS RESOURCES ALASKA LLC FAIRBANKS TERMINAL.5500 AIRPORT WAY, FAIRBANKS ALASKA 99709 (FAIRBANKS NORTH STAR BOROUGH)",0,C,,110000491780
99701GRTWS4199S,-147.74200000000002,64.804,False,02,090,001000,02,02090,02090001000,1400000US02090001000,BRENNTAG PACIFIC INC,4199 S LATHROP ST,FAIRBANKS,AK,99701,"BRENNTAG PACIFIC INC.4199 S LATHROP ST, FAIRBANKS ALASKA 99701 (FAIRBANKS NORTH STAR BOROUGH)",0,C,,110000517940
99752RDDGP13MIL,-164.048,67.581,False,02,188,000100,02,02188,02188000100,1400000US02188000100,DELONG MOUNTAIN TRANSPORTATION FACILITY PORT SITE,13 MILES SW OF KIVALINA,KOTZEBUE,AK,99752,"DELONG MOUNTAIN TRANSPORTATION FACILITY PORT SITE.13 MILES SW OF KIVALINA, KOTZEBUE ALASKA 99752 (NORTHWEST ARCTIC BOROUGH)",0,C,,110002465779
99752RDDGP90MIL,-162.855,68.062,False,02,188,000100,02,02188,02188000100,1400000US02188000100,RED DOG OPERATIONS,90 MILES N OF KOTZEBUE,KOTZEBUE,AK,99752,"RED DOG OPERATIONS.90 MILES N OF KOTZEBUE, KOTZEBUE ALASKA 99752 (NORTHWEST ARCTIC BOROUGH)",0,C,,110000601705
99801KNNCT13401,-134.641,58.082,False,02,110,000600,02,00000,02110000600,1400000US02110000600,HECLA GREENS CREEK MINING CO,13401 GLACIER HWY,JUNEAU,AK,99801,"HECLA GREENS CREEK MINING CO.13401 GLACIER HWY, JUNEAU ALASKA 99801 (JUNEAU BOROUGH)",0,C,,110032882735
99901TSRLS1010S,-131.628,55.335,False,02,130,000300,02,02130,02130000300,1400000US02130000300,TESORO ALASKA CO. KETCHIKAN TERMINAL,1010 STEDMAN ST.,KETCHIKAN,AK,99901,"TESORO ALASKA CO. KETCHIKAN TERMINAL.1010 STEDMAN ST., KETCHIKAN ALASKA 99901 (KETCHIKAN GATEWAY BOROUGH)",0,C,,
99901SCSTG1300S,-131.625,55.333999999999996,False,02,130,000300,02,02130,02130000300,1400000US02130000300,US COAST GUARD BASE KETCHIKAN,1300 STEDMAN ST,KETCHIKAN,AK,99901,"US COAST GUARD BASE KETCHIKAN.1300 STEDMAN ST, KETCHIKAN ALASKA 99901 (KETCHIKAN GATEWAY BOROUGH)",0,F,,110000885873
9990WCRWLY9STED,-131.63299999999998,55.338,False,02,130,000300,02,02130,02130000300,1400000US02130000300,CROWLEY KETCHIKAN BULK FUEL STORAGE FACILITY,900 STEDMAN ST,KETCHIKAN,AK,99901,"CROWLEY KETCHIKAN BULK FUEL STORAGE FACILITY.900 STEDMAN ST, KETCHIKAN ALASKA 99901 (KETCHIKAN GATEWAY BOROUGH)",0,C,,
99553TRDNTAKUTA,-165.787,54.132,False,02,013,000100,02,02013,02013000100,1400000US02013000100,TRIDENT SEAFOODS CORP AKUTAN SHORE PLANT,1 SALMON LANE,AKUTAN,AK,99553,"TRIDENT SEAFOODS CORP AKUTAN SHORE PLANT.1 SALMON LANE, AKUTAN ALASKA 99553 (ALEUTIANS EAST BOROUGH)",0,C,,110002003153
9958WTRDNT11BEA,-163.41299999999998,54.863,False,02,013,000100,02,02013,02013000100,1400000US02013000100,TRIDENT SEAFOODS FALSE PASS SEAFOODS,101 BEACH RD,FALSE PASS,AK,99583,"TRIDENT SEAFOODS FALSE PASS SEAFOODS.101 BEACH RD, FALSE PASS ALASKA 99583 (ALEUTIANS EAST BOROUGH)",0,C,,110070235018
99503CRMRY814WN,-149.9,61.195,False,02,020,002000,02,02020,02020002000,1400000US02020002000,CREAMERY CORP (DBA MATANUSKA MAID DAIRY),814 W NORTHERN LIGHTS BLVD,ANCHORAGE,AK,99503,"CREAMERY CORP (DBA MATANUSKA MAID DAIRY).814 W NORTHERN LIGHTS BLVD, ANCHORAGE ALASKA 99503 (ANCHORAGE MUNICIPALITY)",0,C,,
99615TRDNT111WM,-152.404,57.787,False,02,150,000400,02,02150,02150000400,1400000US02150000400,TRIDENT SEAFOODS CORP KODIAK PLANT,111 W MARINE WAY,KODIAK,AK,99615,"TRIDENT SEAFOODS CORP KODIAK PLANT.111 W MARINE WAY, KODIAK ALASKA 99615 (KODIAK ISLAND BOROUGH)",0,C,,110015306284
99702LSNRF2258C,-147.049,64.671,False,02,090,001800,02,02090,02090001800,1400000US02090001800,US DOD USAF EIELSON AFB AK,2310 CENTRAL AVE,EIELSON AFB,AK,997022299,"US DOD USAF EIELSON AFB AK.2310 CENTRAL AVE, EIELSON AFB ALASKA 99702 (FAIRBANKS NORTH STAR BOROUGH)",0,F,,110041255003
99703SDPRT1060G,-147.611,64.82300000000001,False,02,090,001100,02,02090,02090001100,1400000US02090001100,FORT WAINWRIGHT MAIN CANTONMENT,FT WAINWRIGHT,FORT WAINWRIGHT,AK,997034500,"FORT WAINWRIGHT MAIN CANTONMENT.FT WAINWRIGHT, FORT WAINWRIGHT ALASKA 99703 (FAIRBANKS NORTH STAR BOROUGH)",0,F,,110006002707
99703DYNTL3564N,-147.611,64.82300000000001,False,02,090,001100,02,02090,02090001100,1400000US02090001100,DOYON UTILITIES FT WAINWRIGHT AK,3564 NEELY RD,FORT WAINWRIGHT,AK,99703,"DOYON UTILITIES FT WAINWRIGHT AK.3564 NEELY RD, FORT WAINWRIGHT ALASKA 99703 (FAIRBANKS NORTH STAR BOROUGH)",0,C,,110006002707
99619SCSTGCOAST,-152.504,57.738,False,02,150,000500,02,02150,02150000500,1400000US02150000500,US COAST GUARD BASE KODIAK,BLDG N38 REZANOF HWY & CAPE SARICHEF RD,KODIAK,AK,99619,"US COAST GUARD BASE KODIAK.BLDG N38 REZANOF HWY & CAPE SARICHEF RD, KODIAK ALASKA 99619 (KODIAK ISLAND BOROUGH)",0,F,,110064071506
99701RRNRG1204F,-147.735,64.848,False,02,090,000200,02,02090,02090000200,1400000US02090000200,AURORA ENERGY LLC,1206 1ST AVE,FAIRBANKS,AK,99701,"AURORA ENERGY LLC.1206 1ST AVE, FAIRBANKS ALASKA 99701 (FAIRBANKS NORTH STAR BOROUGH)",0,C,,110041255012
99737SRMYFRICHA,-145.727,63.901,False,02,240,000400,02,00000,02240000400,1400000US02240000400,US ARMY DONNELLY TRAINING AREA RANGES,RICHARDSON HWY,DELTA JUNCTION,AK,99737,"US ARMY DONNELLY TRAINING AREA RANGES.RICHARDSON HWY, DELTA JUNCTION ALASKA 99737 (SOUTHEAST FAIRBANKS CENSU)",0,F,,110070135405
99737SRMYFRICHB,-145.727,63.901,False,02,240,000400,02,00000,02240000400,1400000US02240000400,U.S. ARMY FORT GREELY AK,RICHARDSON HWY,FORT GREELY,AK,99731,"U.S. ARMY FORT GREELY AK.RICHARDSON HWY, FORT GREELY ALASKA 99731 (SOUTHEAST FAIRBANKS CENSU)",0,F,,110012971631
99737PGMNX38MIL,-144.94,64.45,False,02,240,000400,02,02090,02240000400,1400000US02240000400,POGO MINE,38 MILES NE OF DELTA JUNCTION,DELTA JUNCTION,AK,99737,"POGO MINE.38 MILES NE OF DELTA JUNCTION, DELTA JUNCTION ALASKA 99737 (FAIRBANKS NORTH STAR BOROUGH)",0,C,,110009058802
99731DYNTL611E5,-145.727,63.901,False,02,240,000400,02,00000,02240000400,1400000US02240000400,DOYON UTILITIES FT GREELY AK,611 E 5TH ST,FORT GREELY,AK,99731,"DOYON UTILITIES FT GREELY AK.611 E 5TH ST, FORT GREELY ALASKA 99731 (SOUTHEAST FAIRBANKS CENSU)",0,C,,110067424479
99801CRLSK331CL,-135.105,58.867,False,02,110,000100,02,00000,02110000100,1400000US02110000100,COEUR ALASKA INC KENSINGTON GOLD PROJECT,3031 CLINTON DR,JUNEAU,AK,99801,"COEUR ALASKA INC KENSINGTON GOLD PROJECT.3031 CLINTON DR, JUNEAU ALASKA 99801 (JUNEAU BOROUGH)",0,C,,110055091699
99574TRDNT31SEA,-145.765,60.549,False,02,261,000200,02,02261,02261000200,1400000US02261000200,TRIDENT SEAFOODS,301 SEAFOOD LN,CORDOVA,AK,99574,"TRIDENT SEAFOODS.301 SEAFOOD LN, CORDOVA ALASKA 99574 (VALDEZ-CORDOVA CENSUS AREA)",0,C,,110041623507
99929TRDNT641SH,-132.382,56.467,False,02,275,000300,02,02275,02275000300,1400000US02275000300,TRIDENT SEAFOODS,641 SHAKES ST,WRANGELL,AK,99929,"TRIDENT SEAFOODS.641 SHAKES ST, WRANGELL ALASKA 99929 (WRANGELL CITY AND BOROUGH)",0,C,,110041624141
99901LSKSH381TN,-131.69799999999998,55.356,False,02,130,000200,02,02130,02130000200,1400000US02130000200,VIGOR ALASKA,3801 TONGASS AVE,KETCHIKAN,AK,99901,"VIGOR ALASKA.3801 TONGASS AVE, KETCHIKAN ALASKA 99901 (KETCHIKAN GATEWAY BOROUGH)",0,C,,110003041887
9982WGLCRBPBX14,-135.887,58.45399999999999,False,02,105,000300,02,02105,02105000300,1400000US02105000300,GLACIER BAY NATIONAL PARK & PRESERVE,1 PARK RD,GUSTAVUS,AK,99826,"GLACIER BAY NATIONAL PARK & PRESERVE.1 PARK RD, GUSTAVUS ALASKA 99826 (HOONAH-ANGOON CENSUS AREA)",0,F,,110055500275
9955WCRWLY38STA,-161.779,60.783,False,02,050,000200,02,02050,02050000200,1400000US02050000200,CROWLEY MARINE SERVICES BETHEL,380 STANDARD OIL RD,BETHEL,AK,99559,"CROWLEY MARINE SERVICES BETHEL.380 STANDARD OIL RD, BETHEL ALASKA 99559 (BETHEL CENSUS AREA)",0,C,,
9975WCRWLY943RD,-162.58100000000002,66.902,False,02,188,000200,02,02188,02188000200,1400000US02188000200,CROWLEY KOTZEBUE BULK FUEL FACILITY,940 3RD AVE,KOTZEBUE,AK,99752,"CROWLEY KOTZEBUE BULK FUEL FACILITY.940 3RD AVE, KOTZEBUE ALASKA 99752 (NORTHWEST ARCTIC BOROUGH)",0,C,,
9980WCRWLY176JA,-134.395,58.288999999999994,False,02,110,000500,02,02110,02110000500,1400000US02110000500,CROWLEY JUNEAU BULK FUEL STORAGE FACILITY,1076 JACOBSEN DR,JUNEAU,AK,99801,"CROWLEY JUNEAU BULK FUEL STORAGE FACILITY.1076 JACOBSEN DR, JUNEAU ALASKA 99801 (JUNEAU CITY AND BOROUGH)",0,C,,
9950WNRCLS294CM,-149.827,61.224,False,02,020,000600,02,02020,02020000600,1400000US02020000600,NRC ALASKA,2940 COMMERCIAL DR,ANCHORAGE,AK,99501,"NRC ALASKA.2940 COMMERCIAL DR, ANCHORAGE ALASKA 99501 (ANCHORAGE MUNICIPALITY)",0,C,,110070239261
9950WNRCLS298CM,-149.828,61.224,False,02,020,000600,02,02020,02020000600,1400000US02020000600,NRC ALASKA LLC,2908 COMMERCIAL DRIVE,ANCHORAGE,AK,99501,"NRC ALASKA LLC.2908 COMMERCIAL DRIVE, ANCHORAGE ALASKA 99501 (ANCHORAGE MUNICIPALITY)",0,C,,110070118942
