TRIFID,LONGITUDE,LATITUDE,ESTIMATE,STATEFP,COUNTYFP,TRACTCE,STATEGEOID,COUNTYGEOID,TRACTGEOID,AFFGEOID,FACILITY_NAME,STREET,CITY,STUSPS,ZIP_CODE,FACILITY,FAC_CLOSED_IND,ASGN_FEDERAL_IND,BIA_CODE,EPA_REGISTRY_ID
3973WSPRRS463IN,-88.57700000000001,33.226,False,28,103,950200,28,28103,28103950200,1400000US28103950200,SUPERIOR ASPHALT BROOKSVILLE PLANT,463 INDUSTRIAL PARK ROAD,BROOKSVILLE,MS,39739,"SUPERIOR ASPHALT BROOKSVILLE PLANT.463 INDUSTRIAL PARK ROAD, BROOKSVILLE MISSISSIPPI 39739 (NOXUBEE)",0,C,,110038354090
3973WPCFDS559WE,-88.589,33.235,False,28,103,950200,28,28103,28103950200,1400000US28103950200,PECO FOODS INC - BROOKSVILLE PROCESSING,559 WEST MAIN ST,BROOKSVILLE,MS,39739,"PECO FOODS INC - BROOKSVILLE PROCESSING.559 WEST MAIN ST, BROOKSVILLE MISSISSIPPI 39739 (NOXUBEE)",0,C,,110058116881
39345LZBYS33SCA,-89.164,32.323,False,28,101,050500,28,28101,28101050500,1400000US28101050500,LA-Z-BOY SOUTH,133 SCANLAN ST,NEWTON,MS,39345,"LA-Z-BOY SOUTH.133 SCANLAN ST, NEWTON MISSISSIPPI 39345 (NEWTON)",0,C,,110000766305
39345SCCRPHIGHW,-89.133,32.352,False,28,101,050300,28,28101,28101050300,1400000US28101050300,ESCO GROUP LLC,9098 EASTSIDE DR EXT.,NEWTON,MS,39345,"ESCO GROUP LLC.9098 EASTSIDE DR EXT., NEWTON MISSISSIPPI 39345 (NEWTON)",0,C,,110056962425
39345CRFTMHWY15,-89.131,32.359,False,28,101,050300,28,28101,28101050300,1400000US28101050300,CROFT METALS INC,HWY 15 N CROFT RD,NEWTON,MS,39345,"CROFT METALS INC.HWY 15 N CROFT RD, NEWTON MISSISSIPPI 39345 (NEWTON)",0,C,,
3909WPCFDS486PN,-89.30799999999999,32.339,False,28,101,050300,28,28101,28101050300,1400000US28101050300,PECO FOODS INC - LAKE FEED MILL,4806 PONDEROSA RD,LAKE,MS,39092,"PECO FOODS INC - LAKE FEED MILL.4806 PONDEROSA RD, LAKE MISSISSIPPI 39092 (NEWTON)",0,C,,110055498313
3934WLZBYN9482E,-89.139,32.36,False,28,101,050300,28,28101,28101050300,1400000US28101050300,LA Z BOY INC PLANT 21,9482 EASTSIDE DRIVE EXTENTION,NEWTON,MS,39345,"LA Z BOY INC PLANT 21.9482 EASTSIDE DRIVE EXTENTION, NEWTON MISSISSIPPI 39345 (NEWTON)",0,C,,110002079713
3934WBWRLM331CL,-89.133,32.361999999999995,False,28,101,050300,28,28101,28101050300,1400000US28101050300,BIEWER SAWMILL - NEWTON LLC,331 COLISEUM DR,NEWTON,MS,39345,"BIEWER SAWMILL - NEWTON LLC.331 COLISEUM DR, NEWTON MISSISSIPPI 39345 (NEWTON)",0,C,,110070234156
39350SMTRSHWY15,-89.11200000000001,32.796,False,28,099,010400,28,28099,28099010400,1400000US28099010400,US ELECTRICAL MOTORS,1224 N PECAN AVE,PHILADELPHIA,MS,39350,"US ELECTRICAL MOTORS.1224 N PECAN AVE, PHILADELPHIA MISSISSIPPI 39350 (NESHOBA)",0,C,,
39350WTCRCHWY19,-89.113,32.798,False,28,099,010400,28,28099,28099010400,1400000US28099010400,RICHARDSON MOLDING LLC,931 HERMAN ALFORD MEMORIAL HWY,PHILADELPHIA,MS,39350,"RICHARDSON MOLDING LLC.931 HERMAN ALFORD MEMORIAL HWY, PHILADELPHIA MISSISSIPPI 39350 (NESHOBA)",0,C,,110000590771
39350PHLDLHWY19,-89.12,32.806,False,28,099,010400,28,28099,28099010400,1400000US28099010400,PECO FOODS INC - PHILADELPHIA FEED MILL,MISSISSIPPI HWY 19 N INDUSTRIAL PARK,PHILADELPHIA,MS,39350,"PECO FOODS INC - PHILADELPHIA FEED MILL.MISSISSIPPI HWY 19 N INDUSTRIAL PARK, PHILADELPHIA MISSISSIPPI 39350 (NESHOBA)",0,C,,110008497091
39350WLLSL219LE,-89.109,32.772,False,28,099,010400,28,28099,28099010400,1400000US28099010400,WELLS LAMONT,219 LEWIS AVE,PHILADELPHIA,MS,39350,"WELLS LAMONT.219 LEWIS AVE, PHILADELPHIA MISSISSIPPI 39350 (NESHOBA)",0,C,,
39350WYRHSWEYER,-89.118,32.763000000000005,False,28,099,010500,28,28099,28099010500,1400000US28099010500,WEYERHAEUSER NR CO-PHILADELPHIA LUMBER,1016 WEYERHAE US ER RD,PHILADELPHIA,MS,39350,"WEYERHAEUSER NR CO-PHILADELPHIA LUMBER.1016 WEYERHAE US ER RD, PHILADELPHIA MISSISSIPPI 39350 (NESHOBA)",0,C,,110002342643
39361DLTBRHIGHW,-88.56700000000001,32.988,False,28,103,950100,28,28103,28103950100,1400000US28103950100,DELTA BRICK SHUQUALAK,HWY 45 N,SHUQUALAK,MS,39361,"DELTA BRICK SHUQUALAK.HWY 45 N, SHUQUALAK MISSISSIPPI 39361 (NOXUBEE)",0,C,,
39361SHQLKNMAIN,-88.57,32.981,False,28,103,950100,28,28103,28103950100,1400000US28103950100,SHUQUALAK LUMBER CO,402 OAK ST,SHUQUALAK,MS,39361,"SHUQUALAK LUMBER CO.402 OAK ST, SHUQUALAK MISSISSIPPI 39361 (NOXUBEE)",0,C,,110007108334
39341SPRRF11751,-88.555,33.091,False,28,103,950100,28,28103,28103950100,1400000US28103950100,SUPERIOR FISH PRODUCTS INC,11751 HWY 45,MACON,MS,39341,"SUPERIOR FISH PRODUCTS INC.11751 HWY 45, MACON MISSISSIPPI 39341 (NOXUBEE)",0,C,,110020518199
39363BRLNGHIGHW,-88.79,32.131,False,28,023,950200,28,28023,28023950200,1400000US28023950200,BURLINGTON GLOBAL DENIM STONEWALL PLANT,HWY 513,STONEWALL,MS,39363,"BURLINGTON GLOBAL DENIM STONEWALL PLANT.HWY 513, STONEWALL MISSISSIPPI 39363 (CLARKE)",0,C,,
39401BFGDR1301W,-89.315,31.34,False,28,035,001100,28,28035,28035001100,1400000US28035001100,ZEON CHEMICALS LP MISSISSIPPI PLANT,1301 W 7TH ST,HATTIESBURG,MS,39401,"ZEON CHEMICALS LP MISSISSIPPI PLANT.1301 W 7TH ST, HATTIESBURG MISSISSIPPI 39401 (FORREST)",0,C,,110000377084
39401HRCLSWEST7,-89.307,31.336,False,28,035,001100,28,28035,28035001100,1400000US28035001100,HERCULES INC,613 W 7TH ST,HATTIESBURG,MS,39401,"HERCULES INC.613 W 7TH ST, HATTIESBURG MISSISSIPPI 39401 (FORREST)",0,C,,110000377093
39401HTTSBLAKEA,-89.32799999999999,31.353,False,28,035,001100,28,28035,28035001100,1400000US28035001100,HATTIESBURG WATER PLANT # 1,LAKEVIEW RD,HATTIESBURG,MS,39401,"HATTIESBURG WATER PLANT # 1.LAKEVIEW RD, HATTIESBURG MISSISSIPPI 39401 (FORREST)",0,C,,
39401HTTSBLAKEV,-89.337,31.36,False,28,035,001100,28,28035,28035001100,1400000US28035001100,HATTIESBURG NORTH LAGOON,LAKEVIEW RD,HATTIESBURG,MS,39401,"HATTIESBURG NORTH LAGOON.LAKEVIEW RD, HATTIESBURG MISSISSIPPI 39401 (FORREST)",0,C,,
39401NLNDC2501I,-89.319,31.348000000000003,False,28,035,001100,28,28035,28035001100,1400000US28035001100,INLAND CONTAINER CORP #24,2501 INLAND PARK,HATTIESBURG,MS,39401,"INLAND CONTAINER CORP #24.2501 INLAND PARK, HATTIESBURG MISSISSIPPI 39401 (FORREST)",0,C,,
39401HTTSB900JA,-89.28200000000001,31.315,False,28,035,000500,28,28035,28035000500,1400000US28035000500,HATTIESBURG WATER PLANT # 2,900 JAMES ST,HATTIESBURG,MS,39401,"HATTIESBURG WATER PLANT # 2.900 JAMES ST, HATTIESBURG MISSISSIPPI 39401 (FORREST)",0,C,,
39401HTTSB1510S,-89.28399999999999,31.304000000000002,False,28,035,000500,28,28035,28035000500,1400000US28035000500,FORTERRA PRESSURE PIPE - HATTIESBURG,1510 S EDWARDS ST,HATTIESBURG,MS,39401,"FORTERRA PRESSURE PIPE - HATTIESBURG.1510 S EDWARDS ST, HATTIESBURG MISSISSIPPI 39401 (FORREST)",1,C,,110001472601
39403CLDWS16EDW,-89.285,31.303,False,28,035,000500,28,28035,28035000500,1400000US28035000500,C L DEWS & SONS FOUNDRY & MACHINERY CO INC,1600 EDWARDS ST,HATTIESBURG,MS,39401,"C L DEWS & SONS FOUNDRY & MACHINERY CO INC.1600 EDWARDS ST, HATTIESBURG MISSISSIPPI 39401 (FORREST)",0,C,,110002220276
39401HTTSBSOUTH,-89.351,31.289,False,28,073,020301,28,28035,28073020301,1400000US28073020301,HATTIESBURG WATER TANK,SOUTH 40TH AVE,HATTIESBURG,MS,39401,"HATTIESBURG WATER TANK.SOUTH 40TH AVE, HATTIESBURG MISSISSIPPI 39401 (FORREST)",0,C,,
39475RDMRR304OL,-89.39399999999999,31.218000000000004,False,28,073,020301,28,28073,28073020301,1400000US28073020301,R D MORROW SR GENERATING PLANT,304 OLD OKAHOLA SCHOOLHO US E RD,PURVIS,MS,39475,"R D MORROW SR GENERATING PLANT.304 OLD OKAHOLA SCHOOLHO US E RD, PURVIS MISSISSIPPI 39475 (LAMAR)",0,C,,110000377271
39401MRRYNMAINA,-89.262,31.346999999999998,False,28,035,010300,28,28035,28035010300,1400000US28035010300,MURRAY ENVELOPE CORP,MAIN & STANLEY ST,HATTIESBURG,MS,39401,"MURRAY ENVELOPE CORP.MAIN & STANLEY ST, HATTIESBURG MISSISSIPPI 39401 (FORREST)",0,C,,
39401NRTHRPOBOX,-89.35600000000001,31.368000000000002,False,28,035,010200,28,28035,28035010200,1400000US28035010200,SUNBEAM-OSTER HOUSEHOLD PRODUCTS,6892 HWY 49 N,HATTIESBURG,MS,39401,"SUNBEAM-OSTER HOUSEHOLD PRODUCTS.6892 HWY 49 N, HATTIESBURG MISSISSIPPI 39401 (FORREST)",0,C,,
39402HPPHT6934H,-89.35799999999999,31.374000000000002,False,28,035,010200,28,28035,28035010200,1400000US28035010200,FORTERRA PIPE & PRECAST - HATTIESBURG,6934 HWY 49 N,HATTIESBURG,MS,39402,"FORTERRA PIPE & PRECAST - HATTIESBURG.6934 HWY 49 N, HATTIESBURG MISSISSIPPI 39402 (FORREST)",1,C,,110020518215
39401RSNLL103DI,-89.274,31.294,False,28,035,010500,28,28035,28035010500,1400000US28035010500,RESINALL CORP,102 DIXIE PINE RD,HATTIESBURG,MS,39401,"RESINALL CORP.102 DIXIE PINE RD, HATTIESBURG MISSISSIPPI 39401 (FORREST)",0,C,,110000377100
39401STHRN627HO,-89.26299999999999,31.283,False,28,035,010500,28,28035,28035010500,1400000US28035010500,HIXSON LUMBER SALES OF MS,627 HOOD RD,HATTIESBURG,MS,39401,"HIXSON LUMBER SALES OF MS.627 HOOD RD, HATTIESBURG MISSISSIPPI 39401 (FORREST)",0,C,,110000377119
39041MRSHL1200J,-89.27799999999999,31.305999999999997,False,28,035,010500,28,28035,28035010500,1400000US28035010500,MAR-JAC POULTRY MS LLC,1301 JAMES ST,HATTIESBURG,MS,39401,"MAR-JAC POULTRY MS LLC.1301 JAMES ST, HATTIESBURG MISSISSIPPI 39401 (FORREST)",0,C,,110058135922
39401SNBMC95WLR,-89.26299999999999,31.261,False,28,035,010500,28,28035,28035010500,1400000US28035010500,SUNBEAM CORP,95 WL RUNNELS INDL DR,HATTIESBURG,MS,39401,"SUNBEAM CORP.95 WL RUNNELS INDL DR, HATTIESBURG MISSISSIPPI 39401 (FORREST)",0,C,,
39401DCKTN977SU,-89.277,31.259,False,28,035,010500,28,28035,28035010500,1400000US28035010500,DICKTEN MASCH PLASTICS LLC,977 SULLIVAN DR,HATTIESBURG,MS,39401,"DICKTEN MASCH PLASTICS LLC.977 SULLIVAN DR, HATTIESBURG MISSISSIPPI 39401 (FORREST)",0,C,,110024887489
39401KHLRC182JO,-89.271,31.267,False,28,035,010500,28,28035,28035010500,1400000US28035010500,KOHLER CO,182 JOHN MERL TATUM INDUSTRIAL DR,HATTIESBURG,MS,39401,"KOHLER CO.182 JOHN MERL TATUM INDUSTRIAL DR, HATTIESBURG MISSISSIPPI 39401 (FORREST)",0,C,,110002213970
39401YRKNT77ACA,-89.251,31.269000000000002,False,28,035,010500,28,28035,28035010500,1400000US28035010500,JOHNSON CONTROLS INC-HATTIESBURG,77 ACADEMY DR,HATTIESBURG,MS,39401,"JOHNSON CONTROLS INC-HATTIESBURG.77 ACADEMY DR, HATTIESBURG MISSISSIPPI 39401 (FORREST)",0,C,,110002207558
39401SYSTL457JM,-89.249,31.273000000000003,False,28,035,010500,28,28035,28035010500,1400000US28035010500,USA YEAST CO,457 J.M. TATUM INDUSTRIAL DR,HATTIESBURG,MS,39401,"USA YEAST CO.457 J.M. TATUM INDUSTRIAL DR, HATTIESBURG MISSISSIPPI 39401 (FORREST)",0,C,,110012660156
39423HDNDSHWY98,-88.931,31.178,False,28,111,950200,28,28111,28111950200,1400000US28111950200,HOOD INDUSTRIES INC,224 DELTA PINE RD,BEAUMONT,MS,39423,"HOOD INDUSTRIES INC.224 DELTA PINE RD, BEAUMONT MISSISSIPPI 39423 (PERRY)",0,C,,110002226154
39428SNDRSOLDHW,-89.566,31.649,False,28,031,950200,28,28031,28031950200,1400000US28031950200,SANDERSON FARMS INC,1111 NORTH FIR AVE,COLLINS,MS,39428,"SANDERSON FARMS INC.1111 NORTH FIR AVE, COLLINS MISSISSIPPI 39428 (COVINGTON)",0,C,,110057788416
39428SNDRS3976H,-89.566,31.651,False,28,031,950200,28,28031,28031950200,1400000US28031950200,SANDERSON FARMS INC,3976 HWY 49,COLLINS,MS,39428,"SANDERSON FARMS INC.3976 HWY 49, COLLINS MISSISSIPPI 39428 (COVINGTON)",0,C,,110007647430
3942WCHVRN15SUT,-89.54299999999999,31.631999999999998,False,28,031,950200,28,28031,28031950200,1400000US28031950200,CHEVRON COLLINS TERMINAL,1500 SOUTH FIR AVENUE,COLLINS,MS,39428,"CHEVRON COLLINS TERMINAL.1500 SOUTH FIR AVENUE, COLLINS MISSISSIPPI 39428 (COVINGTON)",0,C,,110007645842
39429RLNSFHIGHW,-89.836,31.268,False,28,091,950300,28,28091,28091950300,1400000US28091950300,ORLEANS FURNITURE INC,1481 MAIN ST,COLUMBIA,MS,39429,"ORLEANS FURNITURE INC.1481 MAIN ST, COLUMBIA MISSISSIPPI 39429 (MARION)",0,C,,
39440CHMLN3705I,-89.182,31.66,False,28,067,950600,28,28067,28067950600,1400000US28067950600,BAKER PETROLITE,3705 INDUSTRIAL BLVD,LAUREL,MS,39440,"BAKER PETROLITE.3705 INDUSTRIAL BLVD, LAUREL MISSISSIPPI 39440 (JONES)",0,C,,110003997514
39440GMCDL1THAM,-89.175,31.66,False,28,067,950600,28,28067,28067950600,1400000US28067950600,DELPHI LAUREL OPERATIONS CITY OF LAUREL THAMES BUILDING,1 THAMES AVE,LAUREL,MS,39440,"DELPHI LAUREL OPERATIONS CITY OF LAUREL THAMES BUILDING.1 THAMES AVE, LAUREL MISSISSIPPI 39440 (JONES)",0,C,,110002107899
39440SNDRS631SA,-89.162,31.666,False,28,067,950600,28,28067,28067950600,1400000US28067950600,SANDERSON FARMS INC,2535 SANDERSON DR,LAUREL,MS,39440,"SANDERSON FARMS INC.2535 SANDERSON DR, LAUREL MISSISSIPPI 39440 (JONES)",0,C,,110016833630
39441HWRDN3225P,-89.176,31.658,False,28,067,950600,28,28067,28067950600,1400000US28067950600,HOWARD INDUSTRIES INC,3225 PENDORF RD,LAUREL,MS,39441,"HOWARD INDUSTRIES INC.3225 PENDORF RD, LAUREL MISSISSIPPI 39441 (JONES)",0,C,,110005985434
39440SNDRS1WARE,-89.163,31.660999999999998,False,28,067,950600,28,28067,28067950600,1400000US28067950600,SANDERSON FARMS INC,1 WAREHOUSE DR,LAUREL,MS,39440,"SANDERSON FARMS INC.1 WAREHOUSE DR, LAUREL MISSISSIPPI 39440 (JONES)",0,C,,110040947777
39441SSMLL334AV,-89.17200000000001,31.660999999999998,False,28,067,950600,28,28067,28067950600,1400000US28067950600,ESSMUELLER CO,334 AVE A AIRBASE,LAUREL,MS,39440,"ESSMUELLER CO.334 AVE A AIRBASE, LAUREL MISSISSIPPI 39440 (JONES)",0,C,,110002218662
3944WRBNND337EL,-89.165,31.659000000000002,False,28,067,950600,28,28067,28067950600,1400000US28067950600,ROBINE & WELCH MACHINE & TOOL CO INC,3037 ELLISVILLE BLVD,LAUREL,MS,39440,"ROBINE & WELCH MACHINE & TOOL CO INC.3037 ELLISVILLE BLVD, LAUREL MISSISSIPPI 39440 (JONES)",0,C,,110038354599
39440LRLLM20921,-89.124,31.715,False,28,067,950402,28,28067,28067950402,1400000US28067950402,LAUREL LUMBER CO INC,209 21ST ST,LAUREL,MS,39441,"LAUREL LUMBER CO INC.209 21ST ST, LAUREL MISSISSIPPI 39441 (JONES)",0,C,,
39440THRMK723EA,-89.118,31.715,False,28,067,950402,28,28067,28067950402,1400000US28067950402,THERMO-KOOL,723 E 21ST ST,LAUREL,MS,39440,"THERMO-KOOL.723 E 21ST ST, LAUREL MISSISSIPPI 39440 (JONES)",0,C,,110002218591
39440MSNTCSOUTH,-89.13,31.678,False,28,067,950700,28,28067,28067950700,1400000US28067950700,MASONITE CORP,1001 S FOURTH AVE,LAUREL,MS,39440,"MASONITE CORP.1001 S FOURTH AVE, LAUREL MISSISSIPPI 39440 (JONES)",0,C,,110000377164
39441CNTNNEAST5,-89.12200000000001,31.694000000000003,False,28,067,950700,28,28067,28067950700,1400000US28067950700,CONTINENTAL GRAIN CO WAYNE FARMS LAUREL PROCESSING,525 MISSISSIPPI AVE,LAUREL,MS,39441,"CONTINENTAL GRAIN CO WAYNE FARMS LAUREL PROCESSING.525 MISSISSIPPI AVE, LAUREL MISSISSIPPI 39441 (JONES)",0,C,,110000751963
39440CHMPN242VI,-89.096,31.689,False,28,067,950700,28,28067,28067950700,1400000US28067950700,CHAMPION TECHNOLOGIES INC.,242 VICTORY RD,LAUREL,MS,39440,"CHAMPION TECHNOLOGIES INC..242 VICTORY RD, LAUREL MISSISSIPPI 39440 (JONES)",0,C,,110002206737
3944WWYNFR525WA,-89.12,31.69,False,28,067,950700,28,28067,28067950700,1400000US28067950700,WAYNE FARMS LLC - LAUREL FRESH PLANT,525 WAYNE DRIVE,LAUREL,MS,39440,"WAYNE FARMS LLC - LAUREL FRESH PLANT.525 WAYNE DRIVE, LAUREL MISSISSIPPI 39440 (JONES)",0,C,,110069252668
39452TRSTTEVANS,-88.555,30.914,False,28,039,950102,28,28039,28039950102,1400000US28039950102,TRI-STATE POLE & PILING INC,103 TRI-STATE RD,LUCEDALE,MS,39452,"TRI-STATE POLE & PILING INC.103 TRI-STATE RD, LUCEDALE MISSISSIPPI 39452 (GEORGE)",0,C,,110000377208
39452MRCNT274EV,-88.555,30.916,False,28,039,950102,28,28039,28039950102,1400000US28039950102,AMERICAN TANK & VESSEL INC,274 EVANSTON RD,LUCEDALE,MS,39452,"AMERICAN TANK & VESSEL INC.274 EVANSTON RD, LUCEDALE MISSISSIPPI 39452 (GEORGE)",0,C,,110002208575
39455MCGRW100IN,-89.45100000000001,30.991999999999997,False,28,073,020600,28,28073,28073020600,1400000US28073020600,COOPER POWER SYSTEM,100 INDUSTRIAL PKWY,LUMBERTON,MS,39455,"COOPER POWER SYSTEM.100 INDUSTRIAL PKWY, LUMBERTON MISSISSIPPI 39455 (LAMAR)",0,C,,
39455STHLNHIGHW,-89.448,31.025,False,28,073,020600,28,28073,28073020600,1400000US28073020600,HUNT SOUTHLAND REFINING CO LUMBERTON,7539 HWY 11 N,LUMBERTON,MS,39455,"HUNT SOUTHLAND REFINING CO LUMBERTON.7539 HWY 11 N, LUMBERTON MISSISSIPPI 39455 (LAMAR)",0,C,,110000605248
39455FRMLN101IN,-89.45700000000001,30.991,False,28,073,020600,28,28073,28073020600,1400000US28073020600,LAND O'LAKES FARMLAND FEED,101 INDUSTRIAL PARK,LUMBERTON,MS,39455,"LAND O'LAKES FARMLAND FEED.101 INDUSTRIAL PARK, LUMBERTON MISSISSIPPI 39455 (LAMAR)",0,C,,
39462LFRVRHWY29,-89.045,31.244,False,28,111,950102,28,28111,28111950102,1400000US28111950102,GEORGIA PACIFIC LEAF RIVER CELLULOSE LLC,HWY 29 BUCK CREEK RD,NEW AUGUSTA,MS,394620329,"GEORGIA PACIFIC LEAF RIVER CELLULOSE LLC.HWY 29 BUCK CREEK RD, NEW AUGUSTA MISSISSIPPI 39462 (PERRY)",0,C,,110056956691
39466BRCKWMARTI,-89.686,30.511,False,28,109,950700,28,28109,28109950700,1400000US28109950700,BROCKWAY STANDARD INC,MARTIN LUTHER KING JR BLVD,PICAYUNE,MS,39466,"BROCKWAY STANDARD INC.MARTIN LUTHER KING JR BLVD, PICAYUNE MISSISSIPPI 39466 (PEARL RIVER)",0,C,,
39466SNBLT210CR,-89.69,30.526,False,28,109,950700,28,28109,28109950700,1400000US28109950700,VALSPAR REFINISH,210 CROSBY ST,PICAYUNE,MS,39466,"VALSPAR REFINISH.210 CROSBY ST, PICAYUNE MISSISSIPPI 39466 (PEARL RIVER)",0,C,,110000377253
39466WDTRT403DA,-89.69,30.524,False,28,109,950700,28,28109,28109950700,1400000US28109950700,WOOD TREATING INC,403 DAVIS ST,PICAYUNE,MS,39466,"WOOD TREATING INC.403 DAVIS ST, PICAYUNE MISSISSIPPI 39466 (PEARL RIVER)",0,C,,
39466PRLRV1900R,-89.70299999999999,30.523000000000003,False,28,109,950700,28,28109,28109950700,1400000US28109950700,PEARL RIVER WOOD LLC,1900 ROSA ST,PICAYUNE,MS,39466,"PEARL RIVER WOOD LLC.1900 ROSA ST, PICAYUNE MISSISSIPPI 39466 (PEARL RIVER)",1,C,,
39463FNNTRJJHOL,-89.693,30.484,False,28,109,950700,28,28109,28109950700,1400000US28109950700,FINI ENTERPRISES,J J HOLCOMB RD,NICHOLSON,MS,39463,"FINI ENTERPRISES.J J HOLCOMB RD, NICHOLSON MISSISSIPPI 39463 (PEARL RIVER)",0,C,,
3946WCPPLL1912R,-89.70100000000001,30.522,False,28,109,950700,28,28109,28109950700,1400000US28109950700,CPP LLC,1900 1/2 ROSA STREET,PICAYUNE,MS,39466,"CPP LLC.1900 1/2 ROSA STREET, PICAYUNE MISSISSIPPI 39466 (PEARL RIVER)",0,C,,110000900277
39466RZNCH815NO,-89.698,30.535999999999998,False,28,109,950401,28,28109,28109950401,1400000US28109950401,ARIZONA CHEMICAL CO PICAYUNE,815 N BEECH ST,PICAYUNE,MS,39466,"ARIZONA CHEMICAL CO PICAYUNE.815 N BEECH ST, PICAYUNE MISSISSIPPI 39466 (PEARL RIVER)",0,C,,
39475MRDHSHIGHW,-89.40899999999999,31.186999999999998,False,28,073,020400,28,28073,28073020400,1400000US28073020400,AMERADA HESS CORP PURVIS TERMINAL,5151 US HWY #11,PURVIS,MS,39475,"AMERADA HESS CORP PURVIS TERMINAL.5151 US HWY #11, PURVIS MISSISSIPPI 39475 (LAMAR)",0,C,,
3947WRNCCR863LD,-89.38600000000001,31.18,False,28,073,020400,28,28073,28073020400,1400000US28073020400,RAIN CII CARBON LLC-PURVIS CALCINING PLANT,863 OLD RICHBURG RD,PURVIS,MS,39475,"RAIN CII CARBON LLC-PURVIS CALCINING PLANT.863 OLD RICHBURG RD, PURVIS MISSISSIPPI 39475 (LAMAR)",0,C,,110002206611
39476PWTMBHWY15,-88.93700000000001,31.359,False,28,111,950101,28,28111,28111950101,1400000US28111950101,POWE TIMBER CO AMERICAN WOOD DIV,HWY 15 N,RICHTON,MS,39476,"POWE TIMBER CO AMERICAN WOOD DIV.HWY 15 N, RICHTON MISSISSIPPI 39476 (PERRY)",0,C,,110000590833
39477STHLNHIGHW,-89.009,31.816999999999997,False,28,067,950100,28,28067,28067950100,1400000US28067950100,HUNT SOUTHLAND REFINING CO-SANDERSVILLE,HWY 11 N,SANDERSVILLE,MS,39477,"HUNT SOUTHLAND REFINING CO-SANDERSVILLE.HWY 11 N, SANDERSVILLE MISSISSIPPI 39477 (JONES)",0,C,,110000590842
39440CNTNN2HAWK,-89.071,31.756,False,28,067,950100,28,28067,28067950100,1400000US28067950100,WAYNE FARMS LLC  - LAUREL FEEDMILL,631 HAWKES RD,LAUREL,MS,39443,"WAYNE FARMS LLC  - LAUREL FEEDMILL.631 HAWKES RD, LAUREL MISSISSIPPI 39443 (JONES)",0,C,,110002225985
39440FRDGMNIMMO,-89.12799999999999,31.759,False,28,067,950100,28,28067,28067950100,1400000US28067950100,FRIDGAMERICA INC,NIMMO CLARK DR,LAUREL,MS,39440,"FRIDGAMERICA INC.NIMMO CLARK DR, LAUREL MISSISSIPPI 39440 (JONES)",0,C,,
39443HWRDN58EAS,-89.084,31.734,False,28,067,950100,28,28067,28067950100,1400000US28067950100,HOWARD INDUSTRIES INC,580 EASTVIEW DR,SANDERSVILLE,MS,39443,"HOWARD INDUSTRIES INC.580 EASTVIEW DR, SANDERSVILLE MISSISSIPPI 39443 (JONES)",0,C,,110037511680
3944WBTSSM911FR,-89.023,31.793000000000003,False,28,067,950100,28,28067,28067950100,1400000US28067950100,BOOTS SMITH ENERGY GROUP SANDERSVILLE FACILITY,911 FRONT ST S,LAUREL,MS,39443,"BOOTS SMITH ENERGY GROUP SANDERSVILLE FACILITY.911 FRONT ST S, LAUREL MISSISSIPPI 39443 (JONES)",0,C,,110070204331
39501NDLLM19003,-89.085,30.391,False,28,047,002000,28,28047,28047002000,1400000US28047002000,TABER EXTRUSIONS LLC,1900 34TH ST,GULFPORT,MS,39501,"TABER EXTRUSIONS LLC.1900 34TH ST, GULFPORT MISSISSIPPI 39501 (HARRISON)",0,C,,110000377280
39501STRTH15003,-89.081,30.391,False,28,047,002000,28,28047,28047002000,1400000US28047002000,STRUTHERS INDUSTRIES INC,1500 34TH ST,GULFPORT,MS,395014225,"STRUTHERS INDUSTRIES INC.1500 34TH ST, GULFPORT MISSISSIPPI 39501 (HARRISON)",0,C,,
39501RCHHL11015,-89.01899999999999,30.427,False,28,047,003208,28,28047,28047003208,1400000US28047003208,"ARIZONA CHEMICAL CO, GULFPORT",11015 REICHHOLD RD,GULFPORT,MS,39503,"ARIZONA CHEMICAL CO, GULFPORT.11015 REICHHOLD RD, GULFPORT MISSISSIPPI 39503 (HARRISON)",1,C,,
39503TRNBL10213,-89.031,30.435,False,28,047,003208,28,28047,28047003208,1400000US28047003208,TURNBULL METAL PRODS,10213 LORRAINE RD,GULFPORT,MS,395036001,"TURNBULL METAL PRODS.10213 LORRAINE RD, GULFPORT MISSISSIPPI 39503 (HARRISON)",0,C,,
39503TRTDM13334,-89.06299999999999,30.434,False,28,047,003208,28,28047,28047003208,1400000US28047003208,TREATED MATERIALS CO INC,13334 SEAWAY RD,GULFPORT,MS,39503,"TREATED MATERIALS CO INC.13334 SEAWAY RD, GULFPORT MISSISSIPPI 39503 (HARRISON)",0,C,,
39503FNSTL14115,-89.073,30.434,False,28,047,003208,28,28047,28047003208,1400000US28047003208,HYDRO CARBIDE INC,14115 SEAWAY RD,GULFPORT,MS,39503,"HYDRO CARBIDE INC.14115 SEAWAY RD, GULFPORT MISSISSIPPI 39503 (HARRISON)",0,C,,110000377306
39503VNDLN13303,-89.06200000000001,30.434,False,28,047,003208,28,28047,28047003208,1400000US28047003208,"INGALLS SHIPBUILDING, GULFPORT OPERATIONS",13303 INDUSTRIAL SEAWAY RD,GULFPORT,MS,39503,"INGALLS SHIPBUILDING, GULFPORT OPERATIONS.13303 INDUSTRIAL SEAWAY RD, GULFPORT MISSISSIPPI 39503 (HARRISON)",0,C,,110000766341
39506HRTSN10115,-89.03200000000001,30.430999999999997,False,28,047,003208,28,28047,28047003208,1400000US28047003208,HARTSON-KENNEDY CABINET TOP CO INC,10115 LORRAINE RD,GULFPORT,MS,39503,"HARTSON-KENNEDY CABINET TOP CO INC.10115 LORRAINE RD, GULFPORT MISSISSIPPI 39503 (HARRISON)",0,C,,110000377360
39503TRNTY13085,-89.06,30.434,False,28,047,003208,28,28047,28047003208,1400000US28047003208,HALTER MARINE,13083 SEAWAY RD,GULFPORT,MS,39503,"HALTER MARINE.13083 SEAWAY RD, GULFPORT MISSISSIPPI 39503 (HARRISON)",0,C,,
39503RDMNH10194,-89.031,30.433000000000003,False,28,047,003208,28,28047,28047003208,1400000US28047003208,REDMAN HOME,10194 LORRAINE RD,GULFPORT,MS,39505,"REDMAN HOME.10194 LORRAINE RD, GULFPORT MISSISSIPPI 39505 (HARRISON)",0,C,,
39502MSSSSINTER,-89.027,30.439,False,28,047,003208,28,28047,28047003208,1400000US28047003208,MISSISSIPPI POWER CO - PLANT WATSON,INTERSTATE 10 & LORRAINE RD,GULFPORT,MS,39502,"MISSISSIPPI POWER CO - PLANT WATSON.INTERSTATE 10 & LORRAINE RD, GULFPORT MISSISSIPPI 39502 (HARRISON)",0,C,,110000590851
39503WRNGL11207,-89.031,30.447,False,28,047,003208,28,28047,28047003208,1400000US28047003208,WARING OIL CO,11207 LORRAINE RD,GULFPORT,MS,39503,"WARING OIL CO.11207 LORRAINE RD, GULFPORT MISSISSIPPI 39503 (HARRISON)",0,C,,110000377351
39503BLCKL11040,-89.021,30.427,False,28,047,003208,28,28047,28047003208,1400000US28047003208,BLACKLIDGE EMULSIONS INC,11040 REICHHOLD RD,GULFPORT,MS,39503,"BLACKLIDGE EMULSIONS INC.11040 REICHHOLD RD, GULFPORT MISSISSIPPI 39503 (HARRISON)",0,C,,
39503FTRPP1245G,-89.046,30.43,False,28,047,003208,28,28047,28047003208,1400000US28047003208,FUTURE PIPE INDUSTRIES,12450 GLASCOCK DR,GULFPORT,MS,39503,"FUTURE PIPE INDUSTRIES.12450 GLASCOCK DR, GULFPORT MISSISSIPPI 39503 (HARRISON)",0,C,,110017777609
39503NTDST111LR,-89.031,30.433000000000003,False,28,047,003208,28,28047,28047003208,1400000US28047003208,US MARINE INC,10011 LORRAINE RD,GULFPORT,MS,39503,"US MARINE INC.10011 LORRAINE RD, GULFPORT MISSISSIPPI 39503 (HARRISON)",0,C,,110031000093
39503GLFSH12351,-89.046,30.43,False,28,047,003208,28,28047,28047003208,1400000US28047003208,GULF SHIP LLC,12351 GLASCOCK DR,GULFPORT,MS,39503,"GULF SHIP LLC.12351 GLASCOCK DR, GULFPORT MISSISSIPPI 39503 (HARRISON)",0,C,,110027227551
39503SMNNC12481,-89.051,30.43,False,28,047,003208,28,28047,28047003208,1400000US28047003208,SEEMANN COMPOSITES INC,12481 GLASCOCK DR,GULFPORT,MS,39503,"SEEMANN COMPOSITES INC.12481 GLASCOCK DR, GULFPORT MISSISSIPPI 39503 (HARRISON)",0,C,,110002216735
3950WCHNNL14373,-89.081,30.433000000000003,False,28,047,003208,28,28047,28047003208,1400000US28047003208,CHANNEL CHEMICAL CORP,14373 SEAWAY RD,GULFPORT,MS,39503,"CHANNEL CHEMICAL CORP.14373 SEAWAY RD, GULFPORT MISSISSIPPI 39503 (HARRISON)",0,C,,110000537893
3950WSPRRS1129G,-89.074,30.434,False,28,047,003208,28,28047,28047003208,1400000US28047003208,SUPERIOR ASPHALT GULFPORT PLANT,10129 GOLDIN LANE,GULFPORT,MS,39503,"SUPERIOR ASPHALT GULFPORT PLANT.10129 GOLDIN LANE, GULFPORT MISSISSIPPI 39503 (HARRISON)",0,C,,110042000848
3950WSPRML12251,-89.042,30.435,False,28,047,003208,28,28047,28047003208,1400000US28047003208,SOPREMA INC,12251 SEAWAY ROAD,GULFPORT,MS,39503,"SOPREMA INC.12251 SEAWAY ROAD, GULFPORT MISSISSIPPI 39503 (HARRISON)",0,C,,110059346499
3950WGLFST1121S,-89.036,30.430999999999997,False,28,047,003208,28,28047,28047003208,1400000US28047003208,GULF STATES READY-MIX PLANT 10,10121 SOUTHPARK DR,GULFPORT,MS,39503,"GULF STATES READY-MIX PLANT 10.10121 SOUTHPARK DR, GULFPORT MISSISSIPPI 39503 (HARRISON)",0,C,,110006724125
39502STRLN36002,-89.09299999999999,30.393,False,28,047,001800,28,28047,28047001800,1400000US28047001800,STERLING HEALTH,3600 25TH AVE,GULFPORT,MS,39501,"STERLING HEALTH.3600 25TH AVE, GULFPORT MISSISSIPPI 39501 (HARRISON)",0,C,,
