TRIFID,LONGITUDE,LATITUDE,ESTIMATE,STATEFP,COUNTYFP,TRACTCE,STATEGEOID,COUNTYGEOID,TRACTGEOID,AFFGEOID,FACILITY_NAME,STREET,CITY,STUSPS,ZIP_CODE,FACILITY,FAC_CLOSED_IND,ASGN_FEDERAL_IND,BIA_CODE,EPA_REGISTRY_ID
38606BTSVLHWY51,-89.944,34.29,False,28,107,950500,28,28107,28107950500,1400000US28107950500,F-BATESVILLE,HWY 51 S,BATESVILLE,MS,38606,"F-BATESVILLE.HWY 51 S, BATESVILLE MISSISSIPPI 38606 (PANOLA)",1,C,,
38606CRWNCHWY35,-89.92399999999999,34.343,False,28,107,950600,28,28107,28107950600,1400000US28107950600,CROWN BEVERAGE PACKAGING,195 CROWN RD,BATESVILLE,MS,38606,"CROWN BEVERAGE PACKAGING.195 CROWN RD, BATESVILLE MISSISSIPPI 38606 (PANOLA)",0,C,,110000375497
38606THRMSSARDI,-89.931,34.339,False,28,107,950600,28,28107,28107950600,1400000US28107950600,THERMOS CO,355 THERMOS RD,BATESVILLE,MS,38606,"THERMOS CO.355 THERMOS RD, BATESVILLE MISSISSIPPI 38606 (PANOLA)",0,C,,
38606BTSVL310CR,-89.917,34.342,False,28,107,950600,28,28107,28107950600,1400000US28107950600,BATESVILLE MANUFACTURING INC,310 CROWN RD,BATESVILLE,MS,38606,"BATESVILLE MANUFACTURING INC.310 CROWN RD, BATESVILLE MISSISSIPPI 38606 (PANOLA)",1,C,,110000375488
38606MGGBT195CO,-89.91799999999999,34.349000000000004,False,28,107,950600,28,28107,28107950600,1400000US28107950600,MOOG BATESVILLE,195 CORPORATE DR,BATESVILLE,MS,38606,"MOOG BATESVILLE.195 CORPORATE DR, BATESVILLE MISSISSIPPI 38606 (PANOLA)",0,C,,
3860WMMCMT449HW,-89.943,34.325,False,28,107,950600,28,28107,28107950600,1400000US28107950600,MMC MATERIALS INC - BATESVILLE,449 HWY 51 N,BATESVILLE,MS,38606,"MMC MATERIALS INC - BATESVILLE.449 HWY 51 N, BATESVILLE MISSISSIPPI 38606 (PANOLA)",0,C,,110002327143
38606PRKRHHIGHW,-89.889,34.31,False,28,107,950300,28,28107,28107950300,1400000US28107950300,PARKER HANNIFIN CORP AUTOMOTIVE CONNECTORS DIV,1620 HWY 6 EAST,BATESVILLE,MS,38606,"PARKER HANNIFIN CORP AUTOMOTIVE CONNECTORS DIV.1620 HWY 6 EAST, BATESVILLE MISSISSIPPI 38606 (PANOLA)",0,C,,
38666GLDBNINDUS,-89.90899999999999,34.375,False,28,107,950300,28,28107,28107950300,1400000US28107950300,GOLD BOND BUILDING PRODS,INDUSTRIAL DR,SARDIS,MS,38666,"GOLD BOND BUILDING PRODS.INDUSTRIAL DR, SARDIS MISSISSIPPI 38666 (PANOLA)",0,C,,
3860WSPRRSHWY35,-89.904,34.351,False,28,107,950300,28,28107,28107950300,1400000US28107950300,SUPERIOR ASPHALT BATESVILLE PLANT,HWY 35,BATESVILLE,MS,38606,"SUPERIOR ASPHALT BATESVILLE PLANT.HWY 35, BATESVILLE MISSISSIPPI 38606 (PANOLA)",0,C,,110060261023
38611GMNCRONEGE,-89.69200000000001,34.872,False,28,093,950200,28,28093,28093950200,1400000US28093950200,E D SMITH-GEM INC,1 GEM BLVD,BYHALIA,MS,38611,"E D SMITH-GEM INC.1 GEM BLVD, BYHALIA MISSISSIPPI 38611 (MARSHALL)",1,C,,
3861WCRGLL71HIG,-89.661,34.864000000000004,False,28,093,950200,28,28093,28093950200,1400000US28093950200,CARGILL FEED & NUTRITION BYHALIA,7100 HIGHWAY 178 WEST,BYHALIA,MS,38611,"CARGILL FEED & NUTRITION BYHALIA.7100 HIGHWAY 178 WEST, BYHALIA MISSISSIPPI 38611 (MARSHALL)",0,C,,110038238760
3861WMMCMT36EST,-89.679,34.859,False,28,093,950200,28,28093,28093950200,1400000US28093950200,MMC MATERIALS INC BYHALIA PLNT,306 E STONEWALL RD,BYHALIA,MS,38611,"MMC MATERIALS INC BYHALIA PLNT.306 E STONEWALL RD, BYHALIA MISSISSIPPI 38611 (MARSHALL)",0,C,,110030451614
3861WCPLYM13LWR,-89.669,34.87,False,28,093,950200,28,28093,28093950200,1400000US28093950200,AC POLYMERS INC,103 LOWRY DR,BYHALIA,MS,38611,"AC POLYMERS INC.103 LOWRY DR, BYHALIA MISSISSIPPI 38611 (MARSHALL)",0,C,,110064645291
38611NTRPRRT5BO,-89.6,34.968,False,28,093,950100,28,28093,28093950100,1400000US28093950100,ENTERPRISE RECOVERY SYSTEMS INC,RT 5 BOX 287,BYHALIA,MS,38611,"ENTERPRISE RECOVERY SYSTEMS INC.RT 5 BOX 287, BYHALIA MISSISSIPPI 38611 (MARSHALL)",0,C,,
3861WRXLSN4572C,-89.616,34.976,False,28,093,950100,28,28093,28093950100,1400000US28093950100,ROXUL USA INC,4594 CAYCE RD,BYHALIA,MS,38611,"ROXUL USA INC.4594 CAYCE RD, BYHALIA MISSISSIPPI 38611 (MARSHALL)",0,C,,110045353050
38614CPRTR2205F,-90.54899999999999,34.207,False,28,027,950400,28,28027,28027950400,1400000US28027950400,THE COOPER TIRE CO,2205 MARTIN LUTHER KING DR,CLARKSDALE,MS,38614,"THE COOPER TIRE CO.2205 MARTIN LUTHER KING DR, CLARKSDALE MISSISSIPPI 38614 (COAHOMA)",0,C,,110002226289
38614RCHRDLYONR,-90.54299999999999,34.211,False,28,027,950400,28,28027,28027950400,1400000US28027950400,ADM,LYON RD,CLARKSDALE,MS,38614,"ADM.LYON RD, CLARKSDALE MISSISSIPPI 38614 (COAHOMA)",0,C,,
38614DLTWR110IN,-90.601,34.193000000000005,False,28,027,950500,28,28027,28027950500,1400000US28027950500,BEKAERT-DELTA WIRE LLC,110 INDUSTRIAL DR,CLARKSDALE,MS,38614,"BEKAERT-DELTA WIRE LLC.110 INDUSTRIAL DR, CLARKSDALE MISSISSIPPI 38614 (COAHOMA)",0,C,,110000375530
38614MHRTNHIGHW,-90.598,34.194,False,28,027,950500,28,28027,28027950500,1400000US28027950500,CORBIN RUSSWIN INC,600 HWY 322,CLARKSDALE,MS,386144719,"CORBIN RUSSWIN INC.600 HWY 322, CLARKSDALE MISSISSIPPI 38614 (COAHOMA)",0,C,,
38614HHPMP520HW,-90.598,34.191,False,28,027,950500,28,28027,28027950500,1400000US28027950500,H & H PUMP & DREDGE CO,520 HWY 322,CLARKSDALE,MS,38614,"H & H PUMP & DREDGE CO.520 HWY 322, CLARKSDALE MISSISSIPPI 38614 (COAHOMA)",0,C,,
38614DLTHMPOBOX,-90.604,34.192,False,28,027,950500,28,28027,28027950500,1400000US28027950500,DELTA HOMES INC,1322 INDUSTRIAL DR,CLARKSDALE,MS,38614,"DELTA HOMES INC.1322 INDUSTRIAL DR, CLARKSDALE MISSISSIPPI 38614 (COAHOMA)",1,C,,
38614RDPNTNORMA,-90.56200000000001,34.187,False,28,027,950600,28,28027,28027950600,1400000US28027950600,RED PANTHER CHEMICAL CO,1201 NORMANDY ST,CLARKSDALE,MS,38614,"RED PANTHER CHEMICAL CO.1201 NORMANDY ST, CLARKSDALE MISSISSIPPI 38614 (COAHOMA)",0,C,,
38618MPNCX485IN,-89.97399999999999,34.694,False,28,137,950301,28,28137,28137950301,1400000US28137950301,INNOCOR FOAM TECHNOLOGIES LLC,485 INDUSTRIAL DR,COLDWATER,MS,38618,"INNOCOR FOAM TECHNOLOGIES LLC.485 INDUSTRIAL DR, COLDWATER MISSISSIPPI 38618 (TATE)",0,C,,110000375549
3861WMMCMT8477H,-89.978,34.674,False,28,137,950301,28,28137,28137950301,1400000US28137950301,MMC MATERIALS INC - COLDWATER PLANT,8477 HIGHWAY 51 N,COLDWATER,MS,38618,"MMC MATERIALS INC - COLDWATER PLANT.8477 HIGHWAY 51 N, COLDWATER MISSISSIPPI 38618 (TATE)",0,C,,110070244577
38632LMXXTMCCRA,-89.975,34.82,False,28,033,071120,28,28033,28033071120,1400000US28033071120,SXP SCHULZ XTRUDED PRODUCTS LP,2785 MCCRACKEN RD,HERNANDO,MS,38632,"SXP SCHULZ XTRUDED PRODUCTS LP.2785 MCCRACKEN RD, HERNANDO MISSISSIPPI 38632 (DESOTO)",0,C,,110000375567
38632PYRLX720VA,-89.977,34.815,False,28,033,071120,28,28033,28033071120,1400000US28033071120,NITEO PRODUCTS LLC,720 VAIDEN DR,HERNANDO,MS,38632,"NITEO PRODUCTS LLC.720 VAIDEN DR, HERNANDO MISSISSIPPI 38632 (DESOTO)",0,C,,110000375576
38635HLLYSPOBOX,-89.45100000000001,34.785,False,28,093,950401,28,28093,28093950401,1400000US28093950401,ACME BRICK - HOLLY SPRINGS,700 HWY 7 N,HOLLY SPRINGS,MS,38635,"ACME BRICK - HOLLY SPRINGS.700 HWY 7 N, HOLLY SPRINGS MISSISSIPPI 38635 (MARSHALL)",0,C,,110000590450
38635MLYPLINDUS,-89.435,34.757,False,28,093,950402,28,28093,28093950402,1400000US28093950402,MULAY PLASTICS,550 INDUSTRIAL DR,HOLLY SPRINGS,MS,38635,"MULAY PLASTICS.550 INDUSTRIAL DR, HOLLY SPRINGS MISSISSIPPI 38635 (MARSHALL)",0,C,,
38635THWRL805WE,-89.44,34.795,False,28,093,950402,28,28093,28093950402,1400000US28093950402,WURLITZER CO,805 W ST,HOLLY SPRINGS,MS,38635,"WURLITZER CO.805 W ST, HOLLY SPRINGS MISSISSIPPI 38635 (MARSHALL)",0,C,,
38635TTTHMHWY78,-89.448,34.775,False,28,093,950402,28,28093,28093950402,1400000US28093950402,THOMPSON INTERNATIONAL,320 HWY 78 E,HOLLY SPRINGS,MS,38635,"THOMPSON INTERNATIONAL.320 HWY 78 E, HOLLY SPRINGS MISSISSIPPI 38635 (MARSHALL)",1,C,,
38635FRRXX805NW,-89.44,34.778,False,28,093,950402,28,28093,28093950402,1400000US28093950402,PARKER HANNIFIN CORP RACOR DIV,805 NORTHWEST,HOLLY SPRINGS,MS,38635,"PARKER HANNIFIN CORP RACOR DIV.805 NORTHWEST, HOLLY SPRINGS MISSISSIPPI 38635 (MARSHALL)",0,C,,
3863WPRKRH85WES,-89.44,34.795,False,28,093,950402,28,28093,28093950402,1400000US28093950402,PARKER HANNIFIN CORP,805 WEST ST,HOLLY SPRINGS,MS,38635,"PARKER HANNIFIN CORP.805 WEST ST, HOLLY SPRINGS MISSISSIPPI 38635 (MARSHALL)",0,C,,110069295079
38637DVRLV6266H,-90.03399999999999,34.951,False,28,033,070322,28,28033,28033070322,1400000US28033070322,DOVER ELEVATOR SYSTEMS INC.,6266 HURT RD.,HORN LAKE,MS,38637,"DOVER ELEVATOR SYSTEMS INC..6266 HURT RD., HORN LAKE MISSISSIPPI 38637 (DESOTO)",0,C,,
38637MMPHSWCENT,-90.027,34.96,False,28,033,070322,28,28033,28033070322,1400000US28033070322,GREAT SOUTHERN WOOD OF NORTH ALABAMA INC,6843 W CENTER ST,HORN LAKE,MS,38637,"GREAT SOUTHERN WOOD OF NORTH ALABAMA INC.6843 W CENTER ST, HORN LAKE MISSISSIPPI 38637 (DESOTO)",0,C,,
38637FLVRT5980H,-90.03399999999999,34.948,False,28,033,070322,28,28033,28033070322,1400000US28033070322,FLAVORITE LABS. INC.,5980 HURT RD.,HORN LAKE,MS,38637,"FLAVORITE LABS. INC..5980 HURT RD., HORN LAKE MISSISSIPPI 38637 (DESOTO)",0,C,,
3020WMMCMT1955N,-90.025,34.948,False,28,033,070322,28,28033,28033070322,1400000US28033070322,MMC MATERIALS INC - HORN LAKE,1955 NAIL RD W,HORN LAKE,MS,38637,"MMC MATERIALS INC - HORN LAKE.1955 NAIL RD W, HORN LAKE MISSISSIPPI 38637 (DESOTO)",0,C,,110063969558
38648GRDNF7046S,-89.863,34.992,False,28,033,070811,28,28033,28033070811,1400000US28033070811,KNAUF INSULATION LLC,7046 STATELINE RD,OLIVE BRANCH,MS,38654,"KNAUF INSULATION LLC.7046 STATELINE RD, OLIVE BRANCH MISSISSIPPI 38654 (DESOTO)",0,C,,110000493225
38652DNTNM1865D,-88.994,34.474000000000004,False,28,145,950400,28,28145,28145950400,1400000US28145950400,DENTON MILLS INC,1865 DENMILL DR,NEW ALBANY,MS,38652,"DENTON MILLS INC.1865 DENMILL DR, NEW ALBANY MISSISSIPPI 38652 (UNION)",0,C,,
38652HCKRY1101D,-88.993,34.475,False,28,145,950400,28,28145,28145950400,1400000US28145950400,HICKORY SPRINGS MANUFACTURING CO,1101 DEN MILL RD,NEW ALBANY,MS,38652,"HICKORY SPRINGS MANUFACTURING CO.1101 DEN MILL RD, NEW ALBANY MISSISSIPPI 38652 (UNION)",1,C,,
38652HMCMT11DEN,-88.992,34.477,False,28,145,950400,28,28145,28145950400,1400000US28145950400,HMC METAL FORMING,1100 DENMILL RD,NEW ALBANY,MS,38652,"HMC METAL FORMING.1100 DENMILL RD, NEW ALBANY MISSISSIPPI 38652 (UNION)",0,C,,110000766261
38652MHSCPHWY78,-89.045,34.518,False,28,145,950300,28,28145,28145950300,1400000US28145950300,MOHASCO UPHOLSTERED FURNITURE CORP,HWY 178 W,NEW ALBANY,MS,386522199,"MOHASCO UPHOLSTERED FURNITURE CORP.HWY 178 W, NEW ALBANY MISSISSIPPI 38652 (UNION)",0,C,,
38652MSTRBHIGHW,-88.99,34.543,False,28,145,950100,28,28145,28145950100,1400000US28145950100,MASTER-BILT PRODUCTS,"908 HWY 15, NORTH",NEW ALBANY,MS,38652,"MASTER-BILT PRODUCTS.908 HWY 15, NORTH, NEW ALBANY MISSISSIPPI 38652 (UNION)",0,C,,110000605140
38652PPRMPBOX72,-88.988,34.546,False,28,145,950100,28,28145,28145950100,1400000US28145950100,PIPER IMPACT,922 HWY 15 N,NEW ALBANY,MS,38652,"PIPER IMPACT.922 HWY 15 N, NEW ALBANY MISSISSIPPI 38652 (UNION)",0,C,,
38652PPRMP795CO,-89.007,34.521,False,28,145,950100,28,28145,28145950100,1400000US28145950100,METAL IMPACT SOUTH,795 SAM T BARKLEY DR,NEW ALBANY,MS,38652,"METAL IMPACT SOUTH.795 SAM T BARKLEY DR, NEW ALBANY MISSISSIPPI 38652 (UNION)",0,C,,110002218154
3865WJNSBF823HI,-88.991,34.531,False,28,145,950100,28,28145,28145950100,1400000US28145950100,JNS BIOFUEL LLC,823 HIGHWAY 15 NORTH,NEW ALBANY,MS,38652,"JNS BIOFUEL LLC.823 HIGHWAY 15 NORTH, NEW ALBANY MISSISSIPPI 38652 (UNION)",0,C,,110070550772
38654HCNDS8363C,-89.814,34.975,False,28,033,070812,28,28033,28033070812,1400000US28033070812,HC INDUSTRIES INC.,8363 CEDAR RIDGE,OLIVE BRANCH,MS,38654,"HC INDUSTRIES INC..8363 CEDAR RIDGE, OLIVE BRANCH MISSISSIPPI 38654 (DESOTO)",0,C,,
38654KSHNC10500,-89.804,34.983000000000004,False,28,033,070812,28,28033,28033070812,1400000US28033070812,PLASKOLITE SOUTH LLC,10500 HIGH POINT RD,OLIVE BRANCH,MS,38654,"PLASKOLITE SOUTH LLC.10500 HIGH POINT RD, OLIVE BRANCH MISSISSIPPI 38654 (DESOTO)",0,C,,110000375647
38654MRCNN10800,-89.79799999999999,34.988,False,28,033,070812,28,28033,28033070812,1400000US28033070812,ARDAGH METAL BEVERAGE USA INC RE: OLIVE BRANCH FACILITY,10800 MARINA DR,OLIVE BRANCH,MS,38654,"ARDAGH METAL BEVERAGE USA INC RE: OLIVE BRANCH FACILITY.10800 MARINA DR, OLIVE BRANCH MISSISSIPPI 38654 (DESOTO)",0,C,,110000375674
38654KLLYM10745,-89.8,34.988,False,28,033,070812,28,28033,28033070812,1400000US28033070812,BRINKMANN,10745 MARINA DR.,OLIVE BRANCH,MS,38654,"BRINKMANN.10745 MARINA DR., OLIVE BRANCH MISSISSIPPI 38654 (DESOTO)",0,C,,
38654MRMRK10511,-89.802,34.983000000000004,False,28,033,070812,28,28033,28033070812,1400000US28033070812,INFINITE BUILDING PRODUCTS,10511 HIGH POINT RD,OLIVE BRANCH,MS,38654,"INFINITE BUILDING PRODUCTS.10511 HIGH POINT RD, OLIVE BRANCH MISSISSIPPI 38654 (DESOTO)",0,C,,110000375683
38654MNSHP10333,-89.806,34.983000000000004,False,28,033,070812,28,28033,28033070812,1400000US28033070812,MENASHA PACKAGING LLC,10333 HIGHPOINT RD,OLIVE BRANCH,MS,386543911,"MENASHA PACKAGING LLC.10333 HIGHPOINT RD, OLIVE BRANCH MISSISSIPPI 38654 (DESOTO)",0,C,,
38654QBCRW8649H,-89.796,34.986,False,28,033,070812,28,28033,28033070812,1400000US28033070812,QUEBECOR WORLD,8649 HACKS CROSS RD,OLIVE BRANCH,MS,38654,"QUEBECOR WORLD.8649 HACKS CROSS RD, OLIVE BRANCH MISSISSIPPI 38654 (DESOTO)",0,C,,110001976862
38654MRCNH11110,-89.79299999999999,34.979,False,28,033,070830,28,28033,28033070830,1400000US28033070830,HELMITIN INC,11110 AIRPORT RD,OLIVE BRANCH,MS,38654,"HELMITIN INC.11110 AIRPORT RD, OLIVE BRANCH MISSISSIPPI 38654 (DESOTO)",0,C,,110000375665
38654MRCNS11170,-89.791,34.986,False,28,033,070830,28,28033,28033070830,1400000US28033070830,MARIETTA AMERICAN CORP,11170 GREEN VALLEY DR,OLIVE BRANCH,MS,38654,"MARIETTA AMERICAN CORP.11170 GREEN VALLEY DR, OLIVE BRANCH MISSISSIPPI 38654 (DESOTO)",0,C,,
38654TYLRR11042,-89.795,34.992,False,28,033,070830,28,28033,28033070830,1400000US28033070830,INTERNATIONAL COLD STORAGE,11042 WILDWOOD DR,OLIVE BRANCH,MS,38654,"INTERNATIONAL COLD STORAGE.11042 WILDWOOD DR, OLIVE BRANCH MISSISSIPPI 38654 (DESOTO)",1,C,,110000375718
38654STHRN11000,-89.795,34.986,False,28,033,070830,28,28033,28033070830,1400000US28033070830,SOUTHERN METAL & PLASTIC PRODUCTS,11000 GREEN VALLEY DR.,OLIVE BRANCH,MS,38654,"SOUTHERN METAL & PLASTIC PRODUCTS.11000 GREEN VALLEY DR., OLIVE BRANCH MISSISSIPPI 38654 (DESOTO)",1,C,,
38654TRTMP8706D,-89.791,34.986999999999995,False,28,033,070830,28,28033,28033070830,1400000US28033070830,TRUE TEMPER SPORTS,8706 DEERFIELD DR.,OLIVE BRANCH,MS,38654,"TRUE TEMPER SPORTS.8706 DEERFIELD DR., OLIVE BRANCH MISSISSIPPI 38654 (DESOTO)",0,C,,
38654TRTMP11222,-89.791,34.986,False,28,033,070830,28,28033,28033070830,1400000US28033070830,TRUE TEMPER SPORTS INC.,11222 GREENVALLEY DR.,OLIVE BRANCH,MS,38654,"TRUE TEMPER SPORTS INC..11222 GREENVALLEY DR., OLIVE BRANCH MISSISSIPPI 38654 (DESOTO)",0,C,,
38654MRCNM8601H,-89.795,34.984,False,28,033,070830,28,28033,28033070830,1400000US28033070830,HART & COOLEY INC,8601 HACKS CROSS RD,OLIVE BRANCH,MS,38654,"HART & COOLEY INC.8601 HACKS CROSS RD, OLIVE BRANCH MISSISSIPPI 38654 (DESOTO)",0,C,,110012145776
38654CHLSP8225H,-89.795,34.979,False,28,033,070830,28,28033,28033070830,1400000US28033070830,CHELSEA PRODUCTS,8225 HACKS CROSS RD,OLIVE BRANCH,MS,38654,"CHELSEA PRODUCTS.8225 HACKS CROSS RD, OLIVE BRANCH MISSISSIPPI 38654 (DESOTO)",0,C,,110024942482
38654THMPS10136,-89.80799999999999,34.961,False,28,033,070822,28,28033,28033070822,1400000US28033070822,BPI COATINGS  SOLUTIONS,10136 MAGNOLIA DR,OLIVE BRANCH,MS,38654,"BPI COATINGS  SOLUTIONS.10136 MAGNOLIA DR, OLIVE BRANCH MISSISSIPPI 38654 (DESOTO)",0,C,,110000375692
38655GRGPCOLDHW,-89.527,34.437,False,28,071,950401,28,28071,28071950401,1400000US28071950401,GEORGIA-PACIFIC OXFORD PARTICLEBOARD,26 COUNTY RD 122,OXFORD,MS,38655,"GEORGIA-PACIFIC OXFORD PARTICLEBOARD.26 COUNTY RD 122, OXFORD MISSISSIPPI 38655 (LAFAYETTE)",0,C,,
38655MRSNMHIGHW,-89.521,34.406,False,28,071,950401,28,28071,28071950401,1400000US28071950401,OLIN WINCHESTER LLC,411 COUNTY RD 101,OXFORD,MS,38655,"OLIN WINCHESTER LLC.411 COUNTY RD 101, OXFORD MISSISSIPPI 38655 (LAFAYETTE)",0,C,,110022886457
38655CTRPL36COU,-89.531,34.415,False,28,071,950401,28,28071,28071950401,1400000US28071950401,CATERPILLAR INC HPE,36 COUNTY RD 166,OXFORD,MS,38655,"CATERPILLAR INC HPE.36 COUNTY RD 166, OXFORD MISSISSIPPI 38655 (LAFAYETTE)",0,C,,110002444178
38655TBRDM13IND,-89.509,34.335,False,28,071,950501,28,28071,28071950501,1400000US28071950501,LAWN-BOY OXFORD,13 INDL PARK DR,OXFORD,MS,38655,"LAWN-BOY OXFORD.13 INDL PARK DR, OXFORD MISSISSIPPI 38655 (LAFAYETTE)",0,C,,
38655WHRLP927WH,-89.54,34.354,False,28,071,950503,28,28071,28071950503,1400000US28071950503,WHIRLPOOL CORP,927 WHIRLPOOL DR,OXFORD,MS,38655,"WHIRLPOOL CORP.927 WHIRLPOOL DR, OXFORD MISSISSIPPI 38655 (LAFAYETTE)",0,C,,
38655XFRDCHWY7S,-89.53299999999999,34.37,False,28,071,950301,28,28071,28071950301,1400000US28071950301,OXFORD CMP INC,8 INDL PARK DR,OXFORD,MS,386551156,"OXFORD CMP INC.8 INDL PARK DR, OXFORD MISSISSIPPI 38655 (LAFAYETTE)",0,C,,
38663BLTRT16310,-88.93,34.789,False,28,139,950200,28,28139,28139950200,1400000US28139950200,BILTRITE RIPLEY OPERATIONS LLC,16310 HWY 15 N,RIPLEY,MS,38663,"BILTRITE RIPLEY OPERATIONS LLC.16310 HWY 15 N, RIPLEY MISSISSIPPI 38663 (TIPPAH)",0,C,,110000590496
38663LCFJKMURRA,-88.917,34.773,False,28,139,950200,28,28139,28139950200,1400000US28139950200,ALCOA FUJIKURA LTD (PEP INDUSTRIES),MURRAY SPUR RD,RIPLEY,MS,38663,"ALCOA FUJIKURA LTD (PEP INDUSTRIES).MURRAY SPUR RD, RIPLEY MISSISSIPPI 38663 (TIPPAH)",0,C,,
38663WDCRFMURRA,-88.913,34.773,False,28,139,950200,28,28139,28139950200,1400000US28139950200,INDUSTRIAL TIMBER LLC,781 CR-549,RIPLEY,MS,38663,"INDUSTRIAL TIMBER LLC.781 CR-549, RIPLEY MISSISSIPPI 38663 (TIPPAH)",0,C,,110002447665
38663HNKNS15881,-88.84700000000001,34.717,False,28,139,950200,28,28139,28139950200,1400000US28139950200,HANKINS INC,15881 HWY 4 E,RIPLEY,MS,38663,"HANKINS INC.15881 HWY 4 E, RIPLEY MISSISSIPPI 38663 (TIPPAH)",0,C,,110006723340
38663FVSTR291CU,-88.917,34.775,False,28,139,950200,28,28139,28139950200,1400000US28139950200,FIVE STAR MARINE INC,2910 COUNTY RD 501,RIPLEY,MS,38663,"FIVE STAR MARINE INC.2910 COUNTY RD 501, RIPLEY MISSISSIPPI 38663 (TIPPAH)",0,C,,110064219705
3866WLTLST2CUNT,-88.91,34.781,False,28,139,950200,28,28139,28139950200,1400000US28139950200,ELITE ELASTOMERS INC,200 COUNTY ROAD 565,RIPLEY,MS,38663,"ELITE ELASTOMERS INC.200 COUNTY ROAD 565, RIPLEY MISSISSIPPI 38663 (TIPPAH)",0,C,,110044503329
38668CHRMC1QUAL,-89.965,34.629,False,28,137,950400,28,28137,28137950400,1400000US28137950400,CHROMCRAFT FURNITURE INC,1 QUALITY LANE,SENATOBIA,MS,38668,"CHROMCRAFT FURNITURE INC.1 QUALITY LANE, SENATOBIA MISSISSIPPI 38668 (TATE)",0,C,,110000375736
38668LMNMX140MA,-89.99,34.613,False,28,137,950400,28,28137,28137950400,1400000US28137950400,AEI LLC,140 MATTHEWS DR,SENATOBIA,MS,38668,"AEI LLC.140 MATTHEWS DR, SENATOBIA MISSISSIPPI 38668 (TATE)",0,C,,110002226181
38671MRCNL8735H,-89.999,34.985,False,28,033,070521,28,28033,28033070521,1400000US28033070521,ABB INSTALLATION PRODUCTS INC,8735 HAMILTON RD,SOUTHAVEN,MS,38671,"ABB INSTALLATION PRODUCTS INC.8735 HAMILTON RD, SOUTHAVEN MISSISSIPPI 38671 (DESOTO)",0,C,,110000375745
38671CLMNS8465H,-89.999,34.984,False,28,033,070521,28,28033,28033070521,1400000US28033070521,COLEMAN STEEL TREATING INC,8465 HAMILTON RD,SOUTHAVEN,MS,38671,"COLEMAN STEEL TREATING INC.8465 HAMILTON RD, SOUTHAVEN MISSISSIPPI 38671 (DESOTO)",0,C,,
38676DRXLCTUNIC,-90.382,34.652,False,28,143,950200,28,28143,28143950200,1400000US28143950200,DREXEL CHEMICAL CO,TUNICA INDUSTRIAL PARK,TUNICA,MS,38676,"DREXEL CHEMICAL CO.TUNICA INDUSTRIAL PARK, TUNICA MISSISSIPPI 38676 (TUNICA)",0,C,,110002212882
38701CMTDLWARFI,-91.12700000000001,33.351,False,28,151,000702,28,28151,28151000702,1400000US28151000702,COMET RICE INC,WARFIELD POINT RD OFF HWY 82 W,GREENVILLE,MS,38701,"COMET RICE INC.WARFIELD POINT RD OFF HWY 82 W, GREENVILLE MISSISSIPPI 38701 (WASHINGTON)",0,C,,
38701VLSCFHIGHW,-91.133,33.339,False,28,151,000702,28,28151,28151000702,1400000US28151000702,VLASIC FOODS INC,84 VLASIC RD,GREENVILLE,MS,38701,"VLASIC FOODS INC.84 VLASIC RD, GREENVILLE MISSISSIPPI 38701 (WASHINGTON)",0,C,,
38701PNSTRHARBO,-91.09299999999999,33.37,False,28,151,000702,28,28151,28151000702,1400000US28151000702,GREAT DANE TRAILERS,1925 HARBOR FRONT RD,GREENVILLE,MS,38701,"GREAT DANE TRAILERS.1925 HARBOR FRONT RD, GREENVILLE MISSISSIPPI 38701 (WASHINGTON)",0,C,,110000375763
38702FRMKSINDUS,-91.113,33.366,False,28,151,000702,28,28151,28151000702,1400000US28151000702,FARMKIST ENTS,INDUSTRIAL FIELD RD,GREENVILLE,MS,38702,"FARMKIST ENTS.INDUSTRIAL FIELD RD, GREENVILLE MISSISSIPPI 38702 (WASHINGTON)",0,C,,
38702CRGLLHWY82,-91.11,33.352,False,28,151,000702,28,28151,28151000702,1400000US28151000702,PRODUCERS RICE MILL INC,HWY 82 W PRODUCERS DR,GREENVILLE,MS,387020690,"PRODUCERS RICE MILL INC.HWY 82 W PRODUCERS DR, GREENVILLE MISSISSIPPI 38702 (WASHINGTON)",1,C,,
38702NTRGYSTATE,-91.115,33.351,False,28,151,000702,28,28151,28151000702,1400000US28151000702,ENTERGY GERALD ANDRUS PLANT,STATE HWY 82 W,GREENVILLE,MS,38701,"ENTERGY GERALD ANDRUS PLANT.STATE HWY 82 W, GREENVILLE MISSISSIPPI 38701 (WASHINGTON)",0,C,,110000375781
38701CPPRS1381P,-91.031,33.431,False,28,151,000300,28,28151,28151000300,1400000US28151000300,COOPER STEEL,1381 PICKETT ST,GREENVILLE,MS,38703,"COOPER STEEL.1381 PICKETT ST, GREENVILLE MISSISSIPPI 38703 (WASHINGTON)",0,C,,
38701HGRHN1540T,-91.025,33.43,False,28,151,000300,28,28151,28151000300,1400000US28151000300,HAGER COS  GREENVILLE,1540 THORNTON ST,GREENVILLE,MS,387010000,"HAGER COS  GREENVILLE.1540 THORNTON ST, GREENVILLE MISSISSIPPI 38701 (WASHINGTON)",0,C,,
38701NCHLS1825N,-91.03299999999999,33.431,False,28,151,000300,28,28151,28151000300,1400000US28151000300,NICHOLSON SAW,1825 N THEOBALD ST,GREENVILLE,MS,38702,"NICHOLSON SAW.1825 N THEOBALD ST, GREENVILLE MISSISSIPPI 38702 (WASHINGTON)",0,C,,
38701NCLBN1098N,-91.046,33.435,False,28,151,000300,28,28151,28151000300,1400000US28151000300,UNCLE BEN'S INC,1098 N BROADWAY EXTD,GREENVILLE,MS,38701,"UNCLE BEN'S INC.1098 N BROADWAY EXTD, GREENVILLE MISSISSIPPI 38701 (WASHINGTON)",0,C,,
38701RLBLL1901N,-91.046,33.429,False,28,151,000300,28,28151,28151000300,1400000US28151000300,MARCONI INC,956 N BROADWAY,GREENVILLE,MS,38701,"MARCONI INC.956 N BROADWAY, GREENVILLE MISSISSIPPI 38701 (WASHINGTON)",0,C,,
38704PLTTCNORTH,-91.0,33.417,False,28,151,000300,28,28151,28151000300,1400000US28151000300,PLATTE CHEMICAL CO,917 PLATTE RD,GREENVILLE,MS,38704,"PLATTE CHEMICAL CO.917 PLATTE RD, GREENVILLE MISSISSIPPI 38704 (WASHINGTON)",0,C,,110000375790
38701WSHNG1265W,-91.03399999999999,33.424,False,28,151,000300,28,28151,28151000300,1400000US28151000300,SCHWINN BICYCLE CO,1265 WASSON ST,GREENVILLE,MS,38701,"SCHWINN BICYCLE CO.1265 WASSON ST, GREENVILLE MISSISSIPPI 38701 (WASHINGTON)",1,C,,
38704CLDWL2590O,-91.008,33.418,False,28,151,000300,28,28151,28151000300,1400000US28151000300,CALDWELL CULVERT CO,2590 OLD LELAND RD,GREENVILLE,MS,38704,"CALDWELL CULVERT CO.2590 OLD LELAND RD, GREENVILLE MISSISSIPPI 38704 (WASHINGTON)",0,C,,
38732BXTRHHIGHW,-90.71700000000001,33.764,False,28,011,950500,28,28011,28011950500,1400000US28011950500,BAXTER HEALTHCARE CORP,911 N DAVIS AVE,CLEVELAND,MS,38732,"BAXTER HEALTHCARE CORP.911 N DAVIS AVE, CLEVELAND MISSISSIPPI 38732 (BOLIVAR)",0,C,,110000375816
38732DGLSLHIGHW,-90.714,33.764,False,28,011,950500,28,28011,28011950500,1400000US28011950500,DOUGLAS & LOMASON CO,HWY 61 N,CLEVELAND,MS,38732,"DOUGLAS & LOMASON CO.HWY 61 N, CLEVELAND MISSISSIPPI 38732 (BOLIVAR)",0,C,,
38732QLTYSUSHWY,-90.71700000000001,33.718,False,28,011,950500,28,28011,28011950500,1400000US28011950500,QUALITY STEEL CORP,2914 US HIGHWAY 61,CLEVELAND,MS,38732,"QUALITY STEEL CORP.2914 US HIGHWAY 61, CLEVELAND MISSISSIPPI 38732 (BOLIVAR)",0,C,,110000605159
38732CLRTLOLDHW,-90.721,33.766,False,28,011,950500,28,28011,28011950500,1400000US28011950500,COLOR TILE CERAMIC MANUFACTURING CO,OLD HWY 61 N,CLEVELAND,MS,38732,"COLOR TILE CERAMIC MANUFACTURING CO.OLD HWY 61 N, CLEVELAND MISSISSIPPI 38732 (BOLIVAR)",0,C,,
38732NTRGY3964H,-90.715,33.795,False,28,011,950500,28,28011,28011950500,1400000US28011950500,ENTERGY DELTA PLANT,3964 HWY 61 N,CLEVELAND,MS,38732,"ENTERGY DELTA PLANT.3964 HWY 61 N, CLEVELAND MISSISSIPPI 38732 (BOLIVAR)",0,C,,
38732DFSTC800NP,-90.709,33.756,False,28,011,950701,28,28011,28011950701,1400000US28011950701,ITW DUO-FAST,800 N PEARMAN RD,CLEVELAND,MS,38732,"ITW DUO-FAST.800 N PEARMAN RD, CLEVELAND MISSISSIPPI 38732 (BOLIVAR)",0,C,,
38732RYLVN907DE,-90.704,33.760999999999996,False,28,011,950701,28,28011,28011950701,1400000US28011950701,ROYAL VENDORS INC,907 DELTA COUNCIL DR,CLEVELAND,MS,38732,"ROYAL VENDORS INC.907 DELTA COUNCIL DR, CLEVELAND MISSISSIPPI 38732 (BOLIVAR)",0,C,,
38737STLLCHWY49,-90.53,33.8,False,28,133,950100,28,28133,28133950100,1400000US28133950100,STOLLE CORP,HWY 49 W,DREW,MS,38737,"STOLLE CORP.HWY 49 W, DREW MISSISSIPPI 38737 (SUNFLOWER)",0,C,,
38751DLTPRINDIA,-90.619,33.439,False,28,133,950600,28,28133,28133950600,1400000US28133950600,"CONFISH, INC",INDUSTRIAL PARK,INDIANOLA,MS,38751,"CONFISH, INC.INDUSTRIAL PARK, INDIANOLA MISSISSIPPI 38751 (SUNFLOWER)",1,C,,110067041230
38751DLTPRHWY49,-90.619,33.439,False,28,133,950600,28,28133,28133950600,1400000US28133950600,DELTA PRIDE CATFISH INC SOUTH PLANT,HWY 49W S,INDIANOLA,MS,38751,"DELTA PRIDE CATFISH INC SOUTH PLANT.HWY 49W S, INDIANOLA MISSISSIPPI 38751 (SUNFLOWER)",2,C,,
38751STHFR267BA,-90.589,33.422,False,28,133,950600,28,28133,28133950600,1400000US28133950600,SOUTHFRESH FARMS INC.,267 BAIRD RD,INDIANOLA,MS,38751,"SOUTHFRESH FARMS INC..267 BAIRD RD, INDIANOLA MISSISSIPPI 38751 (SUNFLOWER)",0,C,,110002213792
38754PRDCTHWY49,-90.57600000000001,33.244,False,28,053,950100,28,28053,28053950100,1400000US28053950100,PRODUCERS FEED CO,HWY 49 W,ISOLA,MS,38754,"PRODUCERS FEED CO.HWY 49 W, ISOLA MISSISSIPPI 38754 (HUMPHREYS)",0,C,,
