TRIFID,LONGITUDE,LATITUDE,ESTIMATE,STATEFP,COUNTYFP,TRACTCE,STATEGEOID,COUNTYGEOID,TRACTGEOID,AFFGEOID,FACILITY_NAME,STREET,CITY,STUSPS,ZIP_CODE,FACILITY,FAC_CLOSED_IND,ASGN_FEDERAL_IND,BIA_CODE,EPA_REGISTRY_ID
38901NWSPRPAPER,-89.819,33.830999999999996,False,28,043,950200,28,28043,28043950200,1400000US28043950200,RESOLUTE FP US INC - GRENADA MILL,1000 PAPERMILL RD,GRENADA,MS,38901,"RESOLUTE FP US INC - GRENADA MILL.1000 PAPERMILL RD, GRENADA MISSISSIPPI 38901 (GRENADA)",0,C,,110000376192
38901HTCRF1000H,-89.79799999999999,33.825,False,28,043,950200,28,28043,28043950200,1400000US28043950200,MODINE GRENADA CIS,1000 HEATCRAFT DR,GRENADA,MS,38901,"MODINE GRENADA CIS.1000 HEATCRAFT DR, GRENADA MISSISSIPPI 38901 (GRENADA)",0,C,,110000744400
38901BNMNF2MAIN,-89.975,33.760999999999996,False,28,043,950200,28,28043,28043950200,1400000US28043950200,BAIN MANUFACTURING CO INC,2 MAIN ST,GRENADA,MS,38901,"BAIN MANUFACTURING CO INC.2 MAIN ST, GRENADA MISSISSIPPI 38901 (GRENADA)",0,C,,
38901HTCRF1995A,-89.80799999999999,33.836,False,28,043,950200,28,28043,28043950200,1400000US28043950200,ADVANCED DISTRIBUTOR PRODUCTS LLC,1995 AIR INDUSTRIAL PARK RD,GRENADA,MS,38901,"ADVANCED DISTRIBUTOR PRODUCTS LLC.1995 AIR INDUSTRIAL PARK RD, GRENADA MISSISSIPPI 38901 (GRENADA)",0,C,,110000376174
38915WYRHS511RA,-89.346,33.986,False,28,013,950200,28,28013,28013950200,1400000US28013950200,WEYERHAEUSER NR CO BRUCE FACILITY,289 S PONTOTOC RD,BRUCE,MS,38915,"WEYERHAEUSER NR CO BRUCE FACILITY.289 S PONTOTOC RD, BRUCE MISSISSIPPI 38915 (CALHOUN)",0,C,,110017416606
38916CVNSSAYCOC,-89.309,33.861,False,28,013,950500,28,28013,28013950500,1400000US28013950500,CAVINESS WORKWORKING CO INC,200 AYCOCK,CALHOUN CITY,MS,38916,"CAVINESS WORKWORKING CO INC.200 AYCOCK, CALHOUN CITY MISSISSIPPI 38916 (CALHOUN)",0,C,,
38930BLDWNOLDAI,-90.2,33.491,False,28,083,950800,28,28083,28083950800,1400000US28083950800,BALDWIN PIANO & ORGAN CO,2900 CR 540 BALDWIN RD,GREENWOOD,MS,389307012,"BALDWIN PIANO & ORGAN CO.2900 CR 540 BALDWIN RD, GREENWOOD MISSISSIPPI 38930 (LEFLORE)",1,C,,
38930NTNLP1500C,-90.199,33.513000000000005,False,28,083,950800,28,28083,28083950800,1400000US28083950800,UNIEK INC WOOD DIV,1500 COMMERCE ST,GREENWOOD,MS,389301910,"UNIEK INC WOOD DIV.1500 COMMERCE ST, GREENWOOD MISSISSIPPI 38930 (LEFLORE)",1,C,,
38935RVNTM1013S,-90.193,33.501999999999995,False,28,083,950800,28,28083,28083950800,1400000US28083950800,IRVIN AUTOMOTIVE PRODUCTS INC,1013 SYCAMORE ST,GREENWOOD,MS,38935,"IRVIN AUTOMOTIVE PRODUCTS INC.1013 SYCAMORE ST, GREENWOOD MISSISSIPPI 38935 (LEFLORE)",0,C,,
38930MLWKL13SYC,-90.193,33.501,False,28,083,950800,28,28083,28083950800,1400000US28083950800,MILWAUKEE ELECTRIC TOOL CORP,1003 SYCAMORE ST,GREENWOOD,MS,38930,"MILWAUKEE ELECTRIC TOOL CORP.1003 SYCAMORE ST, GREENWOOD MISSISSIPPI 38930 (LEFLORE)",0,C,,110016778913
38930JHNRC36EAS,-90.20299999999999,33.5,False,28,083,950800,28,28083,28083950800,1400000US28083950800,JOHN RICHARD COLLECTION,306 EASTMAN,GREENWOOD,MS,38930,"JOHN RICHARD COLLECTION.306 EASTMAN, GREENWOOD MISSISSIPPI 38930 (LEFLORE)",0,C,,110031019421
38930MDRTNMEDAR,-90.166,33.544000000000004,False,28,083,950200,28,28083,28083950200,1400000US28083950200,MEDART EQUIPMENT INC,MEDART RD,GREENWOOD,MS,38930,"MEDART EQUIPMENT INC.MEDART RD, GREENWOOD MISSISSIPPI 38930 (LEFLORE)",0,C,,
38930VKNGR561VI,-90.165,33.54,False,28,083,950200,28,28083,28083950200,1400000US28083950200,VIKING RANGE CORP-MAIN PLANT,5601 VIKING RD,GREENWOOD,MS,38930,"VIKING RANGE CORP-MAIN PLANT.5601 VIKING RD, GREENWOOD MISSISSIPPI 38930 (LEFLORE)",0,C,,110020518135
38965BNDFMHWY32,-89.62799999999999,34.129,False,28,161,950100,28,28161,28161950100,1400000US28161950100,BONDAFOAM INC,HWY 32 E,WATER VALLEY,MS,38965,"BONDAFOAM INC.HWY 32 E, WATER VALLEY MISSISSIPPI 38965 (YALOBUSHA)",0,C,,
38922KDCLTHWY7S,-89.679,33.97,False,28,161,950100,28,28161,28161950100,1400000US28161950100,K& D CULTURED MARBLE INC,17425 OKAHOMA ST,COFFEEVILLE,MS,38922,"K& D CULTURED MARBLE INC.17425 OKAHOMA ST, COFFEEVILLE MISSISSIPPI 38922 (YALOBUSHA)",0,C,,110000590619
38965CLTNDHIGHW,-89.639,34.131,False,28,161,950200,28,28161,28161950200,1400000US28161950200,BORGWARNER EMISSION SYSTEMS INC,600 HWY 32 E,WATER VALLEY,MS,38965,"BORGWARNER EMISSION SYSTEMS INC.600 HWY 32 E, WATER VALLEY MISSISSIPPI 38965 (YALOBUSHA)",0,C,,110008510496
38965MTTSF190LA,-89.62899999999999,34.163000000000004,False,28,161,950200,28,28161,28161950200,1400000US28161950200,MOTTS/BLUE COACH FOODS,190 LAFAYETTE ST,WATER VALLEY,MS,38965,"MOTTS/BLUE COACH FOODS.190 LAFAYETTE ST, WATER VALLEY MISSISSIPPI 38965 (YALOBUSHA)",0,C,,
3896WWTRVL57LAF,-89.64200000000001,34.144,False,28,161,950200,28,28161,28161950200,1400000US28161950200,"WATER VALLEY POULTRY, LLC",507 LAFAYETTE STREET,WATER VALLEY,MS,38965,"WATER VALLEY POULTRY, LLC.507 LAFAYETTE STREET, WATER VALLEY MISSISSIPPI 38965 (YALOBUSHA)",0,C,,110055498304
38967SCRWC700CO,-89.73100000000001,33.468,False,28,097,950300,28,28097,28097950300,1400000US28097950300,SCREW CONVEYOR CORPORATION,781 CHURCH STREET,WINONA,MS,38967,"SCREW CONVEYOR CORPORATION.781 CHURCH STREET, WINONA MISSISSIPPI 38967 (MONTGOMERY)",0,C,,
38967KRGRN800OL,-89.73299999999999,33.499,False,28,097,950300,28,28097,28097950300,1400000US28097950300,KRUEGER INTERNATIONAL,4 OLD HWY 51 N,WINONA,MS,38967,"KRUEGER INTERNATIONAL.4 OLD HWY 51 N, WINONA MISSISSIPPI 38967 (MONTGOMERY)",0,C,,
38967MRGNTHWY51,-89.73299999999999,33.504,False,28,097,950300,28,28097,28097950300,1400000US28097950300,ENERGY CONVERSION SYSTEMS WINONA DIV,HWY 51 N CROSSROADS INDUSTRIAL PARK,WINONA,MS,38967,"ENERGY CONVERSION SYSTEMS WINONA DIV.HWY 51 N CROSSROADS INDUSTRIAL PARK, WINONA MISSISSIPPI 38967 (MONTGOMERY)",0,C,,110012706170
39042RWCKN815NO,-89.995,32.286,False,28,121,020801,28,28121,28121020801,1400000US28121020801,RECKITT BENCKISER INC,815 N COLLEGE ST,BRANDON,MS,39042,"RECKITT BENCKISER INC.815 N COLLEGE ST, BRANDON MISSISSIPPI 39042 (RANKIN)",0,C,,110000376281
39043PRSGSPURSU,-89.978,32.149,False,28,121,021002,28,28121,28121021002,1400000US28121021002,PURSUE GAS PROCESSING & PETROCHEMICAL CO,PURSUE RD,BRANDON,MS,39043,"PURSUE GAS PROCESSING & PETROCHEMICAL CO.PURSUE RD, BRANDON MISSISSIPPI 39043 (RANKIN)",0,C,,
39046HLLWDNMILL,-90.025,32.618,False,28,089,030600,28,28089,28089030600,1400000US28089030600,HALL WOOD PRODUCTS INC,NORTH MILLER ST,CANTON,MS,39046,"HALL WOOD PRODUCTS INC.NORTH MILLER ST, CANTON MISSISSIPPI 39046 (MADISON)",0,C,,
39046VNLRC100IN,-90.021,32.62,False,28,089,030600,28,28089,28089030600,1400000US28089030600,GREIF INDUSTRIAL PACKAGING & SERVICES LLC,100 INDUSTRIAL DR,CANTON,MS,39046,"GREIF INDUSTRIAL PACKAGING & SERVICES LLC.100 INDUSTRIAL DR, CANTON MISSISSIPPI 39046 (MADISON)",0,C,,110000766270
39046THNTN2075H,-90.00299999999999,32.617,False,28,089,030600,28,28089,28089030600,1400000US28089030600,FALCON THONET INDUSTRIES,2075 HWY 43 N,CANTON,MS,39046,"FALCON THONET INDUSTRIES.2075 HWY 43 N, CANTON MISSISSIPPI 39046 (MADISON)",0,C,,
39046HCKRY451CO,-90.00299999999999,32.624,False,28,089,030600,28,28089,28089030600,1400000US28089030600,HICKORY SPRINGS MANUFACTURING CO,451 COMMERCE AVE,CANTON,MS,39046,"HICKORY SPRINGS MANUFACTURING CO.451 COMMERCE AVE, CANTON MISSISSIPPI 39046 (MADISON)",0,C,,
39051CHCTWHWY35,-89.535,32.823,False,28,079,040100,28,28079,28079040100,1400000US28079040100,TYSON FARMS INC - CARTHAGE MS PROCESSING PLANT,3865 HWY 35N,CARTHAGE,MS,39051,"TYSON FARMS INC - CARTHAGE MS PROCESSING PLANT.3865 HWY 35N, CARTHAGE MISSISSIPPI 39051 (LEAKE)",0,C,,110002326698
39056GLFST1006I,-90.363,32.352,False,28,049,010400,28,28049,28049010400,1400000US28049010400,GULF STATES CANNERS INC,1006 CLINTON INDL PARK DR,CLINTON,MS,390563298,"GULF STATES CANNERS INC.1006 CLINTON INDL PARK DR, CLINTON MISSISSIPPI 39056 (HINDS)",0,C,,
39056PCKRD1001I,-90.363,32.36,False,28,049,010400,28,28049,28049010400,1400000US28049010400,DELPHI PACKARD ELECTRIC SYSTEMS,1001 INDUSTRIAL PARK DR,CLINTON,MS,39056,"DELPHI PACKARD ELECTRIC SYSTEMS.1001 INDUSTRIAL PARK DR, CLINTON MISSISSIPPI 39056 (HINDS)",0,C,,110000376325
39056RLNCN1000I,-90.363,32.361,False,28,049,010400,28,28049,28049010400,1400000US28049010400,AKZO NOBEL COATINGS INC,1000 INDUSTRIAL PARK DR,CLINTON,MS,39056,"AKZO NOBEL COATINGS INC.1000 INDUSTRIAL PARK DR, CLINTON MISSISSIPPI 39056 (HINDS)",0,C,,110064301722
39056RVRWD1021C,-90.346,32.353,False,28,049,010400,28,28049,28049010400,1400000US28049010400,GRAPHIC PACKAGING INTERNATIONAL CLINTON PLANT,1021 CLINTON INDUSTRIAL PK RD,CLINTON,MS,39056,"GRAPHIC PACKAGING INTERNATIONAL CLINTON PLANT.1021 CLINTON INDUSTRIAL PK RD, CLINTON MISSISSIPPI 39056 (HINDS)",0,C,,
39073GNBNC250EL,-90.12700000000001,32.155,False,28,121,021001,28,28121,28121021001,1400000US28121021001,EXIDE TECHNOLOGIES,250 ELLIS ST,FLORENCE,MS,39073,"EXIDE TECHNOLOGIES.250 ELLIS ST, FLORENCE MISSISSIPPI 39073 (RANKIN)",0,C,,110000376343
39074CHCTWHWY80,-89.494,32.359,False,28,123,020600,28,28123,28123020600,1400000US28123020600,CHOCTAW MAID FARMS INC FOREST PROCESSING PLANT,304 HWY 80 W,FOREST,MS,39074,"CHOCTAW MAID FARMS INC FOREST PROCESSING PLANT.304 HWY 80 W, FOREST MISSISSIPPI 39074 (SCOTT)",0,C,,
39074CHCTW1225J,-89.493,32.359,False,28,123,020600,28,28123,28123020600,1400000US28123020600,TYSON FARMS INC - FOREST MS T2,1225 JACK LEE DR,FOREST,MS,39074,"TYSON FARMS INC - FOREST MS T2.1225 JACK LEE DR, FOREST MISSISSIPPI 39074 (SCOTT)",0,C,,110024424256
39074CNTRL11634,-89.54,32.363,False,28,123,020600,28,28123,28123020600,1400000US28123020600,TYSON FARMS INC,11634 HWY 80 W,FOREST,MS,39074,"TYSON FARMS INC.11634 HWY 80 W, FOREST MISSISSIPPI 39074 (SCOTT)",0,C,,110002324191
3907WSPRRS154HW,-89.48299999999999,32.332,False,28,123,020600,28,28123,28123020600,1400000US28123020600,SUPERIOR ASPHALT FOREST PLANT,1540 HWY 35 SOUTH,FOREST,MS,39074,"SUPERIOR ASPHALT FOREST PLANT.1540 HWY 35 SOUTH, FOREST MISSISSIPPI 39074 (SCOTT)",0,C,,110043284344
39074FLCNSHWY80,-89.50200000000001,32.363,False,28,123,020500,28,28123,28123020500,1400000US28123020500,FLO-CON SYSTEMS INC,HWY 80 W,FOREST,MS,39074,"FLO-CON SYSTEMS INC.HWY 80 W, FOREST MISSISSIPPI 39074 (SCOTT)",0,C,,
39074MCCRT110CL,-89.485,32.367,False,28,123,020500,28,28123,28123020500,1400000US28123020500,TYSON FOODS INC T1 FOREST PROCESSING PLANT,110 CLEVELAND ST,FOREST,MS,39074,"TYSON FOODS INC T1 FOREST PROCESSING PLANT.110 CLEVELAND ST, FOREST MISSISSIPPI 39074 (SCOTT)",0,C,,110000376361
39074BCRGR501NO,-89.475,32.352,False,28,123,020500,28,28123,28123020500,1400000US28123020500,KOCH FOODS OF MISSISSIPPI LLC,921 S MAIN ST,FOREST,MS,39074,"KOCH FOODS OF MISSISSIPPI LLC.921 S MAIN ST, FOREST MISSISSIPPI 39074 (SCOTT)",0,C,,110010121313
39074MCCRT430OA,-89.47200000000001,32.361,False,28,123,020500,28,28123,28123020500,1400000US28123020500,TYSON FOODS INC FOREST MS FEEDMILL,430 OAK ST,FOREST,MS,39074,"TYSON FOODS INC FOREST MS FEEDMILL.430 OAK ST, FOREST MISSISSIPPI 39074 (SCOTT)",0,C,,110000746961
39074FRSTP110CO,-89.48,32.364000000000004,False,28,123,020500,28,28123,28123020500,1400000US28123020500,FOREST PACKING CO INC.,110 COMMERCE LOOP,FOREST,MS,39074,"FOREST PACKING CO INC..110 COMMERCE LOOP, FOREST MISSISSIPPI 39074 (SCOTT)",0,C,,110002222504
39074LDYFR11CMM,-89.48,32.364000000000004,False,28,123,020500,28,28123,28123020500,1400000US28123020500,LADY FOREST FARMS INC. FOREST FEED MILL,110 COMMERCE LOOP,FOREST,MS,39074,"LADY FOREST FARMS INC. FOREST FEED MILL.110 COMMERCE LOOP, FOREST MISSISSIPPI 39074 (SCOTT)",0,C,,110067041463
3907WHJBKR42EAS,-89.471,32.36,False,28,123,020500,28,28123,28123020500,1400000US28123020500,HJ BAKER & BRO INC,420 E OAK ST,FOREST,MS,39074,"HJ BAKER & BRO INC.420 E OAK ST, FOREST MISSISSIPPI 39074 (SCOTT)",0,C,,110038344743
39074HGHSRRTE5B,-89.40299999999999,32.358000000000004,False,28,123,020100,28,28123,28123020100,1400000US28123020100,RAYTHEON CO,19859 HWY 80,FOREST,MS,39074,"RAYTHEON CO.19859 HWY 80, FOREST MISSISSIPPI 39074 (SCOTT)",0,C,,110040048178
39359GRNCRHWY21,-89.323,32.575,False,28,123,020100,28,28123,28123020100,1400000US28123020100,PECO FOODS INC - SEBASTOPOL PROCESSING,HWY 21 S,SEBASTOPOL,MS,39359,"PECO FOODS INC - SEBASTOPOL PROCESSING.HWY 21 S, SEBASTOPOL MISSISSIPPI 39359 (SCOTT)",0,C,,110007649884
39359STVSB18134,-89.32700000000001,32.576,False,28,123,020100,28,28123,28123020100,1400000US28123020100,US TVA SEBASTOPOL 161KV SUBSTATION,18134 HIGHWAY 21,SEBASTOPOL,MS,39359,"US TVA SEBASTOPOL 161KV SUBSTATION.18134 HIGHWAY 21, SEBASTOPOL MISSISSIPPI 39359 (SCOTT)",0,F,,
39077MGNTKUSHWY,-90.398,31.916,False,28,029,950300,28,28029,28029950300,1400000US28029950300,GALLMAN WIRE TECHNOLOGIES,19120 HWY 51,GALLMAN,MS,39077,"GALLMAN WIRE TECHNOLOGIES.19120 HWY 51, GALLMAN MISSISSIPPI 39077 (COPIAH)",0,C,,110000741467
39077MDRNNI55SO,-90.395,31.924,False,28,029,950300,28,28029,28029950300,1400000US28029950300,MODERN ENGINEERING CO INC,1095 MECO RD,GALLMAN,MS,39077,"MODERN ENGINEERING CO INC.1095 MECO RD, GALLMAN MISSISSIPPI 39077 (COPIAH)",0,C,,
39077SNDRSHWY15,-90.387,31.935,False,28,029,950300,28,28029,28029950300,1400000US28029950300,SANDERSON FARMS INC,19148 HIGHWAY 51N,HAZLEHURST,MS,39083,"SANDERSON FARMS INC.19148 HIGHWAY 51N, HAZLEHURST MISSISSIPPI 39083 (COPIAH)",0,C,,110007109093
39059CHCTWHWY51,-90.375,32.0,False,28,029,950300,28,28029,28029950300,1400000US28029950300,CHOCTAW METAL FARMS INC,HWY 51 S,CRYSTAL SPRINGS,MS,39059,"CHOCTAW METAL FARMS INC.HWY 51 S, CRYSTAL SPRINGS MISSISSIPPI 39059 (COPIAH)",0,C,,
39077GRGGL20043,-90.39399999999999,31.926,False,28,029,950300,28,28029,28029950300,1400000US28029950300,WESTLAKE COMPOUNDS LLC,20043 HWY 51,HAZLEHURST,MS,39083,"WESTLAKE COMPOUNDS LLC.20043 HWY 51, HAZLEHURST MISSISSIPPI 39083 (COPIAH)",0,C,,110000590655
39059THRDG23101,-90.37700000000001,31.964000000000002,False,28,029,950300,28,28029,28029950300,1400000US28029950300,ETHERIDGE ENTERPRISES,23101 HWY 51 S SUITE B,CRYSTAL SPRINGS,MS,39059,"ETHERIDGE ENTERPRISES.23101 HWY 51 S SUITE B, CRYSTAL SPRINGS MISSISSIPPI 39059 (COPIAH)",0,C,,
3908WDGFDS195IN,-90.399,31.924,False,28,029,950300,28,28029,28029950300,1400000US28029950300,DG FOODS LLC,1095 INDUSTIRAL DRIVE,HAZLEHURST,MS,39083,"DG FOODS LLC.1095 INDUSTIRAL DRIVE, HAZLEHURST MISSISSIPPI 39083 (COPIAH)",0,C,,110025342476
39083CPHCN600GE,-90.384,31.872,False,28,029,950400,28,28029,28029950400,1400000US28029950400,COPIAH COUNTY MANUFACTURING CO INC,600 GEORGETOWN ST,HAZLEHURST,MS,39083,"COPIAH COUNTY MANUFACTURING CO INC.600 GEORGETOWN ST, HAZLEHURST MISSISSIPPI 39083 (COPIAH)",0,C,,
39083SNDRSHIGHW,-90.37899999999999,31.875999999999998,False,28,029,950400,28,28029,28029950400,1400000US28029950400,SANDERSON FARMS INC,28163 HWY 28E,HAZLEHURST,MS,39083,"SANDERSON FARMS INC.28163 HWY 28E, HAZLEHURST MISSISSIPPI 39083 (COPIAH)",0,C,,110055519979
39083KTCHN1519M,-90.39399999999999,31.846999999999998,False,28,029,950400,28,28029,28029950400,1400000US28029950400,KITCHENS BROTHERS MANUFACTURING CO,15190 MONTICELLO RD,HAZLEHURST,MS,39083,"KITCHENS BROTHERS MANUFACTURING CO.15190 MONTICELLO RD, HAZLEHURST MISSISSIPPI 39083 (COPIAH)",0,C,,110002211286
39110NRTHM210IN,-90.09299999999999,32.521,False,28,089,030400,28,28089,28089030400,1400000US28089030400,WESTLAKE COMPOUNDS LLC,210 IND US TRIAL DR N,MADISON,MS,39110,"WESTLAKE COMPOUNDS LLC.210 IND US TRIAL DR N, MADISON MISSISSIPPI 39110 (MADISON)",0,C,,110009416569
39046NSSNN3NISS,-90.069,32.571,False,28,089,030400,28,28089,28089030400,1400000US28089030400,NISSAN NA INC,300 NISSAN DR,CANTON,MS,39046,"NISSAN NA INC.300 NISSAN DR, CANTON MISSISSIPPI 39046 (MADISON)",0,C,,110011073435
39110TWRTM44CHU,-90.094,32.532,False,28,089,030400,28,28089,28089030400,1400000US28089030400,TOWER AUTOMOTIVE,440 CHURCH RD,MADISON,MS,39110,"TOWER AUTOMOTIVE.440 CHURCH RD, MADISON MISSISSIPPI 39110 (MADISON)",0,C,,110016792791
39110MTCHS576CH,-90.08200000000001,32.532,False,28,089,030400,28,28089,28089030400,1400000US28089030400,STEEL TECHNOLOGIES LLC,576 CHURCH RD,MADISON,MS,39110,"STEEL TECHNOLOGIES LLC.576 CHURCH RD, MADISON MISSISSIPPI 39110 (MADISON)",0,C,,110025332548
3904WJCKSN19TYL,-90.051,32.586,False,28,089,030400,28,28089,28089030400,1400000US28089030400,JACKSON READY-MIX PLANT 26,109 TYLER DR,CANTON,MS,39046,"JACKSON READY-MIX PLANT 26.109 TYLER DR, CANTON MISSISSIPPI 39046 (MADISON)",0,C,,110060260042
3014WMMCMT2161H,-90.07600000000001,32.535,False,28,089,030400,28,28089,28089030400,1400000US28089030400,MMC MATERIALS INC - GLUCKSTADT,2161 HWY 51 N,MADISON,MS,39110,"MMC MATERIALS INC - GLUCKSTADT.2161 HWY 51 N, MADISON MISSISSIPPI 39110 (MADISON)",0,C,,110017879205
39114MGNTKHWY49,-89.82700000000001,31.933000000000003,False,28,127,950100,28,28127,28127950100,1400000US28127950100,MAGNETEK INC,HWY 49 S,MENDENHALL,MS,39114,"MAGNETEK INC.HWY 49 S, MENDENHALL MISSISSIPPI 39114 (SIMPSON)",0,C,,
39117BCRGRMORRI,-89.655,32.354,False,28,123,020400,28,28123,28123020400,1400000US28123020400,KOCH FOODS OF MISSISSIPPI LLC,108 MORRIS TULLOS DR,MORTON,MS,39117,"KOCH FOODS OF MISSISSIPPI LLC.108 MORRIS TULLOS DR, MORTON MISSISSIPPI 39117 (SCOTT)",0,C,,110039216265
39117BCRGR4718H,-89.656,32.352,False,28,123,020400,28,28123,28123020400,1400000US28123020400,KOCH FOODS FEEDMILL,4718 HWY 80,MORTON,MS,39117,"KOCH FOODS FEEDMILL.4718 HWY 80, MORTON MISSISSIPPI 39117 (SCOTT)",1,C,,110000590682
39117RMNNCHWY13,-89.69,32.263000000000005,False,28,123,020300,28,28129,28123020300,1400000US28123020300,REMAN INC,HWY 13 S,POLKVILLE,MS,39117,"REMAN INC.HWY 13 S, POLKVILLE MISSISSIPPI 39117 (SMITH)",0,C,,
39117NTRNTHWY80,-89.61200000000001,32.357,False,28,123,020300,28,28123,28123020300,1400000US28123020300,INTERNATIONAL PAPER CO MORTON LUMBER MILL,HWY 80 E PO BOX 587,MORTON,MS,39117,"INTERNATIONAL PAPER CO MORTON LUMBER MILL.HWY 80 E PO BOX 587, MORTON MISSISSIPPI 39117 (SCOTT)",0,C,,
39117KCHFD41KCH,-89.663,32.314,False,28,123,020300,28,28123,28123020300,1400000US28123020300,KOCH FOODS DISTRIBUTION CENTER,410 KOCH DR,MORTON,MS,39117,"KOCH FOODS DISTRIBUTION CENTER.410 KOCH DR, MORTON MISSISSIPPI 39117 (SCOTT)",0,C,,110022811037
3911WKCHFR278HE,-89.611,32.357,False,28,123,020300,28,28123,28123020300,1400000US28123020300,KOCH FARMS OF MISSISSIPPI MORTON FEED MILL,278 HERRING RD,MORTON,MS,39117,"KOCH FARMS OF MISSISSIPPI MORTON FEED MILL.278 HERRING RD, MORTON MISSISSIPPI 39117 (SCOTT)",0,C,,110040497405
39120FDLTYBRENH,-91.38,31.561999999999998,False,28,001,000400,28,28001,28001000400,1400000US28001000400,TITAN TIRE CORP NATCHEZ,89 KELLY AVE,NATCHEZ,MS,391200927,"TITAN TIRE CORP NATCHEZ.89 KELLY AVE, NATCHEZ MISSISSIPPI 39120 (ADAMS)",1,C,,
39120MCPTRRIVER,-91.43799999999999,31.535999999999998,False,28,001,000800,28,28001,28001000800,1400000US28001000800,WORLD ENERGY NATCHEZ LLC,151 L E BARRY RD,NATCHEZ,MS,39120,"WORLD ENERGY NATCHEZ LLC.151 L E BARRY RD, NATCHEZ MISSISSIPPI 39120 (ADAMS)",0,C,,110000376441
39120NTRNT312LO,-91.425,31.515,False,28,001,000800,28,28001,28001000800,1400000US28001000800,INTERNATIONAL PAPER CO NATCHEZ,61 CARTHAGE POINT RD,NATCHEZ,MS,39120,"INTERNATIONAL PAPER CO NATCHEZ.61 CARTHAGE POINT RD, NATCHEZ MISSISSIPPI 39120 (ADAMS)",1,C,,
39121JMJNS136GO,-91.42200000000001,31.544,False,28,001,000800,28,28001,28001000800,1400000US28001000800,J. M. JONES LUMBER CO.,136 GOVERNMENT FLEET RD,NATCHEZ,MS,39121,"J. M. JONES LUMBER CO..136 GOVERNMENT FLEET RD, NATCHEZ MISSISSIPPI 39121 (ADAMS)",0,C,,110009863193
39145CHCTWHWY80,-89.825,32.308,False,28,121,020900,28,28121,28121020900,1400000US28121020900,CHOCTAW MAID FARMS INC PELAHATCHIE PROCESSING DIV,HWY 80 W,PELAHATCHIE,MS,391450769,"CHOCTAW MAID FARMS INC PELAHATCHIE PROCESSING DIV.HWY 80 W, PELAHATCHIE MISSISSIPPI 39145 (RANKIN)",0,C,,
39151JHNSGPOBOX,-89.792,32.099000000000004,False,28,121,020900,28,28121,28121020900,1400000US28121020900,JOHNS GAS PROCESSING PLANT,HWY 43 N,PUCKETT,MS,391510190,"JOHNS GAS PROCESSING PLANT.HWY 43 N, PUCKETT MISSISSIPPI 39151 (RANKIN)",0,C,,
39151HYDRP2650H,-89.77799999999999,32.082,False,28,121,020900,28,28121,28121020900,1400000US28121020900,HYDRO ALUMINUM PUCKETT,2650 HWY 18,PUCKETT,MS,39151,"HYDRO ALUMINUM PUCKETT.2650 HWY 18, PUCKETT MISSISSIPPI 39151 (RANKIN)",0,C,,
39145MRGNT201HW,-89.834,32.308,False,28,121,020900,28,28121,28121020900,1400000US28121020900,ENERGY CONVERSION SYSTEMS PEL AHATCHIE DIV,201 HWY 80 W,PELAHATCHIE,MS,39145,"ENERGY CONVERSION SYSTEMS PEL AHATCHIE DIV.201 HWY 80 W, PELAHATCHIE MISSISSIPPI 39145 (RANKIN)",0,C,,110012706054
39145SSNLLPOBOX,-89.794,32.315,False,28,121,020102,28,28121,28121020102,1400000US28121020102,SEASON-ALL IND INC,HWY 80 W,PELAHATCHIE,MS,39145,"SEASON-ALL IND INC.HWY 80 W, PELAHATCHIE MISSISSIPPI 39145 (RANKIN)",0,C,,
39042LQDCR813HW,-89.93299999999999,32.287,False,28,121,020102,28,28121,28121020102,1400000US28121020102,PRAXAIR INC,214 CARBONIC DR,BRANDON,MS,39042,"PRAXAIR INC.214 CARBONIC DR, BRANDON MISSISSIPPI 39042 (RANKIN)",0,C,,
39145MLTTCHWY80,-89.802,32.318000000000005,False,28,121,020102,28,28121,28121020102,1400000US28121020102,MULTITEC-PTG INC,HWY 80 W,PELAHATCHIE,MS,39145,"MULTITEC-PTG INC.HWY 80 W, PELAHATCHIE MISSISSIPPI 39145 (RANKIN)",0,C,,
39042BCGSS159AN,-89.91,32.288000000000004,False,28,121,020102,28,28121,28121020102,1400000US28121020102,MESSER BRANDON MS,159 ANDREW CHAPEL RD,BRANDON,MS,39042,"MESSER BRANDON MS.159 ANDREW CHAPEL RD, BRANDON MISSISSIPPI 39042 (RANKIN)",0,C,,110038352083
3904WMMCMT2196H,-89.962,32.375,False,28,121,020102,28,28121,28121020102,1400000US28121020102,MMC MATERIALS INC - RESERVOIR,2196 HIGHWAY 471,BRANDON,MS,39047,"MMC MATERIALS INC - RESERVOIR.2196 HIGHWAY 471, BRANDON MISSISSIPPI 39047 (RANKIN)",0,C,,110002327081
39150NTNLPINDUS,-90.977,31.945999999999998,False,28,021,950200,28,28021,28021950200,1400000US28021950200,PROLON INC,305 INDUSTRIAL AVE,PORT GIBSON,MS,39150,"PROLON INC.305 INDUSTRIAL AVE, PORT GIBSON MISSISSIPPI 39150 (CLAIBORNE)",0,C,,
39150MRCNP1315B,-90.977,31.951,False,28,021,950200,28,28021,28021950200,1400000US28021950200,AMERICAN PAPER TUBE CO,1315 BRIDEWELL LN,PORT GIBSON,MS,391502704,"AMERICAN PAPER TUBE CO.1315 BRIDEWELL LN, PORT GIBSON MISSISSIPPI 39150 (CLAIBORNE)",1,C,,
39150BRCHR1512B,-90.977,31.949,False,28,021,950200,28,28021,28021950200,1400000US28021950200,PORT GIBSON VENEER LLC,1512 BRIDEWELL LN,PORT GIBSON,MS,39150,"PORT GIBSON VENEER LLC.1512 BRIDEWELL LN, PORT GIBSON MISSISSIPPI 39150 (CLAIBORNE)",0,C,,110002225360
39168GRGPCHIGHA,-89.47,31.835,False,28,129,950300,28,28129,28129950300,1400000US28129950300,ROSEBURG TAYLORSVILLE PARTICLEBOARD,105F SCR 25,TAYLORSVILLE,MS,39168,"ROSEBURG TAYLORSVILLE PARTICLEBOARD.105F SCR 25, TAYLORSVILLE MISSISSIPPI 39168 (SMITH)",0,C,,110037144587
39168GRGPCHIGHW,-89.46600000000001,31.839000000000002,False,28,129,950300,28,28129,28129950300,1400000US28129950300,GEORGIA-PACIFIC LLC,105 SCR 25,TAYLORSVILLE,MS,39168,"GEORGIA-PACIFIC LLC.105 SCR 25, TAYLORSVILLE MISSISSIPPI 39168 (SMITH)",0,C,,110000590691
39168TMTCPFELLO,-89.447,31.831,False,28,129,950300,28,28129,28129950300,1400000US28129950300,AUTOMATIC PLATING INC,204 FELLOWSHIP RD,TAYLORSVILLE,MS,39168,"AUTOMATIC PLATING INC.204 FELLOWSHIP RD, TAYLORSVILLE MISSISSIPPI 39168 (SMITH)",0,C,,
39168STVNSFELLO,-89.45,31.834,False,28,129,950300,28,28129,28129950300,1400000US28129950300,STEVENS SPORTWEAR CO INC,"FELLOWSHIP RD, TAYLORSVILLE IND PARK",TAYLORSVILLE,MS,39168,"STEVENS SPORTWEAR CO INC.FELLOWSHIP RD, TAYLORSVILLE IND PARK, TAYLORSVILLE MISSISSIPPI 39168 (SMITH)",0,C,,
39168BLTRN214FE,-89.449,31.831,False,28,129,950300,28,28129,28129950300,1400000US28129950300,REMY REMAN LLC TAYLORSVILLE FACILITY,214 FELLOWSHIP RD,TAYLORSVILLE,MS,39168,"REMY REMAN LLC TAYLORSVILLE FACILITY.214 FELLOWSHIP RD, TAYLORSVILLE MISSISSIPPI 39168 (SMITH)",0,C,,
39168TYLRS1342S,-89.417,31.826,False,28,129,950300,28,28129,28129950300,1400000US28129950300,TAYLORSVILLE CHIPMILL,1342 ST REGIS DR HWY 28 E,TAYLORSVILLE,MS,39168,"TAYLORSVILLE CHIPMILL.1342 ST REGIS DR HWY 28 E, TAYLORSVILLE MISSISSIPPI 39168 (SMITH)",0,C,,
39180CDRCHPOBOX,-90.9,32.301,False,28,149,950800,28,28149,28149950800,1400000US28149950800,HARCROS CHEMICALS INC,4280 RIFLE RANGE RD,VICKSBURG,MS,39180,"HARCROS CHEMICALS INC.4280 RIFLE RANGE RD, VICKSBURG MISSISSIPPI 39180 (WARREN)",0,C,,110000376511
39180PTRSROLDHI,-90.919,32.284,False,28,149,950800,28,28149,28149950800,1400000US28149950800,PETRO SOURCE RESOURCES CORP VICKSBURG MS REFINERY,OLD HWY 61 S,VICKSBURG,MS,39180,"PETRO SOURCE RESOURCES CORP VICKSBURG MS REFINERY.OLD HWY 61 S, VICKSBURG MISSISSIPPI 39180 (WARREN)",0,C,,
3918WMMCMT445RI,-90.899,32.295,False,28,149,950800,28,28149,28149950800,1400000US28149950800,MMC MATERIALS INC - VICKSBURG,4450 RIFLE RANGE RD,VICKSBURG,MS,39180,"MMC MATERIALS INC - VICKSBURG.4450 RIFLE RANGE RD, VICKSBURG MISSISSIPPI 39180 (WARREN)",0,C,,110070070766
39180NTRNTPOBOX,-90.775,32.529,False,28,149,950100,28,28149,28149950100,1400000US28149950100,INTERNATIONAL PAPER-VICKSBURG MILL,3737 HWY 3 N,REDWOOD,MS,39156,"INTERNATIONAL PAPER-VICKSBURG MILL.3737 HWY 3 N, REDWOOD MISSISSIPPI 39156 (WARREN)",0,C,,110000605220
39180QKRSTPORTO,-90.87799999999999,32.384,False,28,149,950100,28,28149,28149950100,1400000US28149950100,SOPUS PRODUCTS-VICKSBURG PLANT,685 HAINING RD,VICKSBURG,MS,39183,"SOPUS PRODUCTS-VICKSBURG PLANT.685 HAINING RD, VICKSBURG MISSISSIPPI 39183 (WARREN)",0,C,,110000376557
39181RGNRFPOBOX,-90.90799999999999,32.385999999999996,False,28,149,950100,28,28149,28149950100,1400000US28149950100,ERGON REFINING INC,2611 HAINING RD,VICKSBURG,MS,39183,"ERGON REFINING INC.2611 HAINING RD, VICKSBURG MISSISSIPPI 39183 (WARREN)",0,C,,110000376575
39180MCCRT600PO,-90.884,32.389,False,28,149,950100,28,28149,28149950100,1400000US28149950100,TYSON FARMS INC,1785 INTERPLEX DR,VICKSBURG,MS,39183,"TYSON FARMS INC.1785 INTERPLEX DR, VICKSBURG MISSISSIPPI 39183 (WARREN)",0,C,,110010344154
39180BNGCR1833H,-90.895,32.389,False,28,149,950100,28,28149,28149950100,1400000US28149950100,ERGON BIOFUELS LLC,1833 HAINING RD.,VICKSBURG,MS,39180,"ERGON BIOFUELS LLC.1833 HAINING RD., VICKSBURG MISSISSIPPI 39180 (WARREN)",0,C,,110000376502
