TRIFID,LONGITUDE,LATITUDE,ESTIMATE,STATEFP,COUNTYFP,TRACTCE,STATEGEOID,COUNTYGEOID,TRACTGEOID,AFFGEOID,FACILITY_NAME,STREET,CITY,STUSPS,ZIP_CODE,FACILITY,FAC_CLOSED_IND,ASGN_FEDERAL_IND,BIA_CODE,EPA_REGISTRY_ID
39730SMMTM123SU,-88.63799999999999,33.799,False,28,095,950600,28,28095,28095950600,1400000US28095950600,SUMMIT MARINE LLC,10023 SUMMIT DR,ABERDEEN,MS,39730,"SUMMIT MARINE LLC.10023 SUMMIT DR, ABERDEEN MISSISSIPPI 39730 (MONROE)",0,C,,110016795752
39759BRDNN200SO,-88.81,33.461999999999996,False,28,105,950400,28,28105,28105950400,1400000US28105950400,BORDEN INC GROCERY & SPECIALTY PRODUCTS,200 S MONTGOMERY ST,STARKVILLE,MS,39759,"BORDEN INC GROCERY & SPECIALTY PRODUCTS.200 S MONTGOMERY ST, STARKVILLE MISSISSIPPI 39759 (OKTIBBEHA)",0,C,,
39759GLFSTAIRPO,-88.845,33.442,False,28,105,950602,28,28105,28105950602,1400000US28105950602,KIRBY BUILDING SYSTEMS MS,101 AIRPORT RD,STARKVILLE,MS,39759,"KIRBY BUILDING SYSTEMS MS.101 AIRPORT RD, STARKVILLE MISSISSIPPI 39759 (OKTIBBEHA)",0,C,,110002225039
39759HTCHCAIRPO,-88.845,33.439,False,28,105,950602,28,28105,28105950602,1400000US28105950602,SOUTHWIRE CO,103 AIRPORT RD,STARKVILLE,MS,39759,"SOUTHWIRE CO.103 AIRPORT RD, STARKVILLE MISSISSIPPI 39759 (OKTIBBEHA)",0,C,,110000377743
39759FLXST500IN,-88.838,33.444,False,28,105,950602,28,28105,28105950602,1400000US28105950602,FLEXSTEEL INDUSTRIES INC,212 IND US TRIAL PARK RD,STARKVILLE,MS,39759,"FLEXSTEEL INDUSTRIES INC.212 IND US TRIAL PARK RD, STARKVILLE MISSISSIPPI 39759 (OKTIBBEHA)",0,C,,110002225119
3085WMMCMT217IN,-88.836,33.446,False,28,105,950602,28,28105,28105950602,1400000US28105950602,MMC MATERIALS INC - STARKVILLE,217 INDUSTRIAL PARK RD,STARKVILLE,MS,39759,"MMC MATERIALS INC - STARKVILLE.217 INDUSTRIAL PARK RD, STARKVILLE MISSISSIPPI 39759 (OKTIBBEHA)",0,C,,110002225501
39759NRTHSPOBOX,-88.823,33.454,False,28,105,950500,28,28105,28105950500,1400000US28105950500,COCA-COLA BOTTLING CO NORTHEAST MISSISSIPPI,HWY 12 W,STARKVILLE,MS,39759,"COCA-COLA BOTTLING CO NORTHEAST MISSISSIPPI.HWY 12 W, STARKVILLE MISSISSIPPI 39759 (OKTIBBEHA)",0,C,,
39773BBCCKPOBOX,-88.63799999999999,33.62,False,28,025,950400,28,28025,28025950400,1400000US28025950400,"BABCOCK & WILCOX POWER GENERATION GROUP, INC",900 B & W DR,WEST POINT,MS,39773,"BABCOCK & WILCOX POWER GENERATION GROUP, INC.900 B & W DR, WEST POINT MISSISSIPPI 39773 (CLAY)",0,C,,110000590986
3977WNVSTR91EAS,-88.639,33.614000000000004,False,28,025,950400,28,28025,28025950400,1400000US28025950400,NAVISTAR DEFENSE LLC,901 E HALF MILE ST,WEST POINT,MS,39773,"NAVISTAR DEFENSE LLC.901 E HALF MILE ST, WEST POINT MISSISSIPPI 39773 (CLAY)",0,C,,110039497693
39773BLZNF100TU,-88.661,33.604,False,28,025,950300,28,28025,28025950300,1400000US28025950300,FLEXIBLE FLYER ACQUISITION,100 TUBB AVE,WEST POINT,MS,39773,"FLEXIBLE FLYER ACQUISITION.100 TUBB AVE, WEST POINT MISSISSIPPI 39773 (CLAY)",0,C,,
39773STHRN506WE,-88.65700000000001,33.606,False,28,025,950300,28,28025,28025950300,1400000US28025950300,SOUTHERN IONICS INC,506 W BROAD ST,WEST POINT,MS,39773,"SOUTHERN IONICS INC.506 W BROAD ST, WEST POINT MISSISSIPPI 39773 (CLAY)",0,C,,
39773RTXNT745NO,-88.652,33.616,False,28,025,950300,28,28025,28025950300,1400000US28025950300,ARTEX INTL INC,745 N DIVISION ST,WEST POINT,MS,397731033,"ARTEX INTL INC.745 N DIVISION ST, WEST POINT MISSISSIPPI 39773 (CLAY)",0,C,,
39773JHNSTINDUS,-88.65,33.626,False,28,025,950300,28,28025,28025950300,1400000US28025950300,JOHNSTON-TOMBIGBEE FURNITURE MANUFACTURING CO INC PLANT NO 3,INDUSTRIAL ACCESS RD,WEST POINT,MS,39773,"JOHNSTON-TOMBIGBEE FURNITURE MANUFACTURING CO INC PLANT NO 3.INDUSTRIAL ACCESS RD, WEST POINT MISSISSIPPI 39773 (CLAY)",0,C,,
39773BLZNT103EI,-88.65,33.626,False,28,025,950300,28,28025,28025950300,1400000US28025950300,BLAZON TUBE,103 E INDUSTRIAL ACCESS RD,WEST POINT,MS,39773,"BLAZON TUBE.103 E INDUSTRIAL ACCESS RD, WEST POINT MISSISSIPPI 39773 (CLAY)",1,C,,110015782688
3977WYKHMT1YKHA,-88.65,33.618,False,28,025,950300,28,28025,28025950300,1400000US28025950300,YOKOHAMA TIRE MANUFACTURING MISSISSIPPI LLC,1 YOKOHAMA BOULEVARD,WEST POINT,MS,39773,"YOKOHAMA TIRE MANUFACTURING MISSISSIPPI LLC.1 YOKOHAMA BOULEVARD, WEST POINT MISSISSIPPI 39773 (CLAY)",0,C,,110066973341
39773BRNSWHWY45,-88.66,33.59,False,28,025,950500,28,28025,28025950500,1400000US28025950500,TRACKER MARINE,HWY 45 S,WEST POINT,MS,39773,"TRACKER MARINE.HWY 45 S, WEST POINT MISSISSIPPI 39773 (CLAY)",1,C,,
39773BRYNF100CH,-88.646,33.592,False,28,025,950500,28,28025,28025950500,1400000US28025950500,BRYAN FOODS INC,100 CHURCHILL RD,WEST POINT,MS,39773,"BRYAN FOODS INC.100 CHURCHILL RD, WEST POINT MISSISSIPPI 39773 (CLAY)",0,C,,110000493298
39773CTPHT1150E,-88.634,33.626999999999995,False,28,025,950500,28,28025,28025950500,1400000US28025950500,CATAPHOTE INC,1150 EAST INDUSTRIAL ACCESS RD,WEST POINT,MS,39773,"CATAPHOTE INC.1150 EAST INDUSTRIAL ACCESS RD, WEST POINT MISSISSIPPI 39773 (CLAY)",0,C,,
38619SMTHWSOUTH,-89.94,34.508,False,28,107,950100,28,28107,28107950100,1400000US28107950100,TAYLOR WOODCRAFT,305 S MAIN ST,COMO,MS,38619,"TAYLOR WOODCRAFT.305 S MAIN ST, COMO MISSISSIPPI 38619 (PANOLA)",0,C,,
38666RMRBNINDUS,-89.91,34.422,False,28,107,950100,28,28107,28107950100,1400000US28107950100,ARMOR BOND BUILDING  PRODUCTS INC,INDUSTRIAL DR,SARDIS,MS,386660369,"ARMOR BOND BUILDING  PRODUCTS INC.INDUSTRIAL DR, SARDIS MISSISSIPPI 38666 (PANOLA)",0,C,,
38621DNCRP110JO,-90.198,34.504,False,28,107,950100,28,28107,28107950100,1400000US28107950100,DANA HOSE & TUBING CRENSHAW,110 JONES ST,CRENSHAW,MS,38621,"DANA HOSE & TUBING CRENSHAW.110 JONES ST, CRENSHAW MISSISSIPPI 38621 (PANOLA)",0,C,,
3861WHNSNP2377H,-89.93,34.484,False,28,107,950100,28,28107,28107950100,1400000US28107950100,FORTERRA PIPE & PRECAST - COMO,2377 HOLSTON ROAD,COMO,MS,38619,"FORTERRA PIPE & PRECAST - COMO.2377 HOLSTON ROAD, COMO MISSISSIPPI 38619 (PANOLA)",0,C,,110012306584
38751MDRNLPOBOX,-90.63799999999999,33.446999999999996,False,28,133,950401,28,28133,28133950401,1400000US28133950401,MODERN LINE PRODUCTS INC,2ND ST EXTENDED,INDIANOLA,MS,387510110,"MODERN LINE PRODUCTS INC.2ND ST EXTENDED, INDIANOLA MISSISSIPPI 38751 (SUNFLOWER)",0,C,,
38769CVSSTPOBOX,-91.022,33.828,False,28,011,950200,28,28011,28011950200,1400000US28011950200,CIVES STEEL CO,219 TERMINAL RD,ROSEDALE,MS,38769,"CIVES STEEL CO.219 TERMINAL RD, ROSEDALE MISSISSIPPI 38769 (BOLIVAR)",0,C,,110002226323
38769JSCRS150CR,-90.955,33.844,False,28,011,950200,28,28011,28011950200,1400000US28011950200,AXEL AMERICAS LLC,150 RUSSELL CRUTCHER RD,ROSEDALE,MS,38769,"AXEL AMERICAS LLC.150 RUSSELL CRUTCHER RD, ROSEDALE MISSISSIPPI 38769 (BOLIVAR)",0,C,,110002107602
38778DLTPREASTR,-90.484,33.542,False,28,133,950300,28,28133,28133950300,1400000US28133950300,DELTA PRIDE CATFISH INC SUNFLOWER PLANT,E REED RD,SUNFLOWER,MS,38778,"DELTA PRIDE CATFISH INC SUNFLOWER PLANT.E REED RD, SUNFLOWER MISSISSIPPI 38778 (SUNFLOWER)",0,C,,
38778PRTNP1042M,-90.514,33.491,False,28,133,950300,28,28133,28133950300,1400000US28133950300,PROTEIN PRODUCTS INC,1042 MISSISSIPPI HWY 3,SUNFLOWER,MS,38778,"PROTEIN PRODUCTS INC.1042 MISSISSIPPI HWY 3, SUNFLOWER MISSISSIPPI 38778 (SUNFLOWER)",0,C,,110002327232
38801BRYNTWESTM,-88.705,34.273,False,28,081,950500,28,28081,28081950500,1400000US28081950500,BRYAN TUPELO FREEZER,WESTMORELAND DR,TUPELO,MS,38801,"BRYAN TUPELO FREEZER.WESTMORELAND DR, TUPELO MISSISSIPPI 38801 (LEE)",1,C,,
38801STHRN1SOUT,-88.69200000000001,34.265,False,28,081,950500,28,28081,28081950500,1400000US28081950500,SOUTHERN BELLE,1 SOUTHERN BELLE LN,TUPELO,MS,38801,"SOUTHERN BELLE.1 SOUTHERN BELLE LN, TUPELO MISSISSIPPI 38801 (LEE)",0,C,,
38801TLSPC300AI,-88.76700000000001,34.266999999999996,False,28,081,980000,28,28081,28081980000,1400000US28081980000,T & L SPECIALTY CO,300 AIR PARK RD,TUPELO,MS,38801,"T & L SPECIALTY CO.300 AIR PARK RD, TUPELO MISSISSIPPI 38801 (LEE)",0,C,,110002225734
38821TLSBDHWY45,-88.473,33.989000000000004,False,28,095,950300,28,28095,28095950300,1400000US28095950300,CENTENNIAL TRANSPORTATION INDUSTRIES LP ATLAS BODY,HWY 45 & 278,AMORY,MS,38821,"CENTENNIAL TRANSPORTATION INDUSTRIES LP ATLAS BODY.HWY 45 & 278, AMORY MISSISSIPPI 38821 (MONROE)",0,C,,
38821FBRSP500WA,-88.499,33.997,False,28,095,950300,28,28095,28095950300,1400000US28095950300,NAUTIC STAR LLC,500 WATERWAY DR,AMORY,MS,38821,"NAUTIC STAR LLC.500 WATERWAY DR, AMORY MISSISSIPPI 38821 (MONROE)",0,C,,110009416391
38862SPRRPPOPLA,-88.675,34.214,False,28,081,950302,28,28081,28081950302,1400000US28081950302,SUPERIOR PRODS SALES INC,224 POPLAR ST,PLANTERSVILLE,MS,388620189,"SUPERIOR PRODS SALES INC.224 POPLAR ST, PLANTERSVILLE MISSISSIPPI 38862 (LEE)",0,C,,
38866RCRPNTURNE,-88.68299999999999,34.384,False,28,081,950202,28,28081,28081950202,1400000US28081950202,CARPENTER CO,TURNER INDL PARK,SALTILLO,MS,38866,"CARPENTER CO.TURNER INDL PARK, SALTILLO MISSISSIPPI 38866 (LEE)",1,C,,
39038DLTPRHWY49,-90.494,33.158,False,28,053,950200,28,28053,28053950200,1400000US28053950200,DELTA PRIDE CATFISH INC BELZONI PLANT,HWY 49 S,BELZONI,MS,39038,"DELTA PRIDE CATFISH INC BELZONI PLANT.HWY 49 S, BELZONI MISSISSIPPI 39038 (HUMPHREYS)",0,C,,
39194SMMNS2628E,-90.51899999999999,32.923,False,28,053,950200,28,28163,28053950200,1400000US28053950200,SIMMONS FARM RAISED CATFISH I NC,2628 ERICKSON RD,YAZOO CITY,MS,39194,"SIMMONS FARM RAISED CATFISH I NC.2628 ERICKSON RD, YAZOO CITY MISSISSIPPI 39194 (YAZOO)",0,C,,110002214078
39046FLVRCHIGHW,-90.038,32.596,False,28,089,030700,28,28089,28089030700,1400000US28089030700,FLAV-O-RICH DAIRY,3091 S LIBERTY ST,CANTON,MS,39046,"FLAV-O-RICH DAIRY.3091 S LIBERTY ST, CANTON MISSISSIPPI 39046 (MADISON)",0,C,,
39046MRSHLOLDFL,-90.055,32.61,False,28,089,030500,28,28089,28089030500,1400000US28089030500,PECO FOODS INC - CANTON FULTON STREET,1039 W FULTON ST,CANTON,MS,39046,"PECO FOODS INC - CANTON FULTON STREET.1039 W FULTON ST, CANTON MISSISSIPPI 39046 (MADISON)",0,C,,110000376290
39046MCCRT200FE,-90.053,32.61,False,28,089,030500,28,28089,28089030500,1400000US28089030500,PECO FOODS OF MISSISSIPPI INC .,200 FEATHER LN,CANTON,MS,39046,"PECO FOODS OF MISSISSIPPI INC ..200 FEATHER LN, CANTON MISSISSIPPI 39046 (MADISON)",0,C,,110002107764
39110PRKRH147WH,-90.113,32.465,False,28,089,030203,28,28089,28089030203,1400000US28089030203,PARKER HANNIFIN (FLUID CONTROL DIV),147 W HOY RD,MADISON,MS,39110,"PARKER HANNIFIN (FLUID CONTROL DIV).147 W HOY RD, MADISON MISSISSIPPI 39110 (MADISON)",0,C,,110000376405
39146BRRWSRTE51,-89.96799999999999,32.885999999999996,False,28,051,950500,28,28051,28051950500,1400000US28051950500,TWIN RIVERS PAPER CO LLC,196 BURROWS DR,PICKENS,MS,39146,"TWIN RIVERS PAPER CO LLC.196 BURROWS DR, PICKENS MISSISSIPPI 39146 (HOLMES)",0,C,,110006723563
39153BNTRPHWY18,-89.555,32.039,False,28,129,950200,28,28129,28129950200,1400000US28129950200,REMY REMAN RALEIGH 1,HWY 18 RALEIGH INDUSTRIAL PARK,RALEIGH,MS,39153,"REMY REMAN RALEIGH 1.HWY 18 RALEIGH INDUSTRIAL PARK, RALEIGH MISSISSIPPI 39153 (SMITH)",0,C,,
39153BCRSN225WH,-89.535,32.039,False,28,129,950200,28,28129,28129950200,1400000US28129950200,REMY REMAN LLC - RALEIGH,219 WHITE OAK AVE,RALEIGH,MS,39153,"REMY REMAN LLC - RALEIGH.219 WHITE OAK AVE, RALEIGH MISSISSIPPI 39153 (SMITH)",0,C,,110000799510
39167CRBNCANDRE,-90.053,32.103,False,28,121,021003,28,28121,28121021003,1400000US28121021003,AIRGAS CARBONIC,217 ANDREW JACKSON CIR,STAR,MS,39167,"AIRGAS CARBONIC.217 ANDREW JACKSON CIR, STAR MISSISSIPPI 39167 (RANKIN)",0,C,,110000708618
39773WSTPNLONEO,-88.662,33.622,False,28,025,950100,28,28025,28025950100,1400000US28025950100,YORK CASKET CO,LONE OAK DR,WEST POINT,MS,39773,"YORK CASKET CO.LONE OAK DR, WEST POINT MISSISSIPPI 39773 (CLAY)",0,C,,
38610PLYCRPOBOX,-89.015,34.686,False,28,139,950400,28,28139,28139950400,1400000US28139950400,POLYCRAFT,6341A HWY 15 N,BLUE MOUNTAIN,MS,38610,"POLYCRAFT.6341A HWY 15 N, BLUE MOUNTAIN MISSISSIPPI 38610 (TIPPAH)",2,C,,
3861WBGMTR6341B,-89.015,34.686,False,28,139,950400,28,28139,28139950400,1400000US28139950400,"BIG M TRANSPORTATION, INC.",6341B HIGHWAY 15 NORTH,BLUE MOUNTAIN,MS,38610,"BIG M TRANSPORTATION, INC..6341B HIGHWAY 15 NORTH, BLUE MOUNTAIN MISSISSIPPI 38610 (TIPPAH)",0,C,,110060259624
38635SNBMSHWY7N,-89.45100000000001,34.788000000000004,False,28,093,950300,28,28093,28093950300,1400000US28093950300,SUNBEAM-OSTER HOUSEHOLD PRODUCTS,HWY 7 N,HOLLY SPRINGS,MS,38635,"SUNBEAM-OSTER HOUSEHOLD PRODUCTS.HWY 7 N, HOLLY SPRINGS MISSISSIPPI 38635 (MARSHALL)",0,C,,
38635BTCLS820HW,-89.45,34.787,False,28,093,950300,28,28093,28093950300,1400000US28093950300,LOUISIANA-PACIFIC VINYL,820 HWY 7 N,HOLLY SPRINGS,MS,38635,"LOUISIANA-PACIFIC VINYL.820 HWY 7 N, HOLLY SPRINGS MISSISSIPPI 38635 (MARSHALL)",0,C,,
38803RCPNDHWY45,-88.72,34.159,False,28,081,951001,28,28081,28081951001,1400000US28081951001,AIRCAP INDUSTRIES CORP,HWY 45 S,TUPELO,MS,38803,"AIRCAP INDUSTRIES CORP.HWY 45 S, TUPELO MISSISSIPPI 38803 (LEE)",2,C,,
3887WTPLMT5484H,-88.72,34.159,False,28,081,951001,28,28081,28081951001,1400000US28081951001,MTD CONSUMER GROUP INC - TUPELO FACILITY,5484 HWY 145 S,VERONA,MS,38879,"MTD CONSUMER GROUP INC - TUPELO FACILITY.5484 HWY 145 S, VERONA MISSISSIPPI 38879 (LEE)",0,C,,110044492894
38860MHSCPWARRE,-88.745,33.998000000000005,False,28,017,950100,28,28017,28017950100,1400000US28017950100,MOHASCO UPHOLSTERED FURNITURE STRATOLOUNGER UPHOLSTERY PLANT,WARREN AVE,OKOLONA,MS,38860,"MOHASCO UPHOLSTERED FURNITURE STRATOLOUNGER UPHOLSTERY PLANT.WARREN AVE, OKOLONA MISSISSIPPI 38860 (CHICKASAW)",0,C,,
38860RSHLL105SC,-88.743,34.004,False,28,017,950100,28,28017,28017950100,1400000US28017950100,ROSE HILL CO,105 S CHILD ST,OKOLONA,MS,38860,"ROSE HILL CO.105 S CHILD ST, OKOLONA MISSISSIPPI 38860 (CHICKASAW)",0,C,,
38860CRNNDHWY41,-88.725,34.0,False,28,017,950100,28,28017,28017950100,1400000US28017950100,CRAIN INDUSTRIES OKALONA DIV,HWY 41 E,OKOLONA,MS,38860,"CRAIN INDUSTRIES OKALONA DIV.HWY 41 E, OKOLONA MISSISSIPPI 38860 (CHICKASAW)",0,C,,
39051TYLRMRTE7B,-89.536,32.76,False,28,079,040600,28,28079,28079040600,1400000US28079040600,TAYLOR MACHINE WORKS INC,1890 N PEARL ST,CARTHAGE,MS,390513199,"TAYLOR MACHINE WORKS INC.1890 N PEARL ST, CARTHAGE MISSISSIPPI 39051 (LEAKE)",0,C,,
39111MCCRTINDUS,-89.72,31.854,False,28,127,950500,28,28127,28127950500,1400000US28127950500,TYSON FARMS MAGEE MS FEED MILL,855 INDUSTRIAL PARK DR SE,MAGEE,MS,39111,"TYSON FARMS MAGEE MS FEED MILL.855 INDUSTRIAL PARK DR SE, MAGEE MISSISSIPPI 39111 (SIMPSON)",0,C,,110008500817
39302PVYLC711AS,-88.686,32.369,False,28,075,010700,28,28075,28075010700,1400000US28075010700,PEAVEY ELECTRONICS CORP-PLANT 3,711 A ST,MERIDIAN,MS,39301,"PEAVEY ELECTRONICS CORP-PLANT 3.711 A ST, MERIDIAN MISSISSIPPI 39301 (LAUDERDALE)",0,C,,110000376931
39301PVYLC200BO,-88.68,32.368,False,28,075,010700,28,28075,28075010700,1400000US28075010700,PEAVEY ELECTRONICS PLANT 5,200 BONITA DR,MERIDIAN,MS,39301,"PEAVEY ELECTRONICS PLANT 5.200 BONITA DR, MERIDIAN MISSISSIPPI 39301 (LAUDERDALE)",0,C,,
39302MDSTH1115C,-88.69,32.363,False,28,075,010700,28,28075,28075010700,1400000US28075010700,MID SOUTH LUMBER INC,1115 C ST,MERIDIAN,MS,39301,"MID SOUTH LUMBER INC.1115 C ST, MERIDIAN MISSISSIPPI 39301 (LAUDERDALE)",0,C,,110000799501
39301MGNLS17SEV,-88.693,32.364000000000004,False,28,075,010700,28,28075,28075010700,1400000US28075010700,MAGNOLIA STEEL CO INC,17 SEVENTEENTH AVE,MERIDIAN,MS,39301,"MAGNOLIA STEEL CO INC.17 SEVENTEENTH AVE, MERIDIAN MISSISSIPPI 39301 (LAUDERDALE)",0,C,,
39358KMPRPBOX10,-88.46600000000001,32.771,False,28,069,030100,28,28069,28069030100,1400000US28069030100,MCFARLAND CASCADE,13569 HWY 45,SCOOBA,MS,39358,"MCFARLAND CASCADE.13569 HWY 45, SCOOBA MISSISSIPPI 39358 (KEMPER)",0,C,,110042085347
39328STVKM221MA,-88.60600000000001,32.797,False,28,069,030100,28,28069,28069030100,1400000US28069030100,US TVA KEMPER COUNTY PLANT,221 MARK COBB RD,DE KALB,MS,39328,"US TVA KEMPER COUNTY PLANT.221 MARK COBB RD, DE KALB MISSISSIPPI 39328 (KEMPER)",0,F,,
39422SSNBMCORNE,-89.286,31.974,False,28,061,950200,28,28061,28061950200,1400000US28061950200,SUNBEAM CONSUMER PRODUCTS,CORNER 3RD ST & 6TH AVE,BAY SPRINGS,MS,39422,"SUNBEAM CONSUMER PRODUCTS.CORNER 3RD ST & 6TH AVE, BAY SPRINGS MISSISSIPPI 39422 (JASPER)",0,C,,
39422PCFDFCOMME,-89.28399999999999,32.016,False,28,061,950200,28,28061,28061950200,1400000US28061950200,PECO FOODS INC - BAY SPRINGS PROCESSING,95 COMMERCE DR INDUSTRIAL PARK,BAY SPRINGS,MS,39422,"PECO FOODS INC - BAY SPRINGS PROCESSING.95 COMMERCE DR INDUSTRIAL PARK, BAY SPRINGS MISSISSIPPI 39422 (JASPER)",0,C,,110000564247
39422SNBMSHWY26,-89.29,32.016999999999996,False,28,061,950200,28,28061,28061950200,1400000US28061950200,SUNBEAM-OSTER HOUSEHOLD PRODUCTS SUNBEAM CORP,HWY 15 N INDL PAR,BAY SPRINGS,MS,39422,"SUNBEAM-OSTER HOUSEHOLD PRODUCTS SUNBEAM CORP.HWY 15 N INDL PAR, BAY SPRINGS MISSISSIPPI 39422 (JASPER)",0,C,,
39422DLXNC123CO,-89.28399999999999,32.018,False,28,061,950200,28,28061,28061950200,1400000US28061950200,REMY REMAN BAY SPRINGS,123 COMMERCE DR BAY SPRINGS INDUSTRIAL PARK,BAY SPRINGS,MS,39422,"REMY REMAN BAY SPRINGS.123 COMMERCE DR BAY SPRINGS INDUSTRIAL PARK, BAY SPRINGS MISSISSIPPI 39422 (JASPER)",0,C,,
39422MNTCLHWY15,-89.28,32.018,False,28,061,950200,28,28061,28061950200,1400000US28061950200,"MONTICELLO HARDWOOD INC.,BAY S PRINGS MILL",HWY 15 N,BAY SPRINGS,MS,39422,"MONTICELLO HARDWOOD INC.,BAY S PRINGS MILL.HWY 15 N, BAY SPRINGS MISSISSIPPI 39422 (JASPER)",0,C,,110015680654
3942WHLMCC273AH,-89.288,31.987,False,28,061,950200,28,28061,28061950200,1400000US28061950200,HOL-MAC CORP. P1,2730A HWY 15,BAY SPRINGS,MS,39422,"HOL-MAC CORP. P1.2730A HWY 15, BAY SPRINGS MISSISSIPPI 39422 (JASPER)",0,C,,110008502566
3942WHLMCC8CMME,-89.287,32.012,False,28,061,950200,28,28061,28061950200,1400000US28061950200,HOL-MAC CORP P2,8 COMMERCE DR,BAY SPRINGS,MS,39422,"HOL-MAC CORP P2.8 COMMERCE DR, BAY SPRINGS MISSISSIPPI 39422 (JASPER)",0,C,,110055498331
39480CNTNN1FRON,-89.273,31.756999999999998,False,28,067,950200,28,28067,28067950200,1400000US28067950200,CONTINENTAL GRAIN WAYNE FARMS,1 FRONT ST,SOSO,MS,39480,"CONTINENTAL GRAIN WAYNE FARMS.1 FRONT ST, SOSO MISSISSIPPI 39480 (JONES)",0,C,,
38632GLNCX40EAS,-89.98899999999999,34.829,False,28,033,071110,28,28033,28033071110,1400000US28033071110,IG-LO INC.,40 E. ROBINSON ST.,HERNANDO,MS,38632,"IG-LO INC..40 E. ROBINSON ST., HERNANDO MISSISSIPPI 38632 (DESOTO)",0,C,,
38651TLSRL222KA,-89.994,34.867,False,28,033,071110,28,28033,28033071110,1400000US28033071110,CLOPAY BUILDING PRODUCTS ATLAS DOOR DIV,222 KAPIK INDUSTRIAL RD,NESBIT,MS,38651,"CLOPAY BUILDING PRODUCTS ATLAS DOOR DIV.222 KAPIK INDUSTRIAL RD, NESBIT MISSISSIPPI 38651 (DESOTO)",0,C,,
38632STYLC325KA,-89.995,34.867,False,28,033,071110,28,28033,28033071110,1400000US28033071110,STYLECRAFT HOME COLLECTIONS,325 KAPIK INDUSTRIAL DR,HERNANDO,MS,38632,"STYLECRAFT HOME COLLECTIONS.325 KAPIK INDUSTRIAL DR, HERNANDO MISSISSIPPI 38632 (DESOTO)",0,C,,110022411380
38651CRDVC735NE,-90.005,34.882,False,28,033,071110,28,28033,28033071110,1400000US28033071110,CORDOVA CONCRETE INC,735 NESBIT RD,NESBIT,MS,38651,"CORDOVA CONCRETE INC.735 NESBIT RD, NESBIT MISSISSIPPI 38651 (DESOTO)",0,C,,
38704TRTNTABIDE,-91.02,33.394,False,28,151,001400,28,28151,28151001400,1400000US28151001400,TARTAN TUBE INC,997 N BEAUCHAMP ST,GREENVILLE,MS,38703,"TARTAN TUBE INC.997 N BEAUCHAMP ST, GREENVILLE MISSISSIPPI 38703 (WASHINGTON)",1,C,,
3870WMMCMT1117S,-91.006,33.388000000000005,False,28,151,001400,28,28151,28151001400,1400000US28151001400,MMC MATERIALS INC - GREENVILLE,1117 S RACEWAY RD,GREENVILLE,MS,38703,"MMC MATERIALS INC - GREENVILLE.1117 S RACEWAY RD, GREENVILLE MISSISSIPPI 38703 (WASHINGTON)",0,C,,110061790879
38774SHLBYHWY61,-90.772,33.94,False,28,011,950100,28,28011,28011950100,1400000US28011950100,SHELBY DIE CASTING,HWY 61 S,SHELBY,MS,387740209,"SHELBY DIE CASTING.HWY 61 S, SHELBY MISSISSIPPI 38774 (BOLIVAR)",0,C,,
38851HSTNFRT3BO,-88.944,33.847,False,28,017,950400,28,28017,28017950400,1400000US28017950400,HOUSTON FOAM FABRICATORS,HWY 8 E,HOUSTON,MS,38851,"HOUSTON FOAM FABRICATORS.HWY 8 E, HOUSTON MISSISSIPPI 38851 (CHICKASAW)",0,C,,
38869VTFMNEASTM,-88.84,34.359,False,28,115,950101,28,28115,28115950101,1400000US28115950101,VITAFOAM INC,E MAIN ST,SHERMAN,MS,38869,"VITAFOAM INC.E MAIN ST, SHERMAN MISSISSIPPI 38869 (PONTOTOC)",0,C,,
38863MSTRB292IN,-88.98,34.271,False,28,115,950101,28,28115,28115950101,1400000US28115950101,MASTER-BILT BEVERAGE DIV,292 INDL DR,PONTOTOC,MS,38863,"MASTER-BILT BEVERAGE DIV.292 INDL DR, PONTOTOC MISSISSIPPI 38863 (PONTOTOC)",0,C,,
38869BHSSX2756T,-88.837,34.354,False,28,115,950101,28,28115,28115950101,1400000US28115950101,BAUHAUS USA,275 6TH AVE,SHERMAN,MS,38869,"BAUHAUS USA.275 6TH AVE, SHERMAN MISSISSIPPI 38869 (PONTOTOC)",0,C,,110002215996
39059GNRLQ205KI,-90.36,31.983,False,28,029,950100,28,28029,28029950100,1400000US28029950100,GENERAL EQUIPMENT MANUFACTURERS,102 KIRK ST,CRYSTAL SPRINGS,MS,39059,"GENERAL EQUIPMENT MANUFACTURERS.102 KIRK ST, CRYSTAL SPRINGS MISSISSIPPI 39059 (COPIAH)",0,C,,
39059KHLMN101KU,-90.35700000000001,31.989,False,28,029,950100,28,28029,28029950100,1400000US28029950100,ABB INC,101 KUHLMAN DR,CRYSTAL SPRINGS,MS,39059,"ABB INC.101 KUHLMAN DR, CRYSTAL SPRINGS MISSISSIPPI 39059 (COPIAH)",0,C,,110003996515
39063HNTRN101HW,-89.852,33.084,False,28,051,950100,28,28051,28051950100,1400000US28051950100,HUNTER ENG CO,101 HWY 12 W,DURANT,MS,39063,"HUNTER ENG CO.101 HWY 12 W, DURANT MISSISSIPPI 39063 (HOLMES)",0,C,,
39063GCNDS165GR,-89.859,33.066,False,28,051,950100,28,28051,28051950100,1400000US28051950100,G & C INDUSTRIES,165 GRIEF LN,DURANT,MS,39063,"G & C INDUSTRIES.165 GRIEF LN, DURANT MISSISSIPPI 39063 (HOLMES)",0,C,,110020518144
39063BBSLL219LA,-89.84899999999999,33.082,False,28,051,950100,28,28051,28051950100,1400000US28051950100,DEEP SOUTH LUMBER,219 LANDRUM RD,DURANT,MS,39063,"DEEP SOUTH LUMBER.219 LANDRUM RD, DURANT MISSISSIPPI 39063 (HOLMES)",1,C,,110025316922
39095FLTWDFLEET,-90.03399999999999,33.107,False,28,051,950200,28,28051,28051950200,1400000US28051950200,FLEETWOOD HOMES OF MISSISSIPPI INC #25,100 FLEETWOOD CIRCLE,LEXINGTON,MS,390950927,"FLEETWOOD HOMES OF MISSISSIPPI INC #25.100 FLEETWOOD CIRCLE, LEXINGTON MISSISSIPPI 39095 (HOLMES)",0,C,,
39095FLTWD491BO,-90.0,33.135,False,28,051,950200,28,28051,28051950200,1400000US28051950200,FLEETWOOD HOMES OF MISSISSIPPI INC #25-3,491 BOWLING GREEN RD,LEXINGTON,MS,390950927,"FLEETWOOD HOMES OF MISSISSIPPI INC #25-3.491 BOWLING GREEN RD, LEXINGTON MISSISSIPPI 39095 (HOLMES)",0,C,,
3909WLXNGT1LEXI,-90.035,33.109,False,28,051,950200,28,28051,28051950200,1400000US28051950200,LEXINGTON HOMES,100 LEXINGTON CIR,LEXINGTON,MS,39095,"LEXINGTON HOMES.100 LEXINGTON CIR, LEXINGTON MISSISSIPPI 39095 (HOLMES)",0,C,,110070070728
39154HNTRNRAYMO,-90.413,32.273,False,28,049,010700,28,28049,28049010700,1400000US28049010700,HUNTER ENGINEERING CO,2489 CLINTON-RAYMOND RD,RAYMOND,MS,39154,"HUNTER ENGINEERING CO.2489 CLINTON-RAYMOND RD, RAYMOND MISSISSIPPI 39154 (HINDS)",0,C,,
39208GNBNCOLDFA,-90.07700000000001,32.341,False,28,121,020211,28,28121,28121020211,1400000US28121020211,EXIDE TECHNOLOGIES,3670 FLOWOOD DR,FLOWOOD,MS,39208,"EXIDE TECHNOLOGIES.3670 FLOWOOD DR, FLOWOOD MISSISSIPPI 39208 (RANKIN)",0,C,,
39360SNBMSHWY45,-88.708,31.904,False,28,023,950300,28,28023,28023950300,1400000US28023950300,SUNBEAM CONSUMER PRODUCTS,HWY 45 N,SHUBUTA,MS,39360,"SUNBEAM CONSUMER PRODUCTS.HWY 45 N, SHUBUTA MISSISSIPPI 39360 (CLARKE)",0,C,,
39347DMNDS100CH,-88.885,32.042,False,28,023,950300,28,28023,28023950300,1400000US28023950300,ODOM INDUSTRIES INC,100 CHESTNUT ST,PACHUTA,MS,39347,"ODOM INDUSTRIES INC.100 CHESTNUT ST, PACHUTA MISSISSIPPI 39347 (CLARKE)",0,C,,110000377020
39367MRSHLWAYNE,-88.62799999999999,31.648000000000003,False,28,153,950200,28,28153,28153950200,1400000US28153950200,M/J FEEDMILL MS LLC,201 MARSHALL DURBIN DR,WAYNESBORO,MS,39367,"M/J FEEDMILL MS LLC.201 MARSHALL DURBIN DR, WAYNESBORO MISSISSIPPI 39367 (WAYNE)",0,C,,110007108655
39367DMNDS800OD,-88.64299999999999,31.651,False,28,153,950200,28,28153,28153950200,1400000US28153950200,ODOM INDUSTRIES INC,800 ODOM INDUSTRIES RD,WAYNESBORO,MS,39367,"ODOM INDUSTRIES INC.800 ODOM INDUSTRIES RD, WAYNESBORO MISSISSIPPI 39367 (WAYNE)",0,C,,110002225878
39367SNBMS224RU,-88.63799999999999,31.659000000000002,False,28,153,950200,28,28153,28153950200,1400000US28153950200,JARDEN CONSUMER SOLUTIONS (DBA SUNBEAM),224 R US SELL DR,WAYNESBORO,MS,39367,"JARDEN CONSUMER SOLUTIONS (DBA SUNBEAM).224 R US SELL DR, WAYNESBORO MISSISSIPPI 39367 (WAYNE)",0,C,,110000377075
39367HDNDS915IN,-88.62899999999999,31.654,False,28,153,950200,28,28153,28153950200,1400000US28153950200,HOOD INDUSTRIES INC,915 INDUSTRIAL PARK RD,WAYNESBORO,MS,39367,"HOOD INDUSTRIES INC.915 INDUSTRIAL PARK RD, WAYNESBORO MISSISSIPPI 39367 (WAYNE)",0,C,,110001976817
39563BSTMN4219J,-88.539,30.39,False,28,059,041800,28,28059,28059041800,1400000US28059041800,ZACHRY MOSS POINT FABRICATION FACILITY,4219 JEFFERSON AVE,MOSS POINT,MS,39563,"ZACHRY MOSS POINT FABRICATION FACILITY.4219 JEFFERSON AVE, MOSS POINT MISSISSIPPI 39563 (JACKSON)",0,C,,110000377397
38850RDGWDONERI,-89.084,34.097,False,28,115,950500,28,28115,28115950500,1400000US28115950500,RIDGEWOOD PRODUCTS INC,115 RIDGEWOOD LN,HOULKA,MS,38850,"RIDGEWOOD PRODUCTS INC.115 RIDGEWOOD LN, HOULKA MISSISSIPPI 38850 (PONTOTOC)",0,C,,
38863NDPNDHWY34,-89.06299999999999,34.211,False,28,115,950500,28,28115,28115950500,1400000US28115950500,INDEPENDENT FURNITURE SUPPLY CO,HWY 341S,PONTOTOC,MS,38863,"INDEPENDENT FURNITURE SUPPLY CO.HWY 341S, PONTOTOC MISSISSIPPI 38863 (PONTOTOC)",0,C,,
38915NTDCHSTATE,-89.354,33.983000000000004,False,28,013,950100,28,28013,28013950100,1400000US28013950100,UNITED CHAIR CO,STATE HWY 9 S,BRUCE,MS,38915,"UNITED CHAIR CO.STATE HWY 9 S, BRUCE MISSISSIPPI 38915 (CALHOUN)",0,C,,
39090CNTRLINDUS,-89.56700000000001,33.088,False,28,007,060100,28,28007,28007060100,1400000US28007060100,AZZ GALVANIZING - KOSCIUSKO,2361 ATTALA RD 2202,KOSCIUSKO,MS,39090,"AZZ GALVANIZING - KOSCIUSKO.2361 ATTALA RD 2202, KOSCIUSKO MISSISSIPPI 39090 (ATTALA)",0,C,,110042079014
