TRIFID,LONGITUDE,LATITUDE,ESTIMATE,STATEFP,COUNTYFP,TRACTCE,STATEGEOID,COUNTYGEOID,TRACTGEOID,AFFGEOID,FACILITY_NAME,STREET,CITY,STUSPS,ZIP_CODE,FACILITY,FAC_CLOSED_IND,ASGN_FEDERAL_IND,BIA_CODE,EPA_REGISTRY_ID
68701SHRWDSOUTH,-97.421,41.994,False,31,119,961100,31,31119,31119961100,1400000US31119961100,TYCO HEALTHCARE,1222 SHERWOOD RD.,NORFOLK,NE,68701,"TYCO HEALTHCARE.1222 SHERWOOD RD., NORFOLK NEBRASKA 68701 (MADISON)",0,C,,110000448141
68701LNDLK1400R,-97.40100000000001,42.016999999999996,False,31,119,961100,31,31119,31119961100,1400000US31119961100,LAND O'LAKES INC FARMLAND FEED,1400 PINE & INDUSTRIAL RD,NORFOLK,NE,68701,"LAND O'LAKES INC FARMLAND FEED.1400 PINE & INDUSTRIAL RD, NORFOLK NEBRASKA 68701 (MADISON)",0,C,,
68701WSPKN1400W,-97.429,42.007,False,31,119,961100,31,31119,31119961100,1400000US31119961100,WIS-PAK OF NORFOLK INC,1400 W TAHAZOUKA DR,NORFOLK,NE,68701,"WIS-PAK OF NORFOLK INC.1400 W TAHAZOUKA DR, NORFOLK NEBRASKA 68701 (MADISON)",0,C,,
68701PRCNCEASTH,-97.464,42.023,False,31,119,961100,31,31119,31119961100,1400000US31119961100,GREENSTONE INDUSTRIES NORFOLK INC,E HWY 24,NORFOLK,NE,687011533,"GREENSTONE INDUSTRIES NORFOLK INC.E HWY 24, NORFOLK NEBRASKA 68701 (MADISON)",0,C,,
68701BPNCX1600S,-97.402,42.013999999999996,False,31,119,961100,31,31119,31119961100,1400000US31119961100,IBP INC,1600 S PINE INDL,NORFOLK,NE,68701,"IBP INC.1600 S PINE INDL, NORFOLK NEBRASKA 68701 (MADISON)",0,C,,
6870WWLNDN86WSU,-97.41799999999999,41.975,False,31,119,961100,31,31119,31119961100,1400000US31119961100,WEILAND INC,806 W SOUTH AIRPORT RD - SE CNR E SOUTH AIRPORT RD & HWY 81,NORFOLK,NE,68701,"WEILAND INC.806 W SOUTH AIRPORT RD - SE CNR E SOUTH AIRPORT RD & HWY 81, NORFOLK NEBRASKA 68701 (MADISON)",0,C,,110069330174
68731BPNCXHIGHW,-96.417,42.428999999999995,False,31,043,010300,31,31043,31043010300,1400000US31043010300,TYSON FRESH MEATS INC,1131 DAKOTA AVENUE,DAKOTA CITY,NE,68731,"TYSON FRESH MEATS INC.1131 DAKOTA AVENUE, DAKOTA CITY NEBRASKA 68731 (DAKOTA)",0,C,,110060335301
68776CNGRS300CO,-96.415,42.441,False,31,043,010300,31,31043,31043010300,1400000US31043010300,CONAGRA SPECIALTY GRAIN CO,300 CONAGRA ST,SOUTH SIOUX CITY,NE,68776,"CONAGRA SPECIALTY GRAIN CO.300 CONAGRA ST, SOUTH SIOUX CITY NEBRASKA 68776 (DAKOTA)",0,C,,
68776BFPRD36016,-96.41799999999999,42.431000000000004,False,31,043,010300,31,31043,31043010300,1400000US31043010300,EMPIRICAL FOODS (SSC),360 164TH ST,SOUTH SIOUX CITY,NE,68776,"EMPIRICAL FOODS (SSC).360 164TH ST, SOUTH SIOUX CITY NEBRASKA 68776 (DAKOTA)",0,C,,110000448178
68731BPNCWGSTXX,-96.404,42.426,False,31,043,010300,31,31043,31043010300,1400000US31043010300,TYSON FRESH MEATS INC WWTP,1674 C AVE,DAKOTA CITY,NE,68731,"TYSON FRESH MEATS INC WWTP.1674 C AVE, DAKOTA CITY NEBRASKA 68731 (DAKOTA)",0,C,,110038965563
68776SXLND2E48T,-96.405,42.442,False,31,043,010300,31,31043,31043010300,1400000US31043010300,SIOUXLAND CONCRETE CO,200 E 48TH ST,SOUTH SIOUX CITY,NE,68776,"SIOUXLAND CONCRETE CO.200 E 48TH ST, SOUTH SIOUX CITY NEBRASKA 68776 (DAKOTA)",0,C,,110017761849
68739MDMRCWESTH,-97.28200000000001,42.613,False,31,027,977100,31,31027,31027977100,1400000US31027977100,LEPRINO FOODS CO,W HWY 84,HARTINGTON,NE,68739,"LEPRINO FOODS CO.W HWY 84, HARTINGTON NEBRASKA 68739 (CEDAR)",0,C,,
68739HYDRLHWY84,-97.273,42.611999999999995,False,31,027,977100,31,31027,31027977100,1400000US31027977100,HYDRAULIC COMPONENTS INDUSTRY,HWY 84 & KATHOL RD BOX 187,HARTINGTON,NE,68739,"HYDRAULIC COMPONENTS INDUSTRY.HWY 84 & KATHOL RD BOX 187, HARTINGTON NEBRASKA 68739 (CEDAR)",0,C,,110002081247
6873WGRHLD88475,-97.26899999999999,42.652,False,31,027,977100,31,31027,31027977100,1400000US31027977100,GERHOLD CONCRETE CO HARTINGTON PLANT,88475 HIGHWAY 57,HARTINGTON,NE,68739,"GERHOLD CONCRETE CO HARTINGTON PLANT.88475 HIGHWAY 57, HARTINGTON NEBRASKA 68739 (CEDAR)",0,C,,110044322596
68748BPNCX1200I,-97.46700000000001,41.816,False,31,119,961300,31,31119,31119961300,1400000US31119961300,TYSON FRESH MEATS INC MADISON NEBRASKA,1200 INDUSTRIAL PKWY,MADISON,NE,68748,"TYSON FRESH MEATS INC MADISON NEBRASKA.1200 INDUSTRIAL PKWY, MADISON NEBRASKA 68748 (MADISON)",0,C,,110000448169
68764RCHRD120WE,-98.24700000000001,42.335,False,31,003,979600,31,31003,31003979600,1400000US31003979600,MID-AMERICA DAIRYMEN INC,120 W 2ND ST,ORCHARD,NE,68764,"MID-AMERICA DAIRYMEN INC.120 W 2ND ST, ORCHARD NEBRASKA 68764 (ANTELOPE)",1,C,,
68776SXCTY25GST,-96.404,42.467,False,31,043,010200,31,31043,31043010200,1400000US31043010200,SIOUX CITY FOUNDRY CO,24TH & G ST,SOUTH SIOUX CITY,NE,68776,"SIOUX CITY FOUNDRY CO.24TH & G ST, SOUTH SIOUX CITY NEBRASKA 68776 (DAKOTA)",0,C,,110014060390
68776CNTRL39THD,-96.41799999999999,42.452,False,31,043,010200,31,31043,31043010200,1400000US31043010200,ADM ANIMAL NUTRITION INC,425 W 39TH ST,SOUTH SIOUX CITY,NE,68776,"ADM ANIMAL NUTRITION INC.425 W 39TH ST, SOUTH SIOUX CITY NEBRASKA 68776 (DAKOTA)",0,C,,110000448187
68784MLTNG105NO,-96.865,42.272,False,31,051,977800,31,31051,31051977800,1400000US31051977800,MG WALDBAUM CO,105 N MAIN ST,WAKEFIELD,NE,68784,"MG WALDBAUM CO.105 N MAIN ST, WAKEFIELD NEBRASKA 68784 (DIXON)",0,C,,110000448196
68784MGWLDHWY35,-96.835,42.293,False,31,051,977800,31,31051,31051977800,1400000US31051977800,BIG RED FARMS,HWY 35 N,WAKEFIELD,NE,687840573,"BIG RED FARMS.HWY 35 N, WAKEFIELD NEBRASKA 68784 (DIXON)",0,C,,
68784MGWLDHWY9N,-96.87,42.308,False,31,051,977800,31,31051,31051977800,1400000US31051977800,HUSKER PRIDE,HWY 9 N,WAKEFIELD,NE,687840573,"HUSKER PRIDE.HWY 9 N, WAKEFIELD NEBRASKA 68784 (DIXON)",0,C,,
68787GRTDN1200N,-97.001,42.24100000000001,False,31,179,978700,31,31179,31179978700,1400000US31179978700,GREAT DANE LLC,1200 CENTENNIAL RD,WAYNE,NE,68787,"GREAT DANE LLC.1200 CENTENNIAL RD, WAYNE NEBRASKA 68787 (WAYNE)",0,C,,110000448203
6878WGRHLD89CEN,-96.99799999999999,42.236999999999995,False,31,179,978700,31,31179,31179978700,1400000US31179978700,GERHOLD CONCRETE CO WAYNE PLANT,809 CENTENNIAL RD,WAYNE,NE,68787,"GERHOLD CONCRETE CO WAYNE PLANT.809 CENTENNIAL RD, WAYNE NEBRASKA 68787 (WAYNE)",0,C,,110067546971
68788BPNCXHIGHW,-96.708,41.798,False,31,039,972800,31,31039,31039972800,1400000US31039972800,WEST POINT DAIRY PRODUCTS LLC,1715 E RD,WEST POINT,NE,68788,"WEST POINT DAIRY PRODUCTS LLC.1715 E RD, WEST POINT NEBRASKA 68788 (CUMING)",0,C,,110040084583
68788WSTPNPOBOX,-96.709,41.854,False,31,039,972800,31,31039,31039972800,1400000US31039972800,WEST POINT DAIRY PRODUCTS LLC,1715 E ROAD,WEST POINT,NE,68788,"WEST POINT DAIRY PRODUCTS LLC.1715 E ROAD, WEST POINT NEBRASKA 68788 (CUMING)",0,C,,110000769231
68788VLMNT1700S,-96.70200000000001,41.825,False,31,039,972800,31,31039,31039972800,1400000US31039972800,VALMONT COATINGS,1700 S BEEMER ST,WEST POINT,NE,68788,"VALMONT COATINGS.1700 S BEEMER ST, WEST POINT NEBRASKA 68788 (CUMING)",0,C,,110000448212
6878WGRHLD143SU,-96.70200000000001,41.825,False,31,039,972800,31,31039,31039972800,1400000US31039972800,GERHOLD CONCRETE CO WEST POINT PLANT,1430 S BEEMER ST,WEST POINT,NE,68788,"GERHOLD CONCRETE CO WEST POINT PLANT.1430 S BEEMER ST, WEST POINT NEBRASKA 68788 (CUMING)",0,C,,110014397893
68802DLCSFNORTH,-98.352,40.95,False,31,079,000200,31,31079,31079000200,1400000US31079000200,ORE-IDA FOODS INC DELICIOUS FOODS DIV PLANT I,204 E ROBERTS ST,GRAND ISLAND,NE,688010730,"ORE-IDA FOODS INC DELICIOUS FOODS DIV PLANT I.204 E ROBERTS ST, GRAND ISLAND NEBRASKA 68801 (HALL)",0,C,,
68801VRHDD2514E,-98.32600000000001,40.944,False,31,079,000200,31,31079,31079000200,1400000US31079000200,OVERHEAD DOOR CORP,2514 E HWY 30,GRAND ISLAND,NE,68801,"OVERHEAD DOOR CORP.2514 E HWY 30, GRAND ISLAND NEBRASKA 68801 (HALL)",0,C,,
68801CNCPT1515E,-98.32600000000001,40.935,False,31,079,000200,31,31079,31079000200,1400000US31079000200,CONCEPT FIBERGLASS INC,1515 E 4TH ST,GRAND ISLAND,NE,68801,"CONCEPT FIBERGLASS INC.1515 E 4TH ST, GRAND ISLAND NEBRASKA 68801 (HALL)",0,C,,
68801CNCPT611NW,-98.325,40.938,False,31,079,000200,31,31079,31079000200,1400000US31079000200,CONCEPT FIBERGLASS,611 WILLOW ST,GRAND ISLAND,NE,68801,"CONCEPT FIBERGLASS.611 WILLOW ST, GRAND ISLAND NEBRASKA 68801 (HALL)",0,C,,110001520275
68802CHFTM1924E,-98.322,40.937,False,31,079,000200,31,31079,31079000200,1400000US31079000200,CHIEF AUTOMOTIVE TECHNOLOGIES,1924 E 4TH ST,GRAND ISLAND,NE,68802,"CHIEF AUTOMOTIVE TECHNOLOGIES.1924 E 4TH ST, GRAND ISLAND NEBRASKA 68802 (HALL)",0,C,,110001518046
68802FRDNW3445W,-98.382,40.900999999999996,False,31,079,000600,31,31079,31079000600,1400000US31079000600,CNH INDUSTRIAL AMERICA LLC,3445 W STOLLEY PARK RD,GRAND ISLAND,NE,68803,"CNH INDUSTRIAL AMERICA LLC.3445 W STOLLEY PARK RD, GRAND ISLAND NEBRASKA 68803 (HALL)",0,C,,110000448267
68802HRNDY3625O,-98.38600000000001,40.917,False,31,079,000600,31,31079,31079000600,1400000US31079000600,HORNADY MANUFACTURING CO,3625 W OLD POTASH HWY,GRAND ISLAND,NE,68803,"HORNADY MANUFACTURING CO.3625 W OLD POTASH HWY, GRAND ISLAND NEBRASKA 68803 (HALL)",0,C,,110011600428
68803CHFCS1808R,-98.395,40.903,False,31,079,000600,31,31079,31079000600,1400000US31079000600,CHIEF INDUSTRIES AGRI DIVISON GRAND ISLAND,1808 RAYMOND DR,GRAND ISLAND,NE,68803,"CHIEF INDUSTRIES AGRI DIVISON GRAND ISLAND.1808 RAYMOND DR, GRAND ISLAND NEBRASKA 68803 (HALL)",0,C,,110000769240
68803CHFND2391S,-98.397,40.898,False,31,079,000600,31,31079,31079000600,1400000US31079000600,CHIEF INDUSTRIES INC - BUILDINGS DIV,2391 S N RD,GRAND ISLAND,NE,68803,"CHIEF INDUSTRIES INC - BUILDINGS DIV.2391 S N RD, GRAND ISLAND NEBRASKA 68803 (HALL)",0,C,,110000448294
68802MNFRT555SO,-98.32,40.922,False,31,079,001000,31,31079,31079001000,1400000US31079001000,SWIFT BEEF CO,555 S STUHR RD,GRAND ISLAND,NE,68801,"SWIFT BEEF CO.555 S STUHR RD, GRAND ISLAND NEBRASKA 68801 (HALL)",0,C,,110000448285
68801GRNDS916NS,-98.301,40.939,False,31,079,001000,31,31079,31079001000,1400000US31079001000,GRAND ISLAND ACCESSORIES INC,916 N SHADY BEND RD,GRAND ISLAND,NE,688018499,"GRAND ISLAND ACCESSORIES INC.916 N SHADY BEND RD, GRAND ISLAND NEBRASKA 68801 (HALL)",0,C,,
68801LCTRN2809E,-98.311,40.935,False,31,079,001000,31,31079,31079001000,1400000US31079001000,ELECTRONIC DISPLAY SYSTEMS,2809 E HWY 30,GRAND ISLAND,NE,68801,"ELECTRONIC DISPLAY SYSTEMS.2809 E HWY 30, GRAND ISLAND NEBRASKA 68801 (HALL)",0,C,,110002434161
68810BLLTWAPPOL,-98.49,40.875,False,31,079,000100,31,31079,31079000100,1400000US31079000100,BULLET WEIGHTS INC,APPOLLO DR,ALDA,NE,688100187,"BULLET WEIGHTS INC.APPOLLO DR, ALDA NEBRASKA 68810 (HALL)",0,C,,
68801CRWNS4112A,-98.323,40.976000000000006,False,31,079,000100,31,31079,31079000100,1400000US31079000100,"BKEP MATERIALS, LLC - GRAND ISLAND",4112 N ACADEMY RD,GRAND ISLAND,NE,68801,"BKEP MATERIALS, LLC - GRAND ISLAND.4112 N ACADEMY RD, GRAND ISLAND NEBRASKA 68801 (HALL)",0,C,,110002441929
6880WFLTRS232SN,-98.31700000000001,41.005,False,31,079,000100,31,31079,31079000100,1400000US31079000100,FILTER SPECIALISTS INC,2302 S N RD,GRAND ISLAND,NE,68803,"FILTER SPECIALISTS INC.2302 S N RD, GRAND ISLAND NEBRASKA 68803 (HALL)",0,C,,110064022668
68810LNPLSARGOI,-98.473,40.866,False,31,079,001300,31,31079,31079001300,1400000US31079001300,LEON PLASTICS INC.,108 APOLLO RD,ALDA,NE,68810,"LEON PLASTICS INC..108 APOLLO RD, ALDA NEBRASKA 68810 (HALL)",0,C,,110011041675
68832DNVSTOLDHW,-98.37,40.772,False,31,079,001300,31,31079,31079001300,1400000US31079001300,3-D INVESTMENT INC,112 W PLUM ST,DONIPHAN,NE,68832,"3-D INVESTMENT INC.112 W PLUM ST, DONIPHAN NEBRASKA 68832 (HALL)",0,C,,
68801PLTTG1035W,-98.34899999999999,40.855,False,31,079,001300,31,31079,31079001300,1400000US31079001300,PLATTE GENERATING STATION,1035 W WILDWOOD DR,GRAND ISLAND,NE,68801,"PLATTE GENERATING STATION.1035 W WILDWOOD DR, GRAND ISLAND NEBRASKA 68801 (HALL)",0,C,,110000448249
6880WSTNDR416GL,-98.37100000000001,40.871,False,31,079,001300,31,31079,31079001300,1400000US31079001300,STANDARD IRON INC,4160 GOLD CORE RD,GRAND ISLAND,NE,68801,"STANDARD IRON INC.4160 GOLD CORE RD, GRAND ISLAND NEBRASKA 68801 (HALL)",0,C,,110022482865
68818CNTRYINDUS,-98.021,40.874,False,31,081,969300,31,31081,31081969300,1400000US31081969300,FIBERGLASS PRODUCTS INC,102 GRANT STREET,AURORA,NE,68818,"FIBERGLASS PRODUCTS INC.102 GRANT STREET, AURORA NEBRASKA 68818 (HAMILTON)",0,C,,110001514638
68818NBRSK1205S,-98.036,40.868,False,31,081,969300,31,31081,31081969300,1400000US31081969300,PACIFIC ETHANOL -AURORA EAST LLC,1205 S O RD,AURORA,NE,68818,"PACIFIC ETHANOL -AURORA EAST LLC.1205 S O RD, AURORA NEBRASKA 68818 (HAMILTON)",0,C,,110000448329
688181FBRG105HA,-98.023,40.873000000000005,False,31,081,969300,31,31081,31081969300,1400000US31081969300,A-1 FIBERGLASS,105 HAMILTON,AURORA,NE,68818,"A-1 FIBERGLASS.105 HAMILTON, AURORA NEBRASKA 68818 (HAMILTON)",0,C,,
68818BNNVL111GR,-98.021,40.873000000000005,False,31,081,969300,31,31081,31081969300,1400000US31081969300,BONNAVILLA HOMES,111 GRANT ST,AURORA,NE,68818,"BONNAVILLA HOMES.111 GRANT ST, AURORA NEBRASKA 68818 (HAMILTON)",0,C,,110013286817
688181FBRG1318W,-98.04,40.871,False,31,081,969300,31,31081,31081969300,1400000US31081969300,A-1 FIBERGLASS,1318 WILSON ST,AURORA,NE,68818,"A-1 FIBERGLASS.1318 WILSON ST, AURORA NEBRASKA 68818 (HAMILTON)",0,C,,110020497121
6881WVNTNR213HA,-98.046,40.87,False,31,081,969300,31,31081,31081969300,1400000US31081969300,PACIFIC ETHANOL -AURORA WEST LLC,2103 HARVEST DR,AURORA,NE,68818,"PACIFIC ETHANOL -AURORA WEST LLC.2103 HARVEST DR, AURORA NEBRASKA 68818 (HAMILTON)",0,C,,110046120167
68822BCTND150SO,-99.631,41.403999999999996,False,31,041,971900,31,31041,31041971900,1400000US31041971900,BECTON DICKINSON & CO VSD,150 S 1ST AVE,BROKEN BOW,NE,68822,"BECTON DICKINSON & CO VSD.150 S 1ST AVE, BROKEN BOW NEBRASKA 68822 (CUSTER)",0,C,,
68840GBBNFEFRTS,-98.836,40.751999999999995,False,31,019,969100,31,31019,31019969100,1400000US31019969100,GIBBON FIBERGLASS,112 E FRONT ST,GIBBON,NE,68840,"GIBBON FIBERGLASS.112 E FRONT ST, GIBBON NEBRASKA 68840 (BUFFALO)",0,C,,
68840GBBNPEHWY3,-98.839,40.751999999999995,False,31,019,969100,31,31019,31019969100,1400000US31019969100,GIBBON PACKING LLC,EAST HWY 30,GIBBON,NE,68840,"GIBBON PACKING LLC.EAST HWY 30, GIBBON NEBRASKA 68840 (BUFFALO)",0,C,,110000596999
68840NTRFL6090O,-98.92,40.731,False,31,019,969100,31,31019,31019969100,1400000US31019969100,THE ANDERSONS INC - GIBBON,6090 OPTIC RD,GIBBON,NE,68840,"THE ANDERSONS INC - GIBBON.6090 OPTIC RD, GIBBON NEBRASKA 68840 (BUFFALO)",0,C,,110000448347
68840NRTFLRR2BO,-98.894,40.737,True,31,019,969100,31,31047,31019969100,1400000US31019969100,NUTRA-FLO CHEMICAL CO,RR#2 BOX 52,GIBBON,NE,68840,"NUTRA-FLO CHEMICAL CO RR#2 BOX 52, GIBBON, NE, 68840",2,C,,
68847CLMNP125AI,-99.016,40.723,False,31,019,969203,31,31019,31019969203,1400000US31019969203,PRAMAC AMERICA,4970 AIRPORT RD,KEARNEY,NE,68847,"PRAMAC AMERICA.4970 AIRPORT RD, KEARNEY NEBRASKA 68847 (BUFFALO)",0,C,,110000448356
68848BLDWNEASTH,-99.01899999999999,40.71,False,31,019,969203,31,31019,31019969203,1400000US31019969203,BALDWIN FILTERS INC,4400 E HWY 30,KEARNEY,NE,68847,"BALDWIN FILTERS INC.4400 E HWY 30, KEARNEY NEBRASKA 68847 (BUFFALO)",0,C,,110000597015
68847CHFND4400E,-99.02,40.714,False,31,019,969203,31,31019,31019969203,1400000US31019969203,CHIEF INDUSTRIES INC - AGRI/INDUSTRIAL DIV,4400 E 39TH ST,KEARNEY,NE,68847,"CHIEF INDUSTRIES INC - AGRI/INDUSTRIAL DIV.4400 E 39TH ST, KEARNEY NEBRASKA 68847 (BUFFALO)",0,C,,110001520621
68847THWST923WR,-99.094,40.694,False,31,019,969600,31,31019,31019969600,1400000US31019969600,WEST PHARMACEUTICAL SERVICES,923 W RAILROAD ST,KEARNEY,NE,68845,"WEST PHARMACEUTICAL SERVICES.923 W RAILROAD ST, KEARNEY NEBRASKA 68845 (BUFFALO)",0,C,,110015738264
68847TNCRP4200E,-99.027,40.71,False,31,019,969300,31,31019,31019969300,1400000US31019969300,EATON CORP,4200 HIGHWAY 30 E,KEARNEY,NE,68847,"EATON CORP.4200 HIGHWAY 30 E, KEARNEY NEBRASKA 68847 (BUFFALO)",0,C,,110000597006
6884WKRNYC298HW,-99.045,40.704,False,31,019,969300,31,31019,31019969300,1400000US31019969300,KEARNEY CRETE & BLOCK CO,2908 HWY 30 E,KEARNEY,NE,68847,"KEARNEY CRETE & BLOCK CO.2908 HWY 30 E, KEARNEY NEBRASKA 68847 (BUFFALO)",0,C,,110010166159
68850RTHMNRR2XX,-99.711,40.81,False,31,047,968100,31,31047,31047968100,1400000US31047968100,ORTHMAN MANUFACTURING INC NORTH PLANT,75765 RD 435,LEXINGTON,NE,68850,"ORTHMAN MANUFACTURING INC NORTH PLANT.75765 RD 435, LEXINGTON NEBRASKA 68850 (DAWSON)",0,C,,110000448383
68850VLLYS1810E,-99.71600000000001,40.769,False,31,047,968400,31,31047,31047968400,1400000US31047968400,BEHLEN MANUFACTURING CO BIG VALLEY DIV,1810 E HWY 30,LEXINGTON,NE,68850,"BEHLEN MANUFACTURING CO BIG VALLEY DIV.1810 E HWY 30, LEXINGTON NEBRASKA 68850 (DAWSON)",0,C,,
68850BPNCX1500S,-99.73700000000001,40.760999999999996,False,31,047,968400,31,31047,31047968400,1400000US31047968400,TYSON FRESH MEATS INC,1500 S PLUM CREEK PKWY,LEXINGTON,NE,68850,"TYSON FRESH MEATS INC.1500 S PLUM CREEK PKWY, LEXINGTON NEBRASKA 68850 (DAWSON)",0,C,,110000760276
68850NBRSK74965,-99.712,40.738,False,31,047,968400,31,31047,31047968400,1400000US31047968400,NEBRASKA PUBLIC POWER DISTRICT CANADAY STEAM PLANT,74965 RD 435,LEXINGTON,NE,688505557,"NEBRASKA PUBLIC POWER DISTRICT CANADAY STEAM PLANT.74965 RD 435, LEXINGTON NEBRASKA 68850 (DAWSON)",0,C,,110001979477
6885WRTHMN152EA,-99.721,40.771,False,31,047,968400,31,31047,31047968400,1400000US31047968400,ORTHMAN MANUFACTURING INC SOUTH PLANT,1502 EAST WALNUT STREET,LEXINGTON,NE,68850,"ORTHMAN MANUFACTURING INC SOUTH PLANT.1502 EAST WALNUT STREET, LEXINGTON NEBRASKA 68850 (DAWSON)",1,C,,110001520845
6885WSTHFR62EAS,-99.743,40.747,False,31,047,968400,31,31047,31047968400,1400000US31047968400,SOUTH FRONTIER FACILITY,620 EAST FRONTIER STREET,LEXINGTON,NE,68850,"SOUTH FRONTIER FACILITY.620 EAST FRONTIER STREET, LEXINGTON NEBRASKA 68850 (DAWSON)",0,C,,110070058067
68869MDMRC102LI,-98.906,41.025,False,31,019,968900,31,31019,31019968900,1400000US31019968900,LEPRINO FOODS CO,102 LINCOLN AVE,RAVENNA,NE,68869,"LEPRINO FOODS CO.102 LINCOLN AVE, RAVENNA NEBRASKA 68869 (BUFFALO)",1,C,,110000448392
68869BNGBN35955,-98.875,41.023999999999994,False,31,019,968900,31,31019,31019968900,1400000US31019968900,KAAPA ETHANOL RAVENNA LLC,35955 NAVAHO RD,RAVENNA,NE,68869,"KAAPA ETHANOL RAVENNA LLC.35955 NAVAHO RD, RAVENNA NEBRASKA 68869 (BUFFALO)",0,C,,110031127126
68901FBRGLROUTE,-98.31299999999999,40.565,False,31,001,966200,31,31001,31001966200,1400000US31001966200,A-1 FIBERGLASS,4495 S GUNPOWDER CIR,HASTINGS,NE,68901,"A-1 FIBERGLASS.4495 S GUNPOWDER CIR, HASTINGS NEBRASKA 68901 (ADAMS)",0,C,,110000448427
68901RCNCXHASTI,-98.305,40.556999999999995,False,31,001,966200,31,31001,31001966200,1400000US31001966200,ERIC INC HASTINGS INDUSTRIES DIV,4855 EAST INDUSTRY CIR INDUSTRIAL PARK EAST,HASTINGS,NE,689020548,"ERIC INC HASTINGS INDUSTRIES DIV.4855 EAST INDUSTRY CIR INDUSTRIAL PARK EAST, HASTINGS NEBRASKA 68902 (ADAMS)",0,C,,
68901WHLNNEHWY6,-98.316,40.582,False,31,001,966200,31,31001,31001966200,1400000US31001966200,WHELAN ENERGY CENTER (WEC 1 HU WEC 2 PPGA),4520 E S ST,HASTINGS,NE,68901,"WHELAN ENERGY CENTER (WEC 1 HU WEC 2 PPGA).4520 E S ST, HASTINGS NEBRASKA 68901 (ADAMS)",0,C,,110001505602
68901SRMYN6700E,-98.28,40.568000000000005,False,31,001,966200,31,31001,31001966200,1400000US31001966200,US ARMY NATIONAL GUARD GREENLIEF TRAINING SITE RANGES,6700 EAST J STREET,HASTINGS,NE,68901,"US ARMY NATIONAL GUARD GREENLIEF TRAINING SITE RANGES.6700 EAST J STREET, HASTINGS NEBRASKA 68901 (ADAMS)",0,F,,110012703949
68901HSTNG2001S,-98.406,40.57,False,31,001,966000,31,31001,31001966000,1400000US31001966000,ARMOUR FOOD CO,2001 SUMMIT AVE,HASTINGS,NE,68901,"ARMOUR FOOD CO.2001 SUMMIT AVE, HASTINGS NEBRASKA 68901 (ADAMS)",0,C,,
68901THRMK1800C,-98.405,40.574,False,31,001,966000,31,31001,31001966000,1400000US31001966000,THERMO KING CORP,1800 CENTENNIAL AVE,HASTINGS,NE,68901,"THERMO KING CORP.1800 CENTENNIAL AVE, HASTINGS NEBRASKA 68901 (ADAMS)",0,C,,110000448454
68901TLRRGHASTI,-98.412,40.568000000000005,False,31,001,966000,31,31035,31001966000,1400000US31001966000,T-L IRRIGATION CO,151 E HWY 6 & AB RD,HASTINGS,NE,68901,"T-L IRRIGATION CO.151 E HWY 6 & AB RD, HASTINGS NEBRASKA 68901 (CLAY)",0,C,,110000608192
68902DNCRP1900S,-98.40700000000001,40.571999999999996,False,31,001,966000,31,31001,31001966000,1400000US31001966000,DANA CORP PERFECT CIRCLE DIV,1900 SUMMIT AVE,HASTINGS,NE,68901,"DANA CORP PERFECT CIRCLE DIV.1900 SUMMIT AVE, HASTINGS NEBRASKA 68901 (ADAMS)",0,C,,
68901LVTTS1009M,-98.395,40.564,False,31,001,966000,31,31001,31001966000,1400000US31001966000,LOVETT & SONS PACKING COMPANY,1009 M STREET,HASTINGS,NE,68901,"LOVETT & SONS PACKING COMPANY.1009 M STREET, HASTINGS NEBRASKA 68901 (ADAMS)",0,C,,
68901MRSHL108SC,-98.385,40.583,False,31,001,966100,31,31001,31001966100,1400000US31001966100,MARSHALLTOWN INSTRUMENTS,108 S COLORADO AVE,HASTINGS,NE,68901,"MARSHALLTOWN INSTRUMENTS.108 S COLORADO AVE, HASTINGS NEBRASKA 68901 (ADAMS)",0,C,,
68901NGRSL1341W,-98.399,40.585,False,31,001,965800,31,31001,31001965800,1400000US31001965800,FLOWSERVE CORP,1341 W 2ND ST,HASTINGS,NE,68901,"FLOWSERVE CORP.1341 W 2ND ST, HASTINGS NEBRASKA 68901 (ADAMS)",0,C,,110000448445
68901DTTNL1601W,-98.40299999999999,40.585,False,31,001,965800,31,31001,31001965800,1400000US31001965800,DUTTON-LAINSON CO,1601 W 2ND ST,HASTINGS,NE,68901,"DUTTON-LAINSON CO.1601 W 2ND ST, HASTINGS NEBRASKA 68901 (ADAMS)",0,C,,110045949462
68901SPLYC1933W,-98.41,40.585,False,31,001,965800,31,31001,31001965800,1400000US31001965800,U S POLY CO,1933 W 2ND ST,HASTINGS,NE,68901,"U S POLY CO.1933 W 2ND ST, HASTINGS NEBRASKA 68901 (ADAMS)",0,C,,110031020008
68902HSTNG3MILE,-98.306,40.583,False,31,001,965400,31,31001,31001965400,1400000US31001965400,HASTINGS NITROGEN PLANT,3 MILES E ON HWY 6,HASTINGS,NE,689020949,"HASTINGS NITROGEN PLANT.3 MILES E ON HWY 6, HASTINGS NEBRASKA 68902 (ADAMS)",0,C,,
68901CHFTHEASTH,-98.319,40.585,False,31,001,965400,31,31001,31001965400,1400000US31001965400,CHIEF ETHANOL FUELS INC,4225 E SOUTH ST,HASTINGS,NE,68901,"CHIEF ETHANOL FUELS INC.4225 E SOUTH ST, HASTINGS NEBRASKA 68901 (ADAMS)",0,C,,110000448409
68949BCTNDWESTH,-99.397,40.433,False,31,137,967000,31,31137,31137967000,1400000US31137967000,BECTON DICKINSON CO HOLDREGE,1329 W HWY 6,HOLDREGE,NE,68949,"BECTON DICKINSON CO HOLDREGE.1329 W HWY 6, HOLDREGE NEBRASKA 68949 (PHELPS)",0,C,,110000597033
68949HLDRGWESTH,-99.39200000000001,40.433,False,31,137,967000,31,31137,31137967000,1400000US31137967000,HOLDREGE SEED & FARM SUPPLY CO INC,W HWY 6,HOLDREGE,NE,689490530,"HOLDREGE SEED & FARM SUPPLY CO INC.W HWY 6, HOLDREGE NEBRASKA 68949 (PHELPS)",0,C,,110007677031
68959GRYSN900WF,-98.96600000000001,40.499,False,31,099,966700,31,31099,31099966700,1400000US31099966700,GRAYSON TOOL CO,900 WEST 5TH ST,MINDEN,NE,68959,"GRAYSON TOOL CO.900 WEST 5TH ST, MINDEN NEBRASKA 68959 (KEARNEY)",0,C,,
68978MDMRC355WE,-98.075,40.018,False,31,129,960100,31,31129,31129960100,1400000US31129960100,MID-AMERICA DAIRYMEN INC,355 W 2ND ST,SUPERIOR,NE,68978,"MID-AMERICA DAIRYMEN INC.355 W 2ND ST, SUPERIOR NEBRASKA 68978 (NUCKOLLS)",1,C,,
69001CRNBLNORTH,-100.65,40.223,False,31,145,963200,31,31145,31145963200,1400000US31145963200,VAN DIEST SUPPLY CO,71703 U.S. HWY 83,MC COOK,NE,69001,"VAN DIEST SUPPLY CO.71703 U.S. HWY 83, MC COOK NEBRASKA 69001 (RED WILLOW)",0,C,,110038269799
69001DYCPR400SO,-100.62200000000001,40.192,False,31,145,963300,31,31145,31145963300,1400000US31145963300,PARKER HANNIFIN,400 S ST,MC COOK,NE,69001,"PARKER HANNIFIN.400 S ST, MC COOK NEBRASKA 69001 (RED WILLOW)",0,C,,110024422640
69001VLMNT75SHW,-100.617,40.195,False,31,145,963300,31,31145,31145963300,1400000US31145963300,VALMONT INDUSTRIES INC,75 SOUTH HWY 83,MC COOK,NE,69001,"VALMONT INDUSTRIES INC.75 SOUTH HWY 83, MC COOK NEBRASKA 69001 (RED WILLOW)",0,C,,110006073113
6900WGRHLDBNRIG,-100.618,40.195,False,31,145,963300,31,31145,31145963300,1400000US31145963300,GERHOLD CONCRETE CO MCCOOK PLANT,B & N RIGHT OF WAY,MC COOK,NE,69001,"GERHOLD CONCRETE CO MCCOOK PLANT.B & N RIGHT OF WAY, MC COOK NEBRASKA 69001 (RED WILLOW)",0,C,,110067544866
69024KGLRLRAILR,-100.83,40.228,False,31,087,962700,31,31087,31087962700,1400000US31087962700,KUGLER OIL CO,RAILROAD ST,CULBERTSON,NE,69024,"KUGLER OIL CO.RAILROAD ST, CULBERTSON NEBRASKA 69024 (HITCHCOCK)",0,C,,
69044TRNTNHC2PB,-100.98,40.196,False,31,087,962700,31,31087,31087962700,1400000US31087962700,TRENTON AGRI PRODUCTS LLC,36638 US HWY 34,TRENTON,NE,69044,"TRENTON AGRI PRODUCTS LLC.36638 US HWY 34, TRENTON NEBRASKA 69044 (HITCHCOCK)",0,C,,110017696340
6902WKGLRC71748,-100.96,40.292,False,31,087,962700,31,31087,31087962700,1400000US31087962700,KUGLER OIL CO - CDF,71748 RAILROAD ST,CULBERTSON,NE,69024,"KUGLER OIL CO - CDF.71748 RAILROAD ST, CULBERTSON NEBRASKA 69024 (HITCHCOCK)",0,C,,110018874262
69129LPRNF100DA,-102.464,41.092,False,31,049,955400,31,31049,31049955400,1400000US31049955400,LEPRINO FOODS CO,100 DANA,CHAPPELL,NE,69129,"LEPRINO FOODS CO.100 DANA, CHAPPELL NEBRASKA 69129 (DEUEL)",0,C,,
69130MNRTQ121ME,-99.98700000000001,40.854,False,31,047,968300,31,31047,31047968300,1400000US31047968300,TENNECO AUTOMOTIVE OPERATING CO INC,121 MERIDIAN AVE,COZAD,NE,69130,"TENNECO AUTOMOTIVE OPERATING CO INC.121 MERIDIAN AVE, COZAD NEBRASKA 69130 (DAWSON)",0,C,,110000448533
69130CNTRL300WE,-99.988,40.855,False,31,047,968300,31,31047,31047968300,1400000US31047968300,ADM ALLIANCE NUTRITION INC,300 W 2ND ST,COZAD,NE,69130,"ADM ALLIANCE NUTRITION INC.300 W 2ND ST, COZAD NEBRASKA 69130 (DAWSON)",1,C,,110041052099
69153SCXXX301WE,-101.73700000000001,41.123999999999995,False,31,101,000200,31,31101,31101000200,1400000US31101000200,ASC,301 W O ST,OGALLALA,NE,69153,"ASC.301 W O ST, OGALLALA NEBRASKA 69153 (KEITH)",0,C,,
6915WRNLDM61WES,-101.725,41.123999999999995,False,31,101,000200,31,31101,31101000200,1400000US31101000200,ARNOLD MAGNETIC TECHNOLOGIES - OGALLALA ELECTRONICS,601 WEST 1ST STREET,OGALLALA,NE,69153,"ARNOLD MAGNETIC TECHNOLOGIES - OGALLALA ELECTRONICS.601 WEST 1ST STREET, OGALLALA NEBRASKA 69153 (KEITH)",0,C,,110001519376
