TRIFID,LONGITUDE,LATITUDE,ESTIMATE,STATEFP,COUNTYFP,TRACTCE,STATEGEOID,COUNTYGEOID,TRACTGEOID,AFFGEOID,FACILITY_NAME,STREET,CITY,STUSPS,ZIP_CODE,FACILITY,FAC_CLOSED_IND,ASGN_FEDERAL_IND,BIA_CODE,EPA_REGISTRY_ID
14623MTLDN2025B,-77.641,43.081,False,36,055,013104,36,36055,36055013104,1400000US36055013104,METALADE INC FINISHING & ASSEMBLY DIV,39 COMMERCE DR,ROCHESTER,NY,146230885,"METALADE INC FINISHING & ASSEMBLY DIV.39 COMMERCE DR, ROCHESTER NEW YORK 14623 (MONROE)",0,C,,
14623PNNWL755JE,-77.622,43.083999999999996,False,36,055,013104,36,36055,36055013104,1400000US36055013104,UNITHER MANUFACTURING LLC,755 JEFFERSON RD,ROCHESTER,NY,14623,"UNITHER MANUFACTURING LLC.755 JEFFERSON RD, ROCHESTER NEW YORK 14623 (MONROE)",0,C,,110000328084
14623RHLNN701JE,-77.624,43.085,False,36,055,013104,36,36055,36055013104,1400000US36055013104,ROEHLEN ENGRAVING,701 JEFFERSON RD,ROCHESTER,NY,14623,"ROEHLEN ENGRAVING.701 JEFFERSON RD, ROCHESTER NEW YORK 14623 (MONROE)",0,C,,
14692TKGRP811JE,-77.619,43.086999999999996,False,36,055,013104,36,36055,36055013104,1400000US36055013104,ITEK GRAPHIC SYS,811 JEFFERSON RD,ROCHESTER,NY,146233211,"ITEK GRAPHIC SYS.811 JEFFERSON RD, ROCHESTER NEW YORK 14623 (MONROE)",0,C,,
14623NTCHN1HIGH,-77.66,43.077,False,36,055,013104,36,36055,36055013104,1400000US36055013104,ENI TECHNOLOGY INC,100 HIGHPOWER RD,ROCHESTER,NY,14623,"ENI TECHNOLOGY INC.100 HIGHPOWER RD, ROCHESTER NEW YORK 14623 (MONROE)",0,C,,110004393095
14624CSHYT100BE,-77.74600000000001,43.096000000000004,False,36,055,014602,36,36055,36055014602,1400000US36055014602,CASE-HOYT PRINTING CORP,100 BEAVER RD,CHURCHVILLE,NY,14624,"CASE-HOYT PRINTING CORP.100 BEAVER RD, CHURCHVILLE NEW YORK 14624 (MONROE)",0,C,,
14692BSCHL465PA,-77.71300000000001,43.105,False,36,055,014602,36,36055,36055014602,1400000US36055014602,BAUSCH & LOMB INC FRAME CENTER,465 PAUL RD,ROCHESTER,NY,14624,"BAUSCH & LOMB INC FRAME CENTER.465 PAUL RD, ROCHESTER NEW YORK 14624 (MONROE)",0,C,,
14624LLNCM12PIX,-77.712,43.141000000000005,False,36,055,014202,36,36055,36055014202,1400000US36055014202,ALLIANCE METAL STAMPING & FABRICATING,12 PIXLEY INDUSTRIAL PKWY,ROCHESTER,NY,14624,"ALLIANCE METAL STAMPING & FABRICATING.12 PIXLEY INDUSTRIAL PKWY, ROCHESTER NEW YORK 14624 (MONROE)",0,C,,
14624RCHST30PIX,-77.71300000000001,43.141000000000005,False,36,055,014202,36,36055,36055014202,1400000US36055014202,ITT AUTOMOTIVE,30 PIXLEY INDL PKY,ROCHESTER,NY,14624,"ITT AUTOMOTIVE.30 PIXLEY INDL PKY, ROCHESTER NEW YORK 14624 (MONROE)",0,C,,
14624RDLPR100PI,-77.714,43.138999999999996,False,36,055,014202,36,36055,36055014202,1400000US36055014202,ERDLE PERFORATING CO INC,100 PIXLEY INDUSTRIAL PKWY,ROCHESTER,NY,14624,"ERDLE PERFORATING CO INC.100 PIXLEY INDUSTRIAL PKWY, ROCHESTER NEW YORK 14624 (MONROE)",0,C,,
14624MNKCN1525B,-77.67699999999999,43.131,False,36,055,014400,36,36055,36055014400,1400000US36055014400,CYPRESS PACKAGING INC,1525 BROOKS AVE,ROCHESTER,NY,14624,"CYPRESS PACKAGING INC.1525 BROOKS AVE, ROCHESTER NEW YORK 14624 (MONROE)",0,C,,
14652STMNK1669L,-77.63,43.198,False,36,055,001900,36,36055,36055001900,1400000US36055001900,EASTMAN KODAK CO EASTMAN BUSINESS PARK,1669 LAKE AVE,ROCHESTER,NY,14652,"EASTMAN KODAK CO EASTMAN BUSINESS PARK.1669 LAKE AVE, ROCHESTER NEW YORK 14652 (MONROE)",0,C,,110000492173
14652CHMPN1669L,-77.628,43.196999999999996,False,36,055,001900,36,36055,36055001900,1400000US36055001900,CHAMPION PHOTOCHEMISTRY INC,1669 LAKE AVE BUILDING 48 MC MC23751,ROCHESTER,NY,146523751,"CHAMPION PHOTOCHEMISTRY INC.1669 LAKE AVE BUILDING 48 MC MC23751, ROCHESTER NEW YORK 14652 (MONROE)",0,C,,110031020375
14615CRSTR149WR,-77.631,43.199,False,36,055,001900,36,36055,36055001900,1400000US36055001900,CARESTREAM HEALTH INC-ISC B-14,1669 LAKE AVE EASTMAN B US INESS PARK BUILDING 14,ROCHESTER,NY,14615,"CARESTREAM HEALTH INC-ISC B-14.1669 LAKE AVE EASTMAN B US INESS PARK BUILDING 14, ROCHESTER NEW YORK 14615 (MONROE)",0,C,,110031331280
1465WCRSTR1669L,-77.628,43.196999999999996,False,36,055,001900,36,36055,36055001900,1400000US36055001900,CARESTREAM HEALTH INC - ISC B-117,"1669 LAKE AVENUE, EASTMAN BUSINESS PARK, BUILDING",ROCHESTER,NY,14615,"CARESTREAM HEALTH INC - ISC B-117.1669 LAKE AVENUE, EASTMAN BUSINESS PARK, BUILDING, ROCHESTER NEW YORK 14615 (MONROE)",0,C,,110039496818
1461WTRSNS1964L,-77.628,43.20399999999999,False,36,055,001900,36,36055,36055001900,1400000US36055001900,SEMICONDUCTOR COMPONENTS INDUSTRIES LLC,1964 LAKE AVE,ROCHESTER,NY,14615,"SEMICONDUCTOR COMPONENTS INDUSTRIES LLC.1964 LAKE AVE, ROCHESTER NEW YORK 14615 (MONROE)",0,C,,110044285911
14653STMNK20AVE,-77.626,43.181000000000004,False,36,055,003900,36,36055,36055003900,1400000US36055003900,EASTMAN KODAK CO HAWK-EYE PLANT,20 AVE E,ROCHESTER,NY,146537116,"EASTMAN KODAK CO HAWK-EYE PLANT.20 AVE E, ROCHESTER NEW YORK 14653 (MONROE)",0,C,,
14653STMNK901EL,-77.732,43.155,False,36,055,014204,36,36055,36055014204,1400000US36055014204,EASTMAN KODAK CO ELMGROVE PLANT,901 ELMGROVE RD,ROCHESTER,NY,146535710,"EASTMAN KODAK CO ELMGROVE PLANT.901 ELMGROVE RD, ROCHESTER NEW YORK 14653 (MONROE)",0,C,,
14692BSCHL1400N,-77.572,43.18,False,36,055,008301,36,36055,36055008301,1400000US36055008301,BAUSCH & LOMB INC,1400 N GOODMAN ST,ROCHESTER,NY,14609,"BAUSCH & LOMB INC.1400 N GOODMAN ST, ROCHESTER NEW YORK 14609 (MONROE)",0,C,,110000774895
14692GLSNW1000U,-77.57600000000001,43.153999999999996,False,36,055,001000,36,36055,36055001000,1400000US36055001000,GLEASON WORKS,1000 UNIVERSITY AVE,ROCHESTER,NY,14607,"GLEASON WORKS.1000 UNIVERSITY AVE, ROCHESTER NEW YORK 14607 (MONROE)",0,C,,110000328146
14701BLCKS1111A,-79.207,42.11,False,36,013,037300,36,36013,36013037300,1400000US36013037300,TITANX ENGINE COOLING INC,2258 ALLEN ST,JAMESTOWN,NY,14701,"TITANX ENGINE COOLING INC.2258 ALLEN ST, JAMESTOWN NEW YORK 14701 (CHAUTAUQUA)",0,C,,110000328173
14702BSHNDONEMA,-79.194,42.113,False,36,013,037300,36,36013,36013037300,1400000US36013037300,BUSH INDUSTRIES INC,1 MASON DR,JAMESTOWN,NY,14702,"BUSH INDUSTRIES INC.1 MASON DR, JAMESTOWN NEW YORK 14702 (CHAUTAUQUA)",0,C,,
14702JMSTWPOBOX,-79.204,42.11,False,36,013,037300,36,36013,36013037300,1400000US36013037300,JAMESTOWN STERLING CORP,ALLEN ST EXTENSION,JAMESTOWN,NY,147020610,"JAMESTOWN STERLING CORP.ALLEN ST EXTENSION, JAMESTOWN NEW YORK 14702 (CHAUTAUQUA)",1,C,,
14733CHSNT235WL,-79.196,42.115,False,36,013,037300,36,36013,36013037300,1400000US36013037300,CHASE INTERIORS INC,235 W LISTER AVE,FALCONER,NY,14733,"CHASE INTERIORS INC.235 W LISTER AVE, FALCONER NEW YORK 14733 (CHAUTAUQUA)",0,C,,
14733DWCRF65SOU,-79.204,42.111999999999995,False,36,013,037300,36,36013,36013037300,1400000US36013037300,DOWCRAFT CORP,65 S DOW ST,FALCONER,NY,14733,"DOWCRAFT CORP.65 S DOW ST, FALCONER NEW YORK 14733 (CHAUTAUQUA)",0,C,,
14733FLCNR500SW,-79.187,42.115,False,36,013,037300,36,36013,36013037300,1400000US36013037300,GUARDIAN JAMESTOWN,LYNDON BLVD,FALCONER,NY,14733,"GUARDIAN JAMESTOWN.LYNDON BLVD, FALCONER NEW YORK 14733 (CHAUTAUQUA)",0,C,,
14733FNCHR121SO,-79.196,42.118,False,36,013,037300,36,36013,36013037300,1400000US36013037300,FANCHER CHAIR CO,121 SOUTH WORK ST,FALCONER,NY,14733,"FANCHER CHAIR CO.121 SOUTH WORK ST, FALCONER NEW YORK 14733 (CHAUTAUQUA)",0,C,,
14733LLSNB125WM,-79.2,42.117,False,36,013,037300,36,36013,36013037300,1400000US36013037300,ELLISON BRONZE INC,125 W MAIN ST,FALCONER,NY,14733,"ELLISON BRONZE INC.125 W MAIN ST, FALCONER NEW YORK 14733 (CHAUTAUQUA)",0,C,,110000328299
14733MNFRX501NE,-79.182,42.11600000000001,False,36,013,037300,36,36013,36013037300,1400000US36013037300,MONOFRAX LLC,1870 NEW YORK AVE,FALCONER,NY,14733,"MONOFRAX LLC.1870 NEW YORK AVE, FALCONER NEW YORK 14733 (CHAUTAUQUA)",0,C,,110000328306
14733TRCKL310EE,-79.186,42.122,False,36,013,037300,36,36013,36013037300,1400000US36013037300,TRUCK-LITE CO LLC,310 E ELMWOOD AVE,FALCONER,NY,14733,"TRUCK-LITE CO LLC.310 E ELMWOOD AVE, FALCONER NEW YORK 14733 (CHAUTAUQUA)",0,C,,110001600768
14733DWCRF221LI,-79.195,42.114,False,36,013,037300,36,36013,36013037300,1400000US36013037300,INSCAPE (NEW YORK) INC.,221 LISTER AVE,FALCONER,NY,14733,"INSCAPE (NEW YORK) INC..221 LISTER AVE, FALCONER NEW YORK 14733 (CHAUTAUQUA)",0,C,,110004542932
14701CRTCSONEPR,-79.187,42.108000000000004,False,36,013,037300,36,36013,36013037300,1400000US36013037300,HEIDENHAIN CORP INC,ONE PRECISION WAY,JAMESTOWN,NY,14701,"HEIDENHAIN CORP INC.ONE PRECISION WAY, JAMESTOWN NEW YORK 14701 (CHAUTAUQUA)",0,C,,110019799306
14701CHTQH3135W,-79.23100000000001,42.093,False,36,013,030600,36,36013,36013030600,1400000US36013030600,CHAUTAUQUA HARDWARE CORP,31-35 WATER ST,JAMESTOWN,NY,14701,"CHAUTAUQUA HARDWARE CORP.31-35 WATER ST, JAMESTOWN NEW YORK 14701 (CHAUTAUQUA)",0,C,,
14701MRCBR402CH,-79.227,42.099,False,36,013,030600,36,36013,36013030600,1400000US36013030600,SKF AEROENGINE JAMESTOWN,402 CHANDLER ST,JAMESTOWN,NY,14701,"SKF AEROENGINE JAMESTOWN.402 CHANDLER ST, JAMESTOWN NEW YORK 14701 (CHAUTAUQUA)",1,C,,110000328226
14701WBRKN441CH,-79.226,42.1,False,36,013,030600,36,36013,36013030600,1400000US36013030600,WEBER KNAPP CO,441 CHANDLER ST,JAMESTOWN,NY,14702,"WEBER KNAPP CO.441 CHANDLER ST, JAMESTOWN NEW YORK 14702 (CHAUTAUQUA)",0,C,,110000328244
14702JMSTW105WA,-79.22800000000001,42.095,False,36,013,030600,36,36013,36013030600,1400000US36013030600,JAMESTOWN ELECTRO PLATING WORKS INC,105 WATER ST,JAMESTOWN,NY,14701,"JAMESTOWN ELECTRO PLATING WORKS INC.105 WATER ST, JAMESTOWN NEW YORK 14701 (CHAUTAUQUA)",0,C,,110000328253
14701CRWFR40WIN,-79.22800000000001,42.097,False,36,013,030600,36,36013,36013030600,1400000US36013030600,CRAWFORD FURNITURE MANUFACTURING CORP ATLAS DIV,40 WINSOR ST,JAMESTOWN,NY,147020668,"CRAWFORD FURNITURE MANUFACTURING CORP ATLAS DIV.40 WINSOR ST, JAMESTOWN NEW YORK 14702 (CHAUTAUQUA)",0,C,,
14701MTLTC200HA,-79.233,42.093999999999994,False,36,013,030600,36,36013,36013030600,1400000US36013030600,METALTECH MANUFACTURING CORP,200 HARRISON ST,JAMESTOWN,NY,14701,"METALTECH MANUFACTURING CORP.200 HARRISON ST, JAMESTOWN NEW YORK 14701 (CHAUTAUQUA)",0,C,,
1470WDWSNM825AL,-79.222,42.104,False,36,013,030600,36,36013,36013030600,1400000US36013030600,DAWSON METAL CO INC,825 ALLEN ST,JAMESTOWN,NY,14701,"DAWSON METAL CO INC.825 ALLEN ST, JAMESTOWN NEW YORK 14701 (CHAUTAUQUA)",0,C,,110004338182
14701DHLST443BU,-79.221,42.107,False,36,013,030100,36,36013,36013030100,1400000US36013030100,DAHLSTROM MANUFACTURING CO INC,443 BUFFALO ST,JAMESTOWN,NY,147020640,"DAHLSTROM MANUFACTURING CO INC.443 BUFFALO ST, JAMESTOWN NEW YORK 14702 (CHAUTAUQUA)",0,C,,
14701HPSRC84HOP,-79.214,42.11,False,36,013,030100,36,36013,36013030100,1400000US36013030100,HOPE'S WINDOWS INC,84 HOPKINS AVE,JAMESTOWN,NY,14701,"HOPE'S WINDOWS INC.84 HOPKINS AVE, JAMESTOWN NEW YORK 14701 (CHAUTAUQUA)",0,C,,110000328208
14701JMSTW104BL,-79.215,42.108999999999995,False,36,013,030100,36,36013,36013030100,1400000US36013030100,JAMESTOWN METAL CORP,104 BLACKSTONE AVE,JAMESTOWN,NY,14701,"JAMESTOWN METAL CORP.104 BLACKSTONE AVE, JAMESTOWN NEW YORK 14701 (CHAUTAUQUA)",0,C,,
14701JMSTW178BL,-79.211,42.11,False,36,013,030100,36,36013,36013030100,1400000US36013030100,JAMESTOWN METAL PRODUCTS LLC,178 BLACKSTONE AVE,JAMESTOWN,NY,14701,"JAMESTOWN METAL PRODUCTS LLC.178 BLACKSTONE AVE, JAMESTOWN NEW YORK 14701 (CHAUTAUQUA)",0,C,,110000328217
14701SSXSP125BL,-79.214,42.108999999999995,False,36,013,030100,36,36013,36013030100,1400000US36013030100,LILLY IND INC,125 BLACKSTONE AVE,JAMESTOWN,NY,14701,"LILLY IND INC.125 BLACKSTONE AVE, JAMESTOWN NEW YORK 14701 (CHAUTAUQUA)",1,C,,
14702CRWFR1061A,-79.215,42.107,False,36,013,030100,36,36013,36013030100,1400000US36013030100,CRAWFORD FURNITURE MANUFACTURING CORP JAMESTOWN DIV,1061 ALLEN ST EXT,JAMESTOWN,NY,147020668,"CRAWFORD FURNITURE MANUFACTURING CORP JAMESTOWN DIV.1061 ALLEN ST EXT, JAMESTOWN NEW YORK 14702 (CHAUTAUQUA)",0,C,,
14702NNNTN226CR,-79.22800000000001,42.101000000000006,False,36,013,030100,36,36013,36013030100,1400000US36013030100,UNION-NATL INC,226 CRESCENT ST,JAMESTOWN,NY,147021259,"UNION-NATL INC.226 CRESCENT ST, JAMESTOWN NEW YORK 14702 (CHAUTAUQUA)",0,C,,
14701JMSTW1300E,-79.214,42.113,False,36,013,030100,36,36013,36013030100,1400000US36013030100,JAMESTOWN LAMINATING CO,1300 E 2ND ST,JAMESTOWN,NY,14701,"JAMESTOWN LAMINATING CO.1300 E 2ND ST, JAMESTOWN NEW YORK 14701 (CHAUTAUQUA)",0,C,,
14701CHTQH243HO,-79.209,42.111999999999995,False,36,013,030100,36,36013,36013030100,1400000US36013030100,CHAUTAUQUA HARDWARE CORP,243 HOPKINS AVE,JAMESTOWN,NY,14701,"CHAUTAUQUA HARDWARE CORP.243 HOPKINS AVE, JAMESTOWN NEW YORK 14701 (CHAUTAUQUA)",0,C,,
14701CLSSC68BLA,-79.217,42.108999999999995,False,36,013,030100,36,36013,36013030100,1400000US36013030100,CLASSIC BRASS INC,68 BLACKSTONE AVE,JAMESTOWN,NY,14701,"CLASSIC BRASS INC.68 BLACKSTONE AVE, JAMESTOWN NEW YORK 14701 (CHAUTAUQUA)",0,C,,
14701BLCKS1BLAC,-79.214,42.108999999999995,False,36,013,030100,36,36061,36013030100,1400000US36013030100,BLACKSTONE ADVANCED TECHNOLOGIES LLC,86 BLACKSTONE AVE,JAMESTOWN,NY,14701,"BLACKSTONE ADVANCED TECHNOLOGIES LLC.86 BLACKSTONE AVE, JAMESTOWN NEW YORK 14701 (NEW YORK)",0,C,,110001567055
14701NDRSN17ROS,-79.258,42.099,False,36,013,030400,36,36013,36013030400,1400000US36013030400,ANDERSON PRECISION INC,20 LIVINGSTON AVE,JAMESTOWN,NY,14701,"ANDERSON PRECISION INC.20 LIVINGSTON AVE, JAMESTOWN NEW YORK 14701 (CHAUTAUQUA)",0,C,,110004339001
14715HRTGCREFIN,-78.189,42.048,False,36,003,951200,36,36003,36003951200,1400000US36003951200,HERITAGE CUTLERY,REFINERY ROAD,BOLIVAR,NY,14715,"HERITAGE CUTLERY.REFINERY ROAD, BOLIVAR NEW YORK 14715 (ALLEGANY)",0,C,,
14727CMLCT20WAT,-78.286,42.218,False,36,003,950500,36,36003,36003950500,1400000US36003950500,ACME ELECTRIC CORP,20 WATER ST,CUBA,NY,14727,"ACME ELECTRIC CORP.20 WATER ST, CUBA NEW YORK 14727 (ALLEGANY)",0,C,,
14727MPRCH4520H,-78.275,42.198,False,36,003,950500,36,36003,36003950500,1400000US36003950500,EMPIRE CHEESE,4520 HASKELL RD,CUBA,NY,14727,"EMPIRE CHEESE.4520 HASKELL RD, CUBA NEW YORK 14727 (ALLEGANY)",0,C,,110019170877
14727DMNGL5WOOD,-78.28,42.22,False,36,003,950500,36,36003,36003950500,1400000US36003950500,DEMING ELECTROPLATING CORP,5 WOODRUFF ST,CUBA,NY,14727,"DEMING ELECTROPLATING CORP.5 WOODRUFF ST, CUBA NEW YORK 14727 (ALLEGANY)",0,C,,
14731SGNRN43JEF,-78.671,42.272,False,36,009,960702,36,36009,36009960702,1400000US36009960702,SIGNORE INC,55-57 JEFFERSON ST,ELLICOTTVILLE,NY,147311448,"SIGNORE INC.55-57 JEFFERSON ST, ELLICOTTVILLE NEW YORK 14731 (CATTARAUGUS)",0,C,,110002379863
14733MRCBRMAROC,-79.17,42.126000000000005,False,36,013,037400,36,36013,36013037400,1400000US36013037400,SKF AEROENGINE FALCONER,1 MAROCO RD,FALCONER,NY,14733,"SKF AEROENGINE FALCONER.1 MAROCO RD, FALCONER NEW YORK 14733 (CHAUTAUQUA)",0,C,,110041073520
14740VLLYNRD1HA,-79.157,42.233999999999995,False,36,013,037400,36,36013,36013037400,1400000US36013037400,VALLEY INDUSTRIES,1397 HARRIS HOLLOW RD,GERRY,NY,147409515,"VALLEY INDUSTRIES.1397 HARRIS HOLLOW RD, GERRY NEW YORK 14740 (CHAUTAUQUA)",0,C,,
14747GWYNCCLARK,-79.122,42.13399999999999,False,36,013,037400,36,36013,36013037400,1400000US36013037400,AGWAY INC JAMESTOWN FEED MILL,1029 POLAND CENTER RD,KENNEDY,NY,14747,"AGWAY INC JAMESTOWN FEED MILL.1029 POLAND CENTER RD, KENNEDY NEW YORK 14747 (CHAUTAUQUA)",0,C,,
14737MSLRN69SMA,-78.46,42.33,False,36,009,960800,36,36009,36009960800,1400000US36009960800,MOSLER INC,69 S MAIN ST,FRANKLINVILLE,NY,14737,"MOSLER INC.69 S MAIN ST, FRANKLINVILLE NEW YORK 14737 (CATTARAUGUS)",0,C,,
14127CCNTS3275B,-78.373,42.373,True,36,009,960800,36,36029,36009960800,1400000US36009960800,ACCENT STRIPE INC,3275 BENZING RD,ORCHARD PARK,NY,14127,"ACCENT STRIPE INC 3275 BENZING RD, ORCHARD PARK, NY, 14127",0,C,,
14738FRWSB36RAI,-79.168,42.055,False,36,013,037500,36,36013,36013037500,1400000US36013037500,ETHAN ALLEN INC FREWSBURG DIV,36 RAILROAD AVE,FREWSBURG,NY,147380536,"ETHAN ALLEN INC FREWSBURG DIV.36 RAILROAD AVE, FREWSBURG NEW YORK 14738 (CHAUTAUQUA)",1,C,,
14738SGKYWFALCO,-79.158,42.067,False,36,013,037500,36,36013,36013037500,1400000US36013037500,KEYWELL L.L.C. VAC AIR DIV,300 FALCONER ST,FREWSBURG,NY,14738,"KEYWELL L.L.C. VAC AIR DIV.300 FALCONER ST, FREWSBURG NEW YORK 14738 (CHAUTAUQUA)",0,C,,110000328315
14739FRNDSCOUNT,-78.115,42.214,False,36,003,950600,36,36003,36003950600,1400000US36003950600,SAPUTO DAIRY FOODS USA LLC,6701 COUNTY RD 20,FRIENDSHIP,NY,14739,"SAPUTO DAIRY FOODS USA LLC.6701 COUNTY RD 20, FRIENDSHIP NEW YORK 14739 (ALLEGANY)",0,C,,110019220573
14750FLCNRWINCH,-79.331,42.1,False,36,013,037100,36,36013,36013037100,1400000US36013037100,PREMIER LAKEWOOD INC,201 WINCHESTER RD,LAKEWOOD,NY,14750,"PREMIER LAKEWOOD INC.201 WINCHESTER RD, LAKEWOOD NEW YORK 14750 (CHAUTAUQUA)",0,C,,110000328342
14750MTCTL160CH,-79.32600000000001,42.1,False,36,013,037100,36,36013,36013037100,1400000US36013037100,MATCO TOOLS JAMESTOWN PLANT,160 CHAUTAUQUA AVE,LAKEWOOD,NY,14750,"MATCO TOOLS JAMESTOWN PLANT.160 CHAUTAUQUA AVE, LAKEWOOD NEW YORK 14750 (CHAUTAUQUA)",0,C,,110019445180
14750LRCHP2120F,-79.351,42.092,False,36,013,037100,36,36013,36013037100,1400000US36013037100,ULRICH PLANFILING EQUIPMENT CORP,2120 FOURTH AVE,LAKEWOOD,NY,14750,"ULRICH PLANFILING EQUIPMENT CORP.2120 FOURTH AVE, LAKEWOOD NEW YORK 14750 (CHAUTAUQUA)",0,C,,110000328351
1471WCHTQP1287H,-79.355,42.09,False,36,013,037100,36,36013,36013037100,1400000US36013037100,CHAUTAUQUA PRECISION MACHINING INC,1287 HUNT ROAD,ASHVILLE,NY,14710,"CHAUTAUQUA PRECISION MACHINING INC.1287 HUNT ROAD, ASHVILLE NEW YORK 14710 (CHAUTAUQUA)",0,C,,110004317962
14755BSHND312FA,-78.805,42.248000000000005,False,36,009,960600,36,36009,36009960600,1400000US36009960600,BUSH INDUSTRIES INC,312 FAIR OAK ST,LITTLE VALLEY,NY,14755,"BUSH INDUSTRIES INC.312 FAIR OAK ST, LITTLE VALLEY NEW YORK 14755 (CATTARAUGUS)",0,C,,
14757GRWRS112NP,-79.583,42.327,False,36,013,036500,36,36013,36013036500,1400000US36013036500,GROWERS COOP GRAPE JUICE CO INC,112 NORTH PORTAGE ST,WESTFIELD,NY,14787,"GROWERS COOP GRAPE JUICE CO INC.112 NORTH PORTAGE ST, WESTFIELD NEW YORK 14787 (CHAUTAUQUA)",0,C,,
14787RNLDNBOURN,-79.57600000000001,42.333999999999996,False,36,013,036500,36,36013,36013036500,1400000US36013036500,RENOLD INC,100 BOURNE ST,WESTFIELD,NY,14787,"RENOLD INC.100 BOURNE ST, WESTFIELD NEW YORK 14787 (CHAUTAUQUA)",0,C,,110000582913
14787MGNDV85BOU,-79.579,42.332,False,36,013,036500,36,36013,36013036500,1400000US36013036500,MOGEN DAVID WINE CORP,85 BOURNE ST,WESTFIELD,NY,147879706,"MOGEN DAVID WINE CORP.85 BOURNE ST, WESTFIELD NEW YORK 14787 (CHAUTAUQUA)",0,C,,
14757CHTQM5551S,-79.611,42.236999999999995,False,36,013,036500,36,36013,36013036500,1400000US36013036500,CHAUTAUQUA MFG CO,5551 SHERMAN RD,MAYVILLE,NY,14757,"CHAUTAUQUA MFG CO.5551 SHERMAN RD, MAYVILLE NEW YORK 14757 (CHAUTAUQUA)",1,C,,
1478WWLCHF1NPRT,-79.582,42.326,False,36,013,036500,36,36013,36013036500,1400000US36013036500,WELCH FOODS INC,100 N PORTAGE ST,WESTFIELD,NY,14787,"WELCH FOODS INC.100 N PORTAGE ST, WESTFIELD NEW YORK 14787 (CHAUTAUQUA)",0,C,,110070059046
14757MYVLL8BART,-79.5,42.243,False,36,013,036401,36,36013,36013036401,1400000US36013036401,ETHAN ALLEN INC MAYVILLE DIV,8 BARTON ST,MAYVILLE,NY,147571308,"ETHAN ALLEN INC MAYVILLE DIV.8 BARTON ST, MAYVILLE NEW YORK 14757 (CHAUTAUQUA)",0,C,,
14760CNPNC1405B,-78.446,42.086000000000006,False,36,009,961700,36,36009,36009961700,1400000US36009961700,ELANTAS PDG INC,1405 BUFFALO ST,OLEAN,NY,14760,"ELANTAS PDG INC.1405 BUFFALO ST, OLEAN NEW YORK 14760 (CATTARAUGUS)",0,C,,110000496268
14760DRSSRPOBOX,-78.443,42.089,False,36,009,961700,36,36009,36009961700,1400000US36009961700,DRESSER-RAND,PAUL CLARK DR,OLEAN,NY,14760,"DRESSER-RAND.PAUL CLARK DR, OLEAN NEW YORK 14760 (CATTARAUGUS)",0,C,,110041382642
14760CPRPW1648D,-78.391,42.071999999999996,False,36,009,961000,36,36009,36009961000,1400000US36009961000,COOPER POWER SYSTEMS LLC,1648 DUGAN RD,OLEAN,NY,14760,"COOPER POWER SYSTEMS LLC.1648 DUGAN RD, OLEAN NEW YORK 14760 (CATTARAUGUS)",0,C,,110000328360
14760LNDVN1002S,-78.399,42.076,False,36,009,961000,36,36009,36009961000,1400000US36009961000,OLEAN ADVANCED PRODUCTS,1695 SENECA AVE,OLEAN,NY,14760,"OLEAN ADVANCED PRODUCTS.1695 SENECA AVE, OLEAN NEW YORK 14760 (CATTARAUGUS)",0,C,,110000328404
14760HYSLL211FR,-78.44,42.095,False,36,009,961500,36,36009,36009961500,1400000US36009961500,SOLEPOXY INC,211 FRANKLIN STREET,OLEAN,NY,14760,"SOLEPOXY INC.211 FRANKLIN STREET, OLEAN NEW YORK 14760 (CATTARAUGUS)",0,C,,110000328388
14760NDCKL140MO,-78.455,42.086000000000006,False,36,009,961500,36,36009,36009961500,1400000US36009961500,INDECK-OLEAN ENERGY CENTER,140 MOORE AVE,OLEAN,NY,14760,"INDECK-OLEAN ENERGY CENTER.140 MOORE AVE, OLEAN NEW YORK 14760 (CATTARAUGUS)",0,C,,110001596381
14760LCSCT1116E,-78.407,42.074,False,36,009,961800,36,36009,36009961800,1400000US36009961800,CUTCO CUTLERY CORP,1116 E STATE ST,OLEAN,NY,14760,"CUTCO CUTLERY CORP.1116 E STATE ST, OLEAN NEW YORK 14760 (CATTARAUGUS)",0,C,,110001566902
14760MRCNL103SO,-78.404,42.073,False,36,009,961800,36,36009,36009961800,1400000US36009961800,DAL-TILE CORP,103 S CLARK ST,OLEAN,NY,147600808,"DAL-TILE CORP.103 S CLARK ST, OLEAN NEW YORK 14760 (CATTARAUGUS)",0,C,,110000328413
14779FNCHR100RO,-78.711,42.16,False,36,009,940300,36,36009,36009940300,1400000US36009940300,FANCHER FURNITURE INC,100 ROCHESTER ST,SALAMANCA,NY,14779,"FANCHER FURNITURE INC.100 ROCHESTER ST, SALAMANCA NEW YORK 14779 (CATTARAUGUS)",0,C,,
14779LMNTPRT353,-78.711,42.16,False,36,009,940300,36,36009,36009940300,1400000US36009940300,LUMINITE PRODUCTS CORP,RTE 353,SALAMANCA,NY,14779,"LUMINITE PRODUCTS CORP.RTE 353, SALAMANCA NEW YORK 14779 (CATTARAUGUS)",0,C,,
14779SNCCR175RO,-78.707,42.159,False,36,009,940300,36,36009,36009940300,1400000US36009940300,SENECA CRAFTSMEN LTD,175 ROCHESTER ST,SALAMANCA,NY,14779,"SENECA CRAFTSMEN LTD.175 ROCHESTER ST, SALAMANCA NEW YORK 14779 (CATTARAUGUS)",0,C,,
14782VNSNS616SI,-79.268,42.256,False,36,013,036901,36,36013,36013036901,1400000US36013036901,VANSON SUPERIOR BRASS CORP,616 SINCLAIR DR,SINCLAIRVILLE,NY,14782,"VANSON SUPERIOR BRASS CORP.616 SINCLAIR DR, SINCLAIRVILLE NEW YORK 14782 (CHAUTAUQUA)",0,C,,
14782RNCND600SI,-79.255,42.254,False,36,013,036901,36,36013,36013036901,1400000US36013036901,RANCO INDUSTRIES INC,600 SINCLAIR DR,SINCLAIRVILLE,NY,14782,"RANCO INDUSTRIES INC.600 SINCLAIR DR, SINCLAIRVILLE NEW YORK 14782 (CHAUTAUQUA)",0,C,,
14788KYSTNRTE41,-78.357,42.071999999999996,False,36,009,961200,36,36009,36009961200,1400000US36009961200,KEYSTONE POLYURETHANE PRODUCTS GROUP INC,RTE 417,WESTONS MILLS,NY,14788,"KEYSTONE POLYURETHANE PRODUCTS GROUP INC.RTE 417, WESTONS MILLS NEW YORK 14788 (CATTARAUGUS)",0,C,,
14760GRFFT1650E,-78.396,42.071000000000005,False,36,009,961200,36,36009,36009961200,1400000US36009961200,GRIFFITH ENERGY - OLEAN,1637 E STATE ST,OLEAN,NY,14760,"GRIFFITH ENERGY - OLEAN.1637 E STATE ST, OLEAN NEW YORK 14760 (CATTARAUGUS)",0,C,,110000328379
14810MRCRYBATHI,-77.298,42.361000000000004,False,36,101,961200,36,36101,36101961200,1400000US36101961200,MERCURY AIRCRAFT INC,BATH INDUSTRIAL PARK RT 54,BATH,NY,14810,"MERCURY AIRCRAFT INC.BATH INDUSTRIAL PARK RT 54, BATH NEW YORK 14810 (STEUBEN)",0,C,,
14810PHLPS7265R,-77.304,42.353,False,36,101,961200,36,36101,36101961200,1400000US36101961200,PHILIPS LIGHTING CO,7265 RT-54,BATH,NY,14810,"PHILIPS LIGHTING CO.7265 RT-54, BATH NEW YORK 14810 (STEUBEN)",1,C,,110000328431
14814GWYNC2883H,-76.93,42.14,False,36,015,010300,36,36015,36015010300,1400000US36015010300,AGWAY INC,2883 HAMMOND ST,BIG FLATS,NY,14814,"AGWAY INC.2883 HAMMOND ST, BIG FLATS NEW YORK 14814 (CHEMUNG)",0,C,,
14814CRNNG673CO,-76.921,42.138000000000005,False,36,015,010300,36,36015,36015010300,1400000US36015010300,CORNING INC,271 COUNTY RT 64,BIG FLATS,NY,14814,"CORNING INC.271 COUNTY RT 64, BIG FLATS NEW YORK 14814 (CHEMUNG)",0,C,,110000838229
14814SCHWZ1250S,-76.88,42.165,False,36,015,010300,36,36015,36015010300,1400000US36015010300,SCHWEIZER AIRCRAFT CORP,1250 SCHWEIZER RD,HORSEHEADS,NY,14845,"SCHWEIZER AIRCRAFT CORP.1250 SCHWEIZER RD, HORSEHEADS NEW YORK 14845 (CHEMUNG)",0,C,,
14814GRFFTSTATE,-76.96300000000001,42.128,False,36,015,010300,36,36015,36015010300,1400000US36015010300,GRIFFITH ENERGY - BIG FLATS,3351 STATE RT 352,BIG FLATS,NY,14814,"GRIFFITH ENERGY - BIG FLATS.3351 STATE RT 352, BIG FLATS NEW YORK 14814 (CHEMUNG)",0,C,,110000582922
14814SYNTH35AIR,-76.899,42.163999999999994,False,36,015,010300,36,36015,36015010300,1400000US36015010300,DEPUY SYNTHES,35 AIRPORT RD,BIG FLATS,NY,14814,"DEPUY SYNTHES.35 AIRPORT RD, BIG FLATS NEW YORK 14814 (CHEMUNG)",0,C,,110020994806
14821PLLDR8600M,-77.187,42.228,False,36,101,961700,36,36101,36101961700,1400000US36101961700,UPSTATE FARMS CHEESE LLC,8600 MAIN ST,CAMPBELL,NY,14821,"UPSTATE FARMS CHEESE LLC.8600 MAIN ST, CAMPBELL NEW YORK 14821 (STEUBEN)",0,C,,110000498373
14826PLLDR1SCHU,-77.50399999999999,42.5,False,36,101,960300,36,36101,36101960300,1400000US36101960300,POLLIO DAIRY PRODS CORP,1 SHULTS AVE,COHOCTON,NY,14826,"POLLIO DAIRY PRODS CORP.1 SHULTS AVE, COHOCTON NEW YORK 14826 (STEUBEN)",1,C,,
14831CRNNGCHEST,-77.057,42.144,False,36,101,962600,36,36101,36101962600,1400000US36101962600,CORNING INC  REFRACTORIES PLANT,FRONT ST,CORNING,NY,14831,"CORNING INC  REFRACTORIES PLANT.FRONT ST, CORNING NEW YORK 14831 (STEUBEN)",0,C,,
14831CRNNGFULTO,-77.055,42.143,False,36,101,962600,36,36101,36101962600,1400000US36101962600,STEUBEN GLASS LLC,ONE STEUBEN WAY,CORNING,NY,14830,"STEUBEN GLASS LLC.ONE STEUBEN WAY, CORNING NEW YORK 14830 (STEUBEN)",0,C,,110064108237
14831CRNNGSTEUB,-77.044,42.144,False,36,101,962700,36,36101,36101962700,1400000US36101962700,WORLD KITCHEN LLC PRESSWARE PLANT,ONE STEUBEN ST,CORNING,NY,14830,"WORLD KITCHEN LLC PRESSWARE PLANT.ONE STEUBEN ST, CORNING NEW YORK 14830 (STEUBEN)",0,C,,110000582931
14831CRNNGTIOGA,-77.044,42.143,False,36,101,962700,36,36101,36101962700,1400000US36101962700,CORNING INC FALL BROOK PLANT,TIOGA AVE,CORNING,NY,14831,"CORNING INC FALL BROOK PLANT.TIOGA AVE, CORNING NEW YORK 14831 (STEUBEN)",0,C,,
