TRIFID,LONGITUDE,LATITUDE,ESTIMATE,STATEFP,COUNTYFP,TRACTCE,STATEGEOID,COUNTYGEOID,TRACTGEOID,AFFGEOID,FACILITY_NAME,STREET,CITY,STUSPS,ZIP_CODE,FACILITY,FAC_CLOSED_IND,ASGN_FEDERAL_IND,BIA_CODE,EPA_REGISTRY_ID
14048CPSCREASTL,-79.308,42.495,False,36,013,036000,36,36013,36013036000,1400000US36013036000,CPS CORP,E LAKE RD RTE 5,DUNKIRK,NY,14048,"CPS CORP.E LAKE RD RTE 5, DUNKIRK NEW YORK 14048 (CHAUTAUQUA)",0,C,,
14048DNKRK1ICEC,-79.322,42.474,False,36,013,036000,36,36013,36013036000,1400000US36013036000,FIELDBROOK FOODS CORP,ONE ICE CREAM DR,DUNKIRK,NY,14048,"FIELDBROOK FOODS CORP.ONE ICE CREAM DR, DUNKIRK NEW YORK 14048 (CHAUTAUQUA)",0,C,,110000326442
14048RLSTN3800M,-79.308,42.49,False,36,013,036000,36,36013,36013036000,1400000US36013036000,NESTLE PURINA PETCARE CO,3800 MIDDLE RD,DUNKIRK,NY,14048,"NESTLE PURINA PETCARE CO.3800 MIDDLE RD, DUNKIRK NEW YORK 14048 (CHAUTAUQUA)",0,C,,110000326479
14048CPSMD3257M,-79.27600000000001,42.498999999999995,False,36,013,035300,36,36013,36013035300,1400000US36013035300,INX INTERNATIONAL INK CO.,3257 MIDDLE RD,DUNKIRK,NY,14048,"INX INTERNATIONAL INK CO..3257 MIDDLE RD, DUNKIRK NEW YORK 14048 (CHAUTAUQUA)",0,C,,110009472276
14048FRRNT3213M,-79.271,42.501000000000005,False,36,013,035300,36,36013,36013035300,1400000US36013035300,FERRANT PACKARD TRANSFORMERS INC,3213 MIDDLE RD,DUNKIRK,NY,14048,"FERRANT PACKARD TRANSFORMERS INC.3213 MIDDLE RD, DUNKIRK NEW YORK 14048 (CHAUTAUQUA)",0,C,,
14048GBPND181ST,-79.31,42.493,False,36,013,035500,36,36013,36013035500,1400000US36013035500,"GBP IND, DUNKIRK",181 STEGELSKE AVE,DUNKIRK,NY,14048,"GBP IND, DUNKIRK.181 STEGELSKE AVE, DUNKIRK NEW YORK 14048 (CHAUTAUQUA)",1,C,,
14048LTCHSWILLO,-79.339,42.468999999999994,False,36,013,035600,36,36013,36013035600,1400000US36013035600,EMPIRE SPECIALTY STEEL INC,90 WILLOWBROOK AVE,DUNKIRK,NY,140480152,"EMPIRE SPECIALTY STEEL INC.90 WILLOWBROOK AVE, DUNKIRK NEW YORK 14048 (CHAUTAUQUA)",0,C,,
14048SPCLMWILLO,-79.342,42.468999999999994,False,36,013,035600,36,36013,36013035600,1400000US36013035600,SPECIAL METALS CORP,WILLOWBROOK AVE,DUNKIRK,NY,14048,"SPECIAL METALS CORP.WILLOWBROOK AVE, DUNKIRK NEW YORK 14048 (CHAUTAUQUA)",0,C,,110001142228
14048NGRMH106PO,-79.348,42.492,False,36,013,035600,36,36013,36013035600,1400000US36013035600,DUNKIRK STEAM STATION,106 POINT DR N,DUNKIRK,NY,14048,"DUNKIRK STEAM STATION.106 POINT DR N, DUNKIRK NEW YORK 14048 (CHAUTAUQUA)",0,C,,110000326460
14048DNKRK88HOW,-79.346,42.473,False,36,013,035600,36,36013,36013035600,1400000US36013035600,DUNKIRK SPECIALTY STEEL LLC,830 BRIGHAM RD,DUNKIRK,NY,14048,"DUNKIRK SPECIALTY STEEL LLC.830 BRIGHAM RD, DUNKIRK NEW YORK 14048 (CHAUTAUQUA)",0,C,,110016752272
14052FRSYT129EL,-78.611,42.763999999999996,False,36,029,013900,36,36029,36029013900,1400000US36029013900,FORSYTH INDUSTRIES INC,129 ELM ST,EAST AURORA,NY,140522535,"FORSYTH INDUSTRIES INC.129 ELM ST, EAST AURORA NEW YORK 14052 (ERIE)",0,C,,
14052MGNCXSENEC,-78.64699999999999,42.805,False,36,029,014102,36,36029,36029014102,1400000US36029014102,MOOG INC,SENECA ST,EAST AURORA,NY,14052,"MOOG INC.SENECA ST, EAST AURORA NEW YORK 14052 (ERIE)",0,C,,110008011490
14059MTRLN611JA,-78.638,42.805,False,36,029,014102,36,36029,36029014102,1400000US36029014102,TEMIC AUTOMOTIVE OF NORTH AMERICA INC,611 JAMISON RD,ELMA,NY,14059,"TEMIC AUTOMOTIVE OF NORTH AMERICA INC.611 JAMISON RD, ELMA NEW YORK 14059 (ERIE)",1,C,,110001602025
14052MGCNT300JA,-78.655,42.805,False,36,029,014102,36,36029,36029014102,1400000US36029014102,MOOG INC,300 JAMISON RD,EAST AURORA,NY,14052,"MOOG INC.300 JAMISON RD, EAST AURORA NEW YORK 14052 (ERIE)",0,C,,
14052MRCNP270QU,-78.637,42.763000000000005,False,36,029,013800,36,36029,36029013800,1400000US36029013800,AMERICAN PRECISION INDUSTRIES DELEVAN DIV,270 QUAKER RD,EAST AURORA,NY,14052,"AMERICAN PRECISION INDUSTRIES DELEVAN DIV.270 QUAKER RD, EAST AURORA NEW YORK 14052 (ERIE)",0,C,,110000763629
14059STBNF1150M,-78.62100000000001,42.801,False,36,029,014101,36,36029,36029014101,1400000US36029014101,STEUBEN FOODS INC,1150 MAPLE RD,ELMA,NY,14059,"STEUBEN FOODS INC.1150 MAPLE RD, ELMA NEW YORK 14059 (ERIE)",0,C,,110000564452
14063RDWNG196NE,-79.32600000000001,42.446000000000005,False,36,013,035800,36,36013,36013035800,1400000US36013035800,RED WING CO INC,196 NEWTON ST,FREDONIA,NY,14063,"RED WING CO INC.196 NEWTON ST, FREDONIA NEW YORK 14063 (CHAUTAUQUA)",0,C,,
14070MNCHT265PA,-78.922,42.449,False,36,009,960400,36,36009,36009960400,1400000US36009960400,MOENCH TANNING CO,265 PALMER ST,GOWANDA,NY,14070,"MOENCH TANNING CO.265 PALMER ST, GOWANDA NEW YORK 14070 (CATTARAUGUS)",1,C,,
14075BFGLC33SCO,-78.842,42.72,False,36,029,013400,36,36029,36029013400,1400000US36029013400,BFG ELECTROPLATING & MANUFACTURING CO,33 SCOTT ST,HAMBURG,NY,14075,"BFG ELECTROPLATING & MANUFACTURING CO.33 SCOTT ST, HAMBURG NEW YORK 14075 (ERIE)",1,C,,110009465088
14085HSBRC1975L,-78.937,42.711999999999996,False,36,029,013102,36,36029,36029013102,1400000US36029013102,HASBROUCK PLASTICS INC,1975 LAKEVIEW RD,LAKE VIEW,NY,14085,"HASBROUCK PLASTICS INC.1975 LAKEVIEW RD, LAKE VIEW NEW YORK 14085 (ERIE)",0,C,,
14086SCTTV225ER,-78.658,42.905,False,36,029,014400,36,36029,36029014400,1400000US36029014400,SCOTT AVIATION,225 ERIE ST,LANCASTER,NY,140869502,"SCOTT AVIATION.225 ERIE ST, LANCASTER NEW YORK 14086 (ERIE)",0,C,,
14086SHRLN2000C,-78.66199999999999,42.913000000000004,False,36,029,014400,36,36029,36029014400,1400000US36029014400,SHUR-LINE INC,2000 COMMERCE PKY,LANCASTER,NY,14086,"SHUR-LINE INC.2000 COMMERCE PKY, LANCASTER NEW YORK 14086 (ERIE)",0,C,,
14086HNRYH3765W,-78.664,42.917,False,36,029,014400,36,36029,36029014400,1400000US36029014400,HC BRILL,3765 WALDEN AVE,LANCASTER,NY,14086,"HC BRILL.3765 WALDEN AVE, LANCASTER NEW YORK 14086 (ERIE)",0,C,,110038052237
14094BBPLS230SO,-78.715,43.169,False,36,063,023600,36,36063,36063023600,1400000US36063023600,METAL CLADDING,230 S NIAGARA ST,LOCKPORT,NY,14094,"METAL CLADDING.230 S NIAGARA ST, LOCKPORT NEW YORK 14094 (NIAGARA)",0,C,,110000326512
14094CCDNT500OH,-78.71,43.161,False,36,063,023600,36,36063,36063023600,1400000US36063023600,OCCIDENTAL CHEMICAL CORP,500 OHIO ST,LOCKPORT,NY,14094,"OCCIDENTAL CHEMICAL CORP.500 OHIO ST, LOCKPORT NEW YORK 14094 (NIAGARA)",0,C,,
14094DMTRG10STE,-78.702,43.165,False,36,063,023600,36,36063,36063023600,1400000US36063023600,DOMTAR GYPSUM INC,10 STEVENS ST,LOCKPORT,NY,14094,"DOMTAR GYPSUM INC.10 STEVENS ST, LOCKPORT NEW YORK 14094 (NIAGARA)",0,C,,
14094LLGHN695OH,-78.712,43.157,False,36,063,023600,36,36063,36063023600,1400000US36063023600,ATI SPECIALTY MATERIALS-LOCKPORT PLANT,695 OHIO ST,LOCKPORT,NY,14094,"ATI SPECIALTY MATERIALS-LOCKPORT PLANT.695 OHIO ST, LOCKPORT NEW YORK 14094 (NIAGARA)",0,C,,110000326549
14094CNDLL24MIC,-78.712,43.168,False,36,063,023600,36,36063,36063023600,1400000US36063023600,CANDLELIGHT CABINETRY INC,24 MICHIGAN ST,LOCKPORT,NY,14094,"CANDLELIGHT CABINETRY INC.24 MICHIGAN ST, LOCKPORT NEW YORK 14094 (NIAGARA)",0,C,,110024422604
14094LFRGN5RICH,-78.71600000000001,43.165,False,36,063,023600,36,36063,36063023600,1400000US36063023600,LAFARGE RICHFIELD RMX,500 RICHFIELD ST,LOCKPORT,NY,14094,"LAFARGE RICHFIELD RMX.500 RICHFIELD ST, LOCKPORT NEW YORK 14094 (NIAGARA)",0,C,,110022522466
14094GNRLM200UP,-78.741,43.166000000000004,False,36,063,023401,36,36063,36063023401,1400000US36063023401,GM COMPONENTS HOLDINGS LLC,200 UPPER MOUNTAIN RD MANUFACTURING PLANT,LOCKPORT,NY,14094,"GM COMPONENTS HOLDINGS LLC.200 UPPER MOUNTAIN RD MANUFACTURING PLANT, LOCKPORT NEW YORK 14094 (NIAGARA)",0,C,,110000326521
1409WPLYNC4921I,-78.74600000000001,43.167,False,36,063,023401,36,36063,36063023401,1400000US36063023401,POLYONE CORP,4921 I D A PARK DR,LOCKPORT,NY,14094,"POLYONE CORP.4921 I D A PARK DR, LOCKPORT NEW YORK 14094 (NIAGARA)",0,C,,110070247069
14094MLWRD500MI,-78.69800000000001,43.185,False,36,063,023500,36,36063,36063023500,1400000US36063023500,MILWARD ALLOYS INC,500 MILL ST,LOCKPORT,NY,14094,"MILWARD ALLOYS INC.500 MILL ST, LOCKPORT NEW YORK 14094 (NIAGARA)",0,C,,110000326558
14094TWNLK520MI,-78.7,43.184,False,36,063,023500,36,36063,36063023500,1400000US36063023500,TWIN LAKE CHEMICAL INC,520 MILL ST,LOCKPORT,NY,14094,"TWIN LAKE CHEMICAL INC.520 MILL ST, LOCKPORT NEW YORK 14094 (NIAGARA)",0,C,,110000326576
14094VNDMR1NORT,-78.69800000000001,43.184,False,36,063,023500,36,36063,36063023500,1400000US36063023500,VANDEMARK CHEMICAL INC,1 N TRANSIT RD,LOCKPORT,NY,14094,"VANDEMARK CHEMICAL INC.1 N TRANSIT RD, LOCKPORT NEW YORK 14094 (NIAGARA)",0,C,,110000326594
14094VNCHL555WE,-78.70100000000001,43.184,False,36,063,023500,36,36063,36063023500,1400000US36063023500,VANCHLOR CO INC,555 W JACKSON ST,LOCKPORT,NY,14094,"VANCHLOR CO INC.555 W JACKSON ST, LOCKPORT NEW YORK 14094 (NIAGARA)",0,C,,110011542054
14094CNDLL24CEN,-78.69,43.183,False,36,063,023500,36,36063,36063023500,1400000US36063023500,CANDLELIGHT CABINETRY,24 CENTER ST,LOCKPORT,NY,14094,"CANDLELIGHT CABINETRY.24 CENTER ST, LOCKPORT NEW YORK 14094 (NIAGARA)",0,C,,
14094JMSTW85GRA,-78.694,43.174,False,36,063,023500,36,36063,36063023500,1400000US36063023500,JAMESTOWN CONTAINER COMPANIES,85 GRAND ST,LOCKPORT,NY,14094,"JAMESTOWN CONTAINER COMPANIES.85 GRAND ST, LOCKPORT NEW YORK 14094 (NIAGARA)",0,C,,110020515441
14094SHRWD120CH,-78.695,43.173,False,36,063,023700,36,36063,36063023700,1400000US36063023700,SHERWOOD LOCKPORT NY,120 CHURCH ST,LOCKPORT,NY,14094,"SHERWOOD LOCKPORT NY.120 CHURCH ST, LOCKPORT NEW YORK 14094 (NIAGARA)",0,C,,110000326567
14103BRNZMONEBE,-78.374,43.218999999999994,False,36,073,040400,36,36073,36073040400,1400000US36073040400,WORTHINGTON CYLINDERS,1 BERNZOMATIC DR,MEDINA,NY,14103,"WORTHINGTON CYLINDERS.1 BERNZOMATIC DR, MEDINA NEW YORK 14103 (ORLEANS)",1,C,,110002094527
14103FSHRP711PA,-78.4,43.218999999999994,False,36,073,040400,36,36073,36073040400,1400000US36073040400,FISHER-PRICE INC,711 PARK AVE,MEDINA,NY,14103,"FISHER-PRICE INC.711 PARK AVE, MEDINA NEW YORK 14103 (ORLEANS)",0,C,,
14103BRNNR3959B,-78.37100000000001,43.22,False,36,073,040400,36,36073,36073040400,1400000US36073040400,BRUNNER INTERNATIONAL INC,3959 BATES RD,MEDINA,NY,141030111,"BRUNNER INTERNATIONAL INC.3959 BATES RD, MEDINA NEW YORK 14103 (ORLEANS)",0,C,,110000809484
14105FMCCR100NI,-78.469,43.207,False,36,063,024002,36,36063,36063024002,1400000US36063024002,FMC CORP  MIDDLEPORT PLANT,100 NIAGARA ST,MIDDLEPORT,NY,14105,"FMC CORP  MIDDLEPORT PLANT.100 NIAGARA ST, MIDDLEPORT NEW YORK 14105 (NIAGARA)",0,C,,110000326601
14105FRFLD100NI,-78.475,43.207,False,36,063,024002,36,36063,36063024002,1400000US36063024002,FAIRFIELD AMERICAN CORP,100 NIAGARA ST,MIDDLEPORT,NY,14105,"FAIRFIELD AMERICAN CORP.100 NIAGARA ST, MIDDLEPORT NEW YORK 14105 (NIAGARA)",0,C,,
14111SCHFF10285,-78.935,42.601000000000006,False,36,029,015700,36,36029,36029015700,1400000US36029015700,SCHAFFSTALL MFG CO INC,10285 SCHAFFSTALL DR,NORTH COLLINS,NY,14111,"SCHAFFSTALL MFG CO INC.10285 SCHAFFSTALL DR, NORTH COLLINS NEW YORK 14111 (ERIE)",0,C,,
14111CRSCN1285E,-78.936,42.601000000000006,False,36,029,015700,36,36029,36029015700,1400000US36029015700,CRESCENT MARKETING (DBA CRESCENT MANUFACTURING),10285 EAGLE DR,NORTH COLLINS,NY,14111,"CRESCENT MARKETING (DBA CRESCENT MANUFACTURING).10285 EAGLE DR, NORTH COLLINS NEW YORK 14111 (ERIE)",0,C,,110020515450
14120BFFLP874OL,-78.884,43.04600000000001,False,36,063,022901,36,36063,36063022901,1400000US36063022901,BUFFALO PUMPS DIV OF AIR & LIQUID SYSTEMS CORP,874 OLIVER ST,NORTH TONAWANDA,NY,14120,"BUFFALO PUMPS DIV OF AIR & LIQUID SYSTEMS CORP.874 OLIVER ST, NORTH TONAWANDA NEW YORK 14120 (NIAGARA)",0,C,,110000326629
14120JNSNF76IND,-78.887,43.047,False,36,063,022901,36,36063,36063022901,1400000US36063022901,SWAGELOK BIOPHARM SERVICES CO,76 INDUSTRIAL DR,NORTH TONAWANDA,NY,14120,"SWAGELOK BIOPHARM SERVICES CO.76 INDUSTRIAL DR, NORTH TONAWANDA NEW YORK 14120 (NIAGARA)",0,C,,110000326638
14120RVRSD871RI,-78.889,43.045,False,36,063,022901,36,36063,36063022901,1400000US36063022901,RIVERSIDE CHEMICAL CO INC,871 RIVER RD,NORTH TONAWANDA,NY,14120,"RIVERSIDE CHEMICAL CO INC.871 RIVER RD, NORTH TONAWANDA NEW YORK 14120 (NIAGARA)",0,C,,110000326656
14120GLDND765RI,-78.888,43.041000000000004,False,36,063,022901,36,36063,36063022901,1400000US36063022901,AGLADE INDUSTRIES LLC,765 RIVER RD,NORTH TONAWANDA,NY,14120,"AGLADE INDUSTRIES LLC.765 RIVER RD, NORTH TONAWANDA NEW YORK 14120 (NIAGARA)",0,C,,110020491644
1412WTYLRD1BUFB,-78.884,43.041000000000004,False,36,063,022901,36,36063,36063022901,1400000US36063022901,TAYLOR DEVICES INC,1 BUFFALO BOLT WAY,NORTH TONAWANDA,NY,14120,"TAYLOR DEVICES INC.1 BUFFALO BOLT WAY, NORTH TONAWANDA NEW YORK 14120 (NIAGARA)",0,C,,110056420387
14120BTTNF1174E,-78.848,43.051,False,36,063,022804,36,36063,36063022804,1400000US36063022804,BATTENFELD GREASE & OIL CORPN Y,1174 ERIE AVE,NORTH TONAWANDA,NY,14120,"BATTENFELD GREASE & OIL CORPN Y.1174 ERIE AVE, NORTH TONAWANDA NEW YORK 14120 (NIAGARA)",0,C,,110000763727
14120CCDNTWALCK,-78.859,43.048,False,36,063,022803,36,36063,36063022803,1400000US36063022803,OCCIDENTAL CHEMICAL CORP DUREZ,673 WALCK RD,NORTH TONAWANDA,NY,141200535,"OCCIDENTAL CHEMICAL CORP DUREZ.673 WALCK RD, NORTH TONAWANDA NEW YORK 14120 (NIAGARA)",0,C,,
14120MTLCL345PA,-78.87100000000001,43.033,False,36,063,023100,36,36063,36063023100,1400000US36063023100,METAL CLADDING INC,345 PAYNE AVE,NORTH TONAWANDA,NY,141200630,"METAL CLADDING INC.345 PAYNE AVE, NORTH TONAWANDA NEW YORK 14120 (NIAGARA)",0,C,,
14120MTLCL470NI,-78.868,43.037,False,36,063,023100,36,36063,36063023100,1400000US36063023100,METAL CLADDING INC,470 NIAGARA PKY,NORTH TONAWANDA,NY,141200630,"METAL CLADDING INC.470 NIAGARA PKY, NORTH TONAWANDA NEW YORK 14120 (NIAGARA)",0,C,,
14120VLKRN369RI,-78.881,43.031000000000006,False,36,063,023100,36,36063,36063023100,1400000US36063023100,"VAL-KRO, INC. / TONAWANDA VALVE INC.",369 RIVER RD,NORTH TONAWANDA,NY,14120,"VAL-KRO, INC. / TONAWANDA VALVE INC..369 RIVER RD, NORTH TONAWANDA NEW YORK 14120 (NIAGARA)",0,C,,110001615011
14120NCRND100ME,-78.839,43.06,False,36,063,022711,36,36063,36063022711,1400000US36063022711,AN-COR INDUSTRIAL PLASTICS,900 NIAGARA FALLS BLVD.,NORTH TONAWANDA,NY,14120,"AN-COR INDUSTRIAL PLASTICS.900 NIAGARA FALLS BLVD., NORTH TONAWANDA NEW YORK 14120 (NIAGARA)",0,C,,110064186296
14304BLLRS2221N,-78.931,43.101000000000006,False,36,063,022711,36,36063,36063022711,1400000US36063022711,BELL AEROSPACE TEXTRON INC,2221 NIAGARA FALLS BLVD,NIAGARA FALLS,NY,14304,"BELL AEROSPACE TEXTRON INC.2221 NIAGARA FALLS BLVD, NIAGARA FALLS NEW YORK 14304 (NIAGARA)",0,C,,
14304NRTNW6600W,-78.92699999999999,43.104,False,36,063,022711,36,36063,36063022711,1400000US36063022711,SAINT GOBAIN INDUSTRIAL CERAMIC INC,6600 WALMORE RD,NIAGARA FALLS,NY,14304,"SAINT GOBAIN INDUSTRIAL CERAMIC INC.6600 WALMORE RD, NIAGARA FALLS NEW YORK 14304 (NIAGARA)",0,C,,110000327423
14132CRBRN2050C,-78.939,43.13,False,36,063,022711,36,36063,36063022711,1400000US36063022711,SAINT-GOBAIN ADVANCED CERAMICS/MICROELECTRONICS,2050 CORY DR,SANBORN,NY,14132,"SAINT-GOBAIN ADVANCED CERAMICS/MICROELECTRONICS.2050 CORY DR, SANBORN NEW YORK 14132 (NIAGARA)",0,C,,
14132KNTXN6125L,-78.844,43.126999999999995,False,36,063,022711,36,36063,36063022711,1400000US36063022711,KINTEX INC,6125 LENDELL DR,SANBORN,NY,14132,"KINTEX INC.6125 LENDELL DR, SANBORN NEW YORK 14132 (NIAGARA)",0,C,,
14132CRBRN2054C,-78.94,43.13,False,36,063,022711,36,36063,36063022711,1400000US36063022711,CARBORUNDUM COMPANY FIBERMAX,2054 CORY RD,SANBORN,NY,141329338,"CARBORUNDUM COMPANY FIBERMAX.2054 CORY RD, SANBORN NEW YORK 14132 (NIAGARA)",0,C,,
14304WLLMS2080L,-78.938,43.122,False,36,063,022711,36,36063,36063022711,1400000US36063022711,WILLIAMS SPECIALTY ALLOYS,2080 LOCKPORT RD,WHEATFIELD,NY,14304,"WILLIAMS SPECIALTY ALLOYS.2080 LOCKPORT RD, WHEATFIELD NEW YORK 14304 (NIAGARA)",0,C,,
14304RJTXX6686W,-78.92699999999999,43.1,False,36,063,022711,36,36063,36063022711,1400000US36063022711,MOOG-ISP  (MOOG INC),6686 WALMORE RD,NIAGARA FALLS,NY,14304,"MOOG-ISP  (MOOG INC).6686 WALMORE RD, NIAGARA FALLS NEW YORK 14304 (NIAGARA)",0,C,,
1413WSNBRN2186C,-78.932,43.13,False,36,063,022711,36,36063,36063022711,1400000US36063022711,SANBORN PLANT,2186 CORY DRIVE,SANBORN,NY,14132,"SANBORN PLANT.2186 CORY DRIVE, SANBORN NEW YORK 14132 (NIAGARA)",0,C,,110006823642
1413WMTLLC24CRY,-78.94,43.131,False,36,063,022711,36,36063,36063022711,1400000US36063022711,METAULLICS SYSTEMS A DIV OF PYROTEK-INC,2040 CORY DR,SANBORN,NY,14132,"METAULLICS SYSTEMS A DIV OF PYROTEK-INC.2040 CORY DR, SANBORN NEW YORK 14132 (NIAGARA)",0,C,,110000917330
1413WNTDBC6351I,-78.917,43.121,False,36,063,022711,36,36063,36063022711,1400000US36063022711,"VWR CHEMICALS, LLC",6351 INDUCON DR E,SANBORN,NY,14132,"VWR CHEMICALS, LLC.6351 INDUCON DR E, SANBORN NEW YORK 14132 (NIAGARA)",0,C,,110018886981
1430WSDDSF272KI,-78.939,43.115,False,36,063,022711,36,36063,36063022711,1400000US36063022711,"U.S. DOD, USAF, NIAGARA FALLS ARS",2720 KIRKBRIDGE DRIVE,NIAGARA FALLS,NY,143045001,"U.S. DOD, USAF, NIAGARA FALLS ARS.2720 KIRKBRIDGE DRIVE, NIAGARA FALLS NEW YORK 14304 (NIAGARA)",0,F,,110060258670
1413WVWRCH6357I,-78.917,43.121,False,36,063,022711,36,36063,36063022711,1400000US36063022711,VWR CHEMICALS LLC,6357 INDUCON DR E,SANBORN,NY,14132,"VWR CHEMICALS LLC.6357 INDUCON DR E, SANBORN NEW YORK 14132 (NIAGARA)",0,C,,110070081628
1413WBRDGS635IN,-78.917,43.121,False,36,063,022711,36,36063,36063022711,1400000US36063022711,BRIDGESTONE APM,6350 INDUCON DR E,SANBORN,NY,14132,"BRIDGESTONE APM.6350 INDUCON DR E, SANBORN NEW YORK 14132 (NIAGARA)",0,C,,110069705634
14125CMSTC40STE,-78.275,43.063,False,36,037,950200,36,36037,36037950200,1400000US36037950200,BONDUELLE USA INC,40 STEVENS ST,OAKFIELD,NY,14125,"BONDUELLE USA INC.40 STEVENS ST, OAKFIELD NEW YORK 14125 (GENESEE)",0,C,,110000541389
14125NTDST2844J,-78.294,43.074,False,36,037,950200,36,36037,36037950200,1400000US36037950200,UNITED STATES GYPSUM CO,2844 JUDGE RD,OAKFIELD,NY,14125,"UNITED STATES GYPSUM CO.2844 JUDGE RD, OAKFIELD NEW YORK 14125 (GENESEE)",0,C,,
1412WSGYPS275MA,-78.297,43.066,False,36,037,950200,36,36037,36037950200,1400000US36037950200,U S GYPSUM CO OAKFIELD PLANT,2750 MAPLE AVE,OAKFIELD,NY,14125,"U S GYPSUM CO OAKFIELD PLANT.2750 MAPLE AVE, OAKFIELD NEW YORK 14125 (GENESEE)",0,C,,110019252262
14138CRNTNFIRST,-79.054,42.357,False,36,009,960500,36,36009,36009960500,1400000US36009960500,NESTLE FOOD CO,1ST AVE,SOUTH DAYTON,NY,14138,"NESTLE FOOD CO.1ST AVE, SOUTH DAYTON NEW YORK 14138 (CATTARAUGUS)",0,C,,
14719TDCNCRTE35,-78.957,42.373000000000005,False,36,009,960500,36,36009,36009960500,1400000US36009960500,TODCO INC,RTE 353,CATTARAUGUS,NY,14719,"TODCO INC.RTE 353, CATTARAUGUS NEW YORK 14719 (CATTARAUGUS)",0,C,,
14141PRLSS172EA,-78.672,42.513999999999996,False,36,029,015900,36,36029,36029015900,1400000US36029015900,PEERLESS-WINSMITH INC,172 EATON ST,SPRINGVILLE,NY,14141,"PEERLESS-WINSMITH INC.172 EATON ST, SPRINGVILLE NEW YORK 14141 (ERIE)",0,C,,110000326665
14141RBNSN243WE,-78.67699999999999,42.50899999999999,False,36,029,015900,36,36029,36029015900,1400000US36029015900,ROBINSON/FIDDLER'S GREEN MANUFACTURING CO INC,243 W MAIN ST,SPRINGVILLE,NY,14141,"ROBINSON/FIDDLER'S GREEN MANUFACTURING CO INC.243 W MAIN ST, SPRINGVILLE NEW YORK 14141 (ERIE)",0,C,,
14150CCCLB200MI,-78.889,42.993,False,36,029,008300,36,36029,36029008300,1400000US36029008300,COCA-COLA BOTTLING CO OF BUFFALO INC,200 MILENS RD,TONAWANDA,NY,14150,"COCA-COLA BOTTLING CO OF BUFFALO INC.200 MILENS RD, TONAWANDA NEW YORK 14150 (ERIE)",0,C,,
14240PNNWL1740M,-78.885,42.983999999999995,False,36,029,008300,36,36029,36029008300,1400000US36029008300,ELF ATOCHEM NA INC ORGANIC PEROXIDES DIV PLANT,1740 MILITARY RD,BUFFALO,NY,14240,"ELF ATOCHEM NA INC ORGANIC PEROXIDES DIV PLANT.1740 MILITARY RD, BUFFALO NEW YORK 14240 (ERIE)",0,C,,
14150BSNTC2250M,-78.883,42.998000000000005,False,36,029,008300,36,36029,36029008300,1400000US36029008300,BISONTE CO INC,2250 MILITARY RD,TONAWANDA,NY,14150,"BISONTE CO INC.2250 MILITARY RD, TONAWANDA NEW YORK 14150 (ERIE)",0,C,,
14150SHLND3701R,-78.917,42.998000000000005,False,36,029,008300,36,36029,36029008300,1400000US36029008300,ASHLAND DISTRIBUTION,3701 RIVER RD,TONAWANDA,NY,14150,"ASHLAND DISTRIBUTION.3701 RIVER RD, TONAWANDA NEW YORK 14150 (ERIE)",0,C,,110000326763
1415WNFRXL36FIR,-78.913,42.99,False,36,029,008300,36,36029,36029008300,1400000US36029008300,UNIFRAX I LLC,360 FIRE TOWER DR,TONAWANDA,NY,14150,"UNIFRAX I LLC.360 FIRE TOWER DR, TONAWANDA NEW YORK 14150 (ERIE)",0,C,,110001599850
14150CLRFR340WA,-78.86,43.02,False,36,029,017200,36,36029,36029017200,1400000US36029017200,COLORFORMS INC,340 WALES AVE,TONAWANDA,NY,14150,"COLORFORMS INC.340 WALES AVE, TONAWANDA NEW YORK 14150 (ERIE)",0,C,,
14151XLNSK1000E,-78.855,43.02,False,36,029,017200,36,36029,36029017200,1400000US36029017200,EXOLON-ESK CO,1000 EAST NIAGARA ST,TONAWANDA,NY,14150,"EXOLON-ESK CO.1000 EAST NIAGARA ST, TONAWANDA NEW YORK 14150 (ERIE)",0,C,,
14151MRCNL99WAL,-78.859,43.013000000000005,False,36,029,017200,36,36029,36029017200,1400000US36029017200,AMERICAN ALLSAFE CO INC,99 WALES AVE,TONAWANDA,NY,141515104,"AMERICAN ALLSAFE CO INC.99 WALES AVE, TONAWANDA NEW YORK 14151 (ERIE)",0,C,,
14150PVNRT395FI,-78.861,43.015,False,36,029,017200,36,36029,36029017200,1400000US36029017200,APV NORTH AMERICA INC,395 FILLMORE AVE,TONAWANDA,NY,14150,"APV NORTH AMERICA INC.395 FILLMORE AVE, TONAWANDA NEW YORK 14150 (ERIE)",1,C,,
14150SGRKK570FI,-78.854,43.015,False,36,029,017200,36,36029,36029017200,1400000US36029017200,SUGAR KAKE COOKIE INC,570 FILLMORE AVE,TONAWANDA,NY,14150,"SUGAR KAKE COOKIE INC.570 FILLMORE AVE, TONAWANDA NEW YORK 14150 (ERIE)",0,C,,110057772245
14150PVSRV395FI,-78.861,43.017,True,36,029,017200,36,36029,36029017200,1400000US36029017200,APV SERVICE CENTER,395 FILLMORE AVE,TONAWANDA,NY,14150,"APV SERVICE CENTER 395 FILLMORE AVE, TONAWANDA, NY, 14150",1,C,,
14150CRBRN168CR,-78.815,43.032,False,36,029,009107,36,36029,36029009107,1400000US36029009107,SAINT GOBAIN CORP CERAMIC MATERIALS,168 CREEKSIDE DR,AMHERST,NY,14228,"SAINT GOBAIN CORP CERAMIC MATERIALS.168 CREEKSIDE DR, AMHERST NEW YORK 14228 (ERIE)",0,C,,110000326692
14150LCLDM185JO,-78.807,43.03,False,36,029,009107,36,36029,36029009107,1400000US36029009107,LACLEDE MFG CO,185 JOHN GLENN DR,BUFFALO,NY,142280009,"LACLEDE MFG CO.185 JOHN GLENN DR, BUFFALO NEW YORK 14228 (ERIE)",0,C,,
14228NTRNT310CO,-78.809,43.027,False,36,029,009107,36,36029,36029009107,1400000US36029009107,IIMAK,310 COMMERCE DR,AMHERST,NY,14228,"IIMAK.310 COMMERCE DR, AMHERST NEW YORK 14228 (ERIE)",0,C,,110010307854
14150FMCCR37SAW,-78.926,42.973,False,36,029,008400,36,36029,36029008400,1400000US36029008400,PEROXYCHEM LLC,35 SAWYER AVE,TONAWANDA,NY,14150,"PEROXYCHEM LLC.35 SAWYER AVE, TONAWANDA NEW YORK 14150 (ERIE)",0,C,,110000326718
14150GNRLM305SA,-78.918,42.976000000000006,False,36,029,008400,36,36029,36029008400,1400000US36029008400,3M CO - TONAWANDA,305 SAWYER AVE,TONAWANDA,NY,14150,"3M CO - TONAWANDA.305 SAWYER AVE, TONAWANDA NEW YORK 14150 (ERIE)",0,C,,110000326727
14150NWYRK3937R,-78.935,42.982,False,36,029,008400,36,36029,36029008400,1400000US36029008400,IVACO STEEL PROCESSING (NEW YORK) LLC,3937 RIVER RD,TONAWANDA,NY,14150,"IVACO STEEL PROCESSING (NEW YORK) LLC.3937 RIVER RD, TONAWANDA NEW YORK 14150 (ERIE)",0,C,,
14150PLYMR3445R,-78.92699999999999,42.97,False,36,029,008400,36,36029,36029008400,1400000US36029008400,POLYMER APPLICATIONS INC,3445 RIVER RD,TONAWANDA,NY,14150,"POLYMER APPLICATIONS INC.3445 RIVER RD, TONAWANDA NEW YORK 14150 (ERIE)",0,C,,
14150RPDMS225EA,-78.89399999999999,42.98,False,36,029,008400,36,36029,36029008400,1400000US36029008400,SFC ADAMS INC.,225 E PARK DR,TONAWANDA,NY,141507813,"SFC ADAMS INC..225 E PARK DR, TONAWANDA NEW YORK 14150 (ERIE)",0,C,,110004338672
14150SCHWB349SA,-78.918,42.977,False,36,029,008400,36,36029,36029008400,1400000US36029008400,SCHWABEL FABRICATING CO INC,349 SAWYER AVE,TONAWANDA,NY,14150,"SCHWABEL FABRICATING CO INC.349 SAWYER AVE, TONAWANDA NEW YORK 14150 (ERIE)",0,C,,
14150TNWND3875R,-78.92699999999999,42.983999999999995,False,36,029,008400,36,36029,36029008400,1400000US36029008400,TONAWANDA COKE CORP,3875 RIVER RD,TONAWANDA,NY,14150,"TONAWANDA COKE CORP.3875 RIVER RD, TONAWANDA NEW YORK 14150 (ERIE)",0,C,,110000326772
14151LNDDV175EA,-78.89,42.975,False,36,029,008400,36,36029,36029008400,1400000US36029008400,PRAXAIR INC,175 E PARK DR,TONAWANDA,NY,141510044,"PRAXAIR INC.175 E PARK DR, TONAWANDA NEW YORK 14151 (ERIE)",0,C,,
14151PXXXX175EA,-78.896,42.98,False,36,029,008400,36,36029,36029008400,1400000US36029008400,UOP LLC,175 E PARK DR,TONAWANDA,NY,14150,"UOP LLC.175 E PARK DR, TONAWANDA NEW YORK 14150 (ERIE)",0,C,,110000326781
14207DPNTYSHERI,-78.919,42.961999999999996,False,36,029,008400,36,36029,36029008400,1400000US36029008400,DUPONT YERKES PLANT,3115 RIVER RD,BUFFALO,NY,14207,"DUPONT YERKES PLANT.3115 RIVER RD, BUFFALO NEW YORK 14207 (ERIE)",0,C,,110007997953
14240CHVRLRIVER,-78.916,42.958999999999996,False,36,029,008400,36,36029,36029008400,1400000US36029008400,GM POWERTRAIN TONAWANDA,2995 RIVER RD,BUFFALO,NY,14207,"GM POWERTRAIN TONAWANDA.2995 RIVER RD, BUFFALO NEW YORK 14207 (ERIE)",0,C,,110000327307
14240DNLPT10SHE,-78.921,42.967,False,36,029,008400,36,36029,36029008400,1400000US36029008400,SUMITOMO RUBBER USA LLC,10 SHERIDAN DRIVE,TONAWANDA,NY,14150,"SUMITOMO RUBBER USA LLC.10 SHERIDAN DRIVE, TONAWANDA NEW YORK 14150 (ERIE)",0,C,,110000327316
14240GNRLM2390K,-78.904,42.97,False,36,029,008400,36,36029,36029008400,1400000US36029008400,AAM TONAWANDA FORGE,2390 KENMORE AVE,TONAWANDA,NY,14150,"AAM TONAWANDA FORGE.2390 KENMORE AVE, TONAWANDA NEW YORK 14150 (ERIE)",0,C,,110000327334
14150CHMCN3709R,-78.932,42.975,False,36,029,008400,36,36029,36029008400,1400000US36029008400,UNIVAR USA INC - TONAWANDA NY,3709 RIVER RD,TONAWANDA,NY,14150,"UNIVAR USA INC - TONAWANDA NY.3709 RIVER RD, TONAWANDA NEW YORK 14150 (ERIE)",0,C,,110000326683
