TRIFID,LONGITUDE,LATITUDE,ESTIMATE,STATEFP,COUNTYFP,TRACTCE,STATEGEOID,COUNTYGEOID,TRACTGEOID,AFFGEOID,FACILITY_NAME,STREET,CITY,STUSPS,ZIP_CODE,FACILITY,FAC_CLOSED_IND,ASGN_FEDERAL_IND,BIA_CODE,EPA_REGISTRY_ID
02903SGNNW40POI,-71.405,41.817,False,44,007,000600,44,44007,44007000600,1400000US44007000600,MANCHESTER STREET LLC,40 POINT ST,PROVIDENCE,RI,2903,"MANCHESTER STREET LLC.40 POINT ST, PROVIDENCE RHODE ISLAND 02903 (PROVIDENCE)",0,C,,110000312796
02905MTVNT520AL,-71.4,41.799,False,44,007,000600,44,44007,44007000600,1400000US44007000600,SHELL PROVIDENCE TERMINAL,520 ALLENS AVE,PROVIDENCE,RI,2905,"SHELL PROVIDENCE TERMINAL.520 ALLENS AVE, PROVIDENCE RHODE ISLAND 02905 (PROVIDENCE)",0,C,,110000312894
02905HRFFJ226PU,-71.408,41.806999999999995,False,44,007,000600,44,44007,44007000600,1400000US44007000600,HERFF JONES INC,226 PUBLIC ST,PROVIDENCE,RI,2905,"HERFF JONES INC.226 PUBLIC ST, PROVIDENCE RHODE ISLAND 02905 (PROVIDENCE)",0,C,,110002087508
02903SPRGP144AL,-71.405,41.81,False,44,007,000600,44,44007,44007000600,1400000US44007000600,SPRAGUE PROVIDENCE,144 ALLENS AVE,PROVIDENCE,RI,2903,"SPRAGUE PROVIDENCE.144 ALLENS AVE, PROVIDENCE RHODE ISLAND 02903 (PROVIDENCE)",0,C,,110001663174
02905MNTRC185SH,-71.407,41.807,True,44,007,000600,44,44007,44007000600,1400000US44007000600,MINIATURE CASTING CORP,185 SHERBURNE ST,PROVIDENCE,RI,29054898,"MINIATURE CASTING CORP 185 SHERBURNE ST, PROVIDENCE, RI, 29054898",1,C,,
02903RLMNF274PI,-71.414,41.818000000000005,False,44,007,000800,44,44007,44007000800,1400000US44007000800,ROLO MANUFACTURING CO INC,274 PINE ST,PROVIDENCE,RI,2903,"ROLO MANUFACTURING CO INC.274 PINE ST, PROVIDENCE RHODE ISLAND 02903 (PROVIDENCE)",0,C,,
02903MLNNC86CRA,-71.412,41.82,True,44,007,000800,44,44007,44007000800,1400000US44007000800,MALINA INC,86 CRARY ST,PROVIDENCE,RI,29034983,"MALINA INC 86 CRARY ST, PROVIDENCE, RI, 29034983",1,C,,
02903XCLLM200CH,-71.41199999999999,41.849,False,44,007,002900,44,44007,44007002900,1400000US44007002900,EXCELL MANUFACTURING CO,70 ROYAL LITTLE  DR,PROVIDENCE,RI,2904,"EXCELL MANUFACTURING CO.70 ROYAL LITTLE  DR, PROVIDENCE RHODE ISLAND 02904 (PROVIDENCE)",0,C,,
02904BBGRN333WE,-71.413,41.846000000000004,False,44,007,002900,44,44007,44007002900,1400000US44007002900,B B GREENBERG CO,333 W RIVER ST,PROVIDENCE,RI,29042610,"B B GREENBERG CO.333 W RIVER ST, PROVIDENCE RHODE ISLAND 02904 (PROVIDENCE)",0,C,,
02904GLDCR403CH,-71.419,41.845,False,44,007,002900,44,44007,44007002900,1400000US44007002900,GOLD CROWN INC,403 CHARLES ST,PROVIDENCE,RI,2904,"GOLD CROWN INC.403 CHARLES ST, PROVIDENCE RHODE ISLAND 02904 (PROVIDENCE)",0,C,,
02904HHSCR148WE,-71.414,41.843999999999994,False,44,007,002900,44,44007,44007002900,1400000US44007002900,H & H PRODUCTS,148 W RIVER ST,PROVIDENCE,RI,2904,"H & H PRODUCTS.148 W RIVER ST, PROVIDENCE RHODE ISLAND 02904 (PROVIDENCE)",0,C,,
02904MXWLL99WES,-71.415,41.842,False,44,007,002900,44,44007,44007002900,1400000US44007002900,QUEBECOR PRINTING PROVIDENCE INC,99 W RIVER ST,PROVIDENCE,RI,29082606,"QUEBECOR PRINTING PROVIDENCE INC.99 W RIVER ST, PROVIDENCE RHODE ISLAND 02908 (PROVIDENCE)",0,C,,
02904NTRNT387CH,-71.418,41.842,False,44,007,002900,44,44007,44007002900,1400000US44007002900,INTERNATIONAL INSIGNIA CORP,387 CHARLES ST,PROVIDENCE,RI,2904,"INTERNATIONAL INSIGNIA CORP.387 CHARLES ST, PROVIDENCE RHODE ISLAND 02904 (PROVIDENCE)",0,C,,
02940NNNDS10ADM,-71.418,41.841,False,44,007,002900,44,44007,44007002900,1400000US44007002900,UNION IND INC,10 ADMIRAL ST,PROVIDENCE,RI,2908,"UNION IND INC.10 ADMIRAL ST, PROVIDENCE RHODE ISLAND 02908 (PROVIDENCE)",0,C,,
02904GPLTN94SIL,-71.416,41.846000000000004,False,44,007,002900,44,44007,44007002900,1400000US44007002900,G & A PLATING CO,94 SILVER SPRING ST,PROVIDENCE,RI,2904,"G & A PLATING CO.94 SILVER SPRING ST, PROVIDENCE RHODE ISLAND 02904 (PROVIDENCE)",0,C,,
02904GVNNJ100NA,-71.402,41.853,False,44,007,003300,44,44007,44007003300,1400000US44007003300,GIOVANNI JEWELRY CO,100 NASHUA ST,PROVIDENCE,RI,2904,"GIOVANNI JEWELRY CO.100 NASHUA ST, PROVIDENCE RHODE ISLAND 02904 (PROVIDENCE)",0,C,,
02904JDNDS812BR,-71.434,41.855,False,44,007,002800,44,44007,44007002800,1400000US44007002800,JED INDUSTRIES INC,812 BRANCH AVE,PROVIDENCE,RI,2904,"JED INDUSTRIES INC.812 BRANCH AVE, PROVIDENCE RHODE ISLAND 02904 (PROVIDENCE)",0,C,,
02904LCTRL10HOU,-71.434,41.856,False,44,007,002800,44,44007,44007002800,1400000US44007002800,ELECTROLIZING INC,20 HOUGHTON ST,PROVIDENCE,RI,2904,"ELECTROLIZING INC.20 HOUGHTON ST, PROVIDENCE RHODE ISLAND 02904 (PROVIDENCE)",0,C,,110040060563
02904MNLLT30HOU,-71.434,41.856,False,44,007,002800,44,44007,44007002800,1400000US44007002800,MAINELLI TOOL & DIE INC,30 HOUGHTON ST,PROVIDENCE,RI,2904,"MAINELLI TOOL & DIE INC.30 HOUGHTON ST, PROVIDENCE RHODE ISLAND 02904 (PROVIDENCE)",0,C,,
02904RYLPL1117D,-71.443,41.856,False,44,007,002800,44,44007,44007002800,1400000US44007002800,ROYAL PLASTICS CO INC (DBA ROYAL OF AMERICA),1117 DOUGLAS AVE,NORTH PROVIDENCE,RI,2904,"ROYAL PLASTICS CO INC (DBA ROYAL OF AMERICA).1117 DOUGLAS AVE, NORTH PROVIDENCE RHODE ISLAND 02904 (PROVIDENCE)",1,C,,
02904MRTCM135PE,-71.442,41.864,False,44,007,011901,44,44007,44007011901,1400000US44007011901,MERIT COMP,135 PEAL AVE,PROVIDENCE,RI,2904,"MERIT COMP.135 PEAL AVE, PROVIDENCE RHODE ISLAND 02904 (PROVIDENCE)",0,C,,
02904RHDSL148WE,-71.438,41.861,True,44,007,011901,44,44007,44007011901,1400000US44007011901,RHODE ISLAND TOOL CO INC,148 W RIVER ST,PROVIDENCE,RI,2904,"RHODE ISLAND TOOL CO INC 148 W RIVER ST, PROVIDENCE, RI, 2904",0,C,,
02905DRMTC960BR,-71.415,41.798,False,44,007,000200,44,44007,44007000200,1400000US44007000200,DARMET CORP,960 BROAD ST,PROVIDENCE,RI,2905,"DARMET CORP.960 BROAD ST, PROVIDENCE RHODE ISLAND 02905 (PROVIDENCE)",0,C,,
02905FRGSN13014,-71.408,41.793,False,44,007,000102,44,44007,44007000102,1400000US44007000102,FERGUSON PERFORATING CO INC,130-140 ERNEST ST,PROVIDENCE,RI,2905,"FERGUSON PERFORATING CO INC.130-140 ERNEST ST, PROVIDENCE RHODE ISLAND 02905 (PROVIDENCE)",0,C,,110004903276
02905LRCCX97JOH,-71.404,41.793,False,44,007,000102,44,44007,44007000102,1400000US44007000102,LORAC CO,97 JOHNSON ST,PROVIDENCE,RI,2905,"LORAC CO.97 JOHNSON ST, PROVIDENCE RHODE ISLAND 02905 (PROVIDENCE)",0,C,,
02905NRRGN82ALD,-71.407,41.795,False,44,007,000102,44,44007,44007000102,1400000US44007000102,NARRAGANSETT SCREW CO,82 ALDRICH ST,PROVIDENCE,RI,2905,"NARRAGANSETT SCREW CO.82 ALDRICH ST, PROVIDENCE RHODE ISLAND 02905 (PROVIDENCE)",0,C,,
02905GRGMNHARBO,-71.383,41.788999999999994,False,44,007,000101,44,44007,44007000101,1400000US44007000101,UNIVAR USA INC - PROVIDENCE BRANCH,HARBORSIDE BLVD,PROVIDENCE,RI,2905,"UNIVAR USA INC - PROVIDENCE BRANCH.HARBORSIDE BLVD, PROVIDENCE RHODE ISLAND 02905 (PROVIDENCE)",0,C,,110000602955
02905LLNSM89SHI,-71.391,41.792,False,44,007,000101,44,44007,44007000101,1400000US44007000101,ALLENS MANUFACTURING,89 SHIPYARD ST,PROVIDENCE,RI,2905,"ALLENS MANUFACTURING.89 SHIPYARD ST, PROVIDENCE RHODE ISLAND 02905 (PROVIDENCE)",0,C,,
02905MNRCH189GE,-71.4,41.792,False,44,007,000101,44,44007,44007000101,1400000US44007000101,MONARCH METAL FINISHING CO INC,189 GEORGIA AVE,PROVIDENCE,RI,2905,"MONARCH METAL FINISHING CO INC.189 GEORGIA AVE, PROVIDENCE RHODE ISLAND 02905 (PROVIDENCE)",0,C,,110000312885
02905PRVDN225CA,-71.4,41.791000000000004,False,44,007,000101,44,44007,44007000101,1400000US44007000101,PROVIDENCE CHAIN CO,225 CAROLINA AVE,PROVIDENCE,RI,2905,"PROVIDENCE CHAIN CO.225 CAROLINA AVE, PROVIDENCE RHODE ISLAND 02905 (PROVIDENCE)",0,C,,110000312910
02905RBCMF192GE,-71.4,41.792,False,44,007,000101,44,44007,44007000101,1400000US44007000101,RIBCO MANUFACTURING INC,192 GEORGIA AVE,PROVIDENCE,RI,2905,"RIBCO MANUFACTURING INC.192 GEORGIA AVE, PROVIDENCE RHODE ISLAND 02905 (PROVIDENCE)",0,C,,
02905RMBRS735AL,-71.39699999999999,41.793,False,44,007,000101,44,44007,44007000101,1400000US44007000101,ARMBRUST INTERNATIONAL,735 ALLENS AVE,PROVIDENCE,RI,2905,"ARMBRUST INTERNATIONAL.735 ALLENS AVE, PROVIDENCE RHODE ISLAND 02905 (PROVIDENCE)",0,C,,110000312938
02905SNRFN35TER,-71.39399999999999,41.79600000000001,False,44,007,000101,44,44007,44007000101,1400000US44007000101,SUN REFINING & MARKETING CO,35 TERMINAL RD,PROVIDENCE,RI,2905,"SUN REFINING & MARKETING CO.35 TERMINAL RD, PROVIDENCE RHODE ISLAND 02905 (PROVIDENCE)",0,C,,
02905SPCTR217CH,-71.40100000000001,41.793,False,44,007,000101,44,44007,44007000101,1400000US44007000101,SPECTRUM COATINGS LABS INC,217 CHAPMAN ST,PROVIDENCE,RI,2905,"SPECTRUM COATINGS LABS INC.217 CHAPMAN ST, PROVIDENCE RHODE ISLAND 02905 (PROVIDENCE)",0,C,,
02940FDRLP1139E,-71.404,41.795,False,44,007,000101,44,44007,44007000101,1400000US44007000101,MAHR INC,1139 EDDY ST,PROVIDENCE,RI,2905,"MAHR INC.1139 EDDY ST, PROVIDENCE RHODE ISLAND 02905 (PROVIDENCE)",0,C,,110000895087
02905JWLRS85ELL,-71.40100000000001,41.794,False,44,007,000101,44,44007,44007000101,1400000US44007000101,JEWELERS REFINING SERVICE INC,85 ELLENFIELD ST,PROVIDENCE,RI,2905,"JEWELERS REFINING SERVICE INC.85 ELLENFIELD ST, PROVIDENCE RHODE ISLAND 02905 (PROVIDENCE)",0,C,,
02905LNJWL1280E,-71.403,41.79,False,44,007,000101,44,44007,44007000101,1400000US44007000101,ALAN JEWELRY CO,1280 EDDY ST,PROVIDENCE,RI,2905,"ALAN JEWELRY CO.1280 EDDY ST, PROVIDENCE RHODE ISLAND 02905 (PROVIDENCE)",1,C,,
02940MNRCH325HA,-71.391,41.787,False,44,007,000101,44,44007,44007000101,1400000US44007000101,MONARCH INDUSTRIES INC,325 HARBORSIDE BLVD,PROVIDENCE,RI,29405202,"MONARCH INDUSTRIES INC.325 HARBORSIDE BLVD, PROVIDENCE RHODE ISLAND 02940 (PROVIDENCE)",0,C,,
02905RNBWM177GE,-71.4,41.792,False,44,007,000101,44,44007,44007000101,1400000US44007000101,IRA GREEN INC,177 GEORGIA AVE,PROVIDENCE,RI,2905,"IRA GREEN INC.177 GEORGIA AVE, PROVIDENCE RHODE ISLAND 02905 (PROVIDENCE)",0,C,,110000312947
02905DNCRF24BAK,-71.398,41.794,False,44,007,000101,44,44007,44007000101,1400000US44007000101,DANECRAFT INC,24 BAKER ST,PROVIDENCE,RI,2905,"DANECRAFT INC.24 BAKER ST, PROVIDENCE RHODE ISLAND 02905 (PROVIDENCE)",0,C,,
02905HDSNT29TER,-71.39699999999999,41.795,False,44,007,000101,44,44007,44007000101,1400000US44007000101,HUDSON TERMINAL,29 TERMINAL RD,PROVIDENCE,RI,2905,"HUDSON TERMINAL.29 TERMINAL RD, PROVIDENCE RHODE ISLAND 02905 (PROVIDENCE)",0,C,,110032893938
0290WNPTNR35TER,-71.392,41.79600000000001,False,44,007,000101,44,44007,44007000101,1400000US44007000101,NEPT NORTH,75 TERMINAL ROAD,PROVIDENCE,RI,2905,"NEPT NORTH.75 TERMINAL ROAD, PROVIDENCE RHODE ISLAND 02905 (PROVIDENCE)",0,C,,110039019193
0290WNPTST13TER,-71.392,41.79600000000001,False,44,007,000101,44,44007,44007000101,1400000US44007000101,NEPT SOUTH,130 TERMINAL ROAD,PROVIDENCE,RI,2905,"NEPT SOUTH.130 TERMINAL ROAD, PROVIDENCE RHODE ISLAND 02905 (PROVIDENCE)",0,C,,110039019200
02905PTTNM17VIR,-71.482,41.997,False,44,007,018500,44,44007,44007018500,1400000US44007018500,PATTON-MACGUYER INC,17 VIRGINIA AVE,PROVIDENCE,RI,29054441,"PATTON-MACGUYER INC.17 VIRGINIA AVE, PROVIDENCE RHODE ISLAND 02905 (PROVIDENCE)",0,C,,
02895HMLTN300PA,-71.47800000000001,41.993,False,44,007,018500,44,44007,44007018500,1400000US44007018500,"HAMILTON STANDARD INTERCONNECT, SYS",300 PARK E DR,WOONSOCKET,RI,2895,"HAMILTON STANDARD INTERCONNECT, SYS.300 PARK E DR, WOONSOCKET RHODE ISLAND 02895 (PROVIDENCE)",1,C,,
02895LTRFN500PA,-71.47800000000001,41.996,False,44,007,018500,44,44007,44007018500,1400000US44007018500,CARPENTER POWDER PRODUCTS,500 PARK E DR HIGHLAND INDL PARK,WOONSOCKET,RI,2895,"CARPENTER POWDER PRODUCTS.500 PARK E DR HIGHLAND INDL PARK, WOONSOCKET RHODE ISLAND 02895 (PROVIDENCE)",0,C,,110004928357
02895TCHNC300PA,-71.471,42.0,False,44,007,018500,44,44007,44007018500,1400000US44007018500,TECHNIC INC ENGINEERED POWDERS DIV,300 PARK EAST DR,WOONSOCKET,RI,2895,"TECHNIC INC ENGINEERED POWDERS DIV.300 PARK EAST DR, WOONSOCKET RHODE ISLAND 02895 (PROVIDENCE)",0,C,,110000496062
02895PLYRT1FUND,-71.485,41.99100000000001,False,44,007,018500,44,44007,44007018500,1400000US44007018500,POLYURETHANE MOLDING INC,100 FOUNDERS DR,WOONSOCKET,RI,2895,"POLYURETHANE MOLDING INC.100 FOUNDERS DR, WOONSOCKET RHODE ISLAND 02895 (PROVIDENCE)",0,C,,110004919474
02905RSTRD928ED,-71.407,41.802,False,44,007,000500,44,44007,44007000500,1400000US44007000500,R E STURDY CO INC,928 EDDY ST,PROVIDENCE,RI,2905,"R E STURDY CO INC.928 EDDY ST, PROVIDENCE RHODE ISLAND 02905 (PROVIDENCE)",0,C,,
02905LTTLC908ED,-71.407,41.803000000000004,False,44,007,000500,44,44007,44007000500,1400000US44007000500,LITTLE & CO INC,908 EDDY ST,PROVIDENCE,RI,2905,"LITTLE & CO INC.908 EDDY ST, PROVIDENCE RHODE ISLAND 02905 (PROVIDENCE)",0,C,,
02907CNSLD150NI,-71.439,41.799,False,44,007,001500,44,44007,44007001500,1400000US44007001500,UNCAS MFGCO,150 NIANTIC AVE,PROVIDENCE,RI,2907,"UNCAS MFGCO.150 NIANTIC AVE, PROVIDENCE RHODE ISLAND 02907 (PROVIDENCE)",0,C,,
02909NSNNC100DU,-71.436,41.8,False,44,007,001500,44,44007,44007001500,1400000US44007001500,C & J JEWELRY CO INC,100 DUPONT DR,PROVIDENCE,RI,2907,"C & J JEWELRY CO INC.100 DUPONT DR, PROVIDENCE RHODE ISLAND 02907 (PROVIDENCE)",0,C,,
02907QLTYS150PA,-71.436,41.794,False,44,007,001500,44,44007,44007001500,1400000US44007001500,"QUALITY SPRAYING & STENCILING, CO",150 PARK LN,PROVIDENCE,RI,2907,"QUALITY SPRAYING & STENCILING, CO.150 PARK LN, PROVIDENCE RHODE ISLAND 02907 (PROVIDENCE)",0,C,,
02907SPSTJ225DU,-71.436,41.797,False,44,007,001500,44,44007,44007001500,1400000US44007001500,ESPOSITO JEWELRY INC,225 DUPONT DR,PROVIDENCE,RI,29070777,"ESPOSITO JEWELRY INC.225 DUPONT DR, PROVIDENCE RHODE ISLAND 02907 (PROVIDENCE)",0,C,,
02907TSRDL195DU,-71.436,41.798,False,44,007,001500,44,44007,44007001500,1400000US44007001500,SARDELLI INTERNATIONAL LLC.,195 DUPONT DR,PROVIDENCE,RI,2907,"SARDELLI INTERNATIONAL LLC..195 DUPONT DR, PROVIDENCE RHODE ISLAND 02907 (PROVIDENCE)",0,C,,110000491913
02907NCRGR175DU,-71.435,41.798,False,44,007,001500,44,44007,44007001500,1400000US44007001500,RAWCLIFFE CORP,175 DUPONT DR,PROVIDENCE,RI,2907,"RAWCLIFFE CORP.175 DUPONT DR, PROVIDENCE RHODE ISLAND 02907 (PROVIDENCE)",0,C,,110004903702
02907NTRPL45SAL,-71.432,41.803999999999995,False,44,007,001400,44,44007,44007001400,1400000US44007001400,INTERPLEX METALS RI CORP,45 SALEM ST,PROVIDENCE,RI,2907,"INTERPLEX METALS RI CORP.45 SALEM ST, PROVIDENCE RHODE ISLAND 02907 (PROVIDENCE)",0,C,,
02907NTRNT7NINI,-71.437,41.803999999999995,False,44,007,001400,44,44007,44007001400,1400000US44007001400,"INTERNATIONAL ETCHING,INC.",7 NINIGRET AVE,PROVIDENCE,RI,2907,"INTERNATIONAL ETCHING,INC..7 NINIGRET AVE, PROVIDENCE RHODE ISLAND 02907 (PROVIDENCE)",0,C,,110000312956
02907PLGRM120SP,-71.453,41.976000000000006,False,44,007,011402,44,44007,44007011402,1400000US44007011402,PILGRIM SCREW CORP,120 SPRAGUE ST,PROVIDENCE,RI,2907,"PILGRIM SCREW CORP.120 SPRAGUE ST, PROVIDENCE RHODE ISLAND 02907 (PROVIDENCE)",0,C,,110000312974
02864TFFNY300MA,-71.459,42.003,False,44,007,011402,44,44007,44007011402,1400000US44007011402,TIFFANY & CO,300 MAPLE RIDGE DR,CUMBERLAND,RI,2864,"TIFFANY & CO.300 MAPLE RIDGE DR, CUMBERLAND RHODE ISLAND 02864 (PROVIDENCE)",0,C,,110070037152
02908MPCNC335VA,-71.439,41.826,False,44,007,002200,44,44007,44007002200,1400000US44007002200,IMPCO INC,335 VALLEY ST,PROVIDENCE,RI,2908,"IMPCO INC.335 VALLEY ST, PROVIDENCE RHODE ISLAND 02908 (PROVIDENCE)",0,C,,
02908GJJWL52RIV,-71.436,41.82899999999999,False,44,007,002200,44,44007,44007002200,1400000US44007002200,G & J JEWELRY,52 RIVER AVE,PROVIDENCE,RI,2908,"G & J JEWELRY.52 RIVER AVE, PROVIDENCE RHODE ISLAND 02908 (PROVIDENCE)",0,C,,
02909GPRVD586AT,-71.436,41.825,False,44,007,002500,44,44007,44007002500,1400000US44007002500,GE PROVIDENCE BASE PLANT,586 ATWELLS AVE,PROVIDENCE,RI,2909,"GE PROVIDENCE BASE PLANT.586 ATWELLS AVE, PROVIDENCE RHODE ISLAND 02909 (PROVIDENCE)",0,C,,
02909NCSMN623AT,-71.438,41.825,False,44,007,002500,44,44007,44007002500,1400000US44007002500,UNCAS MFG CO,623 ATWELLS AVE,PROVIDENCE,RI,2909,"UNCAS MFG CO.623 ATWELLS AVE, PROVIDENCE RHODE ISLAND 02909 (PROVIDENCE)",0,C,,
02909STRNW498KI,-71.433,41.827,False,44,007,002500,44,44007,44007002500,1400000US44007002500,EASTERN WIRE PRODUCTS CO,498 KINSLEY AVE,PROVIDENCE,RI,2909,"EASTERN WIRE PRODUCTS CO.498 KINSLEY AVE, PROVIDENCE RHODE ISLAND 02909 (PROVIDENCE)",0,C,,
02908MCRFN555VA,-71.431,41.83,False,44,007,002500,44,44007,44007002500,1400000US44007002500,MICROFIN CORP,555 VALLEY ST,PROVIDENCE,RI,2908,"MICROFIN CORP.555 VALLEY ST, PROVIDENCE RHODE ISLAND 02908 (PROVIDENCE)",0,C,,
02909RCNMS400HA,-71.434,41.825,False,44,007,002500,44,44007,44007002500,1400000US44007002500,ARCONIUM SPECIALTY ALLOYS,400 HARRIS AVE,PROVIDENCE,RI,2909,"ARCONIUM SPECIALTY ALLOYS.400 HARRIS AVE, PROVIDENCE RHODE ISLAND 02909 (PROVIDENCE)",0,C,,
02909STRLL50SIM,-71.434,41.827,False,44,007,002500,44,44007,44007002500,1400000US44007002500,OSTER ALLOYS,50 SIMS AVE,PROVIDENCE,RI,2909,"OSTER ALLOYS.50 SIMS AVE, PROVIDENCE RHODE ISLAND 02909 (PROVIDENCE)",0,C,,
02909RCNMS50SIM,-71.434,41.827,False,44,007,002500,44,44007,44007002500,1400000US44007002500,UMICORE THIN FILM PRODUCTS,50 SIMS AVE,PROVIDENCE,RI,2909,"UMICORE THIN FILM PRODUCTS.50 SIMS AVE, PROVIDENCE RHODE ISLAND 02909 (PROVIDENCE)",0,C,,110000313018
02909MPRLP25MAN,-71.444,41.817,False,44,007,001900,44,44007,44007001900,1400000US44007001900,CATHEDRAL ART METAL CO INC.,25 MANTON AVE,PROVIDENCE,RI,2909,"CATHEDRAL ART METAL CO INC..25 MANTON AVE, PROVIDENCE RHODE ISLAND 02909 (PROVIDENCE)",0,C,,110000312260
02909STRTR58CUR,-71.45,41.821999999999996,False,44,007,001900,44,44007,44007001900,1400000US44007001900,STAR-TRON CORP,58 CURTIS ST,PROVIDENCE,RI,2909,"STAR-TRON CORP.58 CURTIS ST, PROVIDENCE RHODE ISLAND 02909 (PROVIDENCE)",0,C,,
02909VCTRY50AGN,-71.443,41.815,False,44,007,001600,44,44007,44007001600,1400000US44007001600,VICTORY PEARL INC,50 AGNES ST,PROVIDENCE,RI,2909,"VICTORY PEARL INC.50 AGNES ST, PROVIDENCE RHODE ISLAND 02909 (PROVIDENCE)",0,C,,
02909NSSNS71TRO,-71.442,41.815,False,44,007,001600,44,44007,44007001600,1400000US44007001600,EUNIS & SONS POLISHING CO,71 TROY ST,PROVIDENCE,RI,2909,"EUNIS & SONS POLISHING CO.71 TROY ST, PROVIDENCE RHODE ISLAND 02909 (PROVIDENCE)",1,C,,
02909LCTRN204HA,-71.449,41.817,False,44,007,001600,44,44007,44007001600,1400000US44007001600,"ELECTRONIC PRECISION CIRCUITRY, INC",204 HARTFORD AVE,PROVIDENCE,RI,2909,"ELECTRONIC PRECISION CIRCUITRY, INC.204 HARTFORD AVE, PROVIDENCE RHODE ISLAND 02909 (PROVIDENCE)",1,C,,
02910HYSHT800WE,-71.428,41.766999999999996,False,44,007,013800,44,44007,44007013800,1400000US44007013800,SPECTRUM THERMAL PROCESSING LLC,818 WELLINGTON AVE,CRANSTON,RI,2910,"SPECTRUM THERMAL PROCESSING LLC.818 WELLINGTON AVE, CRANSTON RHODE ISLAND 02910 (PROVIDENCE)",0,C,,110000313036
02910RHDSL50BUR,-71.44800000000001,41.793,False,44,007,014100,44,44007,44007014100,1400000US44007014100,"RHODE ISLAND INSULATED WIRE, UNIT OF AMER INSULATED WIRE",50 BURNHAM AV,CRANSTON,RI,2910,"RHODE ISLAND INSULATED WIRE, UNIT OF AMER INSULATED WIRE.50 BURNHAM AV, CRANSTON RHODE ISLAND 02910 (PROVIDENCE)",1,C,,
02910TCHNC1SPEC,-71.445,41.792,False,44,007,014100,44,44007,44007014100,1400000US44007014100,TECHNIC INC,1 SPECTACLE ST,CRANSTON,RI,2910,"TECHNIC INC.1 SPECTACLE ST, CRANSTON RHODE ISLAND 02910 (PROVIDENCE)",0,C,,110000313072
02920TCNCC1160C,-71.45,41.795,False,44,007,014100,44,44007,44007014100,1400000US44007014100,TACO INC - CRANSTON,1160 CRANSTON ST,CRANSTON,RI,2920,"TACO INC - CRANSTON.1160 CRANSTON ST, CRANSTON RHODE ISLAND 02920 (PROVIDENCE)",0,C,,110012482713
02910SCTTB1637E,-71.425,41.768,False,44,007,013600,44,44007,44007013600,1400000US44007013600,SCOTT BRASS INC,1637 ELMWOOD AVE,CRANSTON,RI,2910,"SCOTT BRASS INC.1637 ELMWOOD AVE, CRANSTON RHODE ISLAND 02910 (PROVIDENCE)",0,C,,110000313054
02910TRBRT1370E,-71.423,41.773,False,44,007,013600,44,44007,44007013600,1400000US44007013600,TRI-BRO TOOL CO INC,1370 ELMWOOD AVE,CRANSTON,RI,2910,"TRI-BRO TOOL CO INC.1370 ELMWOOD AVE, CRANSTON RHODE ISLAND 02910 (PROVIDENCE)",0,C,,
02910PLYCH20FIF,-71.425,41.763000000000005,False,44,007,013600,44,44007,44007013600,1400000US44007013600,POLYCHEM CORP,20 5TH AVE,CRANSTON,RI,2910,"POLYCHEM CORP.20 5TH AVE, CRANSTON RHODE ISLAND 02910 (PROVIDENCE)",0,C,,
02910TBZXX20AVE,-71.429,41.761,False,44,007,013600,44,44007,44007013600,1400000US44007013600,AUTOBRAZE,20 AVERY RD,CRANSTON,RI,29105602,"AUTOBRAZE.20 AVERY RD, CRANSTON RHODE ISLAND 02910 (PROVIDENCE)",0,C,,
02905CHMPK167MI,-71.414,41.766000000000005,False,44,007,013600,44,44007,44007013600,1400000US44007013600,SAFETY-KLEEN SYSTEMS INC,167 MILL ST,CRANSTON,RI,2905,"SAFETY-KLEEN SYSTEMS INC.167 MILL ST, CRANSTON RHODE ISLAND 02905 (PROVIDENCE)",0,C,,110000312849
02910NTYTC72FEN,-71.42399999999999,41.773999999999994,False,44,007,013600,44,44007,44007013600,1400000US44007013600,ANTAYA TECHNOLOGIES CORP,72 FENNER ST,CRANSTON,RI,2910,"ANTAYA TECHNOLOGIES CORP.72 FENNER ST, CRANSTON RHODE ISLAND 02910 (PROVIDENCE)",1,C,,110002087642
02910MSLCT1515E,-71.425,41.766999999999996,False,44,007,013600,44,44007,44007013600,1400000US44007013600,UMICORE TECHNICAL MATERIALS NORTH AMERICA INC,1515 ELMWOOD AVE,CRANSTON,RI,29103800,"UMICORE TECHNICAL MATERIALS NORTH AMERICA INC.1515 ELMWOOD AVE, CRANSTON RHODE ISLAND 02910 (PROVIDENCE)",0,C,,110009444182
02911FRNCC1800S,-71.472,41.855,False,44,007,012000,44,44007,44007012000,1400000US44007012000,F RONCI CO INC,1800 SMITH ST,NORTH PROVIDENCE,RI,2911,"F RONCI CO INC.1800 SMITH ST, NORTH PROVIDENCE RHODE ISLAND 02911 (PROVIDENCE)",0,C,,
02911FRNND184WO,-71.475,41.84,False,44,007,012102,44,44007,44007012102,1400000US44007012102,FERNANDO ORIGINALS,184 WOONASQUATUCKET AVE,NORTH PROVIDENCE,RI,2911,"FERNANDO ORIGINALS.184 WOONASQUATUCKET AVE, NORTH PROVIDENCE RHODE ISLAND 02911 (PROVIDENCE)",0,C,,
02911THNWN19HUM,-71.475,41.845,False,44,007,012102,44,44007,44007012102,1400000US44007012102,NEW ANNEX PLATING INC,19 HUMBERT ST,NORTH PROVIDENCE,RI,2911,"NEW ANNEX PLATING INC.19 HUMBERT ST, NORTH PROVIDENCE RHODE ISLAND 02911 (PROVIDENCE)",0,C,,
02911VLRCR330WO,-71.477,41.845,False,44,007,012102,44,44007,44007012102,1400000US44007012102,VOLARE CREATIONS INC,330 WOONASQUATUCKET AVE,NORTH PROVIDENCE,RI,2911,"VOLARE CREATIONS INC.330 WOONASQUATUCKET AVE, NORTH PROVIDENCE RHODE ISLAND 02911 (PROVIDENCE)",0,C,,
02911SRNGT1GREY,-71.492,41.865,False,44,007,012300,44,44007,44007012300,1400000US44007012300,INDUPLATE LLC,1 GREYSTONE DR,NORTH PROVIDENCE,RI,2911,"INDUPLATE LLC.1 GREYSTONE DR, NORTH PROVIDENCE RHODE ISLAND 02911 (PROVIDENCE)",0,C,,110000313090
02911WRCSTGREYS,-71.492,41.865,False,44,007,012300,44,44007,44007012300,1400000US44007012300,WORCESTER CO,1 GREYSTONE AVE,NORTH PROVIDENCE,RI,2911,"WORCESTER CO.1 GREYSTONE AVE, NORTH PROVIDENCE RHODE ISLAND 02911 (PROVIDENCE)",0,C,,
02912BTRSL115RA,-71.486,41.852,False,44,007,012300,44,44007,44007012300,1400000US44007012300,ABATE & URSILLO PLATING CO,115 RAILROAD AVE,JOHNSTON,RI,2919,"ABATE & URSILLO PLATING CO.115 RAILROAD AVE, JOHNSTON RHODE ISLAND 02919 (PROVIDENCE)",1,C,,
02919GTNRY100RA,-71.486,41.853,False,44,007,012300,44,44007,44007012300,1400000US44007012300,G TANURY PLATING CO,100 RAILROAD AVE,JOHNSTON,RI,2919,"G TANURY PLATING CO.100 RAILROAD AVE, JOHNSTON RHODE ISLAND 02919 (PROVIDENCE)",0,C,,
02919JMSRVGOLDS,-71.47399999999999,41.833999999999996,False,44,007,012300,44,44007,44007012300,1400000US44007012300,FIBERMARK DSI,1 GOLDSMITH ST,JOHNSTON,RI,2919,"FIBERMARK DSI.1 GOLDSMITH ST, JOHNSTON RHODE ISLAND 02919 (PROVIDENCE)",0,C,,
02919TWNLC178GE,-71.488,41.846,True,44,007,012300,44,44007,44007012300,1400000US44007012300,TOWN ELECTROPLATING CO INC,178 GEORGAE WATERMAN RD,JOHNSTON,RI,2919,"TOWN ELECTROPLATING CO INC 178 GEORGAE WATERMAN RD, JOHNSTON, RI, 2919",0,C,,
02911VNSPL50WAT,-71.486,41.86,False,44,007,012104,44,44007,44007012104,1400000US44007012104,EVANS PLATING CORP,50 WATERMAN AVE,CENTERDALE,RI,2911,"EVANS PLATING CORP.50 WATERMAN AVE, CENTERDALE RHODE ISLAND 02911 (PROVIDENCE)",0,C,,
02914BBLLC800WA,-71.35300000000001,41.81399999999999,False,44,007,010300,44,44007,44007010300,1400000US44007010300,B.A.BALLOU & CO. INC.,800 WATERMAN AVE,EAST PROVIDENCE,RI,2914,"B.A.BALLOU & CO. INC..800 WATERMAN AVE, EAST PROVIDENCE RHODE ISLAND 02914 (PROVIDENCE)",0,C,,110012481858
02914SPDLD25FAI,-71.35300000000001,41.81399999999999,False,44,007,010300,44,44007,44007010300,1400000US44007010300,TEXTRON INC SPEIDEL DIV,25 FAIRMOUNT AVE,EAST PROVIDENCE,RI,2914,"TEXTRON INC SPEIDEL DIV.25 FAIRMOUNT AVE, EAST PROVIDENCE RHODE ISLAND 02914 (PROVIDENCE)",0,C,,
02914SCCCT889WA,-71.348,41.812,False,44,007,010300,44,44007,44007010300,1400000US44007010300,SCUCCATO CORP,889 WATERMAN AVE,EAST PROVIDENCE,RI,2914,"SCUCCATO CORP.889 WATERMAN AVE, EAST PROVIDENCE RHODE ISLAND 02914 (PROVIDENCE)",0,C,,
02914PRCSN22ALM,-71.346,41.81399999999999,False,44,007,010300,44,44007,44007010300,1400000US44007010300,PRECISION ART COORDINATORS INC,22 ALMEIDA AVE,EAST PROVIDENCE,RI,2914,"PRECISION ART COORDINATORS INC.22 ALMEIDA AVE, EAST PROVIDENCE RHODE ISLAND 02914 (PROVIDENCE)",1,C,,
02914FDXXX977WA,-71.347,41.81100000000001,False,44,007,010300,44,44007,44007010300,1400000US44007010300,EFD INC,977 WATERMAN AVE,EAST PROVIDENCE,RI,2914,"EFD INC.977 WATERMAN AVE, EAST PROVIDENCE RHODE ISLAND 02914 (PROVIDENCE)",0,C,,
02914GRDNR830WA,-71.351,41.813,False,44,007,010300,44,44007,44007010300,1400000US44007010300,GARDENER SPECIALTY METALS LLC,830 WATERMAN AVE,EAST PROVIDENCE,RI,2914,"GARDENER SPECIALTY METALS LLC.830 WATERMAN AVE, EAST PROVIDENCE RHODE ISLAND 02914 (PROVIDENCE)",0,C,,
02914KNCRP199AM,-71.34899999999999,41.8,False,44,007,010501,44,44007,44007010501,1400000US44007010501,DSM COATING RESINS INC,199 AMARAL ST,EAST PROVIDENCE,RI,2915,"DSM COATING RESINS INC.199 AMARAL ST, EAST PROVIDENCE RHODE ISLAND 02915 (PROVIDENCE)",0,C,,110000313134
0291WNRDSN4CATA,-71.343,41.803000000000004,False,44,007,010501,44,44007,44007010501,1400000US44007010501,NORDSONEFD,40 CATAMORE BLVD.,EAST PROVIDENCE,RI,2914,"NORDSONEFD.40 CATAMORE BLVD., EAST PROVIDENCE RHODE ISLAND 02914 (PROVIDENCE)",0,C,,110004932912
