TRIFID,LONGITUDE,LATITUDE,ESTIMATE,STATEFP,COUNTYFP,TRACTCE,STATEGEOID,COUNTYGEOID,TRACTGEOID,AFFGEOID,FACILITY_NAME,STREET,CITY,STUSPS,ZIP_CODE,FACILITY,FAC_CLOSED_IND,ASGN_FEDERAL_IND,BIA_CODE,EPA_REGISTRY_ID
84006KNNCT8362W,-112.141,40.734,False,49,035,113906,49,49035,49035113906,1400000US49035113906,KENNECOTT UTAH COPPER SMELTER & REFINERY,12000 WEST 2100 SOUTH & 11500 W 2100 S,MAGNA,UT,84044,"KENNECOTT UTAH COPPER SMELTER & REFINERY.12000 WEST 2100 SOUTH & 11500 W 2100 S, MAGNA UTAH 84044 (SALT LAKE)",0,C,,110009506347
84044NNCRB12385,-112.186,40.727,False,49,035,113906,49,49035,49035113906,1400000US49035113906,PRAXAIR INC,12385 W HWY 201,MAGNA,UT,84044,"PRAXAIR INC.12385 W HWY 201, MAGNA UTAH 84044 (SALT LAKE)",0,C,,
84116CMPQN620NO,-112.036,40.783,False,49,035,113906,49,49035,49035113906,1400000US49035113906,COMPEQ INTERNATIONAL,620 N JOHN GLENN RD,SALT LAKE CITY,UT,841164400,"COMPEQ INTERNATIONAL.620 N JOHN GLENN RD, SALT LAKE CITY UTAH 84116 (SALT LAKE)",0,C,,110022400846
84116TSCLT595WA,-112.03299999999999,40.779,False,49,035,113906,49,49035,49035113906,1400000US49035113906,TOSCA LTD UTAH,5950 W AMELIA EARHART DR,SALT LAKE CITY,UT,84116,"TOSCA LTD UTAH.5950 W AMELIA EARHART DR, SALT LAKE CITY UTAH 84116 (SALT LAKE)",0,C,,110032629715
84104PLKNG1225S,-112.027,40.744,False,49,035,113906,49,49035,49035113906,1400000US49035113906,PILKINGTON METAL FINISHING LLC,1225 S LEGACY VIEW ST,SALT LAKE CITY,UT,84104,"PILKINGTON METAL FINISHING LLC.1225 S LEGACY VIEW ST, SALT LAKE CITY UTAH 84104 (SALT LAKE)",0,C,,110020824713
84014SYRST950WE,-111.89299999999999,40.915,False,49,011,126304,49,49011,49011126304,1400000US49011126304,TRINITY HIGHWAY PRODUCTS LLC PLT NO 1033,950 W 400 SO,CENTERVILLE,UT,84014,"TRINITY HIGHWAY PRODUCTS LLC PLT NO 1033.950 W 400 SO, CENTERVILLE UTAH 84014 (DAVIS)",1,C,,110057608520
84016FBLLNPOBOX,-112.02799999999999,41.093,False,49,011,125600,49,49011,49011125600,1400000US49011125600,FABALL ENTERPRISES OF UTAH,BLDG G-9 FREEPORT CENTER,CLEARFIELD,UT,84016,"FABALL ENTERPRISES OF UTAH.BLDG G-9 FREEPORT CENTER, CLEARFIELD UTAH 84016 (DAVIS)",0,C,,
84016FTRHMBLDGH,-112.03200000000001,41.103,False,49,011,125600,49,49011,49011125600,1400000US49011125600,FUTURA INDUSTRIES,BUILDING H-11 FREEPORT CENTER,CLEARFIELD,UT,84016,"FUTURA INDUSTRIES.BUILDING H-11 FREEPORT CENTER, CLEARFIELD UTAH 84016 (DAVIS)",0,C,,110000600555
84016HRCLSFREEP,-112.031,41.104,False,49,011,125600,49,49011,49011125600,1400000US49011125600,ALLIANT TECHSYSTEMS PLANT 2,FREEPORT CENTER 14TH ST,CLEARFIELD,UT,84016,"ALLIANT TECHSYSTEMS PLANT 2.FREEPORT CENTER 14TH ST, CLEARFIELD UTAH 84016 (DAVIS)",2,C,,
84016LLDFTBUILD,-112.02799999999999,41.093,False,49,011,125600,49,49011,49011125600,1400000US49011125600,HONEYWELL INTERNATIONAL CLEARFIELD UT,BLDG. C-13 FREEPORT CENTER,CLEARFIELD,UT,84016,"HONEYWELL INTERNATIONAL CLEARFIELD UT.BLDG. C-13 FREEPORT CENTER, CLEARFIELD UTAH 84016 (DAVIS)",0,C,,110002455548
84016RRWDYH12FR,-112.02799999999999,41.093,False,49,011,125600,49,49011,49011125600,1400000US49011125600,ARROW DYNAMICS INC,H-12 FREEPORT CENTER,CLEARFIELD,UT,84016,"ARROW DYNAMICS INC.H-12 FREEPORT CENTER, CLEARFIELD UTAH 84016 (DAVIS)",0,C,,
84016TLTYTBLDGE,-112.02799999999999,41.101000000000006,False,49,011,125600,49,49011,49011125600,1400000US49011125600,UTILITY TRAILER MANUFACTURING,BLDG E-14 FREEPORT CTR,CLEARFIELD,UT,840160387,"UTILITY TRAILER MANUFACTURING.BLDG E-14 FREEPORT CTR, CLEARFIELD UTAH 84016 (DAVIS)",0,C,,
84016LLMRCFREEP,-112.02799999999999,41.093,False,49,011,125600,49,49011,49011125600,1400000US49011125600,"WEIGHT WATCHERS GOURMET FOOD, CO",BLDG A16-H,FREEPORT CENTER,UT,840160427,"WEIGHT WATCHERS GOURMET FOOD, CO.BLDG A16-H, FREEPORT CENTER UTAH 84016 (DAVIS)",0,C,,
84016WRGRCFREEP,-112.042,41.102,False,49,011,125600,49,49011,49011125600,1400000US49011125600,GCP APPLIED TECHNOLOGIES INC,"FREEPORT CENTER, BUILDING J5",CLEARFIELD,UT,84016,"GCP APPLIED TECHNOLOGIES INC.FREEPORT CENTER, BUILDING J5, CLEARFIELD UTAH 84016 (DAVIS)",0,C,,110000744008
84016SHLNDFREEP,-112.03399999999999,41.105,False,49,011,125600,49,49011,49011125600,1400000US49011125600,NEXEO SOLUTIONS LLC-CLEARFIELD,12 FREEPORT CENTER,CLEARFIELD,UT,84016,"NEXEO SOLUTIONS LLC-CLEARFIELD.12 FREEPORT CENTER, CLEARFIELD UTAH 84016 (DAVIS)",0,C,,110000619983
84054NPTCH851SW,-112.023,41.1,False,49,011,125600,49,49011,49011125600,1400000US49011125600,CP INDUSTRIES,851 S FREEPORT INDS PKY,CLEARFIELD,UT,84054,"CP INDUSTRIES.851 S FREEPORT INDS PKY, CLEARFIELD UTAH 84054 (DAVIS)",0,C,,
84016TLTYT1111S,-112.045,41.096000000000004,False,49,011,125600,49,49011,49011125600,1400000US49011125600,UTILITY TRAILER MANUFACTURING,1111 S 1000 W,CLEARFIELD,UT,84015,"UTILITY TRAILER MANUFACTURING.1111 S 1000 W, CLEARFIELD UTAH 84015 (DAVIS)",0,C,,110057506970
84016NCFPLBUILD,-112.039,41.106,False,49,011,125600,49,49011,49011125600,1400000US49011125600,NCFI POLYURETHANES SLC,"BUILDING M-9, FREEPORT CENTER",CLEARFIELD,UT,84015,"NCFI POLYURETHANES SLC.BUILDING M-9, FREEPORT CENTER, CLEARFIELD UTAH 84015 (DAVIS)",0,C,,110025331745
84016WRTHNBUILD,-112.01799999999999,41.09,False,49,011,125600,49,49011,49011125600,1400000US49011125600,WORTHINGTON FOODS INC,BUILDING A 16-H FREEPORT CENTER,CLEARFIELD,UT,84016,"WORTHINGTON FOODS INC.BUILDING A 16-H FREEPORT CENTER, CLEARFIELD UTAH 84016 (DAVIS)",0,C,,110043694801
84016MRTNTFREEP,-112.01700000000001,41.093999999999994,False,49,011,125701,49,49011,49011125701,1400000US49011125701,THIOKOL PROPULSION CLEARFIELD OPERATIONS,1298 S FREEPORT INDUSTRIAL PKWY,CLEARFIELD,UT,84015,"THIOKOL PROPULSION CLEARFIELD OPERATIONS.1298 S FREEPORT INDUSTRIAL PKWY, CLEARFIELD UTAH 84015 (DAVIS)",2,C,,
84015NPTCH851SF,-112.022,41.104,False,49,011,125701,49,49011,49011125701,1400000US49011125701,CB&I CLEARFIELD,210 E 700 S ST,CLEARFIELD,UT,84015,"CB&I CLEARFIELD.210 E 700 S ST, CLEARFIELD UTAH 84015 (DAVIS)",0,C,,110028188244
8401WMNVSNPBX16,-112.024,41.103,False,49,011,125701,49,49011,49011125701,1400000US49011125701,MINOVA USA INC.,FREEPORT CENTER BUILDING Z15,CLEARFIELD,UT,84016,"MINOVA USA INC..FREEPORT CENTER BUILDING Z15, CLEARFIELD UTAH 84016 (DAVIS)",1,C,,110041243419
84029CLMXCHIGHW,-112.553,40.68,False,49,045,130703,49,49045,49045130703,1400000US49045130703,BASIC ELEMENTS MANUFACTURING,8400 N ELLERBECK RD,GRANTSVILLE,UT,84029,"BASIC ELEMENTS MANUFACTURING.8400 N ELLERBECK RD, GRANTSVILLE UTAH 84029 (TOOELE)",0,C,,
84029HRCLSSKULL,-112.51899999999999,40.7,False,49,045,130703,49,49045,49045130703,1400000US49045130703,HERCULES INC TEKOI,SKULL VALLEY RESERVATION,GRANTSVILLE,UT,84029,"HERCULES INC TEKOI.SKULL VALLEY RESERVATION, GRANTSVILLE UTAH 84029 (TOOELE)",0,C,,
84074TLRMYSDSTE,-112.41,40.525999999999996,False,49,045,130703,49,49045,49045130703,1400000US49045130703,U.S. ARMY TOOELE ARMY DEPOT,ATTN: JMTE-GME 1 TOOELE ARMY DEPOT BLDG 501,TOOELE,UT,840745003,"U.S. ARMY TOOELE ARMY DEPOT.ATTN: JMTE-GME 1 TOOELE ARMY DEPOT BLDG 501, TOOELE UTAH 84074 (TOOELE)",0,F,,110013864078
84074SRMYXDESER,-112.345,40.3,False,49,045,130703,49,49045,49045130703,1400000US49045130703,U.S. TOOELE ARMY DEPOT SOUTH,CMDC-CO 11500 STARK RD,STOCKTON,UT,84071,"U.S. TOOELE ARMY DEPOT SOUTH.CMDC-CO 11500 STARK RD, STOCKTON UTAH 84071 (TOOELE)",0,F,,110022521608
84071BRRCKMERCU,-112.196,40.329,False,49,045,130703,49,49045,49045130703,1400000US49045130703,BARRICK RESOURCES USA INC MERCUR GOLD MINE,MERCUR CANYON RD,STOCKTON,UT,84071,"BARRICK RESOURCES USA INC MERCUR GOLD MINE.MERCUR CANYON RD, STOCKTON UTAH 84071 (TOOELE)",0,C,,
84074BRRDY2894S,-112.354,40.473,False,49,045,130703,49,49045,49045130703,1400000US49045130703,BAUER READY MIX CONCRETE,2894 S STATE RD 36,TOOELE,UT,84074,"BAUER READY MIX CONCRETE.2894 S STATE RD 36, TOOELE UTAH 84074 (TOOELE)",0,C,,110031002126
84074HNTRP51SEM,-112.339,40.519,False,49,045,130703,49,49045,49045130703,1400000US49045130703,HUNTER PANELS A DIV OF CARLISLE CONSTRUCTION MATERIALS,501 S EMERALD AVE,TOOELE,UT,84074,"HUNTER PANELS A DIV OF CARLISLE CONSTRUCTION MATERIALS.501 S EMERALD AVE, TOOELE UTAH 84074 (TOOELE)",0,C,,110031002144
8407WGNVRC29UT1,-112.368,40.567,False,49,045,130703,49,49045,49045130703,1400000US49045130703,GENEVA ROCK,2900 UT-112,TOOELE,UT,84074,"GENEVA ROCK.2900 UT-112, TOOELE UTAH 84074 (TOOELE)",0,C,,110070570072
84029NRTHMI80WE,-112.51,40.709,False,49,045,980000,49,49045,49045980000,1400000US49045980000,NORTH AMERICAN SALT CO,I-80 W EXIT 84,GRANTSVILLE,UT,84029,"NORTH AMERICAN SALT CO.I-80 W EXIT 84, GRANTSVILLE UTAH 84029 (TOOELE)",0,C,,
84074KZSLT1428J,-112.279,40.688,False,49,045,980000,49,49045,49045980000,1400000US49045980000,AKZO NOBEL SALT INC,1428 JAMES PALMER RD,LAKE POINT,UT,84074,"AKZO NOBEL SALT INC.1428 JAMES PALMER RD, LAKE POINT UTAH 84074 (TOOELE)",0,C,,
84037BRDNN100EA,-111.936,41.038000000000004,False,49,011,127100,49,49011,49011127100,1400000US49011127100,BORDEN INC SNACKS & SPECIALTY,100 E 200 N,KAYSVILLE,UT,84037,"BORDEN INC SNACKS & SPECIALTY.100 E 200 N, KAYSVILLE UTAH 84037 (DAVIS)",0,C,,
84043RCNCRPELIC,-111.887,40.409,False,49,049,010108,49,49049,49049010108,1400000US49049010108,DYNO NOBEL INC LEHI SITE B,9210 W 1750 N,SARATOGA SPRINGS,UT,84045,"DYNO NOBEL INC LEHI SITE B.9210 W 1750 N, SARATOGA SPRINGS UTAH 84045 (UTAH)",0,C,,110000468887
84043WSTRNCENTE,-111.87100000000001,40.393,False,49,049,010110,49,49049,49049010110,1400000US49049010110,WESTERN STATES ENERGY,CENTER SECTION 3 T6S R1W,LEHI,UT,84043,"WESTERN STATES ENERGY.CENTER SECTION 3 T6S R1W, LEHI UTAH 84043 (UTAH)",0,C,,
84044HRCLS4950S,-112.09200000000001,40.668,False,49,035,113907,49,49035,49035113907,1400000US49035113907,ATK LAUNCH SYSTEMS-BACCHUS,5000 S 8400 W,MAGNA,UT,84044,"ATK LAUNCH SYSTEMS-BACCHUS.5000 S 8400 W, MAGNA UTAH 84044 (SALT LAKE)",0,C,,110002380254
84047WSTRN6952S,-111.885,40.617,False,49,035,112503,49,49035,49035112503,1400000US49035112503,WESTRONIX INC,6952 S 185 W,MIDVALE,UT,84047,"WESTRONIX INC.6952 S 185 W, MIDVALE UTAH 84047 (SALT LAKE)",0,C,,
84054BGWST333WE,-111.921,40.838,False,49,011,127002,49,49011,49011127002,1400000US49011127002,BIG WEST OIL LLC,333 W CENTER ST,NORTH SALT LAKE,UT,84054,"BIG WEST OIL LLC.333 W CENTER ST, NORTH SALT LAKE UTAH 84054 (DAVIS)",0,C,,110000468921
84054CMPNN645WE,-111.927,40.846,False,49,011,127002,49,49011,49011127002,1400000US49011127002,COMPANION SYSTEMS INC,645 W 200 N,NORTH SALT LAKE,UT,84054,"COMPANION SYSTEMS INC.645 W 200 N, NORTH SALT LAKE UTAH 84054 (DAVIS)",0,C,,110006858739
84054FXVLL633WE,-111.928,40.842,False,49,011,127002,49,49011,49011127002,1400000US49011127002,FOX VALLEY TANNING INC,633 WEST CENTER ST,NORTH SALT LAKE,UT,84054,"FOX VALLEY TANNING INC.633 WEST CENTER ST, NORTH SALT LAKE UTAH 84054 (DAVIS)",0,C,,
84116CHVRN2351N,-111.92399999999999,40.825,False,49,011,127002,49,49035,49011127002,1400000US49011127002,CHEVRON PRODUCTS CO - SALT LAKE REFINERY,2351 NORTH 1100 WEST,SALT LAKE CITY,UT,84116,"CHEVRON PRODUCTS CO - SALT LAKE REFINERY.2351 NORTH 1100 WEST, SALT LAKE CITY UTAH 84116 (SALT LAKE)",0,C,,110000469485
84054FSHRC980NO,-111.912,40.86,False,49,011,127002,49,49011,49011127002,1400000US49011127002,FISHER CO,980 NORTH MAIN ST,NORTH SALT LAKE,UT,84054,"FISHER CO.980 NORTH MAIN ST, NORTH SALT LAKE UTAH 84054 (DAVIS)",0,C,,
84054MCRXX333SR,-111.93299999999999,40.836999999999996,False,49,011,127002,49,49011,49011127002,1400000US49011127002,AMCOR MASONRY PRODUCTS,333 S. REDWOOD ROAD,NORTH SALT LAKE,UT,84054,"AMCOR MASONRY PRODUCTS.333 S. REDWOOD ROAD, NORTH SALT LAKE UTAH 84054 (DAVIS)",0,C,,110008177187
84054ZRNCL200NO,-111.92399999999999,40.846,False,49,011,127002,49,49011,49011127002,1400000US49011127002,ZERO MANUFACTURING,500 W 200 N,NORTH SALT LAKE,UT,840542734,"ZERO MANUFACTURING.500 W 200 N, NORTH SALT LAKE UTAH 84054 (DAVIS)",0,C,,110000468976
84054HLLBR75N64,-111.926,40.844,False,49,011,127002,49,49011,49011127002,1400000US49011127002,HILL BROTHERS CHEMICAL CO,75 N 64 W,NORTH SALT LAKE,UT,84054,"HILL BROTHERS CHEMICAL CO.75 N 64 W, NORTH SALT LAKE UTAH 84054 (DAVIS)",0,C,,110008973003
84054JRDNP1117N,-111.90100000000001,40.861,False,49,011,127002,49,49011,49011127002,1400000US49011127002,THOMAS PETROLEUM LLC NORTH SALT LAKE,1117 N 400 E,NORTH SALT LAKE,UT,84054,"THOMAS PETROLEUM LLC NORTH SALT LAKE.1117 N 400 E, NORTH SALT LAKE UTAH 84054 (DAVIS)",0,C,,110002136643
8405WMTLBS68NRT,-111.928,40.853,False,49,011,127002,49,49011,49011127002,1400000US49011127002,INNOPHOS NUTRITION NORTH SALT LAKE,680 N 700 W,NORTH SALT LAKE,UT,84054,"INNOPHOS NUTRITION NORTH SALT LAKE.680 N 700 W, NORTH SALT LAKE UTAH 84054 (DAVIS)",0,C,,110055129132
8405WDTCHN8EUNI,-111.91,40.858000000000004,False,49,011,127002,49,49011,49011127002,1400000US49011127002,DURA-LINE,80 E UNION AVE,NORTH SALT LAKE,UT,84054,"DURA-LINE.80 E UNION AVE, NORTH SALT LAKE UTAH 84054 (DAVIS)",0,C,,110042380839
8405WRPSCM615WE,-111.926,40.858000000000004,False,49,011,127002,49,49011,49011127002,1400000US49011127002,RPS COMPOSITES-UTAH INC,615 W 900 N,NORTH SALT LAKE,UT,84054,"RPS COMPOSITES-UTAH INC.615 W 900 N, NORTH SALT LAKE UTAH 84054 (DAVIS)",0,C,,110032662152
84054KCHMT95WES,-111.914,40.861999999999995,False,49,011,127004,49,49011,49011127004,1400000US49011127004,WESTERN EMULSIONS NORTH SALT LAKE  PLANT,95 W 1100 N,NORTH SALT LAKE,UT,84054,"WESTERN EMULSIONS NORTH SALT LAKE  PLANT.95 W 1100 N, NORTH SALT LAKE UTAH 84054 (DAVIS)",0,C,,110001884523
84087CRYSN2355S,-111.911,40.866,False,49,011,127004,49,49011,49011127004,1400000US49011127004,SILVER EAGLE REFINING WOODS CROSS,2355 S 1100 W,WOODS CROSS,UT,84087,"SILVER EAGLE REFINING WOODS CROSS.2355 S 1100 W, WOODS CROSS UTAH 84087 (DAVIS)",0,C,,110000499069
84087VLLYP727SO,-111.906,40.883,False,49,011,127004,49,49011,49011127004,1400000US49011127004,VALLEY PAINT MANUFACTURING,727 S 950 W,WOODS CROSS,UT,84087,"VALLEY PAINT MANUFACTURING.727 S 950 W, WOODS CROSS UTAH 84087 (DAVIS)",0,C,,110000469145
84054CNCNR245E1,-111.906,40.861999999999995,False,49,011,127004,49,49011,49011127004,1400000US49011127004,PHILLIPS 66 CO NORTH SALT LAKE PRODUCT TERMINAL,245 E 1100 N,NORTH SALT LAKE,UT,84054,"PHILLIPS 66 CO NORTH SALT LAKE PRODUCT TERMINAL.245 E 1100 N, NORTH SALT LAKE UTAH 84054 (DAVIS)",0,C,,110000468949
84087CHMCN2465S,-111.912,40.864000000000004,False,49,011,127004,49,49011,49011127004,1400000US49011127004,CHEMCENTRAL/SALT LAKE CITY,2465 S 1100 W,WOODS CROSS,UT,84087,"CHEMCENTRAL/SALT LAKE CITY.2465 S 1100 W, WOODS CROSS UTAH 84087 (DAVIS)",0,C,,110000469127
84087SMMTR991W1,-111.90700000000001,40.875,False,49,011,127004,49,49011,49011127004,1400000US49011127004,ERGON ASPHALT & EMULSIONS INC - WOODS CROSS,991 W 1500 S,WOODS CROSS,UT,84087,"ERGON ASPHALT & EMULSIONS INC - WOODS CROSS.991 W 1500 S, WOODS CROSS UTAH 84087 (DAVIS)",0,C,,110002270881
84087RPSTH965W8,-111.906,40.881,False,49,011,127004,49,49011,49011127004,1400000US49011127004,RPS COMPOSITES UTAH,965 W 865 S,WOODS CROSS,UT,84087,"RPS COMPOSITES UTAH.965 W 865 S, WOODS CROSS UTAH 84087 (DAVIS)",0,C,,110005211449
84057GNVST1600W,-111.734,40.297,False,49,049,002201,49,49049,49049002201,1400000US49049002201,GENEVA STEEL LLC,10 S GENEVA RD,VINEYARD,UT,84058,"GENEVA STEEL LLC.10 S GENEVA RD, VINEYARD UTAH 84058 (UTAH)",0,C,,
84057HRSCCCOGEN,-111.74799999999999,40.314,False,49,049,002201,49,49049,49049002201,1400000US49049002201,HARSCO METALS PLANT 12,C/O GENEVA STEEL GENEVA WORKS,VINEYARD,UT,84058,"HARSCO METALS PLANT 12.C/O GENEVA STEEL GENEVA WORKS, VINEYARD UTAH 84058 (UTAH)",0,C,,110000600573
84057LRCHN1165N,-111.735,40.318000000000005,False,49,049,002201,49,49049,49049002201,1400000US49049002201,GENEVA NITROGEN LLC,1165 N 1600 W,VINEYARD,UT,84057,"GENEVA NITROGEN LLC.1165 N 1600 W, VINEYARD UTAH 84057 (UTAH)",1,C,,110000468994
84057MTYLT1301W,-111.727,40.304,False,49,049,002201,49,49049,49049002201,1400000US49049002201,MITY-LITE INC,1301 W 400 N,OREM,UT,84057,"MITY-LITE INC.1301 W 400 N, OREM UTAH 84057 (UTAH)",0,C,,
84057PRSHC145NO,-111.734,40.3,False,49,049,002201,49,49049,49049002201,1400000US49049002201,PARISH CHEMICAL CO,145 N GENEVA RD,VINEYARD,UT,84057,"PARISH CHEMICAL CO.145 N GENEVA RD, VINEYARD UTAH 84057 (UTAH)",0,C,,
84058BRWNM520W2,-111.708,40.260999999999996,False,49,049,002201,49,49049,49049002201,1400000US49049002201,EIDSON BROWN-MINNEAPOLIS TANK CO,520 W 2000 S,OREM,UT,84058,"EIDSON BROWN-MINNEAPOLIS TANK CO.520 W 2000 S, OREM UTAH 84058 (UTAH)",0,C,,
84057BGTHR1100N,-111.736,40.317,False,49,049,002201,49,49049,49049002201,1400000US49049002201,ALAC PROVO ASU,1100 N GENEVA RD,OREM,UT,84057,"ALAC PROVO ASU.1100 N GENEVA RD, OREM UTAH 84057 (UTAH)",0,C,,
84057FRTKN1051I,-111.729,40.316,False,49,049,002201,49,49049,49049002201,1400000US49049002201,FORT KNOX SECURITY PRODUCTS,1051 INDUSTRIAL PKWY,OREM,UT,84057,"FORT KNOX SECURITY PRODUCTS.1051 INDUSTRIAL PKWY, OREM UTAH 84057 (UTAH)",0,C,,
84059PRXRN1000N,-111.735,40.315,False,49,049,002201,49,49049,49049002201,1400000US49049002201,PRAXAIR INC,1000 N GENEVA RD,VINEYARD,UT,84059,"PRAXAIR INC.1000 N GENEVA RD, VINEYARD UTAH 84059 (UTAH)",0,C,,
84057RTMNF1186N,-111.728,40.319,False,49,049,002201,49,49049,49049002201,1400000US49049002201,RT MANUFACTURING INC,1186 N INDUSTRIAL PARK DR,OREM,UT,84057,"RT MANUFACTURING INC.1186 N INDUSTRIAL PARK DR, OREM UTAH 84057 (UTAH)",0,C,,110000469010
84042PNRPP1610W,-111.75299999999999,40.333,False,49,049,002201,49,49049,49049002201,1400000US49049002201,PIONEER PIPE,1610 W 200 S,LINDON,UT,84042,"PIONEER PIPE.1610 W 200 S, LINDON UTAH 84042 (UTAH)",0,C,,
84042CCCST1555W,-111.75299999999999,40.333,False,49,049,002201,49,49049,49049002201,1400000US49049002201,C & C CAST POLYMERS INC,1525W 275S,LINDON,UT,84042,"C & C CAST POLYMERS INC.1525W 275S, LINDON UTAH 84042 (UTAH)",0,C,,110013337656
84059MCKLM212N1,-111.727,40.301,False,49,049,002201,49,49049,49049002201,1400000US49049002201,ALABAMA METAL INDUSTRIES CORPORATION,212 N 1330 W,OREM,UT,84057,"ALABAMA METAL INDUSTRIES CORPORATION.212 N 1330 W, OREM UTAH 84057 (UTAH)",1,C,,110020078333
84057DSGNR861NI,-111.728,40.313,False,49,049,002201,49,49049,49049002201,1400000US49049002201,DESIGNER MARBLE & CONTRACTOR SERVICES,861 N INDUSTRIAL PARK DR,OREM,UT,84057,"DESIGNER MARBLE & CONTRACTOR SERVICES.861 N INDUSTRIAL PARK DR, OREM UTAH 84057 (UTAH)",0,C,,
84058WLFLC1176S,-111.73100000000001,40.275,False,49,049,002201,49,49049,49049002201,1400000US49049002201,WOLF ELECTRONIX,1226 SOUTH 1480 WEST,OREM,UT,84058,"WOLF ELECTRONIX.1226 SOUTH 1480 WEST, OREM UTAH 84058 (UTAH)",0,C,,110020516057
84058PRCSN1315W,-111.727,40.29,False,49,049,002201,49,49049,49049002201,1400000US49049002201,PRECISION ASSEMBLY INC.,1315 W 400 S,OREM,UT,840585153,"PRECISION ASSEMBLY INC..1315 W 400 S, OREM UTAH 84058 (UTAH)",0,C,,110022524204
8405WGNVRC1565W,-111.73200000000001,40.305,False,49,049,002201,49,49049,49049002201,1400000US49049002201,GENEVA ROCK PRODUCTS INC - OREM FACILITY,1565 WEST 400 NORTH,OREM,UT,84057,"GENEVA ROCK PRODUCTS INC - OREM FACILITY.1565 WEST 400 NORTH, OREM UTAH 84057 (UTAH)",0,C,,110056133633
8405WSHWCRPINEE,-111.75299999999999,40.328,False,49,049,002201,49,49049,49049002201,1400000US49049002201,SHAWCOR,1750 N PIONEER LN,VINEYARD,UT,84058,"SHAWCOR.1750 N PIONEER LN, VINEYARD UTAH 84058 (UTAH)",0,C,,110069270265
84058SGNTC1275S,-111.676,40.273,False,49,049,001300,49,49049,49049001300,1400000US49049001300,PHILIPS SEMICONDUCTORS,1275 S 800 E,OREM,UT,84058,"PHILIPS SEMICONDUCTORS.1275 S 800 E, OREM UTAH 84058 (UTAH)",0,C,,
84062GLBLC200WE,-111.744,40.355,False,49,049,000601,49,49049,49049000601,1400000US49049000601,GLOBAL COATINGS INC.,200 W 700 S,PLEASANT GROVE,UT,84062,"GLOBAL COATINGS INC..200 W 700 S, PLEASANT GROVE UTAH 84062 (UTAH)",0,C,,110010576769
84042NTRMN1085W,-111.743,40.344,False,49,049,000601,49,49049,49049000601,1400000US49049000601,VALMONT COATINGS INTERMOUNTAIN GALVANIZING,1085 WEST 400 NORTH,LINDON,UT,84042,"VALMONT COATINGS INTERMOUNTAIN GALVANIZING.1085 WEST 400 NORTH, LINDON UTAH 84042 (UTAH)",0,C,,110011800319
84042NVRSL165W4,-111.742,40.344,False,49,049,000601,49,49049,49049000601,1400000US49049000601,UNIVERSAL INDUSTRIAL SALES INC,1065 W 400 N,LINDON,UT,84042,"UNIVERSAL INDUSTRIAL SALES INC.1065 W 400 N, LINDON UTAH 84042 (UTAH)",0,C,,110064112767
8404WCMCRB15WCE,-111.742,40.338,False,49,049,000601,49,49049,49049000601,1400000US49049000601,CMC REBAR - UT - LINDON,1050 W CENTER ST,LINDON,UT,84042,"CMC REBAR - UT - LINDON.1050 W CENTER ST, LINDON UTAH 84042 (UTAH)",0,C,,110070556428
8404WSCHFF325SG,-111.738,40.330999999999996,False,49,049,000601,49,49049,49049000601,1400000US49049000601,SCHUFF STEEL,325 S GENEVA RD,LINDON,UT,84042,"SCHUFF STEEL.325 S GENEVA RD, LINDON UTAH 84042 (UTAH)",0,C,,110070550175
84062NTDCN430NO,-111.75,40.369,False,49,049,000508,49,49049,49049000508,1400000US49049000508,NORTHWEST PIPE CO,430 N 600 W,PLEASANT GROVE,UT,84062,"NORTHWEST PIPE CO.430 N 600 W, PLEASANT GROVE UTAH 84062 (UTAH)",1,C,,110001881517
84066PNNZLWESTH,-110.126,40.389,False,49,013,940600,49,49013,49013940600,1400000US49013940600,PENNZOIL PRODUCTS CO ROOSEVELT REFINERY,WEST HWY 40,ROOSEVELT,UT,84066,"PENNZOIL PRODUCTS CO ROOSEVELT REFINERY.WEST HWY 40, ROOSEVELT UTAH 84066 (DUCHESNE)",0,C,,
84067MGCRP1821W,-112.023,41.191,False,49,057,210600,49,49057,49057210600,1400000US49057210600,IOMEGA CORP,1821 W 4000 S,ROY,UT,84067,"IOMEGA CORP.1821 W 4000 S, ROY UTAH 84067 (WEBER)",0,C,,
84070DSRTM9450S,-111.891,40.58,False,49,035,112605,49,49035,49035112605,1400000US49035112605,BD MEDICAL,9450 SOUTH STATE,SANDY,UT,84070,"BD MEDICAL.9450 SOUTH STATE, SANDY UTAH 84070 (SALT LAKE)",0,C,,110000469065
84070BLLFR9479S,-111.906,40.579,False,49,035,112605,49,49035,49035112605,1400000US49035112605,BULLFROG INTERNATIONAL LC,9479 S 500 W,SANDY,UT,84070,"BULLFROG INTERNATIONAL LC.9479 S 500 W, SANDY UTAH 84070 (SALT LAKE)",0,C,,
84074MXMGNROWLE,-112.734,40.916,False,49,045,130600,49,49045,49045130600,1400000US49045130600,US MAGNESIUM LLC,12819 N SKULL VALLEY RD,GRANTSVILLE,UT,84029,"US MAGNESIUM LLC.12819 N SKULL VALLEY RD, GRANTSVILLE UTAH 84029 (TOOELE)",0,C,,110045587352
84074PPMNCI80XX,-113.208,40.825,False,49,045,130600,49,49045,49045130600,1400000US49045130600,CLEAN HARBORS GRASSY MOUNTAIN LLC,3 MILES E 7 MILES N EXIT 41 ON I-80,GRANTSVILLE,UT,84029,"CLEAN HARBORS GRASSY MOUNTAIN LLC.3 MILES E 7 MILES N EXIT 41 ON I-80, GRANTSVILLE UTAH 84029 (TOOELE)",0,C,,110013709754
84022SRMYDSTEDP,-112.75,40.22,False,49,045,130600,49,49045,49045130600,1400000US49045130600,US ARMY DUGWAY PROVING GROUND,5330 VALDEZ CIRCLE,DUGWAY,UT,84022,"US ARMY DUGWAY PROVING GROUND.5330 VALDEZ CIRCLE, DUGWAY UTAH 84022 (TOOELE)",0,F,,110042021996
84074KZSLT1428H,-112.637,40.769,False,49,045,130600,49,49045,49045130600,1400000US49045130600,CARGILL SALT,15100 W ROWLEY RD,GRANTSVILLE,UT,84029,"CARGILL SALT.15100 W ROWLEY RD, GRANTSVILLE UTAH 84029 (TOOELE)",0,C,,110000469083
84083MCRCY333S2,-114.01299999999999,40.736999999999995,False,49,045,130600,49,49045,49045130600,1400000US49045130600,IMCO RECYCLING OF UTAH,333 S 29TH ST PO BOX 640,WENDOVER,UT,84083,"IMCO RECYCLING OF UTAH.333 S 29TH ST PO BOX 640, WENDOVER UTAH 84083 (TOOELE)",0,C,,
84029NVRCRUSINT,-113.125,40.681,False,49,045,130600,49,49045,49045130600,1400000US49045130600,ENERGYSOLUTIONS LLC,US INTERSTATE 80 EXIT 49 5 MILES S OF INTERSTATE,GRANTSVILLE,UT,84029,"ENERGYSOLUTIONS LLC.US INTERSTATE 80 EXIT 49 5 MILES S OF INTERSTATE, GRANTSVILLE UTAH 84029 (TOOELE)",0,C,,110000607184
84029SFTYK11600,-112.96799999999999,40.734,False,49,045,130600,49,49045,49045130600,1400000US49045130600,CLEAN HARBORS ARAGONITE LLC,11600 NORTH APTUS ROAD,GRANTSVILLE,UT,84029,"CLEAN HARBORS ARAGONITE LLC.11600 NORTH APTUS ROAD, GRANTSVILLE UTAH 84029 (TOOELE)",0,C,,110000906985
84029TRWLY12633,-112.736,40.91,False,49,045,130600,49,49045,49045130600,1400000US49045130600,ATI ROWLEY OPERATIONS,12633 N ROWLEY RD,NORTH SKULL VALLEY,UT,84029,"ATI ROWLEY OPERATIONS.12633 N ROWLEY RD, NORTH SKULL VALLEY UTAH 84029 (TOOELE)",0,C,,110041623142
84084FSHNC5440W,-112.02,40.576,False,49,035,115209,49,49035,49035115209,1400000US49035115209,FASHION CABINET MANUFACTURING INC.,5440 W AXEL PARK RD,WEST JORDAN,UT,84088,"FASHION CABINET MANUFACTURING INC..5440 W AXEL PARK RD, WEST JORDAN UTAH 84088 (SALT LAKE)",0,C,,110012413833
84088NTRST9780S,-112.015,40.575,False,49,035,115209,49,49035,49035115209,1400000US49035115209,INTERSTATE BRICK,9780 S 5200 W,WEST JORDAN,UT,84081,"INTERSTATE BRICK.9780 S 5200 W, WEST JORDAN UTAH 84081 (SALT LAKE)",0,C,,110000469190
84088STRFR5955W,-112.03200000000001,40.577,False,49,035,115209,49,49035,49035115209,1400000US49035115209,STARFIRE IND,5955 W WELLS PARK RD,WEST JORDAN,UT,840885660,"STARFIRE IND.5955 W WELLS PARK RD, WEST JORDAN UTAH 84088 (SALT LAKE)",0,C,,
84088MRCNW5520W,-112.04899999999999,40.559,False,49,035,115209,49,49035,49035115209,1400000US49035115209,QUALITY STEEL CORP OF MS,5520 W OLD BINGHAM HWY,WEST JORDAN,UT,84081,"QUALITY STEEL CORP OF MS.5520 W OLD BINGHAM HWY, WEST JORDAN UTAH 84081 (SALT LAKE)",0,C,,110000469172
84088LMCNC5970W,-112.03299999999999,40.583,False,49,035,115209,49,49035,49035115209,1400000US49035115209,ADP LEMCO INC,5970 W DANNON WAY,WEST JORDAN,UT,840886203,"ADP LEMCO INC.5970 W DANNON WAY, WEST JORDAN UTAH 84088 (SALT LAKE)",0,C,,
84088TTSNS4980W,-112.01100000000001,40.58,False,49,035,115209,49,49035,49035115209,1400000US49035115209,OTTO & SONS WEST JORDAN DIVISION,4980 W 9470 S,WEST JORDAN,UT,840885691,"OTTO & SONS WEST JORDAN DIVISION.4980 W 9470 S, WEST JORDAN UTAH 84088 (SALT LAKE)",0,C,,110000469225
84088DNNNC6165A,-112.036,40.583,False,49,035,115209,49,49035,49035115209,1400000US49035115209,DANONE US LLC,6165 W DANNON WAY,WEST JORDAN,UT,84081,"DANONE US LLC.6165 W DANNON WAY, WEST JORDAN UTAH 84081 (SALT LAKE)",0,C,,110000469154
84088JRDNR5447W,-112.02,40.576,False,49,035,115209,49,49035,49035115209,1400000US49035115209,JORDAN RIVER GALVANIZING,5447 AXLE PARK RD,WEST JORDAN,UT,84081,"JORDAN RIVER GALVANIZING.5447 AXLE PARK RD, WEST JORDAN UTAH 84081 (SALT LAKE)",0,C,,110015780341
