TRIFID,LONGITUDE,LATITUDE,ESTIMATE,STATEFP,COUNTYFP,TRACTCE,STATEGEOID,COUNTYGEOID,TRACTGEOID,AFFGEOID,FACILITY_NAME,STREET,CITY,STUSPS,ZIP_CODE,FACILITY,FAC_CLOSED_IND,ASGN_FEDERAL_IND,BIA_CODE,EPA_REGISTRY_ID
84713CCHVL330WE,-112.93,38.211,False,49,001,100200,49,49001,49001100200,1400000US49001100200,DAIRY FARMERS OF AMERICA INC BEAVER UT,330 WEST 300 SOUTH,BEAVER,UT,84713,"DAIRY FARMERS OF AMERICA INC BEAVER UT.330 WEST 300 SOUTH, BEAVER UTAH 84713 (BEAVER)",0,C,,110001132809
84751MRPHY585E6,-112.999,38.389,False,49,001,100200,49,49001,49001100200,1400000US49001100200,MURPHY-BROWN LLC CIRCLE 4 FEED MILL,585 E 6TH AVE,MILFORD,UT,84751,"MURPHY-BROWN LLC CIRCLE 4 FEED MILL.585 E 6TH AVE, MILFORD UTAH 84751 (BEAVER)",0,C,,110002159690
84752SMTHF36WTH,-112.92399999999999,38.214,False,49,001,100200,49,49001,49001100200,1400000US49001100200,SMITHFIELD BIOENERGY LLC,3600 W THERMO RD,MINERSVILLE,UT,84752,"SMITHFIELD BIOENERGY LLC.3600 W THERMO RD, MINERSVILLE UTAH 84752 (BEAVER)",0,C,,110024887620
84020CTTNW12757,-111.891,40.52,False,49,035,112817,49,49035,49035112817,1400000US49035112817,COTTONWOOD CABINETS,12757 S MINUTEMAN DR,DRAPER,UT,84020,"COTTONWOOD CABINETS.12757 S MINUTEMAN DR, DRAPER UTAH 84020 (SALT LAKE)",0,C,,
84020BLLRD12050,-111.896,40.532,False,49,035,112817,49,49035,49035112817,1400000US49035112817,BALLARD MEDICAL PRODUCTS,12050 LONE PEAK PKWY,DRAPER,UT,84020,"BALLARD MEDICAL PRODUCTS.12050 LONE PEAK PKWY, DRAPER UTAH 84020 (SALT LAKE)",0,C,,110000468841
84070NLMTD1175S,-111.891,40.551,False,49,035,112817,49,49035,49035112817,1400000US49035112817,UNLIMITED DESIGNS INC.,11075 S STATE SUITE 30,SANDY,UT,84070,"UNLIMITED DESIGNS INC..11075 S STATE SUITE 30, SANDY UTAH 84070 (SALT LAKE)",0,C,,110037148510
8402WGNVRC15547,-111.90100000000001,40.541,False,49,035,112817,49,49035,49035112817,1400000US49035112817,GENEVA ROCK PRODUCTS INC,15547 SOUTH 300 WEST,DRAPER,UT,84020,"GENEVA ROCK PRODUCTS INC.15547 SOUTH 300 WEST, DRAPER UTAH 84020 (SALT LAKE)",0,C,,110005210388
84044HRCLS6800W,-112.054,40.654,False,49,035,113525,49,49035,49035113525,1400000US49035113525,HEXCEL CORP,5400 S 6800 W,WEST VALLEY CITY,UT,84119,"HEXCEL CORP.5400 S 6800 W, WEST VALLEY CITY UTAH 84119 (SALT LAKE)",0,C,,110020094351
84118BRDYC4825S,-112.037,40.665,False,49,035,113525,49,49035,49035113525,1400000US49035113525,BRODY CHEMICAL,6125 W DOUBLE EAGLE CIR,SALT LAKE CITY,UT,84118,"BRODY CHEMICAL.6125 W DOUBLE EAGLE CIR, SALT LAKE CITY UTAH 84118 (SALT LAKE)",0,C,,110042338832
84118RCTNC6301W,-112.04,40.668,False,49,035,113525,49,49035,49035113525,1400000US49035113525,FRITO-LAY INC.,6301 W 4700 S,WEST VALLEY CITY,UT,84118,"FRITO-LAY INC..6301 W 4700 S, WEST VALLEY CITY UTAH 84118 (SALT LAKE)",0,C,,110009508568
84118SPSTC5195W,-112.014,40.668,False,49,035,113539,49,49035,49035113539,1400000US49035113539,SPS TECHS INC,5195 W 4700 S,SALT LAKE CITY,UT,84118,"SPS TECHS INC.5195 W 4700 S, SALT LAKE CITY UTAH 84118 (SALT LAKE)",0,C,,
84302VLCRF1875W,-112.05799999999999,41.532,False,49,003,960500,49,49003,49003960500,1400000US49003960500,NUCOR CORP VULCRAFT DIV,1875 W HWY 13,BRIGHAM CITY,UT,84302,"NUCOR CORP VULCRAFT DIV.1875 W HWY 13, BRIGHAM CITY UTAH 84302 (BOX ELDER)",0,C,,110000771291
84302MRTNT250AM,-112.03,41.516000000000005,False,49,003,960500,49,49003,49003960500,1400000US49003960500,AUTOLIV NA,250 AMERICAN WAY,BRIGHAM CITY,UT,84302,"AUTOLIV NA.250 AMERICAN WAY, BRIGHAM CITY UTAH 84302 (BOX ELDER)",0,C,,110000469680
84302STHRN920W6,-112.031,41.522,False,49,003,960500,49,49003,49003960500,1400000US49003960500,CMC SOUTHERN POST UTAH,920 W 600 N,BRIGHAM CITY,UT,84302,"CMC SOUTHERN POST UTAH.920 W 600 N, BRIGHAM CITY UTAH 84302 (BOX ELDER)",0,C,,110000495394
84302STRMP165S8,-112.02799999999999,41.507,False,49,003,960500,49,49003,49003960500,1400000US49003960500,STORM PRODUCTS INC.,165 S 800 W,BRIGHAM CITY,UT,84302,"STORM PRODUCTS INC..165 S 800 W, BRIGHAM CITY UTAH 84302 (BOX ELDER)",0,C,,110013327435
84302NCRBL15NWA,-112.04899999999999,41.526,False,49,003,960500,49,49003,49003960500,1400000US49003960500,NUCOR BUILDING SYSTEMS LLC-UTAH,1050 N WATERY LN,BRIGHAM CITY,UT,84302,"NUCOR BUILDING SYSTEMS LLC-UTAH.1050 N WATERY LN, BRIGHAM CITY UTAH 84302 (BOX ELDER)",0,C,,110039075336
84402FLMCB1483W,-112.015,41.22,False,49,057,210505,49,49057,49057210505,1400000US49057210505,BARNES AEROSPACE OGDEN DIV,1025 S. DEPOT DRIVE,OGDEN,UT,84404,"BARNES AEROSPACE OGDEN DIV.1025 S. DEPOT DRIVE, OGDEN UTAH 84404 (WEBER)",0,C,,110008176320
84402WLLSN1741W,-112.022,41.22,False,49,057,210505,49,49057,49057210505,1400000US49057210505,WELLS INDUSTRIES INC,1741 W 2550 S,OGDEN,UT,844021619,"WELLS INDUSTRIES INC.1741 W 2550 S, OGDEN UTAH 84402 (WEBER)",0,C,,
84401STKRP2350S,-112.02600000000001,41.225,False,49,057,210505,49,49057,49057210505,1400000US49057210505,"SEMMATERIALS, L.P. - OGDEN UT",2350 S 1900 W,OGDEN,UT,84401,"SEMMATERIALS, L.P. - OGDEN UT.2350 S 1900 W, OGDEN UTAH 84401 (WEBER)",0,C,,110002470200
8440WWSTHV16S25,-112.029,41.233999999999995,False,49,057,210505,49,49057,49057210505,1400000US49057210505,WEST HAVEN BATCH PLANT,1600 S 2050 W,OGDEN,UT,84401,"WEST HAVEN BATCH PLANT.1600 S 2050 W, OGDEN UTAH 84401 (WEBER)",0,C,,110046339084
84501KLFGL1510S,-110.81,39.6,False,49,007,000300,49,49007,49007000300,1400000US49007000300,KILFOYLE KRAFTS,1510 S CARBON ON HAY 10,PRICE,UT,845010917,"KILFOYLE KRAFTS.1510 S CARBON ON HAY 10, PRICE UTAH 84501 (CARBON)",0,C,,110000469993
84720MRCNZ10622,-113.113,37.795,False,49,021,110200,49,49021,49021110200,1400000US49021110200,AMERICAN PACIFIC CORP UTAH OPERATIONS,10622 W 6400 N,CEDAR CITY,UT,84721,"AMERICAN PACIFIC CORP UTAH OPERATIONS.10622 W 6400 N, CEDAR CITY UTAH 84721 (IRON)",0,C,,110000566593
84010TNKNW525WE,-111.87,40.893,False,49,011,126500,49,49011,49011126500,1400000US49011126500,HK SYSTEMS INC,525 W 350 N,WEST BOUNTIFUL,UT,84101,"HK SYSTEMS INC.525 W 350 N, WEST BOUNTIFUL UTAH 84101 (DAVIS)",0,C,,
84043GNRLR2200N,-111.869,40.417,False,49,049,010214,49,49049,49049010214,1400000US49049010214,UTAH REFRACTORIES CORP,2200 N 1200 W,LEHI,UT,84043,"UTAH REFRACTORIES CORP.2200 N 1200 W, LEHI UTAH 84043 (UTAH)",0,C,,110064205444
84104PRSRC977SO,-111.911,40.748000000000005,False,49,035,102801,49,49035,49035102801,1400000US49035102801,PRS INC,977 S 700 W,SALT LAKE CITY,UT,84104,"PRS INC.977 S 700 W, SALT LAKE CITY UTAH 84104 (SALT LAKE)",0,C,,
84115PXCXX580W1,-111.90799999999999,40.742,False,49,035,102801,49,49035,49035102801,1400000US49035102801,PAX CO,580 W 13TH ST,SALT LAKE CITY,UT,841155197,"PAX CO.580 W 13TH ST, SALT LAKE CITY UTAH 84115 (SALT LAKE)",0,C,,
84720GRMNF2695W,-113.105,37.685,False,49,021,110701,49,49021,49021110701,1400000US49021110701,GOER MFG CO,2695 W HWY 56,CEDAR CITY,UT,84720,"GOER MFG CO.2695 W HWY 56, CEDAR CITY UTAH 84720 (IRON)",0,C,,
84720NDRSN1033N,-113.095,37.695,False,49,021,110701,49,49021,49021110701,1400000US49021110701,ANDERSON HICKEY CO,1033 N PRODUCTION RD,CEDAR CITY,UT,84720,"ANDERSON HICKEY CO.1033 N PRODUCTION RD, CEDAR CITY UTAH 84720 (IRON)",0,C,,
84720MTLCR498N2,-113.102,37.685,False,49,021,110701,49,49021,49021110701,1400000US49021110701,METALCRAFT TECHNOLOGIES INC,498 N 2774 W,CEDAR CITY,UT,84720,"METALCRAFT TECHNOLOGIES INC.498 N 2774 W, CEDAR CITY UTAH 84720 (IRON)",0,C,,
84720WSTRN997NO,-113.089,37.694,False,49,021,110701,49,49021,49021110701,1400000US49021110701,WESTERN QUALITY FOODS LLC,997 N AIRPORT RD,CEDAR CITY,UT,84721,"WESTERN QUALITY FOODS LLC.997 N AIRPORT RD, CEDAR CITY UTAH 84721 (IRON)",0,C,,110000470142
84720MTLCR597N1,-113.08200000000001,37.685,False,49,021,110701,49,49021,49021110701,1400000US49021110701,METALCRAFT PRECISION COMPONENTS LC,597 N 1500 W,CEDAR CITY,UT,84720,"METALCRAFT PRECISION COMPONENTS LC.597 N 1500 W, CEDAR CITY UTAH 84720 (IRON)",0,C,,
84720CDRCT145NB,-113.079,37.703,False,49,021,110701,49,49021,49021110701,1400000US49021110701,CEDAR CITY ASPHALT & CONCRETE PLANTS,1405 N BULLDOG RD,CEDAR CITY,UT,84721,"CEDAR CITY ASPHALT & CONCRETE PLANTS.1405 N BULLDOG RD, CEDAR CITY UTAH 84721 (IRON)",0,C,,110025331996
84720SFRST1635N,-113.087,37.708,False,49,021,110701,49,49021,49021110701,1400000US49021110701,U.S. FOREST SERVICE CEDAR CITY AIRTANKER BASE,1635 N AIRPORT RD,CEDAR CITY,UT,84720,"U.S. FOREST SERVICE CEDAR CITY AIRTANKER BASE.1635 N AIRPORT RD, CEDAR CITY UTAH 84720 (IRON)",0,F,,110025332012
84720WHTWV2172W,-113.09,37.693000000000005,False,49,021,110701,49,49021,49021110701,1400000US49021110701,WHITEWAVE FOODS,2172 W INDUSTRY WAY,CEDAR CITY,UT,84720,"WHITEWAVE FOODS.2172 W INDUSTRY WAY, CEDAR CITY UTAH 84720 (IRON)",0,C,,110006624206
8472WCDRCT197NB,-113.079,37.713,False,49,021,110701,49,49021,49021110701,1400000US49021110701,CEDAR CITY,1970 N BULLDOG RD,CEDAR CITY,UT,84721,"CEDAR CITY.1970 N BULLDOG RD, CEDAR CITY UTAH 84721 (IRON)",0,C,,110070566213
84003NTNLS620SO,-111.789,40.364000000000004,False,49,049,000400,49,49049,49049000400,1400000US49049000400,NATIONAL SECURITY SAFE CO,620 S 380 E,AMERICAN FORK,UT,84003,"NATIONAL SECURITY SAFE CO.620 S 380 E, AMERICAN FORK UTAH 84003 (UTAH)",0,C,,
84041SMTHS500NS,-111.988,41.067,False,49,011,126002,49,49011,49011126002,1400000US49011126002,KROGER CORP SMITHS FOOD & DRUG DAIRY DIV,500 N SUGAR ST,LAYTON,UT,84041,"KROGER CORP SMITHS FOOD & DRUG DAIRY DIV.500 N SUGAR ST, LAYTON UTAH 84041 (DAVIS)",0,C,,110000468850
84117GLLLB1011E,-111.86200000000001,40.666,False,49,035,111904,49,49035,49035111904,1400000US49035111904,GULL LABORATORIES INC,1011 EAST 4800 SOUTH,SALT LAKE CITY,UT,84117,"GULL LABORATORIES INC.1011 EAST 4800 SOUTH, SALT LAKE CITY UTAH 84117 (SALT LAKE)",0,C,,
84321LGNCC290S4,-111.846,41.726000000000006,False,49,005,001002,49,49005,49005001002,1400000US49005001002,LOGAN COACH INC,290 S 400 W,LOGAN,UT,84321,"LOGAN COACH INC.290 S 400 W, LOGAN UTAH 84321 (CACHE)",0,C,,
84321BCRXX710W2,-111.852,41.735,False,49,005,001002,49,49005,49005001002,1400000US49005001002,BAICOR,710 W 200 N,LOGAN,UT,84321,"BAICOR.710 W 200 N, LOGAN UTAH 84321 (CACHE)",0,C,,
84648NPHRB255WE,-111.839,39.725,False,49,023,010100,49,49023,49023010100,1400000US49023010100,NRPJONESLLC,255 W 1100 N,NEPHI,UT,84648,"NRPJONESLLC.255 W 1100 N, NEPHI UTAH 84648 (JUAB)",0,C,,110011800275
84770VRXSY3301D,-113.51799999999999,37.115,False,49,053,271100,49,49053,49053271100,1400000US49053271100,OMG APEX,15 MILES W HWY 91,SAINT GEORGE,UT,84770,"OMG APEX.15 MILES W HWY 91, SAINT GEORGE UTAH 84770 (WASHINGTON)",0,C,,
84790CBNTC188N3,-113.521,37.115,False,49,053,271100,49,49053,49053271100,1400000US49053271100,CABINETEC,188 N 3050 E,SAINT GEORGE,UT,84790,"CABINETEC.188 N 3050 E, SAINT GEORGE UTAH 84790 (WASHINGTON)",0,C,,110001883793
84780HNSNP99S1E,-113.508,37.116,False,49,053,271100,49,49053,49053271100,1400000US49053271100,HANSON PIPE & PRECAST INC WASHINGTON UT,990 S 100 E,WASHINGTON,UT,84780,"HANSON PIPE & PRECAST INC WASHINGTON UT.990 S 100 E, WASHINGTON UTAH 84780 (WASHINGTON)",0,C,,110031018351
84016LFTMPBUILD,-112.03299999999999,41.083999999999996,False,49,011,125406,49,49011,49011125406,1400000US49011125406,LIFETIME PRODUCTS INC,FREEPORT CENTER BUILDING D-11,CLEARFIELD,UT,84016,"LIFETIME PRODUCTS INC.FREEPORT CENTER BUILDING D-11, CLEARFIELD UTAH 84016 (DAVIS)",0,C,,110000746587
84088NTTRM4080W,-111.95,40.596,False,49,035,112920,49,49035,49035112920,1400000US49035112920,NATTER MANUFACTURING INC,4080 W 8540 S,WEST JORDAN,UT,84088,"NATTER MANUFACTURING INC.4080 W 8540 S, WEST JORDAN UTAH 84088 (SALT LAKE)",2,C,,
84107VCTNV4231S,-111.88799999999999,40.679,False,49,035,112001,49,49035,49035112001,1400000US49035112001,VACATION VILLAGE INC.,4231 S STATE ST,SALT LAKE CITY,UT,84107,"VACATION VILLAGE INC..4231 S STATE ST, SALT LAKE CITY UTAH 84107 (SALT LAKE)",0,C,,110000469449
84116MRKST1230W,-111.928,40.765,False,49,035,102702,49,49035,49035102702,1400000US49035102702,MARK STEEL CORP JORDAN RIVER PLANT,1230 WEST 200 SOUTH,SALT LAKE CITY,UT,84104,"MARK STEEL CORP JORDAN RIVER PLANT.1230 WEST 200 SOUTH, SALT LAKE CITY UTAH 84104 (SALT LAKE)",0,C,,110005197072
84339MVMWL185E3,-111.93,41.645,False,49,005,001300,49,49005,49005001300,1400000US49005001300,MVM WELLSVILLE DAIRY,185 E 300 N,WELLSVILLE,UT,84339,"MVM WELLSVILLE DAIRY.185 E 300 N, WELLSVILLE UTAH 84339 (CACHE)",0,C,,
84068LCSWS6125S,-111.48200000000001,40.721,False,49,043,964102,49,49043,49043964102,1400000US49043964102,LUCAS AEROSPACE GEARED SYSTEMS,6125 SILVER CREEK DR,PARK CITY,UT,840680910,"LUCAS AEROSPACE GEARED SYSTEMS.6125 SILVER CREEK DR, PARK CITY UTAH 84068 (SUMMIT)",0,C,,
84068PPRMP6280S,-111.48200000000001,40.721,False,49,043,964102,49,49043,49043964102,1400000US49043964102,"PIPER IMPACT INC, UTAH DIV",6280 SILVER CREEK DR,PARK CITY,UT,840681990,"PIPER IMPACT INC, UTAH DIV.6280 SILVER CREEK DR, PARK CITY UTAH 84068 (SUMMIT)",0,C,,
8406WGNVRC248AT,-111.461,40.686,False,49,043,964102,49,49043,49043964102,1400000US49043964102,GENEVA ROCK PRODUCTS INC - PARK CITY FACILITY,248 ATKINSON ROAD,PARK CITY,UT,84060,"GENEVA ROCK PRODUCTS INC - PARK CITY FACILITY.248 ATKINSON ROAD, PARK CITY UTAH 84060 (SUMMIT)",0,C,,110067127479
84302MRTNT9160A,-112.227,41.575,False,49,003,960400,49,49003,49003960400,1400000US49003960400,AUTOLIV ASP INC PROMONTORY,16700 W HWY 83 ASP-4,PROMONTORY,UT,84307,"AUTOLIV ASP INC PROMONTORY.16700 W HWY 83 ASP-4, PROMONTORY UTAH 84307 (BOX ELDER)",0,C,,110015675599
8430WPRCTR5NRTH,-112.17299999999999,41.598,False,49,003,960400,49,49003,49003960400,1400000US49003960400,THE PROCTER & GAMBLE PAPER PRODUCTS CO,5000 NORTH IOWA STRING RD,BEAR RIVER CITY,UT,84301,"THE PROCTER & GAMBLE PAPER PRODUCTS CO.5000 NORTH IOWA STRING RD, BEAR RIVER CITY UTAH 84301 (BOX ELDER)",0,C,,110043263544
84414DMRLB2700N,-112.00299999999999,41.308,False,49,057,210304,49,49057,49057210304,1400000US49057210304,ADMIRAL BEVERAGE CORP,2751 N 1000 W,OGDEN,UT,844142144,"ADMIRAL BEVERAGE CORP.2751 N 1000 W, OGDEN UTAH 84414 (WEBER)",0,C,,
84660CRSSN1550N,-111.64399999999999,40.13,False,49,049,010304,49,49049,49049010304,1400000US49049010304,SAPA EXTRUSIONS INC,1550 NORTH KIRBY LN,SPANISH FORK,UT,84660,"SAPA EXTRUSIONS INC.1550 NORTH KIRBY LN, SPANISH FORK UTAH 84660 (UTAH)",0,C,,110000470099
84770QRSKT516NI,-113.56,37.117,False,49,053,271200,49,49053,49053271200,1400000US49053271200,AQUARIUS KITCHEN & BATH,516 N INDUSTRIAL RD,SAINT GEORGE,UT,84770,"AQUARIUS KITCHEN & BATH.516 N INDUSTRIAL RD, SAINT GEORGE UTAH 84770 (WASHINGTON)",0,C,,
84770STGRG1301E,-113.557,37.12,False,49,053,271200,49,49053,49053271200,1400000US49053271200,ST GEORGE STEEL LLC,1301 E 700 N,SAINT GEORGE,UT,84770,"ST GEORGE STEEL LLC.1301 E 700 N, SAINT GEORGE UTAH 84770 (WASHINGTON)",0,C,,110000470151
84770RMNMR451N1,-113.557,37.116,False,49,053,271200,49,49053,49053271200,1400000US49053271200,ROMAN MARBLE CO INC,451 N 1300 E,SAINT GEORGE,UT,84770,"ROMAN MARBLE CO INC.451 N 1300 E, SAINT GEORGE UTAH 84770 (WASHINGTON)",0,C,,
84770HYCCK845NI,-113.557,37.121,False,49,053,271200,49,49053,49053271200,1400000US49053271200,THOMAS PETROLEUM SAINT GEORGE BULK PLANT,845 N INDUSTRIAL RD,SAINT GEORGE,UT,84770,"THOMAS PETROLEUM SAINT GEORGE BULK PLANT.845 N INDUSTRIAL RD, SAINT GEORGE UTAH 84770 (WASHINGTON)",0,C,,110056978677
84056SRFRC7274W,-112.021,41.128,False,49,011,125200,49,49011,49011125200,1400000US49011125200,US DOD USAF HILL AFB,6044 DOGWOOD AVE,HILL AFB,UT,84056,"US DOD USAF HILL AFB.6044 DOGWOOD AVE, HILL AFB UTAH 84056 (DAVIS)",0,F,,110064299085
84058WSTRN1625N,-111.69,40.328,False,49,049,000708,49,49049,49049000708,1400000US49049000708,WESTERN PIPE COATERS,1610 N 250 W,VINEYARD,UT,84058,"WESTERN PIPE COATERS.1610 N 250 W, VINEYARD UTAH 84058 (UTAH)",0,C,,
84062SKYLN382WE,-111.74700000000001,40.365,False,49,049,000509,49,49049,49049000509,1400000US49049000509,SKYLINE IND,382 W CENTER ST,PLEASANT GROVE,UT,84062,"SKYLINE IND.382 W CENTER ST, PLEASANT GROVE UTAH 84062 (UTAH)",0,C,,
84062TMTRP35WCE,-111.74700000000001,40.365,False,49,049,000509,49,49049,49049000509,1400000US49049000509,AUTO METER PRODUCTS  PLEASANT GROVE FACILITY,350 W CENTER ST,PLEASANT GROVE,UT,84062,"AUTO METER PRODUCTS  PLEASANT GROVE FACILITY.350 W CENTER ST, PLEASANT GROVE UTAH 84062 (UTAH)",0,C,,110009506169
84070HRMNM8670S,-111.905,40.593,False,49,035,112403,49,49035,49035112403,1400000US49035112403,HARMAN MUSIC GROUP INC,8670 S SANDY PKWY,SANDY,UT,84070,"HARMAN MUSIC GROUP INC.8670 S SANDY PKWY, SANDY UTAH 84070 (SALT LAKE)",0,C,,110010576830
84115CNXSP580WE,-111.87200000000001,40.784,False,49,035,101000,49,49035,49035101000,1400000US49035101000,CENEX SUPPLY & MARKETING INC,580 W 13TH ST,SALT LAKE CITY,UT,841155197,"CENEX SUPPLY & MARKETING INC.580 W 13TH ST, SALT LAKE CITY UTAH 84115 (SALT LAKE)",0,C,,
84407SDDDF500W1,-112.0,41.25899999999999,False,49,057,200300,49,49057,49057200300,1400000US49057200300,"US DEFENSE LOGISTICS AGENCY, OGDEN DISTRIBUTION DEPOT",500 W 12TH ST,OGDEN,UT,844075803,"US DEFENSE LOGISTICS AGENCY, OGDEN DISTRIBUTION DEPOT.500 W 12TH ST, OGDEN UTAH 84407 (WEBER)",1,F,,
84315NTRPC736WH,-111.99600000000001,41.284,False,49,057,200300,49,49057,49057200300,1400000US49057200300,INTERPACE HOLDINGS LLC,736 W HARRISVILLE RD,HARRISVILLE,UT,84404,"INTERPACE HOLDINGS LLC.736 W HARRISVILLE RD, HARRISVILLE UTAH 84404 (WEBER)",0,C,,110001881786
84404LKYWS551SD,-111.99700000000001,41.253,False,49,057,200300,49,49057,49057200300,1400000US49057200300,ELKAY PLUMBING PRODUCTS CO,551 S DEPOT DR,OGDEN,UT,84404,"ELKAY PLUMBING PRODUCTS CO.551 S DEPOT DR, OGDEN UTAH 84404 (WEBER)",0,C,,110039204802
8440WBRNSR125SU,-111.995,41.247,False,49,057,200300,49,49057,49057200300,1400000US49057200300,BARNES AEROSPACE OGDEN DIV,1025 S DEPOT DR,OGDEN,UT,84404,"BARNES AEROSPACE OGDEN DIV.1025 S DEPOT DR, OGDEN UTAH 84404 (WEBER)",0,C,,110037445921
8440WRLCRP215N7,-111.995,41.266000000000005,False,49,057,200300,49,49057,49057200300,1400000US49057200300,RALCORP FROZEN BAKERY INC (TREEHOUSE FOODS),215 N 700 W,OGDEN,UT,84404,"RALCORP FROZEN BAKERY INC (TREEHOUSE FOODS).215 N 700 W, OGDEN UTAH 84404 (WEBER)",0,C,,110069293687
84050HLNMN6055E,-111.53200000000001,41.063,False,49,029,970100,49,49029,49029970100,1400000US49029970100,HOLCIM (US) INC DEVIL'S SLIDE PLANT,6055 E CROYDON RD,MORGAN,UT,84050,"HOLCIM (US) INC DEVIL'S SLIDE PLANT.6055 E CROYDON RD, MORGAN UTAH 84050 (MORGAN)",0,C,,110012414128
84050BRWNN1BROW,-111.76899999999999,41.148999999999994,False,49,029,970100,49,49029,49029970100,1400000US49029970100,BROWNING ARMS CO,1 BROWNING PL,MORGAN,UT,84050,"BROWNING ARMS CO.1 BROWNING PL, MORGAN UTAH 84050 (MORGAN)",0,C,,110012700737
84335CNSMT935SO,-111.833,41.818000000000005,False,49,005,000202,49,49005,49005000202,1400000US49005000202,ICON SMITHFIELD SOUTH,935 S MAIN,SMITHFIELD,UT,84335,"ICON SMITHFIELD SOUTH.935 S MAIN, SMITHFIELD UTAH 84335 (CACHE)",0,C,,
84335STKRP250N3,-111.824,41.842,False,49,005,000202,49,49005,49005000202,1400000US49005000202,STAKER & PARSON COMPANIES SMITHFIELD PLANT,250 N 300 E,SMITHFIELD,UT,84335,"STAKER & PARSON COMPANIES SMITHFIELD PLANT.250 N 300 E, SMITHFIELD UTAH 84335 (CACHE)",0,C,,110001880572
84060PRKCT248EH,-111.82,41.842,False,49,005,000202,49,49043,49005000202,1400000US49005000202,PARK CITY READY-MIX CONCRETE,248 E HWY 40,PARK CITY,UT,84060,"PARK CITY READY-MIX CONCRETE.248 E HWY 40, PARK CITY UTAH 84060 (SUMMIT)",0,C,,110002322157
84784BRNTW689NS,-113.0,37.001999999999995,False,49,053,270100,49,49053,49053270100,1400000US49053270100,BRENTWOOD IND INC,689 N STATE ST,HILDALE,UT,84784,"BRENTWOOD IND INC.689 N STATE ST, HILDALE UTAH 84784 (WASHINGTON)",1,C,,
84784FRSTW138WF,-113.005,37.001999999999995,False,49,053,270100,49,49053,49053270100,1400000US49053270100,FORESTWOOD INDUSTRIAL INC.,1380 W FIELD AVE,HILDALE,UT,84784,"FORESTWOOD INDUSTRIAL INC..1380 W FIELD AVE, HILDALE UTAH 84784 (WASHINGTON)",0,C,,110020516128
84767SNTLPZINNA,-112.988,37.2,False,49,053,270100,49,49053,49053270100,1400000US49053270100,U.S. NATL. PARK SERVICE ZION NATIONAL PARK (ZION),ZION NATIONAL PARK SR9,SPRINGDALE,UT,84767,"U.S. NATL. PARK SERVICE ZION NATIONAL PARK (ZION).ZION NATIONAL PARK SR9, SPRINGDALE UTAH 84767 (WASHINGTON)",0,F,,110006883051
84646MRNFD350SO,-111.594,39.519,False,49,039,972200,49,49039,49039972200,1400000US49039972200,MORONI TURKEY PROCESSING,350 S 300 W,MORONI,UT,84646,"MORONI TURKEY PROCESSING.350 S 300 W, MORONI UTAH 84646 (SANPETE)",0,C,,110000470062
8464WFDMLL15EAS,-111.58200000000001,39.501,False,49,039,972200,49,49039,49039972200,1400000US49039972200,FEED MILL,15 E 1900 S FEED MILL RD,MORONI,UT,84646,"FEED MILL.15 E 1900 S FEED MILL RD, MORONI UTAH 84646 (SANPETE)",0,C,,110064460266
84737PCMRC210NH,-113.417,37.172,False,49,053,270902,49,49053,49053270902,1400000US49053270902,PACE AMERICAN OF UTAH,210 N HWY 91,HURRICANE,UT,84737,"PACE AMERICAN OF UTAH.210 N HWY 91, HURRICANE UTAH 84737 (WASHINGTON)",0,C,,
8473WSSSTL2292W,-113.33,37.184,False,49,053,270902,49,49053,49053270902,1400000US49053270902,S&S STEEL FABRICATION,2292 WEST 500 NORTH,HURRICANE,UT,84737,"S&S STEEL FABRICATION.2292 WEST 500 NORTH, HURRICANE UTAH 84737 (WASHINGTON)",0,C,,
8473WSNRCC155NR,-113.42299999999999,37.169000000000004,False,49,053,270902,49,49053,49053270902,1400000US49053270902,SUNROC CORP,155 NORTH OLD HIGHWAY 91,HURRICANE,UT,84737,"SUNROC CORP.155 NORTH OLD HIGHWAY 91, HURRICANE UTAH 84737 (WASHINGTON)",0,C,,110027235301
84006KNNCT12300,-112.15,40.516999999999996,False,49,035,113105,49,49035,49035113105,1400000US49035113105,KENNECOTT UTAH COPPER MINE CONCENTRATORS & POWER PLANT,8362 WEST 10200 SOUTH,BINGHAM CANYON,UT,84006,"KENNECOTT UTAH COPPER MINE CONCENTRATORS & POWER PLANT.8362 WEST 10200 SOUTH, BINGHAM CANYON UTAH 84006 (SALT LAKE)",0,C,,110000468805
84006KNNCT8200S,-112.09899999999999,40.584,False,49,035,113105,49,49035,49035113105,1400000US49035113105,KENNECOTT BARNEYS CANYON MINING CO,8200 SOUTH 9600 WEST,COPPERTON,UT,840060311,"KENNECOTT BARNEYS CANYON MINING CO.8200 SOUTH 9600 WEST, COPPERTON UTAH 84006 (SALT LAKE)",0,C,,110042022085
84078BNNZP12500,-109.28399999999999,40.086,False,49,047,940201,49,49047,49047940201,1400000US49047940201,BONANZA POWER PLANT,12500 E 25500 S,VERNAL,UT,84078,"BONANZA POWER PLANT.12500 E 25500 S, VERNAL UTAH 84078 (UINTAH)",0,C,687,110015757670
8406WRLDYN4269E,-109.92,40.302,False,49,047,940201,49,49047,49047940201,1400000US49047940201,RELADYNE WEST,4269 E MAIN STREET,BALLARD,UT,84066,"RELADYNE WEST.4269 E MAIN STREET, BALLARD UTAH 84066 (UINTAH)",0,C,,110070068326
84118BSCPR6087W,-112.035,40.653,False,49,035,113526,49,49035,49035113526,1400000US49035113526,FORTERRA STRUCTURAL SPECIALTY PRODUCTS - WEST VALLEY,6087 W 5400 S,WEST VALLEY CITY,UT,84118,"FORTERRA STRUCTURAL SPECIALTY PRODUCTS - WEST VALLEY.6087 W 5400 S, WEST VALLEY CITY UTAH 84118 (SALT LAKE)",0,C,,110000469555
8411WWSTVL6685W,-112.051,40.653,False,49,035,113526,49,49035,49035113526,1400000US49035113526,WEST VALLEY,6685 W 5400 S,WEST VALLEY CITY,UT,84118,"WEST VALLEY.6685 W 5400 S, WEST VALLEY CITY UTAH 84118 (SALT LAKE)",0,C,,110070070514
8411WGNVRC62S64,-112.041,40.639,False,49,035,113526,49,49035,49035113526,1400000US49035113526,GENEVA ROCK PRODUCTS   BACCHUS PIT,4699 S 6400 W,WEST VALLEY CITY,UT,84128,"GENEVA ROCK PRODUCTS   BACCHUS PIT.4699 S 6400 W, WEST VALLEY CITY UTAH 84128 (SALT LAKE)",0,C,,110002160063
84513PCFCR3MILE,-111.029,39.173,False,49,015,976300,49,49015,49015976300,1400000US49015976300,PACIFICORP HUNTER PLANT,3 MILES S OF CASTLE DALE ON STATE HIGHTWAY 10,CASTLE DALE,UT,84513,"PACIFICORP HUNTER PLANT.3 MILES S OF CASTLE DALE ON STATE HIGHTWAY 10, CASTLE DALE UTAH 84513 (EMERY)",0,C,,110000600608
84537TRLMNWONHW,-111.189,39.316,False,49,015,976300,49,49015,49015976300,1400000US49015976300,TRAIL MOUNTAIN COTTONWOOD MINE,W ON HWY 29 FOR 10 MILES COTTONWOOD CANYON,ORANGEVILLE,UT,84537,"TRAIL MOUNTAIN COTTONWOOD MINE.W ON HWY 29 FOR 10 MILES COTTONWOOD CANYON, ORANGEVILLE UTAH 84537 (EMERY)",0,C,,
84526PCFCRINTER,-110.865,39.727,False,49,007,000600,49,49007,49007000600,1400000US49007000600,PACIFICORP CARBON PLANT,INTERSECTION HWY 6 & 191,HELPER,UT,84526,"PACIFICORP CARBON PLANT.INTERSECTION HWY 6 & 191, HELPER UTAH 84526 (CARBON)",0,C,,110000607200
84539SNNYSONEPO,-110.391,39.548,False,49,007,000600,49,49007,49007000600,1400000US49007000600,SUNNYSIDE COGENERATION ASSOCIATES,ONE POWER PLANT RD,SUNNYSIDE,UT,84539,"SUNNYSIDE COGENERATION ASSOCIATES.ONE POWER PLANT RD, SUNNYSIDE UTAH 84539 (CARBON)",0,C,,110000470008
8454WCVLNG1865W,-110.772,39.525999999999996,False,49,007,000600,49,49007,49007000600,1400000US49007000600,BRC WELLINGTON LLC,1865 W RIDGE RD,WELLINGTON,UT,84542,"BRC WELLINGTON LLC.1865 W RIDGE RD, WELLINGTON UTAH 84542 (CARBON)",0,C,,110016685522
8452WTHMRC794CC,-110.439,39.615,False,49,007,000600,49,49007,49007000600,1400000US49007000600,UTAH AMERICAN ENERGY - WESTRIDGE,794 C CANYON ROAD,EAST CARBON,UT,84520,"UTAH AMERICAN ENERGY - WESTRIDGE.794 C CANYON ROAD, EAST CARBON UTAH 84520 (CARBON)",0,C,,110055499919
84528PCFCR10MIL,-111.07,39.376,False,49,015,976200,49,49015,49015976200,1400000US49015976200,PACIFICORP ENERGY-HUNTINGTON PLANT,10 MILES W OF HUNTINGTON,HUNTINGTON,UT,84528,"PACIFICORP ENERGY-HUNTINGTON PLANT.10 MILES W OF HUNTINGTON, HUNTINGTON UTAH 84528 (EMERY)",0,C,,110020101922
84624BRSHW10MIL,-112.43799999999999,39.467,False,49,027,974100,49,49027,49027974100,1400000US49027974100,MATERION NATURAL RESOURCES INC MILL,10 MILES N HWY 6,DELTA,UT,84624,"MATERION NATURAL RESOURCES INC MILL.10 MILES N HWY 6, DELTA UTAH 84624 (MILLARD)",0,C,,110008175232
84624BRSHW47MIN,-112.574,39.494,False,49,027,974100,49,49023,49027974100,1400000US49027974100,MATERION NATURAL RESOURCES MINE,47 MI NW OF DELTA ON HWY 174,DELTA,UT,84624,"MATERION NATURAL RESOURCES MINE.47 MI NW OF DELTA ON HWY 174, DELTA UTAH 84624 (JUAB)",0,C,,110064500286
84624NTRMN850BR,-112.58,39.51,False,49,027,974100,49,49027,49027974100,1400000US49027974100,INTERMOUNTAIN POWER GENERATING STATION,850 W BRUSH WELLMAN RD,DELTA,UT,84624,"INTERMOUNTAIN POWER GENERATING STATION.850 W BRUSH WELLMAN RD, DELTA UTAH 84624 (MILLARD)",0,C,,110000470053
