TRIFID,LONGITUDE,LATITUDE,ESTIMATE,STATEFP,COUNTYFP,TRACTCE,STATEGEOID,COUNTYGEOID,TRACTGEOID,AFFGEOID,FACILITY_NAME,STREET,CITY,STUSPS,ZIP_CODE,FACILITY,FAC_CLOSED_IND,ASGN_FEDERAL_IND,BIA_CODE,EPA_REGISTRY_ID
84084KRFTM126SP,-112.04,40.568000000000005,False,49,035,115209,49,49035,49035115209,1400000US49035115209,MRCG KRAFTMAID UTAH,10026 S PROSPERITY ST,WEST JORDAN,UT,84084,"MRCG KRAFTMAID UTAH.10026 S PROSPERITY ST, WEST JORDAN UTAH 84084 (SALT LAKE)",0,C,,110056155707
8408WWSTJR5792W,-112.027,40.574,False,49,035,115209,49,49035,49035115209,1400000US49035115209,WEST JORDAN BATCH PLANT,5792 W AXEL PARK RD,WEST JORDAN,UT,84088,"WEST JORDAN BATCH PLANT.5792 W AXEL PARK RD, WEST JORDAN UTAH 84088 (SALT LAKE)",0,C,,110070070512
84087CMPNN2415S,-111.93,40.865,False,49,011,127003,49,49011,49011127003,1400000US49011127003,COMPANION SYSTEMS INC,2415 SOUTH REDWOOD RD,WOODS CROSS,UT,84087,"COMPANION SYSTEMS INC.2415 SOUTH REDWOOD RD, WOODS CROSS UTAH 84087 (DAVIS)",0,C,,
84087PHLLP393SO,-111.905,40.885999999999996,False,49,011,127003,49,49011,49011127003,1400000US49011127003,HOLLYFRONTIER WOODS CROSS REFINING LLC,393 S 800 W,WOODS CROSS,UT,84087,"HOLLYFRONTIER WOODS CROSS REFINING LLC.393 S 800 W, WOODS CROSS UTAH 84087 (DAVIS)",0,C,,110000469136
84087CRWNS1710W,-111.93,40.861999999999995,False,49,011,127003,49,49011,49011127003,1400000US49011127003,PEAK ASPHALT LLC - COWBOY ASPHALT TERMINAL,1710 W 2600 S,WOODS CROSS,UT,84087,"PEAK ASPHALT LLC - COWBOY ASPHALT TERMINAL.1710 W 2600 S, WOODS CROSS UTAH 84087 (DAVIS)",0,C,,110058916053
84087FLXPK2425S,-111.932,40.864000000000004,False,49,011,127003,49,49011,49011127003,1400000US49011127003,FLEXPAK INC,2425 SOUTH 1894 WEST,WOODS CROSS,UT,84087,"FLEXPAK INC.2425 SOUTH 1894 WEST, WOODS CROSS UTAH 84087 (DAVIS)",0,C,,110037148529
84088FRCHL8540S,-111.98899999999999,40.597,False,49,035,113101,49,49035,49035113101,1400000US49035113101,FAIRCHILD/VSI/NATTER MANUFACTURING CO,8540 S 4080 W,WEST JORDAN,UT,84088,"FAIRCHILD/VSI/NATTER MANUFACTURING CO.8540 S 4080 W, WEST JORDAN UTAH 84088 (SALT LAKE)",2,C,,
84088PPRCL8556S,-111.986,40.596,False,49,035,113101,49,49035,49035113101,1400000US49035113101,BUCYRUS BLADES INC.,8556 S 4000 W,WEST JORDAN,UT,84088,"BUCYRUS BLADES INC..8556 S 4000 W, WEST JORDAN UTAH 84088 (SALT LAKE)",0,C,,110000469207
84088PNCPR48WFA,-111.988,40.597,False,49,035,113101,49,49035,49035113101,1400000US49035113101,PENCO PRODUCTS SALT LAKE PLANT,4080 W FARM RD,WEST JORDAN,UT,84088,"PENCO PRODUCTS SALT LAKE PLANT.4080 W FARM RD, WEST JORDAN UTAH 84088 (SALT LAKE)",0,C,,110057988637
84088NTNLS3333W,-111.97,40.588,False,49,035,112921,49,49035,49035112921,1400000US49035112921,FAIRCHILD SEMICONDUCTOR,3333 W 9000 S,WEST JORDAN,UT,840888838,"FAIRCHILD SEMICONDUCTOR.3333 W 9000 S, WEST JORDAN UTAH 84088 (SALT LAKE)",0,C,,110000469181
84088THBLD3295W,-111.971,40.595,False,49,035,112916,49,49035,49035112916,1400000US49035112916,SOUTHWIRE CO,3295 W 8600 S,WEST JORDAN,UT,840889773,"SOUTHWIRE CO.3295 W 8600 S, WEST JORDAN UTAH 84088 (SALT LAKE)",0,C,,
84101MDWGL1030S,-111.891,40.747,False,49,035,102900,49,49035,49035102900,1400000US49035102900,MEADOW GOLD DAIRIES INC,1030 S MAIN ST,SALT LAKE CITY,UT,84101,"MEADOW GOLD DAIRIES INC.1030 S MAIN ST, SALT LAKE CITY UTAH 84101 (SALT LAKE)",1,C,,
84115SLTLK1855S,-111.9,40.73,False,49,035,102900,49,49035,49035102900,1400000US49035102900,SALT LAKE EGG INC,1855 S 3RD W,SALT LAKE CITY,UT,841151804,"SALT LAKE EGG INC.1855 S 3RD W, SALT LAKE CITY UTAH 84115 (SALT LAKE)",0,C,,
84115HGHSC1937S,-111.9,40.728,False,49,035,102900,49,49035,49035102900,1400000US49035102900,HUGHES CHRISTENSEN CO,1937 S 300 W,SALT LAKE CITY,UT,84115,"HUGHES CHRISTENSEN CO.1937 S 300 W, SALT LAKE CITY UTAH 84115 (SALT LAKE)",0,C,,
84115FTZRS1436S,-111.89399999999999,40.738,False,49,035,102900,49,49035,49035102900,1400000US49035102900,FETZER'S INC,1436 SOUTH WEST TEMPLE,SALT LAKE CITY,UT,84115,"FETZER'S INC.1436 SOUTH WEST TEMPLE, SALT LAKE CITY UTAH 84115 (SALT LAKE)",0,C,,
84101SCHMD1235S,-111.9,40.742,False,49,035,102900,49,49035,49035102900,1400000US49035102900,SCHMIDT SIGN INC,1235 S 300 W,SALT LAKE CITY,UT,84101,"SCHMIDT SIGN INC.1235 S 300 W, SALT LAKE CITY UTAH 84101 (SALT LAKE)",0,C,,
84115LNRSL24W17,-111.897,40.734,False,49,035,102900,49,49035,49035102900,1400000US49035102900,LYNRUS,204 W 1700 S,SALT LAKE CITY,UT,84115,"LYNRUS.204 W 1700 S, SALT LAKE CITY UTAH 84115 (SALT LAKE)",0,C,,110020516093
84101PCKGN460WE,-111.904,40.758,False,49,035,114000,49,49035,49035114000,1400000US49035114000,PACKAGING CORP OF AMERICA,460 W 5TH S,SALT LAKE CITY,UT,84101,"PACKAGING CORP OF AMERICA.460 W 5TH S, SALT LAKE CITY UTAH 84101 (SALT LAKE)",0,C,,
84101QLTYP533WE,-111.906,40.76,False,49,035,114000,49,49035,49035114000,1400000US49035114000,QUALITY PLATING CO INC,420 SOUTH 500 WEST,SALT LAKE CITY,UT,84101,"QUALITY PLATING CO INC.420 SOUTH 500 WEST, SALT LAKE CITY UTAH 84101 (SALT LAKE)",0,C,,110009115670
84101STRFR619SO,-111.90799999999999,40.756,False,49,035,114000,49,49035,49035114000,1400000US49035114000,STARFIRE IND,619 S 600 W,SALT LAKE CITY,UT,841011093,"STARFIRE IND.619 S 600 W, SALT LAKE CITY UTAH 84101 (SALT LAKE)",0,C,,
84110BGNTR440W8,-111.905,40.751999999999995,False,49,035,114000,49,49035,49035114000,1400000US49035114000,WEIR SPECIALTY PUMPS,440 W 800 S,SALT LAKE CITY,UT,84101,"WEIR SPECIALTY PUMPS.440 W 800 S, SALT LAKE CITY UTAH 84101 (SALT LAKE)",0,C,,110012413815
84119RBBRN3459S,-111.905,40.751999999999995,False,49,035,114000,49,49035,49035114000,1400000US49035114000,WEIR MINERALS LINATEX- SALT LAKE CITY,3459 SOUTH 700 WEST,SALT LAKE CITY,UT,84119,"WEIR MINERALS LINATEX- SALT LAKE CITY.3459 SOUTH 700 WEST, SALT LAKE CITY UTAH 84119 (SALT LAKE)",0,C,,110011782133
84104MRKST455W6,-111.904,40.756,False,49,035,114000,49,49035,49035114000,1400000US49035114000,MARK STEEL CORP PIONEER PLANT,455 W 600 S,SALT LAKE CITY,UT,841012213,"MARK STEEL CORP PIONEER PLANT.455 W 600 S, SALT LAKE CITY UTAH 84101 (SALT LAKE)",0,C,,
84104VNWTR650W8,-111.91,40.751999999999995,False,49,035,114000,49,49035,49035114000,1400000US49035114000,UNIVAR USA INC - SALT LAKE CI TY,650 W  800 S,SALT LAKE CITY,UT,84104,"UNIVAR USA INC - SALT LAKE CI TY.650 W  800 S, SALT LAKE CITY UTAH 84104 (SALT LAKE)",0,C,,110000469387
8410WPRMLK67S5W,-111.905,40.755,False,49,035,114000,49,49035,49035114000,1400000US49035114000,PERMALOK A NORTHWEST PIPE CO,670 S 500 W,SALT LAKE CITY,UT,84101,"PERMALOK A NORTHWEST PIPE CO.670 S 500 W, SALT LAKE CITY UTAH 84101 (SALT LAKE)",1,C,,110063897868
84103CPNDS503NO,-111.90299999999999,40.781,False,49,035,100100,49,49035,49035100100,1400000US49035100100,CP INDUSTRIES,503 N 400 W,SALT LAKE CITY,UT,84103,"CP INDUSTRIES.503 N 400 W, SALT LAKE CITY UTAH 84103 (SALT LAKE)",0,C,,
84103MCLCM474WE,-111.904,40.789,False,49,035,100100,49,49035,49035100100,1400000US49035100100,TESORO REFINING & MARKETING COMPANY LLC - SLC,474 W 900 N,SALT LAKE CITY,UT,84103,"TESORO REFINING & MARKETING COMPANY LLC - SLC.474 W 900 N, SALT LAKE CITY UTAH 84103 (SALT LAKE)",0,C,,110000469243
84103MYFND454WE,-111.904,40.782,False,49,035,100100,49,49035,49035100100,1400000US49035100100,MAY FOUNDRY & MACHINE CO,454 W 600 N,SALT LAKE CITY,UT,84103,"MAY FOUNDRY & MACHINE CO.454 W 600 N, SALT LAKE CITY UTAH 84103 (SALT LAKE)",0,C,,110011675650
84116STKRP2080N,-111.919,40.812,False,49,035,100100,49,49035,49035100100,1400000US49035100100,STAKER & PARSON COS BECK NORTH READY MIX & ASPHALT,2080 N BECK ST,SALT LAKE CITY,UT,84116,"STAKER & PARSON COS BECK NORTH READY MIX & ASPHALT.2080 N BECK ST, SALT LAKE CITY UTAH 84116 (SALT LAKE)",0,C,,110002274501
8411WNLMTD78NRT,-111.911,40.786,False,49,035,100100,49,49035,49035100100,1400000US49035100100,UNLIMITED DESIGNS INC.,780 NORTH 700 WEST,SALT LAKE CITY,UT,841162303,"UNLIMITED DESIGNS INC..780 NORTH 700 WEST, SALT LAKE CITY UTAH 84116 (SALT LAKE)",0,C,,110039075327
8410WTSRLG475WE,-111.904,40.789,False,49,035,100100,49,49035,49035100100,1400000US49035100100,TESORO LOGISTICS-SALT LAKE CITY TERMINAL,475 W 900 N,SALT LAKE CITY,UT,84103,"TESORO LOGISTICS-SALT LAKE CITY TERMINAL.475 W 900 N, SALT LAKE CITY UTAH 84103 (SALT LAKE)",0,C,,110046279273
84104BLNCH1115S,-111.958,40.745,False,49,035,114500,49,49035,49035114500,1400000US49035114500,BLANCHARD METALS PROCESSING CO,1115 S PIONEER RD,SALT LAKE CITY,UT,84104,"BLANCHARD METALS PROCESSING CO.1115 S PIONEER RD, SALT LAKE CITY UTAH 84104 (SALT LAKE)",0,C,,110002264399
84104CNTNN1658S,-111.99799999999999,40.734,False,49,035,114500,49,49035,49035114500,1400000US49035114500,MILK SPECIALTIES GLOBAL,1658 S 4370 W,SALT LAKE CITY,UT,841044800,"MILK SPECIALTIES GLOBAL.1658 S 4370 W, SALT LAKE CITY UTAH 84104 (SALT LAKE)",1,C,,110000469261
84104CSCRT1635S,-111.939,40.734,False,49,035,114500,49,49035,49035114500,1400000US49035114500,IC SECURITY PRINTERS INC,1635 S REDWOOD RD,SALT LAKE CITY,UT,84104,"IC SECURITY PRINTERS INC.1635 S REDWOOD RD, SALT LAKE CITY UTAH 84104 (SALT LAKE)",1,C,,
84104DLTFB1235S,-111.958,40.742,False,49,035,114500,49,49035,49035114500,1400000US49035114500,MIDWESTERN FABRICATORS INC,1235 S PIONEER RD,SALT LAKE CITY,UT,84104,"MIDWESTERN FABRICATORS INC.1235 S PIONEER RD, SALT LAKE CITY UTAH 84104 (SALT LAKE)",0,C,,110000469270
84104FCTTM1900S,-111.975,40.728,False,49,035,114500,49,49035,49035114500,1400000US49035114500,PUROLATOR PRODUCTS INC,1900 S 3480 W,SALT LAKE CITY,UT,84104,"PUROLATOR PRODUCTS INC.1900 S 3480 W, SALT LAKE CITY UTAH 84104 (SALT LAKE)",0,C,,
84104HSHDT3540W,-111.975,40.728,False,49,035,114500,49,49035,49035114500,1400000US49035114500,SUN PRODUCTS CORPORATION,3540 W 1987 S,SALT LAKE CITY,UT,84104,"SUN PRODUCTS CORPORATION.3540 W 1987 S, SALT LAKE CITY UTAH 84104 (SALT LAKE)",0,C,,110037945873
84104MDWGL3730W,-111.98,40.731,False,49,035,114500,49,49035,49035114500,1400000US49035114500,SOUTHERN FOODS GROUP LLC D/B/A MEADOW GOLD DAIRIES,3730 W 1820 S,SALT LAKE CITY,UT,84104,"SOUTHERN FOODS GROUP LLC D/B/A MEADOW GOLD DAIRIES.3730 W 1820 S, SALT LAKE CITY UTAH 84104 (SALT LAKE)",0,C,,110011683151
84104NGLHR2580A,-111.96600000000001,40.736999999999995,False,49,035,114500,49,49035,49035114500,1400000US49035114500,ENGELHARD CORP,3050 ANDREW AVE,SALT LAKE CITY,UT,84104,"ENGELHARD CORP.3050 ANDREW AVE, SALT LAKE CITY UTAH 84104 (SALT LAKE)",0,C,,
84104PNRRF1520P,-111.958,40.736999999999995,False,49,035,114500,49,49035,49035114500,1400000US49035114500,ACADEMY PIONEER LLC,1520 PIONEER RD,SALT LAKE CITY,UT,84104,"ACADEMY PIONEER LLC.1520 PIONEER RD, SALT LAKE CITY UTAH 84104 (SALT LAKE)",0,C,,110000469341
84104RCKYM2363W,-111.959,40.736999999999995,False,49,035,114500,49,49035,49035114500,1400000US49035114500,ROCKY MOUNTAIN REFRACTORIES,2363 W ANDREW AVE,SALT LAKE CITY,UT,84104,"ROCKY MOUNTAIN REFRACTORIES.2363 W ANDREW AVE, SALT LAKE CITY UTAH 84104 (SALT LAKE)",0,C,,
84104SNDST1291S,-111.958,40.742,False,49,035,114500,49,49035,49035114500,1400000US49035114500,USA INDUSTRIES,1291 S PIONEER RD,SALT LAKE CITY,UT,84104,"USA INDUSTRIES.1291 S PIONEER RD, SALT LAKE CITY UTAH 84104 (SALT LAKE)",1,C,,110001881045
84104STMNC1822S,-111.945,40.73,False,49,035,114500,49,49035,49035114500,1400000US49035114500,EASTMAN CHRISTENSEN,1822 S INDL RD,SALT LAKE CITY,UT,84104,"EASTMAN CHRISTENSEN.1822 S INDL RD, SALT LAKE CITY UTAH 84104 (SALT LAKE)",0,C,,
84104STRBR976PI,-111.958,40.748000000000005,False,49,035,114500,49,49035,49035114500,1400000US49035114500,STAR FOUNDRY & MACHINE,976 PIONEER RD,SALT LAKE CITY,UT,84104,"STAR FOUNDRY & MACHINE.976 PIONEER RD, SALT LAKE CITY UTAH 84104 (SALT LAKE)",0,C,,110000469369
84104VRNMC1678S,-111.958,40.734,False,49,035,114500,49,49035,49035114500,1400000US49035114500,VAREX IMAGING CORP,1678 S PIONEER RD,SALT LAKE CITY,UT,84104,"VAREX IMAGING CORP.1678 S PIONEER RD, SALT LAKE CITY UTAH 84104 (SALT LAKE)",0,C,,110009508504
84120JHNSN4601W,-112.001,40.726,False,49,035,114500,49,49035,49035114500,1400000US49035114500,ASAHI REFINING USA INC,4601 W 2100 S,WEST VALLEY CITY,UT,84120,"ASAHI REFINING USA INC.4601 W 2100 S, WEST VALLEY CITY UTAH 84120 (SALT LAKE)",0,C,,110055233251
84127THTCH1905F,-111.945,40.742,False,49,035,114500,49,49035,49035114500,1400000US49035114500,THATCHER CO,1905 FORTUNE RD,SALT LAKE CITY,UT,84104,"THATCHER CO.1905 FORTUNE RD, SALT LAKE CITY UTAH 84104 (SALT LAKE)",0,C,,110000469671
84104TWDMB1847S,-111.958,40.729,False,49,035,114500,49,49035,49035114500,1400000US49035114500,ATWOOD MOBILE PRODUCTS,1874 S PIONEER RD,SALT LAKE CITY,UT,84104,"ATWOOD MOBILE PRODUCTS.1874 S PIONEER RD, SALT LAKE CITY UTAH 84104 (SALT LAKE)",1,C,,110043645918
84104CLSSC1830S,-111.96799999999999,40.73,False,49,035,114500,49,49035,49035114500,1400000US49035114500,CLASSIC CABINETS,1830 S 3230 W,SALT LAKE CITY,UT,84104,"CLASSIC CABINETS.1830 S 3230 W, SALT LAKE CITY UTAH 84104 (SALT LAKE)",0,C,,
84104CLSSC2587W,-111.964,40.746,False,49,035,114500,49,49035,49035114500,1400000US49035114500,CLASSIC CABINETS INC,3045 WEST DIRECTORS ROW,SALT LAKE CITY,UT,84104,"CLASSIC CABINETS INC.3045 WEST DIRECTORS ROW, SALT LAKE CITY UTAH 84104 (SALT LAKE)",0,C,,
84104WSTRN4340W,-111.99600000000001,40.751,False,49,035,114500,49,49035,49035114500,1400000US49035114500,OWENS CORNING INSULATING SYSTEM LLC-SALT LAKE CITY,4340 W 850 S,SALT LAKE CITY,UT,841044465,"OWENS CORNING INSULATING SYSTEM LLC-SALT LAKE CITY.4340 W 850 S, SALT LAKE CITY UTAH 84104 (SALT LAKE)",0,C,,110000469403
84120THLTG4603W,-112.0,40.724000000000004,False,49,035,114500,49,49035,49035114500,1400000US49035114500,HONEYWELL INTERNATIONAL  INC,4603 WEST 2100 SOUTH,SALT LAKE CITY,UT,84120,"HONEYWELL INTERNATIONAL  INC.4603 WEST 2100 SOUTH, SALT LAKE CITY UTAH 84120 (SALT LAKE)",0,C,,110000469644
84104PLKNG4088W,-111.98899999999999,40.731,False,49,035,114500,49,49035,49035114500,1400000US49035114500,PILKINGTON METAL FINISHING LLC,4088 W 1820 S,SALT LAKE CITY,UT,84104,"PILKINGTON METAL FINISHING LLC.4088 W 1820 S, SALT LAKE CITY UTAH 84104 (SALT LAKE)",0,C,,
84104GRTWS2334W,-111.95200000000001,40.746,False,49,035,114500,49,49035,49035114500,1400000US49035114500,BRENNTAG PACIFIC INC,2334 W DIRECTORS ROW,SALT LAKE CITY,UT,84104,"BRENNTAG PACIFIC INC.2334 W DIRECTORS ROW, SALT LAKE CITY UTAH 84104 (SALT LAKE)",0,C,,110009506178
84104RGSNT1177S,-111.95100000000001,40.744,False,49,035,114500,49,49035,49035114500,1400000US49035114500,AIRGAS INTERMOUNTAIN,1177 S SWANER RD,SALT LAKE CITY,UT,84104,"AIRGAS INTERMOUNTAIN.1177 S SWANER RD, SALT LAKE CITY UTAH 84104 (SALT LAKE)",0,C,,
84104FLCTR1751S,-112.006,40.731,False,49,035,114500,49,49035,49035114500,1400000US49035114500,SCHNEIDER ELECTRIC USA INC,1751 S 4800 W,SALT LAKE CITY,UT,84104,"SCHNEIDER ELECTRIC USA INC.1751 S 4800 W, SALT LAKE CITY UTAH 84104 (SALT LAKE)",1,C,,110015583082
84104CRCTG1120S,-111.95100000000001,40.745,False,49,035,114500,49,49035,49035114500,1400000US49035114500,CIRCUIT GRAPHICS INC,1120 S SWANER RD,SALT LAKE CITY,UT,84104,"CIRCUIT GRAPHICS INC.1120 S SWANER RD, SALT LAKE CITY UTAH 84104 (SALT LAKE)",0,C,,
84157STKRP3313W,-111.97,40.746,False,49,035,114500,49,49035,49035114500,1400000US49035114500,STAKER & PARSON CALIFORNIA READY-MIX CONCRETE,3313 W DIRECTORS ROW,SALT LAKE CITY,UT,84104,"STAKER & PARSON CALIFORNIA READY-MIX CONCRETE.3313 W DIRECTORS ROW, SALT LAKE CITY UTAH 84104 (SALT LAKE)",0,C,,110020516100
84104RGSPN1211S,-111.958,40.743,False,49,035,114500,49,49035,49035114500,1400000US49035114500,AIRGAS USA LLC,1211 S. PIONEER ROAD,SALT LAKE CITY,UT,84104,"AIRGAS USA LLC.1211 S. PIONEER ROAD, SALT LAKE CITY UTAH 84104 (SALT LAKE)",0,C,,110022524213
84104CHLTD331W9,-111.969,40.75,False,49,035,114500,49,49035,49035114500,1400000US49035114500,CHELATED MINERALS CORP,3310 WEST 900 SOUTH,SALT LAKE CITY,UT,84104,"CHELATED MINERALS CORP.3310 WEST 900 SOUTH, SALT LAKE CITY UTAH 84104 (SALT LAKE)",0,C,,110001882918
8410WSFTYK166SP,-111.958,40.747,False,49,035,114500,49,49035,49035114500,1400000US49035114500,SAFETY-KLEEN SYSTEMS SALT LAKE CITY (SLC),1066 S PIONEER RD,SALT LAKE CITY,UT,84104,"SAFETY-KLEEN SYSTEMS SALT LAKE CITY (SLC).1066 S PIONEER RD, SALT LAKE CITY UTAH 84104 (SALT LAKE)",0,C,,110000620025
8410WGNVPP3355W,-111.97,40.75,False,49,035,114500,49,49035,49035114500,1400000US49035114500,GENEVA PIPE CO INC,3355 W 900 S,SALT LAKE CITY,UT,84104,"GENEVA PIPE CO INC.3355 W 900 S, SALT LAKE CITY UTAH 84104 (SALT LAKE)",0,C,,110070070946
8410WPLKNG192S4,-112.00200000000001,40.729,False,49,035,114500,49,49035,49035114500,1400000US49035114500,PILKINGTON METAL FINISHING LLC SITE 3,1920 S 4650 W,SALT LAKE CITY,UT,84104,"PILKINGTON METAL FINISHING LLC SITE 3.1920 S 4650 W, SALT LAKE CITY UTAH 84104 (SALT LAKE)",0,C,,110070070646
8410WTHRMF3545W,-111.975,40.758,False,49,035,114500,49,49035,49035114500,1400000US49035114500,THERMO FLUIDS INC - SALT LAKE,3545 WEST 500 SOUTH,SALT LAKE CITY,UT,84104,"THERMO FLUIDS INC - SALT LAKE.3545 WEST 500 SOUTH, SALT LAKE CITY UTAH 84104 (SALT LAKE)",0,C,,110046248066
84104LYMPS1537S,-111.911,40.735,False,49,035,102802,49,49035,49035102802,1400000US49035102802,OLYMPIA SALES CO,1537 S 700 W ST,SALT LAKE CITY,UT,84104,"OLYMPIA SALES CO.1537 S 700 W ST, SALT LAKE CITY UTAH 84104 (SALT LAKE)",0,C,,
84104MCPRC669WE,-111.911,40.765,False,49,035,102500,49,49035,49035102500,1400000US49035102500,EIMCO PROCESS EQUIPMENT,669 W 200 SOUTH,SALT LAKE CITY,UT,841011160,"EIMCO PROCESS EQUIPMENT.669 W 200 SOUTH, SALT LAKE CITY UTAH 84101 (SALT LAKE)",1,C,,
84104CYTZY134S7,-111.911,40.766999999999996,False,49,035,102500,49,49035,49035102500,1400000US49035102500,CYTOZYME LABORATORIES INC,134 S 700 W,SALT LAKE CITY,UT,84104,"CYTOZYME LABORATORIES INC.134 S 700 W, SALT LAKE CITY UTAH 84104 (SALT LAKE)",0,C,,110011667419
8410WGNVRC748WE,-111.913,40.763000000000005,False,49,035,102500,49,49035,49035102500,1400000US49035102500,GENEVA ROCK PRODUCTS INC-DOWNTOWN FACILITY,748 W 300 S,SALT LAKE CITY,UT,84104,"GENEVA ROCK PRODUCTS INC-DOWNTOWN FACILITY.748 W 300 S, SALT LAKE CITY UTAH 84104 (SALT LAKE)",0,C,,110020076460
84107KRMNK6000S,-111.902,40.64,False,49,035,112202,49,49035,49035112202,1400000US49035112202,KARMAN KITCHENS INC,6000 S STRATLER ST,SALT LAKE CITY,UT,84107,"KARMAN KITCHENS INC.6000 S STRATLER ST, SALT LAKE CITY UTAH 84107 (SALT LAKE)",0,C,,
84107PWRLN6020S,-111.898,40.64,False,49,035,112202,49,49035,49035112202,1400000US49035112202,POWER LINE CHEMICAL,6020 S 300 W,SALT LAKE CITY,UT,84107,"POWER LINE CHEMICAL.6020 S 300 W, SALT LAKE CITY UTAH 84107 (SALT LAKE)",0,C,,
84107XXLCR5975S,-111.902,40.64,False,49,035,112202,49,49035,49035112202,1400000US49035112202,EXXEL CORP,5975 STRATLER,SALT LAKE CITY,UT,84107,"EXXEL CORP.5975 STRATLER, SALT LAKE CITY UTAH 84107 (SALT LAKE)",0,C,,
84107TTNST4315S,-111.9,40.678000000000004,False,49,035,112100,49,49035,49035112100,1400000US49035112100,EXPRESS METAL FABRICATORS LLC-ST GEORGE STEEL DIV,4315 S 300 W,MURRAY,UT,84107,"EXPRESS METAL FABRICATORS LLC-ST GEORGE STEEL DIV.4315 S 300 W, MURRAY UTAH 84107 (SALT LAKE)",0,C,,110002380496
84107BHNRC5200S,-111.89200000000001,40.676,False,49,035,112100,49,49035,49035112100,1400000US49035112100,BUEHNER CORP,5200 S MAIN ST,SALT LAKE CITY,UT,84107,"BUEHNER CORP.5200 S MAIN ST, SALT LAKE CITY UTAH 84107 (SALT LAKE)",0,C,,
84107SMPSN120WF,-111.895,40.678000000000004,False,49,035,112100,49,49035,49035112100,1400000US49035112100,"SIMPSON STEEL FABRICATORS &, ERECTORS INC",120 W FIRECLAY AVE,MURRAY,UT,84107,"SIMPSON STEEL FABRICATORS &, ERECTORS INC.120 W FIRECLAY AVE, MURRAY UTAH 84107 (SALT LAKE)",0,C,,
84123BRDGP542WC,-111.90700000000001,40.678000000000004,False,49,035,112100,49,49035,49035112100,1400000US49035112100,BRIDGEPOINT SYSTEMS,542 W CONFLUENCE AVE,SALT LAKE CITY,UT,84123,"BRIDGEPOINT SYSTEMS.542 W CONFLUENCE AVE, SALT LAKE CITY UTAH 84123 (SALT LAKE)",0,C,,110025404596
84123BRDGP4282S,-111.90799999999999,40.678000000000004,False,49,035,112100,49,49035,49035112100,1400000US49035112100,BRIDGEPOINT SYSTEMS,4282 S 590 W,SALT LAKE CITY,UT,84123,"BRIDGEPOINT SYSTEMS.4282 S 590 W, SALT LAKE CITY UTAH 84123 (SALT LAKE)",0,C,,110037148574
84115CTNNR1930S,-111.88799999999999,40.728,False,49,035,103200,49,49035,49035103200,1400000US49035103200,OC TANNER MANUFACTURING CO,1930 S STATE ST,SALT LAKE CITY,UT,84115,"OC TANNER MANUFACTURING CO.1930 S STATE ST, SALT LAKE CITY UTAH 84115 (SALT LAKE)",0,C,,110000469467
84115DCRPR2645S,-111.9,40.713,False,49,035,111500,49,49035,49035111500,1400000US49035111500,EDO CORP WESTERN DIV,2645 S 300 W,SALT LAKE CITY,UT,84115,"EDO CORP WESTERN DIV.2645 S 300 W, SALT LAKE CITY UTAH 84115 (SALT LAKE)",0,C,,110000469476
84115PRCSN2970S,-111.89299999999999,40.707,False,49,035,111500,49,49035,49035111500,1400000US49035111500,PRECISION TECHNOLOGY INC,65 W CENTURY PKWY,SALT LAKE CITY,UT,84115,"PRECISION TECHNOLOGY INC.65 W CENTURY PKWY, SALT LAKE CITY UTAH 84115 (SALT LAKE)",0,C,,110064119555
84115DLBTS2150S,-111.9,40.724000000000004,False,49,035,111500,49,49035,49035111500,1400000US49035111500,DALEBOOT USA,2150 S 300 W,SALT LAKE CITY,UT,84115,"DALEBOOT USA.2150 S 300 W, SALT LAKE CITY UTAH 84115 (SALT LAKE)",0,C,,
84119DWTCH2700S,-111.917,40.713,False,49,035,111500,49,49035,49035111500,1400000US49035111500,DAW TECHNOLOGIES,2700 SOUTH 900 WEST,SALT LAKE CITY,UT,84119,"DAW TECHNOLOGIES.2700 SOUTH 900 WEST, SALT LAKE CITY UTAH 84119 (SALT LAKE)",0,C,,
8451WHDSPP25S3W,-111.9,40.717,False,49,035,111500,49,49035,49035111500,1400000US49035111500,"HD SUPPLY CONSTRUCTION SUPPLY, LTD (UT006-6149)",2503 SOUTH 300 WEST,SOUTH SALT LAKE,UT,84115,"HD SUPPLY CONSTRUCTION SUPPLY, LTD (UT006-6149).2503 SOUTH 300 WEST, SOUTH SALT LAKE UTAH 84115 (SALT LAKE)",0,C,,110039495551
8411WCRMTC2425S,-111.917,40.718,False,49,035,111500,49,49035,49035111500,1400000US49035111500,CERAMATEC INC,2425 SOUTH 900 WEST,SALT LAKE CITY,UT,841191517,"CERAMATEC INC.2425 SOUTH 900 WEST, SALT LAKE CITY UTAH 84119 (SALT LAKE)",0,C,,110002280255
8411WBHNRB28SWT,-111.895,40.71,False,49,035,111500,49,49035,49035111500,1400000US49035111500,BUEHNER BLOCK CO,2800 S W TEMPLE,SALT LAKE CITY,UT,841153504,"BUEHNER BLOCK CO.2800 S W TEMPLE, SALT LAKE CITY UTAH 84115 (SALT LAKE)",0,C,,110002278543
8411WCYTZY27SUT,-111.90700000000001,40.713,False,49,035,111500,49,49035,49035111500,1400000US49035111500,CYTOZYME LABORATORIES INC,2700 S 600 W,SALT LAKE CITY,UT,84115,"CYTOZYME LABORATORIES INC.2700 S 600 W, SALT LAKE CITY UTAH 84115 (SALT LAKE)",0,C,,110060259517
84116CMLCT5416A,-112.021,40.775999999999996,False,49,035,980000,49,49035,49035980000,1400000US49035980000,ACME ELECTRIC CORP POWER PRODS GROUP,5416 AMELIA EARHART DR,SALT LAKE CITY,UT,841163799,"ACME ELECTRIC CORP POWER PRODS GROUP.5416 AMELIA EARHART DR, SALT LAKE CITY UTAH 84116 (SALT LAKE)",0,C,,
84116DCRPR506NB,-112.015,40.779,False,49,035,980000,49,49035,49035980000,1400000US49035980000,EDO CORP FIBER SCIENCE DIV,506 N BILLY MITCHELL RD,SALT LAKE CITY,UT,84116,"EDO CORP FIBER SCIENCE DIV.506 N BILLY MITCHELL RD, SALT LAKE CITY UTAH 84116 (SALT LAKE)",0,C,,
84116LKTHX594NB,-112.01299999999999,40.782,False,49,035,980000,49,49035,49035980000,1400000US49035980000,VIKTRON UTAH,594 N BILLY MITCHELL RD,SALT LAKE CITY,UT,84116,"VIKTRON UTAH.594 N BILLY MITCHELL RD, SALT LAKE CITY UTAH 84116 (SALT LAKE)",0,C,,
84116LTTNG2211W,-111.954,40.771,False,49,035,980000,49,49035,49035980000,1400000US49035980000,NORTHROP GRUMMAN SYSTEMS COPORATION,2211 W NORTH TEMPLE,SALT LAKE CITY,UT,84116,"NORTHROP GRUMMAN SYSTEMS COPORATION.2211 W NORTH TEMPLE, SALT LAKE CITY UTAH 84116 (SALT LAKE)",0,C,,110000896772
84116NSYSS322NO,-111.954,40.783,False,49,035,980000,49,49035,49035980000,1400000US49035980000,PARAMAX SYSTEMS CORP PARAMAX,640 N 2200 W,SALT LAKE CITY,UT,84116,"PARAMAX SYSTEMS CORP PARAMAX.640 N 2200 W, SALT LAKE CITY UTAH 84116 (SALT LAKE)",0,C,,
84116RCKWL5520W,-112.023,40.781,False,49,035,980000,49,49035,49035980000,1400000US49035980000,ROCKWELL INTL CORP,5520 W HAROLD GATTY DR,SALT LAKE CITY,UT,84116,"ROCKWELL INTL CORP.5520 W HAROLD GATTY DR, SALT LAKE CITY UTAH 84116 (SALT LAKE)",0,C,,
84116STNLM5040W,-112.01100000000001,40.781,False,49,035,980000,49,49035,49035980000,1400000US49035980000,EASTON TECHNICAL PRODUCTS,5040 WEST HAROLD GATTY DR.,SALT LAKE CITY,UT,84116,"EASTON TECHNICAL PRODUCTS.5040 WEST HAROLD GATTY DR., SALT LAKE CITY UTAH 84116 (SALT LAKE)",0,C,,110010797218
84116SRXMD5725W,-112.025,40.778,False,49,035,980000,49,49035,49035980000,1400000US49035980000,STERIGENICS-SALT LAKE CITY FACILITY,5725 W HAROLD GATTY DR,SALT LAKE CITY,UT,84116,"STERIGENICS-SALT LAKE CITY FACILITY.5725 W HAROLD GATTY DR, SALT LAKE CITY UTAH 84116 (SALT LAKE)",0,C,,110000469528
84104STLCT410SO,-111.956,40.779,False,49,035,980000,49,49035,49035980000,1400000US49035980000,STEEL COATINGS INC,410 S 2650 W,SALT LAKE CITY,UT,84104,"STEEL COATINGS INC.410 S 2650 W, SALT LAKE CITY UTAH 84104 (SALT LAKE)",0,C,,110002299441
84116L3CMM640N2,-111.954,40.783,False,49,035,980000,49,49035,49035980000,1400000US49035980000,L3 TECHNOLOGIES INC COMMUNICATION SYSTEMS - WEST,640 NORTH 2200 WEST,SALT LAKE CITY,UT,84116,"L3 TECHNOLOGIES INC COMMUNICATION SYSTEMS - WEST.640 NORTH 2200 WEST, SALT LAKE CITY UTAH 84116 (SALT LAKE)",0,C,,110001882936
84116SRFRC765N2,-111.955,40.786,False,49,035,980000,49,49035,49035980000,1400000US49035980000,"U.S. DOD, USAF, UTAH ANG BASE",765 N 2200 W,SALT LAKE CITY,UT,841162999,"U.S. DOD, USAF, UTAH ANG BASE.765 N 2200 W, SALT LAKE CITY UTAH 84116 (SALT LAKE)",0,F,,110037148556
84116RCKYM1125W,-111.925,40.817,False,49,035,114700,49,49035,49035114700,1400000US49035114700,ROCKY MOUNTAIN FABRICATION,1125 W 2300 N,SALT LAKE CITY,UT,84116,"ROCKY MOUNTAIN FABRICATION.1125 W 2300 N, SALT LAKE CITY UTAH 84116 (SALT LAKE)",0,C,,110000469519
8411WNRTHS111W2,-111.92299999999999,40.817,False,49,035,114700,49,49035,49035114700,1400000US49035114700,NORTH SALT LAKE BATCH PLANT,1110 W 2300 N,SALT LAKE CITY,UT,84116,"NORTH SALT LAKE BATCH PLANT.1110 W 2300 N, SALT LAKE CITY UTAH 84116 (SALT LAKE)",0,C,,110046339048
