TRIFID,LONGITUDE,LATITUDE,ESTIMATE,STATEFP,COUNTYFP,TRACTCE,STATEGEOID,COUNTYGEOID,TRACTGEOID,AFFGEOID,FACILITY_NAME,STREET,CITY,STUSPS,ZIP_CODE,FACILITY,FAC_CLOSED_IND,ASGN_FEDERAL_IND,BIA_CODE,EPA_REGISTRY_ID
05042CPMNCCHURC,-72.059,44.207,False,50,005,957800,50,50005,50005957800,1400000US50005957800,CPM INC,TOWN HWY 70,EAST RYEGATE,VT,5042,"CPM INC.TOWN HWY 70, EAST RYEGATE VERMONT 05042 (CALEDONIA)",0,C,,
05060THNLLHULLS,-72.655,43.919,False,50,017,959400,50,50017,50017959400,1400000US50017959400,ETHAN ALLEN INC RANDOLPH DIV,44 HULL ST,RANDOLPH,VT,50601102,"ETHAN ALLEN INC RANDOLPH DIV.44 HULL ST, RANDOLPH VERMONT 05060 (ORANGE)",0,C,,
0506WVRMNT1131B,-72.652,43.901,False,50,017,959400,50,50017,50017959400,1400000US50017959400,VERMONT CASTINGS GROUP - FOUNDRY DIVISION,1131 BEANVILLE ROAD,RANDOLPH,VT,5060,"VERMONT CASTINGS GROUP - FOUNDRY DIVISION.1131 BEANVILLE ROAD, RANDOLPH VERMONT 05060 (ORANGE)",0,C,,110001124060
05089GRNMNWINDS,-72.382,43.483000000000004,False,50,027,966000,50,50027,50027966000,1400000US50027966000,GREEN MOUNTAIN MARBLE CO,WINDSOR INDUSTRIAL PARK,WINDSOR,VT,5089,"GREEN MOUNTAIN MARBLE CO.WINDSOR INDUSTRIAL PARK, WINDSOR VERMONT 05089 (WINDSOR)",1,C,,
05089SCTNY2637U,-72.39699999999999,43.437,False,50,027,966000,50,50027,50027966000,1400000US50027966000,ASCUTNEY METAL PRODS,2637 US RTE 5 N,WINDSOR,VT,5089,"ASCUTNEY METAL PRODS.2637 US RTE 5 N, WINDSOR VERMONT 05089 (WINDSOR)",0,C,,
05089WNSRMROUTE,-72.529,43.468999999999994,False,50,027,965900,50,50027,50027965900,1400000US50027965900,LUZENAC AMERICA INC,RTE 44,WINDSOR,VT,50890680,"LUZENAC AMERICA INC.RTE 44, WINDSOR VERMONT 05089 (WINDSOR)",0,C,,
05150DLNTFPIPER,-72.509,43.331,False,50,027,966700,50,50027,50027966700,1400000US50027966700,IDLENOT FARM DAIRY INC,PIPER RD,NORTH SPRINGFIELD,VT,5150,"IDLENOT FARM DAIRY INC.PIPER RD, NORTH SPRINGFIELD VERMONT 05150 (WINDSOR)",0,C,,
05156BRYNT257CL,-72.472,43.287,False,50,027,966600,50,50027,50027966600,1400000US50027966600,BRYANT GRINDER CORP,257 CLINTON ST,SPRINGFIELD,VT,51560852,"BRYANT GRINDER CORP.257 CLINTON ST, SPRINGFIELD VERMONT 05156 (WINDSOR)",0,C,,
05156FLLWSPRECI,-72.538,43.327,False,50,027,966600,50,50027,50027966600,1400000US50027966600,FELLOWS CORP,PRECISION DR,NORTH SPRINGFIELD,VT,5150,"FELLOWS CORP.PRECISION DR, NORTH SPRINGFIELD VERMONT 05150 (WINDSOR)",0,C,,
05201BJRLB50KOC,-73.199,42.894,False,50,003,971200,50,50003,50003971200,1400000US50003971200,BIJUR LUBRICATING CORP,50 KOCHER DR,BENNINGTON,VT,52011994,"BIJUR LUBRICATING CORP.50 KOCHER DR, BENNINGTON VERMONT 05201 (BENNINGTON)",0,C,,
05201JRDCNBOWEN,-73.189,42.888999999999996,False,50,003,971200,50,50003,50003971200,1400000US50003971200,JARD CO INC,BOWEN RD,BENNINGTON,VT,5201,"JARD CO INC.BOWEN RD, BENNINGTON VERMONT 05201 (BENNINGTON)",1,C,,
05201VRDYB401GA,-73.191,42.882,False,50,003,971200,50,50003,50003971200,1400000US50003971200,ENERGIZER MANUFACTURING INC,401 GAGE ST,BENNINGTON,VT,5201,"ENERGIZER MANUFACTURING INC.401 GAGE ST, BENNINGTON VERMONT 05201 (BENNINGTON)",0,C,,110000314758
05201JHNSNROUTE,-73.217,42.903999999999996,False,50,003,971000,50,50003,50003971000,1400000US50003971000,"JOHNSON CONTROLS INC, BATTERY GROUP",RTE 67A,BENNINGTON,VT,5201,"JOHNSON CONTROLS INC, BATTERY GROUP.RTE 67A, BENNINGTON VERMONT 05201 (BENNINGTON)",1,C,,
05201TNSTRWESTR,-73.267,42.878,False,50,003,971000,50,50003,50003971000,1400000US50003971000,TANSITOR ELECTRONICS INC,2813 W RD,BENNINGTON,VT,5201,"TANSITOR ELECTRONICS INC.2813 W RD, BENNINGTON VERMONT 05201 (BENNINGTON)",0,C,,110007400963
05201BNMNTBENMO,-73.215,42.875,False,50,003,971000,50,50003,50003971000,1400000US50003971000,BEN-MONT CORP,BENMONT AVE,BENNINGTON,VT,5201,"BEN-MONT CORP.BENMONT AVE, BENNINGTON VERMONT 05201 (BENNINGTON)",1,C,,
05257CHMCL13WAT,-73.247,42.913999999999994,False,50,003,971000,50,50003,50003971000,1400000US50003971000,CHEMFAB CORP,1030 WATER ST,NORTH BENNINGTON,VT,5257,"CHEMFAB CORP.1030 WATER ST, NORTH BENNINGTON VERMONT 05257 (BENNINGTON)",0,C,,
05257KRNPT441WA,-73.24600000000001,42.923,False,50,003,971000,50,50003,50003971000,1400000US50003971000,ADC OPTICAL SYSTEMS,441 WATER ST,NORTH BENNINGTON,VT,5257,"ADC OPTICAL SYSTEMS.441 WATER ST, NORTH BENNINGTON VERMONT 05257 (BENNINGTON)",0,C,,110015681751
05262STNLYROUTE,-73.217,42.946999999999996,False,50,003,970800,50,50003,50003970800,1400000US50003970800,STANLEY TOOLS EAGLE SQUARE PLANT,372 VT RTE 67,SHAFTSBURY,VT,5262,"STANLEY TOOLS EAGLE SQUARE PLANT.372 VT RTE 67, SHAFTSBURY VERMONT 05262 (BENNINGTON)",0,C,,
05301BSCSCBRUDI,-72.546,42.888999999999996,False,50,025,968600,50,50025,50025968600,1400000US50025968600,NEENAH NORTHEAST LLC,161 WELLINGTON RD,BRATTLEBORO,VT,5301,"NEENAH NORTHEAST LLC.161 WELLINGTON RD, BRATTLEBORO VERMONT 05301 (WINDHAM)",0,C,,110000763148
05301CBRDLQUINN,-72.54899999999999,42.896,False,50,025,968600,50,50025,50025968600,1400000US50025968600,CE BRADLEY LABORATORIES INC,55 BENNETT DR,BRATTLEBORO,VT,5301,"CE BRADLEY LABORATORIES INC.55 BENNETT DR, BRATTLEBORO VERMONT 05301 (WINDHAM)",0,C,,110039145092
05301FLFLXPUTNE,-72.555,42.885,False,50,025,968600,50,50025,50025968600,1400000US50025968600,FULFLEX A GARFLEX INC CO,32 JUSTIN HOLDEN DR,BRATTLEBORO,VT,5301,"FULFLEX A GARFLEX INC CO.32 JUSTIN HOLDEN DR, BRATTLEBORO VERMONT 05301 (WINDHAM)",0,C,,110000581567
05301NTDCRONETE,-72.563,42.876000000000005,False,50,025,968600,50,50025,50025968600,1400000US50025968600,VERMONT CIRCUITS INC,76 TECHNOLOGY DR,BRATTLEBORO,VT,5301,"VERMONT CIRCUITS INC.76 TECHNOLOGY DR, BRATTLEBORO VERMONT 05301 (WINDHAM)",0,C,,110001124079
05301WNTRPRR5PO,-72.544,42.893,False,50,025,968600,50,50025,50025968600,1400000US50025968600,WINTER PANEL CORP,74 GLEN ORNE DR,BRATTLEBORO,VT,5301,"WINTER PANEL CORP.74 GLEN ORNE DR, BRATTLEBORO VERMONT 05301 (WINDHAM)",0,C,,110000314785
05346PTNYPMAINS,-72.517,42.975,False,50,025,967700,50,50025,50025967700,1400000US50025967700,PUTNEY PAPER CO INC,MAIN ST,PUTNEY,VT,5346,"PUTNEY PAPER CO INC.MAIN ST, PUTNEY VERMONT 05346 (WINDHAM)",0,C,,
05363GSPRCWESTR,-72.895,42.879,False,50,025,968000,50,50025,50025968000,1400000US50025968000,G S PRECISION INC,W RT 9,WILMINGTON,VT,5363,"G S PRECISION INC.W RT 9, WILMINGTON VERMONT 05363 (WINDHAM)",0,C,,
05401GNRLLINDUS,-73.221,44.446999999999996,False,50,007,001100,50,50007,50007001100,1400000US50007001100,GE CO,INDUSTRIAL PKWY BLDG 61 & 41,BURLINGTON,VT,5401,"GE CO.INDUSTRIAL PKWY BLDG 61 & 41, BURLINGTON VERMONT 05401 (CHITTENDEN)",0,C,,
05402DLNDC159IN,-73.221,44.446999999999996,False,50,007,001100,50,50007,50007001100,1400000US50007001100,EDLUND CO INC,159 INDUSTRIAL PKWY,BURLINGTON,VT,5402,"EDLUND CO INC.159 INDUSTRIAL PKWY, BURLINGTON VERMONT 05402 (CHITTENDEN)",0,C,,
05401GNRLLLAKES,-73.218,44.461000000000006,False,50,007,001000,50,50007,50007001000,1400000US50007001000,MARTIN MARIETTA ORDNANCE SYSTEMS CO,LAKESIDE AVE,BURLINGTON,VT,54014985,"MARTIN MARIETTA ORDNANCE SYSTEMS CO.LAKESIDE AVE, BURLINGTON VERMONT 05401 (CHITTENDEN)",0,C,,
05402GSBLD50LAK,-73.22,44.461000000000006,False,50,007,001000,50,50007,50007001000,1400000US50007001000,BLODGETT OVEN CO,50 LAKESIDE AVE,BURLINGTON,VT,5401,"BLODGETT OVEN CO.50 LAKESIDE AVE, BURLINGTON VERMONT 05401 (CHITTENDEN)",0,C,,110000314794
05401HPHDN187SO,-73.211,44.475,False,50,007,001000,50,50007,50007001000,1400000US50007001000,HP HOOD INC,187 S WINOOSKI AVE,BURLINGTON,VT,5401,"HP HOOD INC.187 S WINOOSKI AVE, BURLINGTON VERMONT 05401 (CHITTENDEN)",0,C,,
05401GLBLP2FLYN,-73.222,44.456,False,50,007,001000,50,50007,50007001000,1400000US50007001000,GLOBAL PETROLEUM SERVICES (DBA VERMONT),2 FLYNN AVE,BURLINGTON,VT,5401,"GLOBAL PETROLEUM SERVICES (DBA VERMONT).2 FLYNN AVE, BURLINGTON VERMONT 05401 (CHITTENDEN)",0,C,,110000826802
05404YRKCP450WE,-73.184,44.501999999999995,False,50,007,002400,50,50007,50007002400,1400000US50007002400,YORK CAPACITOR CORP,450 WEAVER ST,WINOOSKI,VT,5404,"YORK CAPACITOR CORP.450 WEAVER ST, WINOOSKI VERMONT 05404 (CHITTENDEN)",0,C,,
05446CHMPLHERCU,-73.176,44.511,False,50,007,002200,50,50007,50007002200,1400000US50007002200,CHAMPLAIN CABLE CORP,175 HERCULES DR,COLCHESTER,VT,5446,"CHAMPLAIN CABLE CORP.175 HERCULES DR, COLCHESTER VERMONT 05446 (CHITTENDEN)",0,C,,110000314810
05446SRMYC789VE,-73.163,44.501000000000005,False,50,007,002200,50,50007,50007002200,1400000US50007002200,U.S. ARMY NATIONAL GUARD CAMP JOHNSON (RANGE),789 VERMONT NATIONAL GUARD RD,COLCHESTER,VT,5446,"U.S. ARMY NATIONAL GUARD CAMP JOHNSON (RANGE).789 VERMONT NATIONAL GUARD RD, COLCHESTER VERMONT 05446 (CHITTENDEN)",0,F,,110037143356
05446HZLTT217LA,-73.218,44.54600000000001,False,50,007,002302,50,50007,50007002302,1400000US50007002302,HAZELETT STRIP CASTING CORP,135 W LAKESHORE DR,COLCHESTER,VT,5446,"HAZELETT STRIP CASTING CORP.135 W LAKESHORE DR, COLCHESTER VERMONT 05446 (CHITTENDEN)",0,C,,110000314829
05452BMXXX1000R,-73.105,44.479,False,50,007,002602,50,50007,50007002602,1400000US50007002602,GLOBALFOUNDRIES US 2 LLC - VERMONT FACILITY,1000 RIVER ST,ESSEX JUNCTION,VT,5452,"GLOBALFOUNDRIES US 2 LLC - VERMONT FACILITY.1000 RIVER ST, ESSEX JUNCTION VERMONT 05452 (CHITTENDEN)",0,C,,110000314847
05461NTRNTPOBOX,-73.111,44.331,False,50,007,003502,50,50007,50007003502,1400000US50007003502,SAPUTO CHEESE  USA INC,10516 RT 116,HINESBURG,VT,5461,"SAPUTO CHEESE  USA INC.10516 RT 116, HINESBURG VERMONT 05461 (CHITTENDEN)",0,C,,110009509308
05468VRMNTGEORG,-73.089,44.696000000000005,False,50,011,010900,50,50011,50011010900,1400000US50011010900,VERMONT WHEY CO,"GEORGIA DAIRY INDL PARK, RD #31",GEORGIA,VT,5468,"VERMONT WHEY CO.GEORGIA DAIRY INDL PARK, RD #31, GEORGIA VERMONT 05468 (FRANKLIN)",1,C,,
05468WYTHNGEORG,-73.098,44.696999999999996,False,50,011,010900,50,50011,50011010900,1400000US50011010900,PERRIGO NUTRITIONALS,147 INDUSTRIAL PARK RD,GEORGIA,VT,5468,"PERRIGO NUTRITIONALS.147 INDUSTRIAL PARK RD, GEORGIA VERMONT 05468 (FRANKLIN)",0,C,,110017405618
05478BRTKN110LA,-73.08800000000001,44.81100000000001,False,50,011,010700,50,50011,50011010700,1400000US50011010700,MYLAN TECHNOLOGIES INC,110 LAKE ST,SAINT ALBANS,VT,5478,"MYLAN TECHNOLOGIES INC.110 LAKE ST, SAINT ALBANS VERMONT 05478 (FRANKLIN)",0,C,,110000496124
05478FNDGR1521L,-73.084,44.818999999999996,False,50,011,010700,50,50011,50011010700,1400000US50011010700,FONDA GROUP INC,15 - 21 LOWER NEWTON ST,SAINT ALBANS,VT,5478,"FONDA GROUP INC.15 - 21 LOWER NEWTON ST, SAINT ALBANS VERMONT 05478 (FRANKLIN)",0,C,,
05478STLBN140FE,-73.085,44.816,False,50,011,010700,50,50011,50011010700,1400000US50011010700,ST ALBANS COOPERATIVE CREAMERY INC,140 FEDERAL ST,SAINT ALBANS,VT,5478,"ST ALBANS COOPERATIVE CREAMERY INC.140 FEDERAL ST, SAINT ALBANS VERMONT 05478 (FRANKLIN)",0,C,,110000314865
05478GWYNC79WAL,-73.097,44.817,False,50,011,010700,50,50011,50011010700,1400000US50011010700,AGWAY INC ST ALBANS FEED MILL,79 WALNUT ST,SAINT ALBANS,VT,5478,"AGWAY INC ST ALBANS FEED MILL.79 WALNUT ST, SAINT ALBANS VERMONT 05478 (FRANKLIN)",0,C,,110038242835
05478SPRRTSTALB,-73.098,44.799,False,50,011,010600,50,50011,50011010600,1400000US50011010600,SUPERIOR TECHNICAL CERAMICS,ST ALBANS INDUSTRIAL PARK,SAINT ALBANS,VT,5478,"SUPERIOR TECHNICAL CERAMICS.ST ALBANS INDUSTRIAL PARK, SAINT ALBANS VERMONT 05478 (FRANKLIN)",0,C,,
05478VRDYB75SWA,-73.08,44.83,False,50,011,010600,50,50011,50011010600,1400000US50011010600,ENERGIZER BATTERY MANUFACTURING INC,75 SWANTON RD,SAINT ALBANS,VT,5478,"ENERGIZER BATTERY MANUFACTURING INC.75 SWANTON RD, SAINT ALBANS VERMONT 05478 (FRANKLIN)",0,C,,110000314874
05478BNJRR900IN,-73.1,44.79600000000001,False,50,011,010600,50,50011,50011010600,1400000US50011010600,BEN & JERRY'S HOMEMADE INC ST ALBANS,900 INDUSTRIAL PARK RD,SAINT ALBANS,VT,5478,"BEN & JERRY'S HOMEMADE INC ST ALBANS.900 INDUSTRIAL PARK RD, SAINT ALBANS VERMONT 05478 (FRANKLIN)",0,C,,110000758350
05482THSHLRTE7S,-73.233,44.36600000000001,False,50,007,003400,50,50007,50007003400,1400000US50007003400,SHELBURNE CORP,6221 SHELBURNE RD,SHELBURNE,VT,5482,"SHELBURNE CORP.6221 SHELBURNE RD, SHELBURNE VERMONT 05482 (CHITTENDEN)",0,C,,
05482BLDGTHARBO,-73.25,44.413999999999994,False,50,007,003400,50,50007,50007003400,1400000US50007003400,BLODGETT OVEN CO,HARBOR RD,SHELBURNE,VT,5482,"BLODGETT OVEN CO.HARBOR RD, SHELBURNE VERMONT 05482 (CHITTENDEN)",0,C,,
05485BSCSCMILLS,-72.976,44.91,False,50,011,010100,50,50011,50011010100,1400000US50011010100,WESTROCK CONVERTING LLC,369 MILL ST,SHELDON SPRINGS,VT,5485,"WESTROCK CONVERTING LLC.369 MILL ST, SHELDON SPRINGS VERMONT 05485 (FRANKLIN)",0,C,,110007328490
05491HRCLSPANTO,-73.263,44.163000000000004,False,50,001,960300,50,50001,50001960300,1400000US50001960300,SIMMONDS PRECISION PRODUCTS INC,100 PANTON RD,VERGENNES,VT,5491,"SIMMONDS PRECISION PRODUCTS INC.100 PANTON RD, VERGENNES VERMONT 05491 (ADDISON)",0,C,,110000826848
05647CBTFRBOX12,-72.314,44.401,False,50,023,954000,50,50023,50023954000,1400000US50023954000,CABOT CREAMERY,2878 MAIN ST,CABOT,VT,5647,"CABOT CREAMERY.2878 MAIN ST, CABOT VERMONT 05647 (WASHINGTON)",0,C,,110000314892
05701GNRLL210CO,-72.993,43.607,False,50,021,963200,50,50021,50021963200,1400000US50021963200,GE AVIATION PLANT 1,210 COLUMBIAN AVE,RUTLAND,VT,5701,"GE AVIATION PLANT 1.210 COLUMBIAN AVE, RUTLAND VERMONT 05701 (RUTLAND)",0,C,,110000314909
05701MRBSNSEWAR,-72.968,43.585,False,50,021,962700,50,50021,50021962700,1400000US50021962700,MOORE CORP BUSINESS FORMS & SYSTEMS DIV,SEWARD DR,RUTLAND,VT,57010729,"MOORE CORP BUSINESS FORMS & SYSTEMS DIV.SEWARD DR, RUTLAND VERMONT 05701 (RUTLAND)",0,C,,
05701RTLNDRIPLE,-73.00399999999999,43.603,False,50,021,962700,50,50021,50021962700,1400000US50021962700,RUTLAND PLYWOOD CORP,98 RIPLEY RD,RUTLAND,VT,5701,"RUTLAND PLYWOOD CORP.98 RIPLEY RD, RUTLAND VERMONT 05701 (RUTLAND)",0,C,,110000314918
05701SSMCCWINDC,-72.959,43.575,False,50,021,962700,50,50021,50021962700,1400000US50021962700,ISOVOLTA/U.S. SAMICA,477 WINDCREST RD,RUTLAND,VT,5701,"ISOVOLTA/U.S. SAMICA.477 WINDCREST RD, RUTLAND VERMONT 05701 (RUTLAND)",0,C,,110000603053
05759GNRLL16WIN,-72.959,43.577,False,50,021,962700,50,50021,50021962700,1400000US50021962700,GE AVIATION PLANT 2,270 WINDCREST RD,NORTH CLARENDON,VT,5759,"GE AVIATION PLANT 2.270 WINDCREST RD, NORTH CLARENDON VERMONT 05759 (RUTLAND)",0,C,,110000314936
05733DWTYLPROSP,-73.092,43.806000000000004,False,50,021,962200,50,50021,50021962200,1400000US50021962200,NEXUS CUSTOM ELECTRONICS INC,402 PROSPECT ST,BRANDON,VT,5733,"NEXUS CUSTOM ELECTRONICS INC.402 PROSPECT ST, BRANDON VERMONT 05733 (RUTLAND)",0,C,,110001122936
05745NWNGLRT53X,-73.098,43.79,False,50,021,962200,50,50021,50021962200,1400000US50021962200,NEW ENGLAND WOODCRAFT INC,RT 53,FOREST DALE,VT,5745,"NEW ENGLAND WOODCRAFT INC.RT 53, FOREST DALE VERMONT 05745 (RUTLAND)",0,C,,
05748WYRHSRTE10,-72.84100000000001,43.919,False,50,001,960600,50,50001,50001960600,1400000US50001960600,CHESAPEAKE HARDWOOD PRODSINC,RTE 100,HANCOCK,VT,5748,"CHESAPEAKE HARDWOOD PRODSINC.RTE 100, HANCOCK VERMONT 05748 (ADDISON)",0,C,,
05753KRFTN500EX,-73.171,44.026,False,50,001,960800,50,50001,50001960800,1400000US50001960800,KRAFT GENERAL FOODS INC KRAFT USA,500 EXCHANGE ST,MIDDLEBURY,VT,5753,"KRAFT GENERAL FOODS INC KRAFT USA.500 EXCHANGE ST, MIDDLEBURY VERMONT 05753 (ADDISON)",0,C,,
05753CBTGR100EX,-73.171,44.031000000000006,False,50,001,960800,50,50001,50001960800,1400000US50001960800,AGRI-MARK INC,869 EXCHANGE ST,MIDDLEBURY,VT,5753,"AGRI-MARK INC.869 EXCHANGE ST, MIDDLEBURY VERMONT 05753 (ADDISON)",0,C,,110040608205
05819HVWDMUSROU,-72.013,44.482,False,50,005,957400,50,50005,50005957400,1400000US50005957400,WEIDMANN ELECTRICAL TECHNOLOGY INC,1 GORDON MILLS WAY,SAINT JOHNSBURY,VT,5819,"WEIDMANN ELECTRICAL TECHNOLOGY INC.1 GORDON MILLS WAY, SAINT JOHNSBURY VERMONT 05819 (CALEDONIA)",0,C,,110000314945
05830NNBTTBAXTE,-72.107,45.004,False,50,019,951200,50,50019,50019951200,1400000US50019951200,TIVOLY INC,434 BAXTER AVE,DERBY LINE,VT,5830,"TIVOLY INC.434 BAXTER AVE, DERBY LINE VERMONT 05830 (ORLEANS)",0,C,,110000314954
05846THNLLRRNO1,-71.84899999999999,44.803999999999995,False,50,009,950200,50,50009,50009950200,1400000US50009950200,ETHAN ALLEN INC ISLAND POND DIV,RR NO 1 BOX 100B,ISLAND POND,VT,5846,"ETHAN ALLEN INC ISLAND POND DIV.RR NO 1 BOX 100B, ISLAND POND VERMONT 05846 (ESSEX)",0,C,,
05847VRMNTRR1BO,-72.52,44.763999999999996,False,50,019,951700,50,50019,50019951700,1400000US50019951700,VERMONT ASBESTOS GROUP INC,NORTH RD,LOWELL,VT,5847,"VERMONT ASBESTOS GROUP INC.NORTH RD, LOWELL VERMONT 05847 (ORLEANS)",1,C,,
05851MRDNNRT122,-72.025,44.552,False,50,005,957300,50,50005,50005957300,1400000US50005957300,MARDON IND INC,RTE 122,LYNDONVILLE,VT,5851,"MARDON IND INC.RTE 122, LYNDONVILLE VERMONT 05851 (CALEDONIA)",1,C,,
05951NRTHSAIRPO,-72.021,44.574,False,50,005,957300,50,50005,50005957300,1400000US50005957300,"VERMONT AMERICAN CORP, NORTHEAST TOOL DIV",AIRPORT RD,LYNDONVILLE,VT,5851,"VERMONT AMERICAN CORP, NORTHEAST TOOL DIV.AIRPORT RD, LYNDONVILLE VERMONT 05851 (CALEDONIA)",1,C,,
05851VRMNT79MAI,-72.002,44.54,False,50,005,957200,50,50005,50005957200,1400000US50005957200,KENNAMETAL INC,378 MAIN ST,LYNDONVILLE,VT,5851,"KENNAMETAL INC.378 MAIN ST, LYNDONVILLE VERMONT 05851 (CALEDONIA)",0,C,,110000314963
05855NWPRTDERBY,-72.179,44.946000000000005,False,50,019,951400,50,50019,50019951400,1400000US50019951400,NEWPORT PLASTICS CORP,DERBY RD,NEWPORT,VT,5855,"NEWPORT PLASTICS CORP.DERBY RD, NEWPORT VERMONT 05855 (ORLEANS)",0,C,,
05860RLNSDRAILR,-72.203,44.808,False,50,019,951800,50,50019,50019951800,1400000US50019951800,ETHAN ALLEN OPERATIONS INC ORLEANS DIV,27 RAILROAD AVE,ORLEANS,VT,5860,"ETHAN ALLEN OPERATIONS INC ORLEANS DIV.27 RAILROAD AVE, ORLEANS VERMONT 05860 (ORLEANS)",0,C,,110012499787
05868KRFTNMILLS,-72.407,44.903,False,50,019,951600,50,50019,50019951600,1400000US50019951600,AGRI-MARK INC,MILL ST,TROY,VT,58680107,"AGRI-MARK INC.MILL ST, TROY VERMONT 05868 (ORLEANS)",0,C,,
05902THNLLMAINS,-71.507,45.011,False,50,009,950100,50,50009,50009950100,1400000US50009950100,ETHAN ALLEN OPERATIONS INC BEECHER FALLS DIV,1280 VT RT 253,BEECHER FALLS,VT,5902,"ETHAN ALLEN OPERATIONS INC BEECHER FALLS DIV.1280 VT RT 253, BEECHER FALLS VERMONT 05902 (ESSEX)",0,C,,110000871156
05904GRGPCRIVER,-71.722,44.412,False,50,009,950500,50,50009,50009950500,1400000US50009950500,DIRIGO PAPER CO/DALTON HYDRO LLC,35 RIVERSIDE AVE,GILMAN,VT,5904,"DIRIGO PAPER CO/DALTON HYDRO LLC.35 RIVERSIDE AVE, GILMAN VERMONT 05904 (ESSEX)",0,C,,110000581601
05476BLSLFELEVA,-72.663,45.001000000000005,False,50,011,010300,50,50011,50011010300,1400000US50011010300,KENT NUTRITION GROUP INC,1 WEBSTER ST,RICHFORD,VT,5476,"KENT NUTRITION GROUP INC.1 WEBSTER ST, RICHFORD VERMONT 05476 (FRANKLIN)",0,C,,110000581576
05488LCLLFPOBOX,-73.128,44.927,False,50,011,010500,50,50011,50011010500,1400000US50011010500,LUCILLE FARM PRODUCTS,SWANTON INDUSTRIAL PARK,SWANTON,VT,5488,"LUCILLE FARM PRODUCTS.SWANTON INDUSTRIAL PARK, SWANTON VERMONT 05488 (FRANKLIN)",0,C,,
05488NWNGLLAKES,-73.13600000000001,44.922,False,50,011,010500,50,50011,50011010500,1400000US50011010500,NEW ENGLAND FIREARMS CO INC,28 LAKE ST,SWANTON,VT,5488,"NEW ENGLAND FIREARMS CO INC.28 LAKE ST, SWANTON VERMONT 05488 (FRANKLIN)",0,C,,
05488NTRTC50BRO,-73.12899999999999,44.925,False,50,011,010500,50,50011,50011010500,1400000US50011010500,NUTRITE CORP,50 BROOKLYN ST,SWANTON,VT,5488,"NUTRITE CORP.50 BROOKLYN ST, SWANTON VERMONT 05488 (FRANKLIN)",0,C,,
05488CRGLL100JO,-73.13,44.93,False,50,011,010500,50,50011,50011010500,1400000US50011010500,CARGILL FEED & NUTRITION SWANTON,149 JONERGIN DR,SWANTON,VT,5488,"CARGILL FEED & NUTRITION SWANTON.149 JONERGIN DR, SWANTON VERMONT 05488 (FRANKLIN)",0,C,,110005293486
0548WSWNVL11JNE,-73.128,44.928000000000004,False,50,011,010500,50,50011,50011010500,1400000US50011010500,SWAN VALLEY CHEESE,11 JONERGIN DR,SWANTON,VT,5488,"SWAN VALLEY CHEESE.11 JONERGIN DR, SWANTON VERMONT 05488 (FRANKLIN)",0,C,,110069308886
05678BMBRDPITMA,-72.487,44.17100000000001,False,50,023,955400,50,50023,50023955400,1400000US50023955400,BOMBARDIER TRANSIT CORP,29 PITMAN RD WILSON INDUSTRIAL PARK,WEBSTERVILLE,VT,5678,"BOMBARDIER TRANSIT CORP.29 PITMAN RD WILSON INDUSTRIAL PARK, WEBSTERVILLE VERMONT 05678 (WASHINGTON)",0,C,,
05641HPHDB219AL,-72.51,44.184,False,50,023,955400,50,50023,50023955400,1400000US50023955400,HP HOOD LLC,219 ALLEN ST,BARRE,VT,5641,"HP HOOD LLC.219 ALLEN ST, BARRE VERMONT 05641 (WASHINGTON)",0,C,,110013724577
0564WVRMNT4PITM,-72.486,44.172,False,50,023,955400,50,50023,50023955400,1400000US50023955400,VERMONT CREAMERY LLC,40 PITMAN RD,BARRE,VT,5641,"VERMONT CREAMERY LLC.40 PITMAN RD, BARRE VERMONT 05641 (WASHINGTON)",0,C,,110070557818
05101MLSRCRTE5S,-72.457,43.09,False,50,025,967600,50,50025,50025967600,1400000US50025967600,MELSUR CORP,RTE 5 S,BELLOWS FALLS,VT,5101,"MELSUR CORP.RTE 5 S, BELLOWS FALLS VERMONT 05101 (WINDHAM)",0,C,,
0515WSRMYNARMRY,-72.449,43.083999999999996,False,50,025,967600,50,50025,50025967600,1400000US50025967600,US ARMY NATIONAL GUARD WESTMINSTER TRAINING SITE (RANGE),ARMORY LANE,WESTMINSTER,VT,5158,"US ARMY NATIONAL GUARD WESTMINSTER TRAINING SITE (RANGE).ARMORY LANE, WESTMINSTER VERMONT 05158 (WINDHAM)",0,F,,110055497519
05101WHTNYINDUS,-72.456,43.163000000000004,False,50,025,967000,50,50025,50025967000,1400000US50025967000,WHITNEY BLAKE CO,20 INDUSTRIAL DR,BELLOWS FALLS,VT,5101,"WHITNEY BLAKE CO.20 INDUSTRIAL DR, BELLOWS FALLS VERMONT 05101 (WINDHAM)",0,C,,110007400936
05301GSPRC101JO,-72.565,42.831,False,50,025,968500,50,50025,50025968500,1400000US50025968500,G S PRECISION INC,101 JOHN SEITZ DR,BRATTLEBORO,VT,5301,"G S PRECISION INC.101 JOHN SEITZ DR, BRATTLEBORO VERMONT 05301 (WINDHAM)",0,C,,
05451CPRNDTHOMP,-73.038,44.498999999999995,False,50,007,002702,50,50007,50007002702,1400000US50007002702,BELDEN CDT INC ESSEX JUNCTION,26 THOMPSON DR,ESSEX JUNCTION,VT,5452,"BELDEN CDT INC ESSEX JUNCTION.26 THOMPSON DR, ESSEX JUNCTION VERMONT 05452 (CHITTENDEN)",0,C,,110000314838
0545WRVSNM7CRPR,-73.045,44.503,False,50,007,002702,50,50007,50007002702,1400000US50007002702,REVISION MILITARY,7 CORPORATE DR,ESSEX JUNCTION,VT,5452,"REVISION MILITARY.7 CORPORATE DR, ESSEX JUNCTION VERMONT 05452 (CHITTENDEN)",0,C,,110038915494
05454MLTNB293FL,-72.986,44.67100000000001,False,50,011,011000,50,50011,50011011000,1400000US50011011000,MILTON BRADLEY CO WOOD PRODUCTS,293 FLETCHER RD,FAIRFAX,VT,54549768,"MILTON BRADLEY CO WOOD PRODUCTS.293 FLETCHER RD, FAIRFAX VERMONT 05454 (FRANKLIN)",0,C,,
05743SKYLNHWY22,-73.264,43.575,False,50,021,963700,50,50021,50021963700,1400000US50021963700,SKYLINE HOMES,875 S MAIN ST,FAIR HAVEN,VT,5743,"SKYLINE HOMES.875 S MAIN ST, FAIR HAVEN VERMONT 05743 (RUTLAND)",0,C,,110000581594
05250MCKML79EAR,-73.153,43.071999999999996,False,50,003,970700,50,50003,50003970700,1400000US50003970700,MACK MOLDING CO,79 E ARLINGTON RD,ARLINGTON,VT,5250,"MACK MOLDING CO.79 E ARLINGTON RD, ARLINGTON VERMONT 05250 (BENNINGTON)",0,C,,110001136155
05495BLDGT290BO,-73.134,44.445,False,50,007,003100,50,50007,50007003100,1400000US50007003100,BLODGETT COMBI,290 BOYER CIRCLE,WILLISTON,VT,5495,"BLODGETT COMBI.290 BOYER CIRCLE, WILLISTON VERMONT 05495 (CHITTENDEN)",0,C,,
0549WPKNDS346AV,-73.133,44.463,False,50,007,003100,50,50007,50007003100,1400000US50007003100,PIKE INDUSTRIES INC - WILLISTON VT (P800),346 AVENUE A,WILLISTON,VT,5495,"PIKE INDUSTRIES INC - WILLISTON VT (P800).346 AVENUE A, WILLISTON VERMONT 05495 (CHITTENDEN)",0,C,,110043670113
05495STGRS193IN,-73.129,44.462,True,50,007,003100,50,50007,50007003100,1400000US50007003100,ST GRISWOLD AND CO INC,193 INDUSTRIAL AVENUE,WILLISTON,VT,5495,"ST GRISWOLD AND CO INC 193 INDUSTRIAL AVENUE, WILLISTON, VT, 5495",0,C,,
05142MCKMLRTE13,-72.609,43.382,False,50,027,966200,50,50027,50027966200,1400000US50027966200,MACK MOLDING CO,2044 MAIN ST,CAVENDISH,VT,5142,"MACK MOLDING CO.2044 MAIN ST, CAVENDISH VERMONT 05142 (WINDSOR)",0,C,,110008205405
05346PTNYPOLDDE,-72.52199999999999,42.963,False,50,025,968300,50,50025,50025968300,1400000US50025968300,SOUNDVIEW VERMONT HOLDINGS LLC,MAIN ST,PUTNEY,VT,5346,"SOUNDVIEW VERMONT HOLDINGS LLC.MAIN ST, PUTNEY VERMONT 05346 (WINDHAM)",0,C,,110008053827
05641SFTYK23WSE,-72.516,44.206,False,50,023,955200,50,50023,50023955200,1400000US50023955200,SAFETY-KLEEN SYSTEMS BARRE (BVT),23 W SECOND ST,BARRE,VT,5641,"SAFETY-KLEEN SYSTEMS BARRE (BVT).23 W SECOND ST, BARRE VERMONT 05641 (WASHINGTON)",0,C,,110000620392
05641RVNGL24SMI,-72.513,44.20399999999999,False,50,023,955200,50,50023,50023955200,1400000US50023955200,"HIGHLANDS FUEL DELIVERY, LLC",24 SMITH ST,BARRE,VT,5641,"HIGHLANDS FUEL DELIVERY, LLC.24 SMITH ST, BARRE VERMONT 05641 (WASHINGTON)",0,C,,110005298702
05762STNLY3950R,-72.808,43.771,False,50,021,962100,50,50021,50021962100,1400000US50021962100,STANLEY TOOLS PITTSFIELD,3950 RTE 100,PITTSFIELD,VT,5762,"STANLEY TOOLS PITTSFIELD.3950 RTE 100, PITTSFIELD VERMONT 05762 (RUTLAND)",1,C,,
05403SRFRC105NC,-73.145,44.476000000000006,False,50,007,980000,50,50007,50007980000,1400000US50007980000,US DOD USAF VERMONT ANG,105 NCO DR,SOUTH BURLINGTON,VT,5403,"US DOD USAF VERMONT ANG.105 NCO DR, SOUTH BURLINGTON VERMONT 05403 (CHITTENDEN)",0,F,,110005260724
05764FRSTL212ID,-73.236,43.519,False,50,021,963800,50,50021,50021963800,1400000US50021963800,FIRST LIGHT TECHNOLOGIES INC,212 IDEAL WAY,POULTNEY,VT,5764,"FIRST LIGHT TECHNOLOGIES INC.212 IDEAL WAY, POULTNEY VERMONT 05764 (RUTLAND)",0,C,,110005299998
05764JYMRS28FSC,-73.237,43.514,True,50,021,963800,50,50021,50021963800,1400000US50021963800,"JAYMAR SPECIALTY CO INC, FAIR HAVEN SPECIALTY CO INC",28 FS CHURCH ST,POULTNEY,VT,5764,"JAYMAR SPECIALTY CO INC, FAIR HAVEN SPECIALTY CO INC 28 FS CHURCH ST, POULTNEY, VT, 5764",1,C,,
05701RVNGL148SP,-72.97800000000001,43.599,False,50,021,963300,50,50021,50021963300,1400000US50021963300,IRVING OIL CORP,148 SPRUCE ST,RUTLAND,VT,5701,"IRVING OIL CORP.148 SPRUCE ST, RUTLAND VERMONT 05701 (RUTLAND)",0,C,,110005299676
05701QSTCH92PAR,-72.979,43.595,False,50,021,963300,50,50021,50021963300,1400000US50021963300,QUESTECH CORP,92 PARK ST,RUTLAND,VT,5701,"QUESTECH CORP.92 PARK ST, RUTLAND VERMONT 05701 (RUTLAND)",0,C,,110020572860
