TRIFID,LONGITUDE,LATITUDE,ESTIMATE,STATEFP,COUNTYFP,TRACTCE,STATEGEOID,COUNTYGEOID,TRACTGEOID,AFFGEOID,FACILITY_NAME,STREET,CITY,STUSPS,ZIP_CODE,FACILITY,FAC_CLOSED_IND,ASGN_FEDERAL_IND,BIA_CODE,EPA_REGISTRY_ID
05403CPRCN6GREE,-73.14,44.457,False,50,007,004002,50,50007,50007004002,1400000US50007004002,COOPER CONTROLS PCI LIGHTING,6 GREEN TREE DR,SOUTH BURLINGTON,VT,5403,"COOPER CONTROLS PCI LIGHTING.6 GREEN TREE DR, SOUTH BURLINGTON VERMONT 05403 (CHITTENDEN)",0,C,,110037143310
05465SRMYTETHAN,-72.935,44.478,False,50,007,002800,50,50007,50007002800,1400000US50007002800,US ARMY NATIONAL GUARD ETHAN ALLEN FIRING RANGE,ETHAN ALLEN FIRING RANGE,JERICHO,VT,5465,"US ARMY NATIONAL GUARD ETHAN ALLEN FIRING RANGE.ETHAN ALLEN FIRING RANGE, JERICHO VERMONT 05465 (CHITTENDEN)",0,F,,110037143365
0547WPKNDS326CA,-73.182,44.086000000000006,False,50,001,960400,50,50001,50001960400,1400000US50001960400,PIKE INDUSTRIES INC - NEW HAVEN (C600 & P736),326 CAMPGROUND ROAD,NEW HAVEN,VT,5472,"PIKE INDUSTRIES INC - NEW HAVEN (C600 & P736).326 CAMPGROUND ROAD, NEW HAVEN VERMONT 05472 (ADDISON)",0,C,,110007329275
0573WPKNDS2275R,-72.991,43.326,False,50,021,964200,50,50021,50021964200,1400000US50021964200,PIKE INDUSTRIES INC - DANBY (C613 & P733),2275 ROUTE 7,DANBY,VT,5739,"PIKE INDUSTRIES INC - DANBY (C613 & P733).2275 ROUTE 7, DANBY VERMONT 05739 (RUTLAND)",0,C,,110008211363
0581WPKNDS2884D,-71.952,44.375,False,50,005,957900,50,50005,50005957900,1400000US50005957900,PIKE INDUSTRIES INC - WATERFORD VT (P702 & C603),2884 DUCK POND ROAD,WATERFORD,VT,5819,"PIKE INDUSTRIES INC - WATERFORD VT (P702 & C603).2884 DUCK POND ROAD, WATERFORD VERMONT 05819 (CALEDONIA)",0,C,,110010911834
0575WKLWTC238IN,-72.955,43.525,False,50,021,963400,50,50021,50021963400,1400000US50021963400,KALOW TECHNOLOGIES,238 INNOVATION DR,NORTH CLARENDON,VT,5759,"KALOW TECHNOLOGIES.238 INNOVATION DR, NORTH CLARENDON VERMONT 05759 (RUTLAND)",0,C,,110005298800
0581WFRBNK2176P,-71.97800000000001,44.428000000000004,False,50,005,957500,50,50005,50005957500,1400000US50005957500,FAIRBANKS SCALES INC,2176 PORTLAND ST,SAINT JOHNSBURY,VT,5819,"FAIRBANKS SCALES INC.2176 PORTLAND ST, SAINT JOHNSBURY VERMONT 05819 (CALEDONIA)",0,C,,110005260939
0564WPKNDS165GR,-72.565,44.21,False,50,023,954500,50,50023,50023954500,1400000US50023954500,PIKE INDUSTRIES PLANT P-901 (BERLIN),165 GRANGER ROAD - BOX 542,BARRE,VT,5641,"PIKE INDUSTRIES PLANT P-901 (BERLIN).165 GRANGER ROAD - BOX 542, BARRE VERMONT 05641 (WASHINGTON)",0,C,,110008208073
05401JSPHC111IN,-73.209,44.493,True,50,007,000300,50,50007,50007000300,1400000US50007000300,JOSEPH C MCNEIL GENERATING STATION,111 INTERVALE RD,BURLINGTON,VT,5401,"JOSEPH C MCNEIL GENERATING STATION 111 INTERVALE RD, BURLINGTON, VT, 5401",0,C,,
05855CLMBF115CO,-72.2,44.953,True,50,019,951500,50,50019,50019951500,1400000US50019951500,COLUMBIA FOREST PRODUCTS,115 COLUMBIA WAY,NEWPORT,VT,5855,"COLUMBIA FOREST PRODUCTS 115 COLUMBIA WAY, NEWPORT, VT, 5855",0,C,,
