TRIFID,LONGITUDE,LATITUDE,ESTIMATE,STATEFP,COUNTYFP,TRACTCE,STATEGEOID,COUNTYGEOID,TRACTGEOID,AFFGEOID,FACILITY_NAME,STREET,CITY,STUSPS,ZIP_CODE,FACILITY,FAC_CLOSED_IND,ASGN_FEDERAL_IND,BIA_CODE,EPA_REGISTRY_ID
54014MYRNDHIGHW,-92.53399999999999,44.593999999999994,False,55,093,960600,55,55093,55093960600,1400000US55093960600,TRINITY MEYER UTILITY STRUCTURES LLC PLT NO 1663,W8020 150TH AVE,HAGER CITY,WI,54014,"TRINITY MEYER UTILITY STRUCTURES LLC PLT NO 1663.W8020 150TH AVE, HAGER CITY WISCONSIN 54014 (PIERCE)",0,C,,110000420731
54016GSLCT1301I,-92.734,44.957,False,55,109,120903,55,00000,55109120903,1400000US55109120903,AMETEK SPECIALTY MOTORS,1301 INDUSTRIAL ST,HUDSON,WI,54016,"AMETEK SPECIALTY MOTORS.1301 INDUSTRIAL ST, HUDSON WISCONSIN 54016 (ST. CROIX ISLAND)",0,C,,
54016MPRMN1360L,-92.73899999999999,44.95399999999999,False,55,109,120903,55,00000,55109120903,1400000US55109120903,EMPIRE MANUFACTURING INC,1630 LIVINGSTONE RD,HUDSON,WI,54016,"EMPIRE MANUFACTURING INC.1630 LIVINGSTONE RD, HUDSON WISCONSIN 54016 (ST. CROIX ISLAND)",0,C,,
54016NRNCX1600O,-92.73100000000001,44.953,False,55,109,120903,55,00000,55109120903,1400000US55109120903,GEA PROCESS ENGINEERING,1600 O'KEEFE RD,HUDSON,WI,54016,"GEA PROCESS ENGINEERING.1600 O'KEEFE RD, HUDSON WISCONSIN 54016 (ST. CROIX ISLAND)",0,C,,110008058626
54017DMNNC201NK,-92.539,45.126000000000005,False,55,109,120501,55,00000,55109120501,1400000US55109120501,DOMAIN INC,156 HIGH ST,NEW RICHMOND,WI,540171213,"DOMAIN INC.156 HIGH ST, NEW RICHMOND WISCONSIN 54017 (ST. CROIX ISLAND)",0,C,,110000420759
54017FDRLF600WI,-92.546,45.106,False,55,109,120501,55,00000,55109120501,1400000US55109120501,FEDERAL FOAM TECHNOLOGIES INC,600 WISCONSIN DR,NEW RICHMOND,WI,54017,"FEDERAL FOAM TECHNOLOGIES INC.600 WISCONSIN DR, NEW RICHMOND WISCONSIN 54017 (ST. CROIX ISLAND)",0,C,,
54020NRTHR805SE,-92.685,45.318000000000005,False,55,095,960800,55,55095,55095960800,1400000US55095960800,POLARIS INDUSTRIES INC,805 SEMINOLE AVE,OSCEOLA,WI,54020,"POLARIS INDUSTRIES INC.805 SEMINOLE AVE, OSCEOLA WISCONSIN 54020 (POLK)",0,C,,110000420768
54020SSCTN807PR,-92.68299999999999,45.321000000000005,False,55,095,960800,55,55095,55095960800,1400000US55095960800,S & S COATINGS INC PLANT 2,807 PROSPECT AVE,OSCEOLA,WI,54020,"S & S COATINGS INC PLANT 2.807 PROSPECT AVE, OSCEOLA WISCONSIN 54020 (POLK)",0,C,,
54022VLLRT715ST,-92.62299999999999,44.869,False,55,109,120901,55,00000,55109120901,1400000US55109120901,MANITOWOC CO INC KOLPAK RIVER FALLS PLANT,715 ST CROIX STREET,RIVER FALLS,WI,54022,"MANITOWOC CO INC KOLPAK RIVER FALLS PLANT.715 ST CROIX STREET, RIVER FALLS WISCONSIN 54022 (ST. CROIX ISLAND)",0,C,,110000420786
54106TGMPR307NC,-88.45200000000001,44.477,False,55,087,012800,55,55087,55087012800,1400000US55087012800,SAPUTO CHEESE USA INC,307 N CLARK ST,BLACK CREEK,WI,54106,"SAPUTO CHEESE USA INC.307 N CLARK ST, BLACK CREEK WISCONSIN 54106 (OUTAGAMIE)",0,C,,110000420795
54110BRLLN200PA,-88.06,44.178999999999995,False,55,015,020100,55,55015,55015020100,1400000US55015020100,BRILLION IRON WORKS INC,200 PARK AVE,BRILLION,WI,54110,"BRILLION IRON WORKS INC.200 PARK AVE, BRILLION WISCONSIN 54110 (CALUMET)",1,C,,110000420802
54110KSSNNHWYKR,-88.10799999999999,44.192,False,55,015,020100,55,55015,55015020100,1400000US55015020100,KASSON INC USA,HWY K RT 2,BRILLION,WI,541100010,"KASSON INC USA.HWY K RT 2, BRILLION WISCONSIN 54110 (CALUMET)",1,C,,
54110PRFSSHWY10,-88.07700000000001,44.184,False,55,015,020100,55,55015,55015020100,1400000US55015020100,PROFESSIONAL PLATING,705 NORTHWAY DR,BRILLION,WI,54110,"PROFESSIONAL PLATING.705 NORTHWAY DR, BRILLION WISCONSIN 54110 (CALUMET)",0,C,,110000498872
54110THLRS235EA,-88.06,44.181999999999995,False,55,015,020100,55,55015,55015020100,1400000US55015020100,LARSEN CO,235 E RYAN ST,BRILLION,WI,54110,"LARSEN CO.235 E RYAN ST, BRILLION WISCONSIN 54110 (CALUMET)",0,C,,
54110RNSCM655WR,-88.07600000000001,44.181999999999995,False,55,015,020100,55,55015,55015020100,1400000US55015020100,ARIENS CO,655 W RYAN ST,BRILLION,WI,54110,"ARIENS CO.655 W RYAN ST, BRILLION WISCONSIN 54110 (CALUMET)",0,C,,110000420811
54113PPLTN540PR,-88.30799999999999,44.27,False,55,087,012000,55,55087,55087012000,1400000US55087012000,APPLETON PROPERTY VENTURES LLC,540 PROSPECT ST,COMBINED LOCKS,WI,54113,"APPLETON PROPERTY VENTURES LLC.540 PROSPECT ST, COMBINED LOCKS WISCONSIN 54113 (OUTAGAMIE)",0,C,,110017419523
54115BYNGN1900E,-88.06200000000001,44.422,False,55,009,010300,55,55009,55009010300,1400000US55009010300,THE CA LAWTON CO FOUNDRY OPERATIONS,1900 ENTERPRISE DR,DE PERE,WI,54115,"THE CA LAWTON CO FOUNDRY OPERATIONS.1900 ENTERPRISE DR, DE PERE WISCONSIN 54115 (BROWN)",0,C,,110002036788
54115SHDCM700HE,-88.06299999999999,44.428000000000004,False,55,009,010300,55,55009,55009010300,1400000US55009010300,SHADE/ALLIED INC,700 HERITAGE RD,DE PERE,WI,541153147,"SHADE/ALLIED INC.700 HERITAGE RD, DE PERE WISCONSIN 54115 (BROWN)",0,C,,
54115TCSYS803PR,-88.06,44.422,False,55,009,010300,55,55009,55009010300,1400000US55009010300,DURR MEGTEC LLC,830 PROSPER RD,DE PERE,WI,54115,"DURR MEGTEC LLC.830 PROSPER RD, DE PERE WISCONSIN 54115 (BROWN)",0,C,,110000420893
54115NDLPR1855E,-88.06200000000001,44.424,False,55,009,010300,55,55009,55009010300,1400000US55009010300,INDUSTRIAL PROTECTIVE COATINGS,1855 ENTERPRISE DR,DE PERE,WI,54115,"INDUSTRIAL PROTECTIVE COATINGS.1855 ENTERPRISE DR, DE PERE WISCONSIN 54115 (BROWN)",0,C,,
54115RMNCX800HE,-88.06,44.428000000000004,False,55,009,010300,55,55009,55009010300,1400000US55009010300,ROMO INC,800 HERITAGE RD,DE PERE,WI,541150800,"ROMO INC.800 HERITAGE RD, DE PERE WISCONSIN 54115 (BROWN)",0,C,,
54115VLLYC845PR,-88.059,44.423,False,55,009,010300,55,55009,55009010300,1400000US55009010300,VALLEY CABINET INC,845 PROSPER RD,DE PERE,WI,54115,"VALLEY CABINET INC.845 PROSPER RD, DE PERE WISCONSIN 54115 (BROWN)",0,C,,110002037947
54115LLDTB65HER,-88.065,44.428000000000004,False,55,009,010300,55,55009,55009010300,1400000US55009010300,ALLIED TUBE & CONDUIT TECTRON TUBE DIV,650 HERITAGE RD,DE PERE,WI,54115,"ALLIED TUBE & CONDUIT TECTRON TUBE DIV.650 HERITAGE RD, DE PERE WISCONSIN 54115 (BROWN)",0,C,,110005459459
54115PRTCT29ENT,-88.06200000000001,44.419,False,55,009,010300,55,55009,55009010300,1400000US55009010300,A W CHESTERTON CO PROTECTIVE FLOORINGS & LININGS DIV.,2009 ENTERPRISE DR,DE PERE,WI,541153169,"A W CHESTERTON CO PROTECTIVE FLOORINGS & LININGS DIV..2009 ENTERPRISE DR, DE PERE WISCONSIN 54115 (BROWN)",0,C,,110025332664
5411WBLMRK6HERI,-88.068,44.428000000000004,False,55,009,010300,55,55009,55009010300,1400000US55009010300,BELMARK INC,600 HERITAGE RD,DE PERE,WI,54115,"BELMARK INC.600 HERITAGE RD, DE PERE WISCONSIN 54115 (BROWN)",0,C,,110005506666
54115DPRFN805SS,-88.07600000000001,44.442,False,55,009,010202,55,55009,55009010202,1400000US55009010202,DE PERE FOUNDRY INC,805-815 S SIXTH ST,DE PERE,WI,54115,"DE PERE FOUNDRY INC.805-815 S SIXTH ST, DE PERE WISCONSIN 54115 (BROWN)",0,C,,110000420848
54115GRNBY1703W,-88.096,44.43,False,55,009,010202,55,55009,55009010202,1400000US55009010202,GREEN BAY ENGRAVING INC,1703 W MATTHEW DR,DE PERE,WI,54115,"GREEN BAY ENGRAVING INC.1703 W MATTHEW DR, DE PERE WISCONSIN 54115 (BROWN)",0,C,,
54115CLNNG1997A,-88.102,44.426,False,55,009,010202,55,55009,55009010202,1400000US55009010202,CLEANING SYSTEMS INC,1997 AMERICAN BLVD,DE PERE,WI,54115,"CLEANING SYSTEMS INC.1997 AMERICAN BLVD, DE PERE WISCONSIN 54115 (BROWN)",0,C,,110000420839
54115GRNBY1409R,-88.102,44.416000000000004,False,55,009,940001,55,55009,55009940001,1400000US55009940001,RICHARDSON WOOD PRESERVING,1409 RED MAPLE RD,DE PERE,WI,54115,"RICHARDSON WOOD PRESERVING.1409 RED MAPLE RD, DE PERE WISCONSIN 54115 (BROWN)",0,C,,
54115MPMRN3399S,-88.1,44.46,False,55,009,940001,55,55009,55009940001,1400000US55009940001,DEAN FOODS OF WISCONSN LLC,3399 S RIDGE RD,DE PERE,WI,54115,"DEAN FOODS OF WISCONSN LLC.3399 S RIDGE RD, DE PERE WISCONSIN 54115 (BROWN)",0,C,,110000420875
54307GRNBY3250S,-88.096,44.461999999999996,False,55,009,940001,55,55009,55009940001,1400000US55009940001,GREEN BAY PACKAGING INC GREEN BAY COATED PRODUCTS DIV,3250 S RIDGE RD,GREEN BAY,WI,54304,"GREEN BAY PACKAGING INC GREEN BAY COATED PRODUCTS DIV.3250 S RIDGE RD, GREEN BAY WISCONSIN 54304 (BROWN)",0,C,,110000421650
54304BDGRS141PA,-88.11200000000001,44.465,False,55,009,940001,55,55009,55009940001,1400000US55009940001,BADGER SHEET METAL WORKS,1410 PARTNERSHIP DR,GREEN BAY,WI,54304,"BADGER SHEET METAL WORKS.1410 PARTNERSHIP DR, GREEN BAY WISCONSIN 54304 (BROWN)",0,C,433,110039204474
5411WBTGPL1375P,-88.126,44.457,False,55,009,940001,55,55009,55009940001,1400000US55009940001,BTG IPI LLC,1375 PLANE SITE BLVD,DE PERE,WI,54115,"BTG IPI LLC.1375 PLANE SITE BLVD, DE PERE WISCONSIN 54115 (BROWN)",0,C,433,110046278808
5411WPDQMN1698S,-88.117,44.431000000000004,False,55,009,940001,55,55009,55009940001,1400000US55009940001,PDQ MANUFACTURING INC,1698 SCHEURING RD,DE PERE,WI,54115,"PDQ MANUFACTURING INC.1698 SCHEURING RD, DE PERE WISCONSIN 54115 (BROWN)",0,C,,110070557909
5411WTRDLL249CR,-88.131,44.416000000000004,False,55,009,940001,55,55009,55009940001,1400000US55009940001,TRUDELL INDUSTRIAL FINISHING,2049 CREAMERY RD,DE PERE,WI,54115,"TRUDELL INDUSTRIAL FINISHING.2049 CREAMERY RD, DE PERE WISCONSIN 54115 (BROWN)",0,C,,110070070731
54115NCLTP200MA,-88.069,44.446999999999996,False,55,009,010201,55,55009,55009010201,1400000US55009010201,AHLSTROM-MUNKSJO NA SPECIALTY SOLUTIONS,200 MAIN AVE,DE PERE,WI,54115,"AHLSTROM-MUNKSJO NA SPECIALTY SOLUTIONS.200 MAIN AVE, DE PERE WISCONSIN 54115 (BROWN)",0,C,,110000420884
54115SNCSM800FO,-88.07700000000001,44.45399999999999,False,55,009,010201,55,55009,55009010201,1400000US55009010201,US PAPER MILLS CORP-DE PERE,800 FORT HOWARD AVE,DE PERE,WI,54115,"US PAPER MILLS CORP-DE PERE.800 FORT HOWARD AVE, DE PERE WISCONSIN 54115 (BROWN)",0,C,,110002033861
54123SCTTP3120R,-87.65,45.105,False,55,075,961300,55,55075,55075961300,1400000US55075961300,KIMBERLY-CLARK CORP MARINETTE,3120 RIVERSIDE AVE,MARINETTE,WI,54143,"KIMBERLY-CLARK CORP MARINETTE.3120 RIVERSIDE AVE, MARINETTE WISCONSIN 54143 (MARINETTE)",0,C,,110000420900
54124NRTHP39NHA,-88.314,44.888000000000005,False,55,083,100700,55,55083,55083100700,1400000US55083100700,NORTHPORT INC,39 N HARDING AVE,GILLETT,WI,54124,"NORTHPORT INC.39 N HARDING AVE, GILLETT WISCONSIN 54124 (OCONTO)",0,C,,
54124RCHTC431EM,-88.29899999999999,44.891999999999996,False,55,083,100700,55,55083,55083100700,1400000US55083100700,CARFAIR COMPOSITES USA INC - GILLETT,431 E MAIN ST,GILLETT,WI,54124,"CARFAIR COMPOSITES USA INC - GILLETT.431 E MAIN ST, GILLETT WISCONSIN 54124 (OCONTO)",0,C,,110000420928
54124WRVLP160WP,-88.31200000000001,44.891999999999996,False,55,083,100700,55,55083,55083100700,1400000US55083100700,"TRM, INC WARVEL PRODUCTS DIV",160 W PARK ST,GILLETT,WI,54124,"TRM, INC WARVEL PRODUCTS DIV.160 W PARK ST, GILLETT WISCONSIN 54124 (OCONTO)",0,C,,110000420937
54130THLMNTHILM,-88.25200000000001,44.283,False,55,087,012300,55,55087,55087012300,1400000US55087012300,AHLSTROM-MUNKSJO NA SPECIALTY SOLUTIONS LLC,600 THILMANY RD,KAUKAUNA,WI,54130,"AHLSTROM-MUNKSJO NA SPECIALTY SOLUTIONS LLC.600 THILMANY RD, KAUKAUNA WISCONSIN 54130 (OUTAGAMIE)",0,C,,110000420973
54130HRTFT801TH,-88.25,44.283,False,55,087,012300,55,55087,55087012300,1400000US55087012300,HEART OF THE VALLEY METRO SEWAGE DISTRICT,801 THILMANY RD,KAUKAUNA,WI,54130,"HEART OF THE VALLEY METRO SEWAGE DISTRICT.801 THILMANY RD, KAUKAUNA WISCONSIN 54130 (OUTAGAMIE)",0,C,,
54130THRML820HY,-88.26799999999999,44.291000000000004,False,55,087,012400,55,55087,55087012400,1400000US55087012400,THERMO ELECTRON WISCONSIN INC,820 HYLAND AVE,KAUKAUNA,WI,54130,"THERMO ELECTRON WISCONSIN INC.820 HYLAND AVE, KAUKAUNA WISCONSIN 54130 (OUTAGAMIE)",0,C,,
54130TMNDS1200M,-88.26899999999999,44.298,False,55,087,012400,55,55087,55087012400,1400000US55087012400,TEAM INDUSTRIES INC,1200 MALONEY RD,KAUKAUNA,WI,54130,"TEAM INDUSTRIES INC.1200 MALONEY RD, KAUKAUNA WISCONSIN 54130 (OUTAGAMIE)",0,C,,110000420982
54130BSSTT1215H,-88.26100000000001,44.294,False,55,087,012400,55,55087,55087012400,1400000US55087012400,BASSETT MECHANICAL INC,1215 HYLAND AVE,KAUKAUNA,WI,54130,"BASSETT MECHANICAL INC.1215 HYLAND AVE, KAUKAUNA WISCONSIN 54130 (OUTAGAMIE)",0,C,,
54130SFTYK2100B,-88.258,44.3,False,55,087,012400,55,55087,55087012400,1400000US55087012400,SAFETY-KLEEN SYSTEMS (517601),2201 BADGER RD,KAUKAUNA,WI,54130,"SAFETY-KLEEN SYSTEMS (517601).2201 BADGER RD, KAUKAUNA WISCONSIN 54130 (OUTAGAMIE)",0,C,,110000420964
54130RLFFM400GE,-88.275,44.288000000000004,False,55,087,012400,55,55087,55087012400,1400000US55087012400,ROLOFF MANUFACTURING CORP,400 GERTRUDE ST,KAUKAUNA,WI,54130,"ROLOFF MANUFACTURING CORP.400 GERTRUDE ST, KAUKAUNA WISCONSIN 54130 (OUTAGAMIE)",0,C,,110001924428
54130RCSNC2BADG,-88.259,44.299,False,55,087,012400,55,55087,55087012400,1400000US55087012400,ORICA USA INC GREEN BAY (PART),2000 BADGER RD,KAUKAUNA,WI,54130,"ORICA USA INC GREEN BAY (PART).2000 BADGER RD, KAUKAUNA WISCONSIN 54130 (OUTAGAMIE)",0,C,,
5413WWSCNS6WTBA,-88.26700000000001,44.288999999999994,False,55,087,012400,55,55087,55087012400,1400000US55087012400,WISCONSIN INDUSTRIAL COATINGS INC,600 W. TOBACNOIR ST.,KAUKAUNA,WI,54130,"WISCONSIN INDUSTRIAL COATINGS INC.600 W. TOBACNOIR ST., KAUKAUNA WISCONSIN 54130 (OUTAGAMIE)",0,C,,110046365777
54130WHTCLROUTE,-88.17299999999999,44.248999999999995,False,55,009,021500,55,55009,55009021500,1400000US55009021500,ARLA FOODS PRODUCTION LLC,489 HOLLAND CT,KAUKAUNA,WI,54130,"ARLA FOODS PRODUCTION LLC.489 HOLLAND CT, KAUKAUNA WISCONSIN 54130 (BROWN)",0,C,,110000420991
5413WBLGSC489HL,-88.17299999999999,44.248999999999995,False,55,009,021500,55,55087,55009021500,1400000US55009021500,BELGIOIOSO CHEESE - HOLLAND TOWN PLANT,489 HOLLAND COURT,KAUKAUNA,WI,54130,"BELGIOIOSO CHEESE - HOLLAND TOWN PLANT.489 HOLLAND COURT, KAUKAUNA WISCONSIN 54130 (OUTAGAMIE)",0,C,,110039493919
54136MDTCPNMAIN,-88.334,44.276,False,55,087,011700,55,55087,55087011700,1400000US55087011700,KIM BERLY MILL,433 N MAIN ST,KIMBERLY,WI,54136,"KIM BERLY MILL.433 N MAIN ST, KIMBERLY WISCONSIN 54136 (OUTAGAMIE)",0,C,,110017418846
54139FRGCHHWY14,-88.04700000000001,44.95399999999999,False,55,083,100800,55,55083,55083100800,1400000US55083100800,SAPUTO CHEESE USA INC,317 ROSERA ST,LENA,WI,54139,"SAPUTO CHEESE USA INC.317 ROSERA ST, LENA WISCONSIN 54139 (OCONTO)",0,C,,110054818006
54140LNDLK1700B,-88.291,44.291000000000004,False,55,087,011900,55,55087,55087011900,1400000US55087011900,LAND O'LAKES PURINA FEED LLC-LITTLE CHUTE,1700 BOHM DR,LITTLE CHUTE,WI,54140,"LAND O'LAKES PURINA FEED LLC-LITTLE CHUTE.1700 BOHM DR, LITTLE CHUTE WISCONSIN 54140 (OUTAGAMIE)",0,C,,110000421044
54140JCKSP401WN,-88.324,44.286,False,55,087,011900,55,55087,55087011900,1400000US55087011900,NESTLE PIZZA DIVISION,401 WEST NORTH AVENUE,LITTLE CHUTE,WI,54140,"NESTLE PIZZA DIVISION.401 WEST NORTH AVENUE, LITTLE CHUTE WISCONSIN 54140 (OUTAGAMIE)",0,C,,110000421035
54140CRGLL1800E,-88.29299999999999,44.292,False,55,087,011900,55,55087,55087011900,1400000US55087011900,CARGILL ANIMAL NUTRITION,1800 E ELM DR,LITTLE CHUTE,WI,54140,"CARGILL ANIMAL NUTRITION.1800 E ELM DR, LITTLE CHUTE WISCONSIN 54140 (OUTAGAMIE)",0,C,,110000497392
54140SMNSS2701F,-88.31200000000001,44.286,False,55,087,011900,55,55087,55087011900,1400000US55087011900,AGROPUR INC,2701 FREEDOM RD,APPLETON,WI,54913,"AGROPUR INC.2701 FREEDOM RD, APPLETON WISCONSIN 54913 (OUTAGAMIE)",0,C,,110013287148
54143KSGND1731I,-87.64200000000001,45.086999999999996,False,55,075,961400,55,55075,55075961400,1400000US55075961400,KS KOLBENSCHMIDT US INC,1731 INDUSTRIAL PKWY,MARINETTE,WI,54143,"KS KOLBENSCHMIDT US INC.1731 INDUSTRIAL PKWY, MARINETTE WISCONSIN 54143 (MARINETTE)",0,C,,110000421062
54143NSLFRPIERC,-87.64399999999999,45.07899999999999,False,55,075,961400,55,55075,55075961400,1400000US55075961400,TYCO FIRE PRODUCTS LP,2700 INDUSTRIAL PKWY S,MARINETTE,WI,54143,"TYCO FIRE PRODUCTS LP.2700 INDUSTRIAL PKWY S, MARINETTE WISCONSIN 54143 (MARINETTE)",0,C,,110041102133
54143SLVNN2121C,-87.637,45.085,False,55,075,961400,55,55075,55075961400,1400000US55075961400,SAMUEL PRESSURE VESSEL GROUP - MARINETTE,2121 CLEVELAND AVE,MARINETTE,WI,54143,"SAMUEL PRESSURE VESSEL GROUP - MARINETTE.2121 CLEVELAND AVE, MARINETTE WISCONSIN 54143 (MARINETTE)",0,C,,110000421071
54143WNSRT2645I,-87.64299999999999,45.082,False,55,075,961400,55,55075,55075961400,1400000US55075961400,WINSERT INC,2645 IND US TRIAL PKWY,MARINETTE,WI,54143,"WINSERT INC.2645 IND US TRIAL PKWY, MARINETTE WISCONSIN 54143 (MARINETTE)",0,C,,110000421099
54143DCRNR3000W,-87.65100000000001,45.081,False,55,075,961400,55,55075,55075961400,1400000US55075961400,DECRANE AIRCRAFT SEATING CO INC MSD,3000 WOLESKE,MARINETTE,WI,54143,"DECRANE AIRCRAFT SEATING CO INC MSD.3000 WOLESKE, MARINETTE WISCONSIN 54143 (MARINETTE)",0,C,,
54143MRNTTELYST,-87.62100000000001,45.099,False,55,075,961500,55,55075,55075961500,1400000US55075961500,MARINETTE MARINE CORP,1600 ELY ST,MARINETTE,WI,54143,"MARINETTE MARINE CORP.1600 ELY ST, MARINETTE WISCONSIN 54143 (MARINETTE)",0,C,,110000742723
54143NSLFRONEST,-87.61399999999999,45.097,False,55,075,961500,55,55075,55075961500,1400000US55075961500,TYCO FIRE PRODUCTS LP,1 STANTON ST,MARINETTE,WI,54143,"TYCO FIRE PRODUCTS LP.1 STANTON ST, MARINETTE WISCONSIN 54143 (MARINETTE)",0,C,,110056962032
54143SPCLT2STAN,-87.61399999999999,45.097,False,55,075,961500,55,55075,55075961500,1400000US55075961500,CHEMDESIGN PRODUCTS INC,2 STANTON ST,MARINETTE,WI,54143,"CHEMDESIGN PRODUCTS INC.2 STANTON ST, MARINETTE WISCONSIN 54143 (MARINETTE)",0,C,,110000421080
54143WPCFN805OD,-87.6,45.095,False,55,075,961500,55,55075,55075961500,1400000US55075961500,WAUPACA FOUNDRY - PLANT 4,805 OGDEN ST,MARINETTE,WI,54143,"WAUPACA FOUNDRY - PLANT 4.805 OGDEN ST, MARINETTE WISCONSIN 54143 (MARINETTE)",0,C,,110000421106
54143WPCPL301ER,-87.594,45.09,False,55,075,961500,55,55075,55075961500,1400000US55075961500,ALLIANCE INDUSTRIES MARINETTE,301 E R US SEL ST,MARINETTE,WI,541433068,"ALLIANCE INDUSTRIES MARINETTE.301 E R US SEL ST, MARINETTE WISCONSIN 54143 (MARINETTE)",0,C,,110002037572
54151NGRFW1101M,-87.992,45.77,False,55,075,960100,55,55075,55075960100,1400000US55075960100,NIAGARA MILL,1101 MILL ST,NIAGARA,WI,54151,"NIAGARA MILL.1101 MILL ST, NIAGARA WISCONSIN 54151 (MARINETTE)",0,C,,110017418837
54156GFCHMKERML,-87.84299999999999,45.652,False,55,075,960100,55,55075,55075960100,1400000US55075960100,SPECIALTY GRANULES INC,N19304 MINE RD,PEMBINE,WI,54156,"SPECIALTY GRANULES INC.N19304 MINE RD, PEMBINE WISCONSIN 54156 (MARINETTE)",0,C,,110000594134
54153CRSRS205CH,-87.89399999999999,44.891999999999996,False,55,083,101000,55,55083,55083101000,1400000US55083101000,KCS INTERNATIONAL INC CRUISERS YACHTS DIV PLANT 2,205 CHARLES ST,OCONTO,WI,54153,"KCS INTERNATIONAL INC CRUISERS YACHTS DIV PLANT 2.205 CHARLES ST, OCONTO WISCONSIN 54153 (OCONTO)",0,C,,110000421133
54153CRSRS804PE,-87.875,44.885,False,55,083,101000,55,55083,55083101000,1400000US55083101000,KCS INTERNATIONAL INC CRUISERS YACHTS  DIV PLANT 1,804 PECOR ST,OCONTO,WI,54153,"KCS INTERNATIONAL INC CRUISERS YACHTS  DIV PLANT 1.804 PECOR ST, OCONTO WISCONSIN 54153 (OCONTO)",0,C,,110009515818
54153CRMTC6150V,-87.896,44.894,False,55,083,101000,55,55083,55083101000,1400000US55083101000,VISHAY CERA-MITE INC,6150 VAN HECKE AVE,OCONTO,WI,54153,"VISHAY CERA-MITE INC.6150 VAN HECKE AVE, OCONTO WISCONSIN 54153 (OCONTO)",0,C,,
54153CNTMT617FA,-87.88,44.888000000000005,False,55,083,101000,55,55083,55083101000,1400000US55083101000,PACE INDUSTRIES OCONTO DIVISION,617 FARNSWORTH AVE,OCONTO,WI,54153,"PACE INDUSTRIES OCONTO DIVISION.617 FARNSWORTH AVE, OCONTO WISCONSIN 54153 (OCONTO)",0,C,,110022523401
54154SCTTP106EC,-88.14399999999999,44.873999999999995,False,55,083,101200,55,55083,55083101200,1400000US55083101200,ST PAPER-OCONTO FALLS,106 E CENTRAL AVE,OCONTO FALLS,WI,54154,"ST PAPER-OCONTO FALLS.106 E CENTRAL AVE, OCONTO FALLS WISCONSIN 54154 (OCONTO)",0,C,,110000421151
54154CRMTC209MA,-88.14299999999999,44.886,False,55,083,101200,55,55083,55083101200,1400000US55083101200,VISHAY CERA-MITE INC,209 MARKS DR,OCONTO FALLS,WI,54154,"VISHAY CERA-MITE INC.209 MARKS DR, OCONTO FALLS WISCONSIN 54154 (OCONTO)",0,C,,
54157BDGRP200WE,-87.749,45.052,False,55,075,961100,55,55075,55075961100,1400000US55075961100,BADGER PAPER MILLS INC,200 W FRONT ST,PESHTIGO,WI,541570149,"BADGER PAPER MILLS INC.200 W FRONT ST, PESHTIGO WISCONSIN 54157 (MARINETTE)",0,C,,
54157MRNTT801MA,-87.73200000000001,45.053000000000004,False,55,075,961100,55,55075,55075961100,1400000US55075961100,MARINETTE CASTING CORP,801 MAPLE ST,PESHTIGO,WI,54157,"MARINETTE CASTING CORP.801 MAPLE ST, PESHTIGO WISCONSIN 54157 (MARINETTE)",0,C,,110002037581
54157DCRNR701MA,-87.734,45.053000000000004,False,55,075,961100,55,55075,55075961100,1400000US55075961100,DECRANE AIRCRAFT SEATING CO INC APD,701 MAPLE ST,PESHTIGO,WI,54157,"DECRANE AIRCRAFT SEATING CO INC APD.701 MAPLE ST, PESHTIGO WISCONSIN 54157 (MARINETTE)",0,C,,
54162CRVRBINDUS,-88.225,44.665,False,55,009,021600,55,55009,55009021600,1400000US55009021600,MARQUIS YACHTS LLC,790 MARKHAM DR,PULASKI,WI,54162,"MARQUIS YACHTS LLC.790 MARKHAM DR, PULASKI WISCONSIN 54162 (BROWN)",0,C,,110000421160
54162KLMFD323TH,-88.229,44.67,False,55,009,021600,55,55009,55009021600,1400000US55009021600,KLM FOODS INC,323 3RD AVE,PULASKI,WI,541620469,"KLM FOODS INC.323 3RD AVE, PULASKI WISCONSIN 54162 (BROWN)",0,C,,
54162NDSTRROUTE,-88.19200000000001,44.615,False,55,009,021600,55,55009,55009021600,1400000US55009021600,INDUSTRIAL ENGRAVING LLC,5324 KUNESH RD,PULASKI,WI,54162,"INDUSTRIAL ENGRAVING LLC.5324 KUNESH RD, PULASKI WISCONSIN 54162 (BROWN)",0,C,,110000421179
54162BLGSB4328B,-88.181,44.66,False,55,009,021600,55,55009,55009021600,1400000US55009021600,BELGIOIOSO - BROOKSIDE,4328 BROOKSIDE DR,PULASKI,WI,54162,"BELGIOIOSO - BROOKSIDE.4328 BROOKSIDE DR, PULASKI WISCONSIN 54162 (BROWN)",0,C,,110022523410
54165BTRCC124BR,-88.329,44.522,False,55,087,013100,55,55087,55087013100,1400000US55087013100,GREAT LAKES CHEESE OF SEYMOUR,124 E BRONSON RD,SEYMOUR,WI,54165,"GREAT LAKES CHEESE OF SEYMOUR.124 E BRONSON RD, SEYMOUR WISCONSIN 54165 (OUTAGAMIE)",0,C,,110001136066
54166SHWNPRTEMM,-88.62299999999999,44.776,False,55,115,100300,55,55115,55115100300,1400000US55115100300,LITTLE RAPIDS CORP SHAWANO MILL,COUNTY HWY M & MM,SHAWANO,WI,54166,"LITTLE RAPIDS CORP SHAWANO MILL.COUNTY HWY M & MM, SHAWANO WISCONSIN 54166 (SHAWANO)",0,C,,
54174NLNND214NU,-88.37200000000001,44.996,False,55,083,100600,55,55083,55083100600,1400000US55083100600,EVENFLO CO INC,214 NU-LINE ST,SURING,WI,541740217,"EVENFLO CO INC.214 NU-LINE ST, SURING WISCONSIN 54174 (OCONTO)",0,C,,
54177WSKNCCEDAR,-87.947,45.376999999999995,False,55,075,960600,55,55075,55075960600,1400000US55075960600,CARFAIR COMPOSITES USA INC - WAUSAUKEE,837 CEDAR ST,WAUSAUKEE,WI,54177,"CARFAIR COMPOSITES USA INC - WAUSAUKEE.837 CEDAR ST, WAUSAUKEE WISCONSIN 54177 (MARINETTE)",0,C,,110050813941
54201PLMBR1101P,-87.447,44.614,False,55,061,960200,55,55061,55061960200,1400000US55061960200,OLSONITE CORPALGOMA WI DIV,1101 PERRY ST,ALGOMA,WI,542010039,"OLSONITE CORPALGOMA WI DIV.1101 PERRY ST, ALGOMA WISCONSIN 54201 (KEWAUNEE)",0,C,,
54201WSCNS1102J,-87.448,44.603,False,55,061,960100,55,55061,55061960100,1400000US55061960100,WISCONSIN LABEL CORP,1102 JEFFERSON ST,ALGOMA,WI,54201,"WISCONSIN LABEL CORP.1102 JEFFERSON ST, ALGOMA WISCONSIN 54201 (KEWAUNEE)",0,C,,
54201LGMHR1001P,-87.446,44.613,False,55,061,960100,55,55061,55061960100,1400000US55061960100,MASONITE CORP,1001 PERRY ST,ALGOMA,WI,54201,"MASONITE CORP.1001 PERRY ST, ALGOMA WISCONSIN 54201 (KEWAUNEE)",1,C,,110000421222
54208LKTLK305WA,-87.82700000000001,44.351000000000006,False,55,009,020600,55,55009,55009020600,1400000US55009020600,LAND O'LAKES - DENMARK,305 WALL ST,DENMARK,WI,54208,"LAND O'LAKES - DENMARK.305 WALL ST, DENMARK WISCONSIN 54208 (BROWN)",1,C,,110000421240
54208STLLF5335S,-87.815,44.443999999999996,False,55,009,020600,55,55009,55009020600,1400000US55009020600,SAPUTO CHEESE USA INC,5335 STATE RD,DENMARK,WI,54208,"SAPUTO CHEESE USA INC.5335 STATE RD, DENMARK WISCONSIN 54208 (BROWN)",0,C,,
54208MLPRN590WO,-87.835,44.356,False,55,009,020600,55,55009,55009020600,1400000US55009020600,MILPRINT INC,590 WOODROW ST,DENMARK,WI,54208,"MILPRINT INC.590 WOODROW ST, DENMARK WISCONSIN 54208 (BROWN)",0,C,,110000856039
54208BLGSC581CT,-87.818,44.361999999999995,False,55,009,020600,55,55009,55009020600,1400000US55009020600,BELGIOIOSO CHEESE INC DENMARK PLANT,5810 CTY RD NN,DENMARK,WI,54208,"BELGIOIOSO CHEESE INC DENMARK PLANT.5810 CTY RD NN, DENMARK WISCONSIN 54208 (BROWN)",0,C,,110020518947
54208BLGSC59CTY,-87.818,44.361999999999995,False,55,009,020600,55,55009,55009020600,1400000US55009020600,BELGIOIOSO GLENMORE,5900 COUNTY RD NN,DENMARK,WI,54208,"BELGIOIOSO GLENMORE.5900 COUNTY RD NN, DENMARK WISCONSIN 54208 (BROWN)",0,C,,110020518956
54208BLGSL5312S,-87.861,44.385,False,55,009,020600,55,55009,55009020600,1400000US55009020600,BELGIOIOSO - LANGES CORNER,5312 STEVE'S CHEESE RD,DENMARK,WI,54208,"BELGIOIOSO - LANGES CORNER.5312 STEVE'S CHEESE RD, DENMARK WISCONSIN 54208 (BROWN)",0,C,,110025332361
54217KRHNDRTE3B,-87.684,44.43,False,55,061,960500,55,55061,55061960500,1400000US55061960500,AGROPUR INC,N 2915 COUNTY  RD AB,LUXEMBURG,WI,54217,"AGROPUR INC.N 2915 COUNTY  RD AB, LUXEMBURG WISCONSIN 54217 (KEWAUNEE)",0,C,,110000594143
54216THVLL23KIL,-87.5,44.457,False,55,061,960500,55,55061,55061960500,1400000US55061960500,VOLLRATH CO LLC,23 KILBOURN ST,KEWAUNEE,WI,54216,"VOLLRATH CO LLC.23 KILBOURN ST, KEWAUNEE WISCONSIN 54216 (KEWAUNEE)",0,C,,110000421259
54217PCKRL2074T,-87.711,44.542,False,55,061,960400,55,55061,55061960400,1400000US55061960400,PACKERLAND WHEY PRODUCTS INC,407 FOURTH ST,LUXEMBURG,WI,54217,"PACKERLAND WHEY PRODUCTS INC.407 FOURTH ST, LUXEMBURG WISCONSIN 54217 (KEWAUNEE)",0,C,,110000421268
