TRIFID,LONGITUDE,LATITUDE,ESTIMATE,STATEFP,COUNTYFP,TRACTCE,STATEGEOID,COUNTYGEOID,TRACTGEOID,AFFGEOID,FACILITY_NAME,STREET,CITY,STUSPS,ZIP_CODE,FACILITY,FAC_CLOSED_IND,ASGN_FEDERAL_IND,BIA_CODE,EPA_REGISTRY_ID
54911CMPRN3100W,-88.45299999999999,44.273,False,55,087,011102,55,55087,55087011102,1400000US55087011102,INX INTERNATIONAL INK CO,3100 W WISCONSIN AVE,APPLETON,WI,54914,"INX INTERNATIONAL INK CO.3100 W WISCONSIN AVE, APPLETON WISCONSIN 54914 (OUTAGAMIE)",0,C,,110002044145
54914RCHPR3300W,-88.46,44.266999999999996,False,55,087,011102,55,55087,55087011102,1400000US55087011102,RICH PRODS MFG CORP APPLETON DIV,3300 W COLLEGE AVE,APPLETON,WI,54914,"RICH PRODS MFG CORP APPLETON DIV.3300 W COLLEGE AVE, APPLETON WISCONSIN 54914 (OUTAGAMIE)",0,C,,
54914SRFCM2135W,-88.44,44.286,False,55,087,011102,55,55087,55087011102,1400000US55087011102,SURFACE MOUNT TECH CORP,2135 W NORDALE DR,APPLETON,WI,54914,"SURFACE MOUNT TECH CORP.2135 W NORDALE DR, APPLETON WISCONSIN 54914 (OUTAGAMIE)",0,C,,
54914MCCNF555HI,-88.448,44.268,False,55,087,011102,55,55087,55087011102,1400000US55087011102,MCCAIN FOODS USA INC,555 HICKORY FARM LN,APPLETON,WI,54914,"MCCAIN FOODS USA INC.555 HICKORY FARM LN, APPLETON WISCONSIN 54914 (OUTAGAMIE)",0,C,,
54914PRSTP670NO,-88.442,44.271,True,55,087,011102,55,55087,55087011102,1400000US55087011102,PRESTO PRODS INC,670 N PERKINS ST,APPLETON,WI,549143133,"PRESTO PRODS INC 670 N PERKINS ST, APPLETON, WI, 549143133",0,C,,
54911VLLYC908NL,-88.397,44.27,False,55,087,010500,55,55087,55087010500,1400000US55087010500,LUVATA APPLETON LLC,908 N LAWE ST,APPLETON,WI,54911,"LUVATA APPLETON LLC.908 N LAWE ST, APPLETON WISCONSIN 54911 (OUTAGAMIE)",0,C,,110000423113
54913FRMST935EA,-88.39200000000001,44.26,False,55,087,010500,55,55087,55087010500,1400000US55087010500,FOREMOST FARMS USA,935 E JOHN ST,APPLETON,WI,54911,"FOREMOST FARMS USA.935 E JOHN ST, APPLETON WISCONSIN 54911 (OUTAGAMIE)",0,C,,
54915MDRLL1130E,-88.39200000000001,44.26,False,55,087,010500,55,55087,55087010500,1400000US55087010500,M-I DRILLING FLUIDS LLC APPLETON  WISCONSIN,1130 E JOHN STREET,APPLETON,WI,54915,"M-I DRILLING FLUIDS LLC APPLETON  WISCONSIN.1130 E JOHN STREET, APPLETON WISCONSIN 54915 (OUTAGAMIE)",0,C,,
54911BNDND1132E,-88.387,44.273,False,55,087,010500,55,55087,55087010500,1400000US55087010500,BEND INDUSTRIES,1132 E WISCONSIN AVE,APPLETON,WI,54911,"BEND INDUSTRIES.1132 E WISCONSIN AVE, APPLETON WISCONSIN 54911 (OUTAGAMIE)",0,C,,
54912KMBRL425WE,-88.412,44.255,False,55,087,011000,55,55087,55087011000,1400000US55087011000,KIMBERLY-CLARK CORP ATLAS MILL,425 W WATER ST,APPLETON,WI,54912,"KIMBERLY-CLARK CORP ATLAS MILL.425 W WATER ST, APPLETON WISCONSIN 54912 (OUTAGAMIE)",1,C,,
54914DRLMN2621W,-88.449,44.251999999999995,False,55,087,011000,55,55087,55087011000,1400000US55087011000,DURALAM INC,2621 W EVERETT ST,APPLETON,WI,54914,"DURALAM INC.2621 W EVERETT ST, APPLETON WISCONSIN 54914 (OUTAGAMIE)",0,C,,
54914MLLRL1635W,-88.431,44.256,False,55,087,011000,55,55087,55087011000,1400000US55087011000,MILLER ELECTRIC (CENTRAL),1635 W SPENCER ST,APPLETON,WI,54914,"MILLER ELECTRIC (CENTRAL).1635 W SPENCER ST, APPLETON WISCONSIN 54914 (OUTAGAMIE)",0,C,,110000423186
54914MPMRN1815W,-88.434,44.25899999999999,False,55,087,011000,55,55087,55087011000,1400000US55087011000,FOREMOST FARMS USA,1815 W SPENCER ST,APPLETON,WI,54914,"FOREMOST FARMS USA.1815 W SPENCER ST, APPLETON WISCONSIN 54914 (OUTAGAMIE)",0,C,,110000423177
54914PRCMN315SP,-88.419,44.25899999999999,False,55,087,011000,55,55087,55087011000,1400000US55087011000,PIERCE MFG INC FABRICATION PLANT,315 S PIERCE,APPLETON,WI,54914,"PIERCE MFG INC FABRICATION PLANT.315 S PIERCE, APPLETON WISCONSIN 54914 (OUTAGAMIE)",0,C,,
54914STKLY1820W,-88.43299999999999,44.26,False,55,087,011000,55,55087,55087011000,1400000US55087011000,STOKELY USA INC,1820 W 8TH ST,APPLETON,WI,549144967,"STOKELY USA INC.1820 W 8TH ST, APPLETON WISCONSIN 54914 (OUTAGAMIE)",0,C,,
54911NRTHL1815N,-88.434,44.25899999999999,False,55,087,011000,55,55087,55087011000,1400000US55087011000,ASSOCIATED MILK PRODUCERS INC,1815 W SPENCER ST,APPLETON,WI,54914,"ASSOCIATED MILK PRODUCERS INC.1815 W SPENCER ST, APPLETON WISCONSIN 54914 (OUTAGAMIE)",1,C,,
54914MLLRL1919W,-88.43700000000001,44.261,False,55,087,011000,55,55087,55087011000,1400000US55087011000,MILLER ELECTRIC FABRICATION,1919 W COLLEGE AVE,APPLETON,WI,54914,"MILLER ELECTRIC FABRICATION.1919 W COLLEGE AVE, APPLETON WISCONSIN 54914 (OUTAGAMIE)",0,C,,110000746079
5491WMLLRL12SPE,-88.441,44.251999999999995,False,55,087,011000,55,55087,55087011000,1400000US55087011000,MILLER ELECTRIC - PSD SOUTH,1200 S PERKINS ST,APPLETON,WI,54914,"MILLER ELECTRIC - PSD SOUTH.1200 S PERKINS ST, APPLETON WISCONSIN 54914 (OUTAGAMIE)",0,C,,110012709603
54912PPLTN825EW,-88.39399999999999,44.273,False,55,087,011501,55,55087,55087011501,1400000US55087011501,APPVION INC APPLET ON PLANT,825 E WISCONSIN AVE,APPLETON,WI,54911,"APPVION INC APPLET ON PLANT.825 E WISCONSIN AVE, APPLETON WISCONSIN 54911 (OUTAGAMIE)",0,C,,110000423140
54914SCLDN1520W,-88.429,44.251999999999995,False,55,087,010900,55,55087,55087010900,1400000US55087010900,SCLODING LOCKS CORP,1520 W ROGERS AVE,APPLETON,WI,54914,"SCLODING LOCKS CORP.1520 W ROGERS AVE, APPLETON WISCONSIN 54914 (OUTAGAMIE)",0,C,,
54915FXRVR430ES,-88.4,44.257,False,55,087,010700,55,55087,55087010700,1400000US55087010700,FOX RIVER PAPER CO,430 E S ISLAND ST,APPLETON,WI,54915,"FOX RIVER PAPER CO.430 E S ISLAND ST, APPLETON WISCONSIN 54915 (OUTAGAMIE)",0,C,,
54915KRWNP800SL,-88.396,44.255,False,55,087,010700,55,55087,55087010700,1400000US55087010700,KERWIN PAPER CO,801 S LAWE ST,APPLETON,WI,54915,"KERWIN PAPER CO.801 S LAWE ST, APPLETON WISCONSIN 54915 (OUTAGAMIE)",0,C,,
54915CCMPR401ES,-88.40100000000001,44.257,False,55,087,010700,55,55087,55087010700,1400000US55087010700,A-C COMPRESSOR CORP,401 E S ISLAND ST,APPLETON,WI,54915,"A-C COMPRESSOR CORP.401 E S ISLAND ST, APPLETON WISCONSIN 54915 (OUTAGAMIE)",0,C,,
54912FXRVR600VU,-88.398,44.257,False,55,087,010700,55,55087,55087010700,1400000US55087010700,NEENAH PAPER INC - APPLETON MILL,600 VULCAN ST,APPLETON,WI,54915,"NEENAH PAPER INC - APPLETON MILL.600 VULCAN ST, APPLETON WISCONSIN 54915 (OUTAGAMIE)",0,C,,110001924446
54915PRCMN2600A,-88.47,44.243,False,55,139,002400,55,55139,55139002400,1400000US55139002400,PIERCE MANUFACTURING INC,2600 AMERICAN DR,APPLETON,WI,54914,"PIERCE MANUFACTURING INC.2600 AMERICAN DR, APPLETON WISCONSIN 54914 (WINNEBAGO)",0,C,,110000871325
54956CNVRT830EH,-88.48100000000001,44.205,False,55,139,002400,55,55139,55139002400,1400000US55139002400,SUN CHEMICAL SPECIALTY INKS,830 EHLERS RD,NEENAH,WI,54956,"SUN CHEMICAL SPECIALTY INKS.830 EHLERS RD, NEENAH WISCONSIN 54956 (WINNEBAGO)",0,C,,
54952WSCNS948WI,-88.48100000000001,44.2,False,55,139,002400,55,55139,55139002400,1400000US55139002400,WISCONSIN TISSUE MILLS INC PLANT #2,984 WINCHESTER RD,NEENAH,WI,54956,"WISCONSIN TISSUE MILLS INC PLANT #2.984 WINCHESTER RD, NEENAH WISCONSIN 54956 (WINNEBAGO)",0,C,,
54956STWWD912HA,-88.48,44.205,False,55,139,002400,55,55139,55139002400,1400000US55139002400,STOWE WOODWARD,912 HASSE ST,NEENAH,WI,54956,"STOWE WOODWARD.912 HASSE ST, NEENAH WISCONSIN 54956 (WINNEBAGO)",0,C,,110005426262
5495WZCNCX215HL,-88.46600000000001,44.233000000000004,False,55,139,002400,55,55139,55139002400,1400000US55139002400,AZCO INC,2150 HOLLY RD,NEENAH,WI,54956,"AZCO INC.2150 HOLLY RD, NEENAH WISCONSIN 54956 (WINNEBAGO)",0,C,,110005472452
54915SNTKC2901N,-88.36399999999999,44.288999999999994,False,55,087,011502,55,55087,55087011502,1400000US55087011502,BASF CORP,2901 N CONKEY ST,APPLETON,WI,54911,"BASF CORP.2901 N CONKEY ST, APPLETON WISCONSIN 54911 (OUTAGAMIE)",0,C,,110009516531
54915XRFBR3001E,-88.363,44.28,False,55,087,011502,55,55087,55087011502,1400000US55087011502,REFIBRE,3001 E GLENDALE AVE,APPLETON,WI,54915,"REFIBRE.3001 E GLENDALE AVE, APPLETON WISCONSIN 54915 (OUTAGAMIE)",0,C,,
54912VTHPP2200N,-88.369,44.282,False,55,087,011502,55,55087,55087011502,1400000US55087011502,VOITH US INC,2200 N ROEMER RD,APPLETON,WI,54911,"VOITH US INC.2200 N ROEMER RD, APPLETON WISCONSIN 54911 (OUTAGAMIE)",0,C,,110005441290
54911SMTCM2222P,-88.37200000000001,44.29,False,55,087,011502,55,55087,55087011502,1400000US55087011502,DUCOMMUN INC,2222 E PENSAR DR,APPLETON,WI,54911,"DUCOMMUN INC.2222 E PENSAR DR, APPLETON WISCONSIN 54911 (OUTAGAMIE)",0,C,,110005268147
5491WZCNCX2111S,-88.35799999999999,44.282,False,55,087,011502,55,55087,55087011502,1400000US55087011502,AZCO INC,2111 S SANDRA ST,APPLETON,WI,54912,"AZCO INC.2111 S SANDRA ST, APPLETON WISCONSIN 54912 (OUTAGAMIE)",0,C,,110046371635
54911VLMTN2111N,-88.36,44.284,True,55,087,011502,55,55087,55087011502,1400000US55087011502,VALMET INC APPLETON DIV,2111 N SANDRA ST,APPLETON,WI,549115101,"VALMET INC APPLETON DIV 2111 N SANDRA ST, APPLETON, WI, 549115101",0,C,,
54923BRLNF242SO,-88.948,43.964,False,55,047,100100,55,55047,55047100100,1400000US55047100100,GREDE - BERLIN,242 S PEARL ST,BERLIN,WI,54923,"GREDE - BERLIN.242 S PEARL ST, BERLIN WISCONSIN 54923 (GREEN LAKE)",1,C,,110000423239
54923BRLNT235SW,-88.947,43.964,False,55,047,100100,55,55047,55047100100,1400000US55047100100,BERLIN LEATHER MAIN PLANT,235 S WISCONSIN ST,BERLIN,WI,54923,"BERLIN LEATHER MAIN PLANT.235 S WISCONSIN ST, BERLIN WISCONSIN 54923 (GREEN LAKE)",0,C,,
54923MCGRG290JU,-88.93799999999999,43.965,False,55,047,100100,55,55047,55047100100,1400000US55047100100,MACGREGOR SAND-KNIT,290 JUNCTION STREET,BERLIN,WI,54923,"MACGREGOR SAND-KNIT.290 JUNCTION STREET, BERLIN WISCONSIN 54923 (GREEN LAKE)",0,C,,
54923SNRNG242AS,-88.948,43.965,False,55,047,100100,55,55047,55047100100,1400000US55047100100,SENIOR ENG CO,242A S PEARL ST,BERLIN,WI,549232071,"SENIOR ENG CO.242A S PEARL ST, BERLIN WISCONSIN 54923 (GREEN LAKE)",0,C,,
54923NTNLB694WH,-88.93,43.957,False,55,047,100100,55,55047,55047100100,1400000US55047100100,DARLING INGREDIENTS INC,694 WHITE RIDGE RD,BERLIN,WI,54923,"DARLING INGREDIENTS INC.694 WHITE RIDGE RD, BERLIN WISCONSIN 54923 (GREEN LAKE)",0,C,,110000423257
54929NRDBR325E1,-88.74700000000001,44.623000000000005,False,55,135,101100,55,55135,55135101100,1400000US55135101100,NORDBERG INC,325 E 15TH ST,CLINTONVILLE,WI,54929,"NORDBERG INC.325 E 15TH ST, CLINTONVILLE WISCONSIN 54929 (WAUPACA)",0,C,,
54929TLTYT151E1,-88.744,44.626000000000005,False,55,135,101100,55,55135,55135101100,1400000US55135101100,UTILITY TOOL & BODY CO INC,151 E 16TH ST,CLINTONVILLE,WI,54929,"UTILITY TOOL & BODY CO INC.151 E 16TH ST, CLINTONVILLE WISCONSIN 54929 (WAUPACA)",0,C,,
54929WLKRF250SP,-88.741,44.628,False,55,135,101100,55,55135,55135101100,1400000US55135101100,WALKER FORGE INC,250 SPRING ST,CLINTONVILLE,WI,54929,"WALKER FORGE INC.250 SPRING ST, CLINTONVILLE WISCONSIN 54929 (WAUPACA)",0,C,,110000423275
54929FWDCR105EA,-88.75200000000001,44.62,False,55,135,101100,55,55135,55135101100,1400000US55135101100,SEAGRAVE FIRE APPARATUS LLC,105 E 12TH ST,CLINTONVILLE,WI,54929,"SEAGRAVE FIRE APPARATUS LLC.105 E 12TH ST, CLINTONVILLE WISCONSIN 54929 (WAUPACA)",0,C,,110000423266
54935BRDNN481WE,-88.47200000000001,43.751999999999995,False,55,039,040700,55,55039,55039040700,1400000US55039040700,BORDEN INC GROCERY & SPECIALTY PRODUCTS,481 W ROLLING MEADOWS DR,FOND DU LAC,WI,549359160,"BORDEN INC GROCERY & SPECIALTY PRODUCTS.481 W ROLLING MEADOWS DR, FOND DU LAC WISCONSIN 54935 (FOND DU LAC)",0,C,,
54935BRNNR450AR,-88.464,43.765,False,55,039,040700,55,55039,55039040700,1400000US55039040700,BRENNER TANK LLC,450 ARLINGTON AVE,FOND DU LAC,WI,54935,"BRENNER TANK LLC.450 ARLINGTON AVE, FOND DU LAC WISCONSIN 54935 (FOND DU LAC)",0,C,,110002122042
54935GLLWY325TO,-88.459,43.771,False,55,039,040700,55,55039,55039040700,1400000US55039040700,MILK SPECIALTIES GLOBAL-FOND DU LAC,325 TOMPKINS ST,FOND DU LAC,WI,54935,"MILK SPECIALTIES GLOBAL-FOND DU LAC.325 TOMPKINS ST, FOND DU LAC WISCONSIN 54935 (FOND DU LAC)",0,C,,110000494448
54935LCTRP430AR,-88.463,43.765,False,55,039,040700,55,55039,55039040700,1400000US55039040700,ELECTROPLATING INC,430 ARLINGTON AVE,FOND DU LAC,WI,54935,"ELECTROPLATING INC.430 ARLINGTON AVE, FOND DU LAC WISCONSIN 54935 (FOND DU LAC)",0,C,,110000423293
54935MDSTT132TR,-88.475,43.748999999999995,False,55,039,040700,55,55039,55039040700,1400000US55039040700,MID STATES ALUMINUM CORP,132 TROWBRIDGE DR,FOND DU LAC,WI,54935,"MID STATES ALUMINUM CORP.132 TROWBRIDGE DR, FOND DU LAC WISCONSIN 54935 (FOND DU LAC)",0,C,,110000768205
54935RBRYL443AR,-88.463,43.765,False,55,039,040700,55,55039,55039040700,1400000US55039040700,RB ROYAL INDUSTRIES INC,442 ARLINGTON AVE,FOND DU LAC,WI,54935,"RB ROYAL INDUSTRIES INC.442 ARLINGTON AVE, FOND DU LAC WISCONSIN 54935 (FOND DU LAC)",0,C,,
54935SCHRM650OA,-88.46700000000001,43.761,False,55,039,040700,55,55039,55039040700,1400000US55039040700,US CHROME CORP OF WISCONSIN,650 OAK PARK AVE,FOND DU LAC,WI,54935,"US CHROME CORP OF WISCONSIN.650 OAK PARK AVE, FOND DU LAC WISCONSIN 54935 (FOND DU LAC)",0,C,,110000423328
54936MRCRYW6250,-88.469,43.76,False,55,039,040700,55,55039,55039040700,1400000US55039040700,BRUNSWICK CORP MERCURY MARINE DIV,W6250 PIONEER RD,FOND DU LAC,WI,54935,"BRUNSWICK CORP MERCURY MARINE DIV.W6250 PIONEER RD, FOND DU LAC WISCONSIN 54935 (FOND DU LAC)",0,C,,110000423364
54936NTRRS525RO,-88.499,43.803000000000004,False,55,039,040700,55,55039,55039040700,1400000US55039040700,INTERIOR SYSTEMS INC,525 ROLLING MEADOWS DR,FOND DU LAC,WI,549361049,"INTERIOR SYSTEMS INC.525 ROLLING MEADOWS DR, FOND DU LAC WISCONSIN 54936 (FOND DU LAC)",0,C,,
54935BSTTR1800M,-88.45700000000001,43.748999999999995,False,55,039,040700,55,55039,55039040700,1400000US55039040700,BESTT LIEBCO,1800 MORRIS ST,FOND DU LAC,WI,54935,"BESTT LIEBCO.1800 MORRIS ST, FOND DU LAC WISCONSIN 54935 (FOND DU LAC)",0,C,,
54935PRNML717SH,-88.462,43.75899999999999,False,55,039,040700,55,55039,55039040700,1400000US55039040700,LAND O'LAKES PURINA FEED LLC - FON DU LAC,717 S HICKORY ST,FOND DU LAC,WI,54935,"LAND O'LAKES PURINA FEED LLC - FON DU LAC.717 S HICKORY ST, FOND DU LAC WISCONSIN 54935 (FOND DU LAC)",0,C,,110000423300
54937LCTRN385WR,-88.47,43.75,False,55,039,040700,55,55039,55039040700,1400000US55039040700,WELLS VEHICLE ELECTRONICS LP,385 W ROLLING MEADOWS DR,FOND DU LAC,WI,54937,"WELLS VEHICLE ELECTRONICS LP.385 W ROLLING MEADOWS DR, FOND DU LAC WISCONSIN 54937 (FOND DU LAC)",0,C,,110002122060
54935CHRTR1795S,-88.46700000000001,43.733999999999995,False,55,039,040700,55,55039,55039040700,1400000US55039040700,CENTRAL WIRE INC,1795 S HICKORY ST,FOND DU LAC,WI,54937,"CENTRAL WIRE INC.1795 S HICKORY ST, FOND DU LAC WISCONSIN 54937 (FOND DU LAC)",0,C,,110005547738
54937RBRYL1350S,-88.46600000000001,43.743,False,55,039,040700,55,55039,55039040700,1400000US55039040700,RB ROYAL INDUSTRIES INC,1350 S HICKORY ST,FOND DU LAC,WI,54937,"RB ROYAL INDUSTRIES INC.1350 S HICKORY ST, FOND DU LAC WISCONSIN 54937 (FOND DU LAC)",0,C,,110012180665
54935BSTTR136SO,-88.454,43.775,False,55,039,040500,55,55039,55039040500,1400000US55039040500,BESTT ROLLR INC,136 S BROOKE ST,FOND DU LAC,WI,549350550,"BESTT ROLLR INC.136 S BROOKE ST, FOND DU LAC WISCONSIN 54935 (FOND DU LAC)",0,C,,
54936GDDNG142DO,-88.45100000000001,43.782,False,55,039,040500,55,55039,55039040500,1400000US55039040500,FIVES GIDDINGS & LEWIS LLC,142 DOTY ST,FOND DU LAC,WI,54935,"FIVES GIDDINGS & LEWIS LLC.142 DOTY ST, FOND DU LAC WISCONSIN 54935 (FOND DU LAC)",0,C,,110000423355
54935WLLSM26SBR,-88.454,43.778,False,55,039,040500,55,55039,55039040500,1400000US55039040500,WELLS MANUFACTURING LP,26 S BROOKE ST,FOND DU LAC,WI,549354007,"WELLS MANUFACTURING LP.26 S BROOKE ST, FOND DU LAC WISCONSIN 54935 (FOND DU LAC)",1,C,,110000423337
54935NTRNTRTE2S,-88.462,43.778999999999996,False,55,039,040300,55,55039,55039040300,1400000US55039040300,INTERNATIONAL PAPER CO,RT 2 S HICKORY RD,FOND DU LAC,WI,54935,"INTERNATIONAL PAPER CO.RT 2 S HICKORY RD, FOND DU LAC WISCONSIN 54935 (FOND DU LAC)",0,C,,
5493WBCBRK66VAN,-88.47399999999999,43.79600000000001,False,55,039,040300,55,55039,55039040300,1400000US55039040300,BCI BURKE CO LLC,660 VAN DYNE RD,FOND DU LAC,WI,54937,"BCI BURKE CO LLC.660 VAN DYNE RD, FOND DU LAC WISCONSIN 54937 (FOND DU LAC)",0,C,,110005426066
54944HRTNV825WM,-88.654,44.336999999999996,False,55,087,012700,55,55087,55087012700,1400000US55087012700,AMERICAN TOY & FURNITURE CO INC,825 W MAIN ST,HORTONVILLE,WI,54944,"AMERICAN TOY & FURNITURE CO INC.825 W MAIN ST, HORTONVILLE WISCONSIN 54944 (OUTAGAMIE)",0,C,,
54944THLRS302SL,-88.64299999999999,44.333,False,55,087,012700,55,55087,55087012700,1400000US55087012700,DEAN FOODS VEGETABLE CO,302 S LINCOLN ST,HORTONVILLE,WI,54944,"DEAN FOODS VEGETABLE CO.302 S LINCOLN ST, HORTONVILLE WISCONSIN 54944 (OUTAGAMIE)",0,C,,
54961CRWDN718HI,-88.728,44.381,False,55,087,012700,55,55087,55087012700,1400000US55087012700,BEMIS WIISCONSIN LLC,718 HIGH ST,NEW LONDON,WI,54961,"BEMIS WIISCONSIN LLC.718 HIGH ST, NEW LONDON WISCONSIN 54961 (OUTAGAMIE)",0,C,,110000423532
54961HLLSHCOUNT,-88.736,44.372,False,55,087,012700,55,55087,55087012700,1400000US55087012700,HILLSHIRE BRANDS CO NEW LONDON PLANT,N3620 COUNTY RD D,NEW LONDON,WI,54961,"HILLSHIRE BRANDS CO NEW LONDON PLANT.N3620 COUNTY RD D, NEW LONDON WISCONSIN 54961 (OUTAGAMIE)",0,C,,110016862723
54961SMMNS613EB,-88.73100000000001,44.388000000000005,False,55,087,012700,55,55087,55087012700,1400000US55087012700,SIMMONS JUVENILE PRODUCTS CO INC,613 E BEACON AVE,NEW LONDON,WI,54961,"SIMMONS JUVENILE PRODUCTS CO INC.613 E BEACON AVE, NEW LONDON WISCONSIN 54961 (OUTAGAMIE)",0,C,,
54944MDCNP262EM,-88.633,44.335,False,55,087,012700,55,55087,55087012700,1400000US55087012700,MIDCON PRODUCTS INC,262 E MAIN ST,HORTONVILLE,WI,54944,"MIDCON PRODUCTS INC.262 E MAIN ST, HORTONVILLE WISCONSIN 54944 (OUTAGAMIE)",0,C,,110006462345
5496WWLFRV5CUNT,-88.726,44.397,False,55,087,012700,55,55087,55087012700,1400000US55087012700,WOLF RIVER LUMBER,500 COUNTY S,NEW LONDON,WI,54961,"WOLF RIVER LUMBER.500 COUNTY S, NEW LONDON WISCONSIN 54961 (OUTAGAMIE)",0,C,,110027215476
54949MCTRD1211D,-88.927,44.451,False,55,135,100400,55,55135,55135100400,1400000US55135100400,OMC TRADE WINDS,1211 DEPOT ST,MANAWA,WI,54949,"OMC TRADE WINDS.1211 DEPOT ST, MANAWA WISCONSIN 54949 (WAUPACA)",0,C,,
54949MCTRDASHST,-88.925,44.457,False,55,135,100400,55,55135,55135100400,1400000US55135100400,OMC TRADE WINDS PLANT 2,ASH ST,MANAWA,WI,54949,"OMC TRADE WINDS PLANT 2.ASH ST, MANAWA WISCONSIN 54949 (WAUPACA)",0,C,,
54949TRLTN1220D,-88.927,44.451,False,55,135,100400,55,55135,55135100400,1400000US55135100400,TRIAL-ET INC,1220 DEPOT ST,MANAWA,WI,54949,"TRIAL-ET INC.1220 DEPOT ST, MANAWA WISCONSIN 54949 (WAUPACA)",1,C,,
54950MRNPL222SP,-88.884,44.67,False,55,135,100100,55,55135,55135100100,1400000US55135100100,MARION PLYWOOD CORP.,222 S PARKVIEW AVE,MARION,WI,54950,"MARION PLYWOOD CORP..222 S PARKVIEW AVE, MARION WISCONSIN 54950 (WAUPACA)",0,C,,110002035315
54929STNBRN1165,-88.723,44.663000000000004,False,55,135,100100,55,55135,55135100100,1400000US55135100100,H & S MANUFACTURING CO INC,N11651 HWY 22,CLINTONVILLE,WI,54929,"H & S MANUFACTURING CO INC.N11651 HWY 22, CLINTONVILLE WISCONSIN 54929 (WAUPACA)",0,C,,110000594330
5495WMRNBD211WR,-88.89200000000001,44.67100000000001,False,55,135,100100,55,55135,55135100100,1400000US55135100100,MARION BODY WORKS,211 W RAMSDELL ST,MARION,WI,54950,"MARION BODY WORKS.211 W RAMSDELL ST, MARION WISCONSIN 54950 (WAUPACA)",0,C,,110000855557
54952CNTRL741FO,-88.43700000000001,44.206,False,55,139,002800,55,55139,55139002800,1400000US55139002800,INTERTAPE POLYMER GROUP,741 FOURTH ST,MENASHA,WI,54952,"INTERTAPE POLYMER GROUP.741 FOURTH ST, MENASHA WISCONSIN 54952 (WINNEBAGO)",0,C,,110000423382
54952GLBRT430AH,-88.447,44.196999999999996,False,55,139,003000,55,55139,55139003000,1400000US55139003000,GILBERT PAPER CO,430 AHNAIP ST,MENASHA,WI,549520260,"GILBERT PAPER CO.430 AHNAIP ST, MENASHA WISCONSIN 54952 (WINNEBAGO)",0,C,,
54952GNRLC388AH,-88.45,44.195,False,55,139,003000,55,55139,55139003000,1400000US55139003000,GENERAL CHEMICAL CORP MENASHA WORKS,388 AHNAIP ST BOX 229,MENASHA,WI,54952,"GENERAL CHEMICAL CORP MENASHA WORKS.388 AHNAIP ST BOX 229, MENASHA WISCONSIN 54952 (WINNEBAGO)",0,C,,
54952JMSRV160WA,-88.454,44.196000000000005,False,55,139,003000,55,55139,55139003000,1400000US55139003000,JAMES RIVER CORP,160 WASHINGTON ST,MENASHA,WI,54952,"JAMES RIVER CORP.160 WASHINGTON ST, MENASHA WISCONSIN 54952 (WINNEBAGO)",0,C,,
54952KRSLX206GA,-88.458,44.196000000000005,False,55,139,003000,55,55139,55139003000,1400000US55139003000,AKROSIL,206 GARFIELD AVE,MENASHA,WI,549528001,"AKROSIL.206 GARFIELD AVE, MENASHA WISCONSIN 54952 (WINNEBAGO)",0,C,,
54952MRCNN271RI,-88.458,44.2,False,55,139,003000,55,55139,55139003000,1400000US55139003000,PECHINEY PLASTIC PACKAGING PPMW,271 RIVER ST,MENASHA,WI,54952,"PECHINEY PLASTIC PACKAGING PPMW.271 RIVER ST, MENASHA WISCONSIN 54952 (WINNEBAGO)",0,C,,
54952SPPRM69WAS,-88.45299999999999,44.198,False,55,139,003000,55,55139,55139003000,1400000US55139003000,US PAPER MILLS CORP,69 WASHINGTON ST,MENASHA,WI,54952,"US PAPER MILLS CORP.69 WASHINGTON ST, MENASHA WISCONSIN 54952 (WINNEBAGO)",0,C,,110000423426
54952SHLND204MA,-88.459,44.195,False,55,139,003000,55,55139,55139003000,1400000US55139003000,ASHLAND DISTRIBUTION CO,204 MADISON ST,MENASHA,WI,54952,"ASHLAND DISTRIBUTION CO.204 MADISON ST, MENASHA WISCONSIN 54952 (WINNEBAGO)",0,C,,
54952MNSHT198RI,-88.458,44.2,False,55,139,003000,55,55139,55139003000,1400000US55139003000,MENASHA UTILITIES,198 RIVER ST,MENASHA,WI,54952,"MENASHA UTILITIES.198 RIVER ST, MENASHA WISCONSIN 54952 (WINNEBAGO)",0,C,,110013287184
54952GNRLP450MI,-88.449,44.207,False,55,139,002900,55,55139,55139002900,1400000US55139002900,SUN CHEMICAL CORP,450 MILWAUKEE ST,MENASHA,WI,54952,"SUN CHEMICAL CORP.450 MILWAUKEE ST, MENASHA WISCONSIN 54952 (WINNEBAGO)",0,C,,110000423391
54952WSCNS3RDAN,-88.45200000000001,44.205,False,55,139,002900,55,55139,55139002900,1400000US55139002900,ESSITY PROFESSIONAL HYGIENE NA LLC,190 THIRD ST,MENASHA,WI,54952,"ESSITY PROFESSIONAL HYGIENE NA LLC.190 THIRD ST, MENASHA WISCONSIN 54952 (WINNEBAGO)",0,C,,110005425682
54952NRTHW1457E,-88.43799999999999,44.229,False,55,139,002601,55,55139,55139002601,1400000US55139002601,"NORTHWESTERN COLORGRAPHICS INC, BANTA DIGITAL GROUP",1457 EARL ST,MENASHA,WI,549520390,"NORTHWESTERN COLORGRAPHICS INC, BANTA DIGITAL GROUP.1457 EARL ST, MENASHA WISCONSIN 54952 (WINNEBAGO)",1,C,,
54952PPLTN1420E,-88.43799999999999,44.228,False,55,139,002601,55,55139,55139002601,1400000US55139002601,APPLETON STRUCTURAL STEEL CO,1420 EARL ST,MENASHA,WI,54952,"APPLETON STRUCTURAL STEEL CO.1420 EARL ST, MENASHA WISCONSIN 54952 (WINNEBAGO)",0,C,,
54952BNTDG1482M,-88.43700000000001,44.23,False,55,139,002601,55,55139,55139002601,1400000US55139002601,BANTA DIGITAL GROUP,1482 MISSION ST,MENASHA,WI,549520390,"BANTA DIGITAL GROUP.1482 MISSION ST, MENASHA WISCONSIN 54952 (WINNEBAGO)",0,C,,
5495WLSCCM83MID,-88.436,44.23,False,55,139,002601,55,55139,55139002601,1400000US55139002601,LSC COMMUNICATIONS US INC,830 MIDWAY RD,MENASHA,WI,54952,"LSC COMMUNICATIONS US INC.830 MIDWAY RD, MENASHA WISCONSIN 54952 (WINNEBAGO)",0,C,,110070309251
54956BLTCR1615M,-88.47,44.172,False,55,139,003300,55,55139,55139003300,1400000US55139003300,BELOIT CORP MANHATTAN DIV,1615 MATTHEWS ST,NEENAH,WI,54956,"BELOIT CORP MANHATTAN DIV.1615 MATTHEWS ST, NEENAH WISCONSIN 54956 (WINNEBAGO)",0,C,,
54956NNHFN500WI,-88.47,44.181000000000004,False,55,139,003300,55,55139,55139003300,1400000US55139003300,NEENAH FNDY CO PLANT 1,500 WINNECONNE AVE,NEENAH,WI,54956,"NEENAH FNDY CO PLANT 1.500 WINNECONNE AVE, NEENAH WISCONSIN 54956 (WINNEBAGO)",0,C,,
54956NNHPP135NC,-88.46,44.188,False,55,139,003300,55,55139,55139003300,1400000US55139003300,NEENAH INC NEENAH MILL,135 N COMMERCIAL ST,NEENAH,WI,54956,"NEENAH INC NEENAH MILL.135 N COMMERCIAL ST, NEENAH WISCONSIN 54956 (WINNEBAGO)",0,C,,110007333242
54956PHGLT225WW,-88.464,44.188,False,55,139,003300,55,55139,55139003300,1400000US55139003300,GLATFELTER CO - NEENAH MI LL,225 W WISCONSIN AVE,NEENAH,WI,54956,"GLATFELTER CO - NEENAH MI LL.225 W WISCONSIN AVE, NEENAH WISCONSIN 54956 (WINNEBAGO)",0,C,,110000423480
54957GLLWY601SO,-88.465,44.181000000000004,False,55,139,003300,55,55139,55139003300,1400000US55139003300,GALLOWAY CO,601 S COMMERCIAL ST,NEENAH,WI,54956,"GALLOWAY CO.601 S COMMERCIAL ST, NEENAH WISCONSIN 54956 (WINNEBAGO)",0,C,,110000423514
54956FXVLL213MI,-88.46700000000001,44.187,False,55,139,003300,55,55139,55139003300,1400000US55139003300,FOX VALLEY ENERGY CENTER LLC,231 MILLVIEW DR,NEENAH,WI,54956,"FOX VALLEY ENERGY CENTER LLC.231 MILLVIEW DR, NEENAH WISCONSIN 54956 (WINNEBAGO)",0,C,,110000423435
54956KMBRL249NO,-88.476,44.193999999999996,False,55,139,003400,55,55139,55139003400,1400000US55139003400,CELLU TISSUE CORP-NEENAH (DBA CLEARWATER PAPER-NEENAH),249 N LAKE ST,NEENAH,WI,54956,"CELLU TISSUE CORP-NEENAH (DBA CLEARWATER PAPER-NEENAH).249 N LAKE ST, NEENAH WISCONSIN 54956 (WINNEBAGO)",0,C,,110005427323
54956MRCNN155WE,-88.48,44.191,False,55,139,003400,55,55139,55139003400,1400000US55139003400,AMERICAN NATIONAL CAN CO NEENAH GRAPHICS,155 WESTERN AVE,NEENAH,WI,54956,"AMERICAN NATIONAL CAN CO NEENAH GRAPHICS.155 WESTERN AVE, NEENAH WISCONSIN 54956 (WINNEBAGO)",0,C,,
54957GGRSN164NO,-88.476,44.192,False,55,139,003400,55,55139,55139003400,1400000US55139003400,EGGERS DIV LLC - NEENAH,164 N LAKE ST,NEENAH,WI,54956,"EGGERS DIV LLC - NEENAH.164 N LAKE ST, NEENAH WISCONSIN 54956 (WINNEBAGO)",0,C,,110000768241
54956LYMPC2411I,-88.475,44.151,False,55,139,003702,55,55139,55139003702,1400000US55139003702,CREATIVE METAL PRODUCTS,2411 INDL DR,NEENAH,WI,54956,"CREATIVE METAL PRODUCTS.2411 INDL DR, NEENAH WISCONSIN 54956 (WINNEBAGO)",0,C,,110000855450
54956MDMRC950BR,-88.48899999999999,44.156000000000006,False,55,139,003702,55,55139,55139003702,1400000US55139003702,MENASHA CORP MID AMERICA DIV,950 BREEZEWOOD LN,NEENAH,WI,54957,"MENASHA CORP MID AMERICA DIV.950 BREEZEWOOD LN, NEENAH WISCONSIN 54957 (WINNEBAGO)",0,C,,
