TRIFID,LONGITUDE,LATITUDE,ESTIMATE,STATEFP,COUNTYFP,TRACTCE,STATEGEOID,COUNTYGEOID,TRACTGEOID,AFFGEOID,FACILITY_NAME,STREET,CITY,STUSPS,ZIP_CODE,FACILITY,FAC_CLOSED_IND,ASGN_FEDERAL_IND,BIA_CODE,EPA_REGISTRY_ID
82007FRNTR2700E,-104.789,41.128,False,56,021,000200,56,56021,56021000200,1400000US56021000200,HOLLYFRONTIER CHEYENNE REFINING LLC,2700 E. 5TH STREET,CHEYENNE,WY,82007,"HOLLYFRONTIER CHEYENNE REFINING LLC.2700 E. 5TH STREET, CHEYENNE WYOMING 82007 (LARAMIE)",0,C,,110000468048
82007SCHRL821BR,-104.79799999999999,41.131,False,56,021,000200,56,56021,56021000200,1400000US56021000200,SCHROLL CABINETS,821 BRADLEY AVE,CHEYENNE,WY,82007,"SCHROLL CABINETS.821 BRADLEY AVE, CHEYENNE WYOMING 82007 (LARAMIE)",0,C,,
8200WVNRTR174PA,-104.833,41.119,False,56,021,000200,56,56021,56021000200,1400000US56021000200,VOESTALPINE NORTRAK INC,1740 PACIFIC AVENUE,CHEYENNE,WY,82007,"VOESTALPINE NORTRAK INC.1740 PACIFIC AVENUE, CHEYENNE WYOMING 82007 (LARAMIE)",0,C,,110028071191
82007WYCNC8305O,-104.913,41.096000000000004,False,56,021,001902,56,56021,56021001902,1400000US56021001902,COASTAL CHEM INC,8201 OTTO RD,CHEYENNE,WY,82007,"COASTAL CHEM INC.8201 OTTO RD, CHEYENNE WYOMING 82007 (LARAMIE)",0,C,,
82007DYNNB835TT,-104.906,41.095,False,56,021,001902,56,56021,56021001902,1400000US56021001902,DYNO NOBEL INC-CHEYENNE PLANT,8305 OTTO RD,CHEYENNE,WY,82001,"DYNO NOBEL INC-CHEYENNE PLANT.8305 OTTO RD, CHEYENNE WYOMING 82001 (LARAMIE)",0,C,,110000468066
8200WJBRNC6331B,-104.891,41.06100000000001,False,56,021,001902,56,56021,56021001902,1400000US56021001902,JEBRO INCORPORATED,6331 BERWICK DRIVE,CHEYENNE,WY,82007,"JEBRO INCORPORATED.6331 BERWICK DRIVE, CHEYENNE WYOMING 82007 (LARAMIE)",0,C,,110046279656
8200WBRNNT6527B,-104.89200000000001,41.059,False,56,021,001902,56,56021,56021001902,1400000US56021001902,BRENNTAG PACIFIC INC,6527 BERWICK DRIVE,CHEYENNE,WY,82007,"BRENNTAG PACIFIC INC.6527 BERWICK DRIVE, CHEYENNE WYOMING 82007 (LARAMIE)",0,C,,110064677933
82240HLLYSUSHIG,-104.189,42.048,False,56,015,958000,56,56015,56015958000,1400000US56015958000,THE WESTERN SUGAR COOP-TORRINGTON PLANT,400 MAIN ST,TORRINGTON,WY,82240,"THE WESTERN SUGAR COOP-TORRINGTON PLANT.400 MAIN ST, TORRINGTON WYOMING 82240 (GOSHEN)",0,C,,110000468084
82007WYZNC475CO,-104.65299999999999,41.638000000000005,False,56,015,958000,56,56021,56015958000,1400000US56015958000,TETRA MICRONUTRIENTS INC,475 COUNTY RD 128A,CHEYENNE,WY,82007,"TETRA MICRONUTRIENTS INC.475 COUNTY RD 128A, CHEYENNE WYOMING 82007 (LARAMIE)",0,C,,
82240WYMNG12MWH,-104.194,42.04600000000001,False,56,015,958000,56,56015,56015958000,1400000US56015958000,WYOMING ETHANOL,4739 WEST STATE HWY 156,TORRINGTON,WY,82240,"WYOMING ETHANOL.4739 WEST STATE HWY 156, TORRINGTON WYOMING 82240 (GOSHEN)",0,C,,110000602205
82334SNCLREASTL,-107.104,41.778999999999996,False,56,007,967600,56,56007,56007967600,1400000US56007967600,SINCLAIR WYOMING REFINING CO,100 E LINCOLN AVE,SINCLAIR,WY,82334,"SINCLAIR WYOMING REFINING CO.100 E LINCOLN AVE, SINCLAIR WYOMING 82334 (CARBON)",0,C,,110000468093
82401CRWNC4THST,-107.964,44.023999999999994,False,56,043,000302,56,56043,56043000302,1400000US56043000302,CROWN BEVERAGE PACKAGING,620 N FOURTH ST,WORLAND,WY,82401,"CROWN BEVERAGE PACKAGING.620 N FOURTH ST, WORLAND WYOMING 82401 (WASHAKIE)",0,C,,110010856341
82401HLLYS300FI,-107.969,44.01,False,56,043,000302,56,56043,56043000302,1400000US56043000302,WYOMING SUGAR CO,300 S 1ST ST,WORLAND,WY,82401,"WYOMING SUGAR CO.300 S 1ST ST, WORLAND WYOMING 82401 (WASHAKIE)",0,C,,110000468128
82401FRMNT821PU,-107.958,44.019,False,56,043,000301,56,56043,56043000301,1400000US56043000301,FREMONT BEVERAGES,821 PULLIAM AVE,WORLAND,WY,82401,"FREMONT BEVERAGES.821 PULLIAM AVE, WORLAND WYOMING 82401 (WASHAKIE)",0,C,,
82431THWST400GR,-108.405,44.838,False,56,003,962800,56,56003,56003962800,1400000US56003962800,WESTERN SUGAR COOPERATIVE LOVELL FACTORY,400 GREAT WESTERN AVE,LOVELL,WY,82431,"WESTERN SUGAR COOPERATIVE LOVELL FACTORY.400 GREAT WESTERN AVE, LOVELL WYOMING 82431 (BIG HORN)",0,C,,110011679567
82431GRGPC2120L,-108.18700000000001,44.716,False,56,003,962800,56,56003,56003962800,1400000US56003962800,GEORGIA-PACIFIC GYPSUM LLC - LOVELL PLANT,2120 LN 16 1/2,LOVELL,WY,82431,"GEORGIA-PACIFIC GYPSUM LLC - LOVELL PLANT.2120 LN 16 1/2, LOVELL WYOMING 82431 (BIG HORN)",0,C,,110002136199
82431CHMDLPOBOX,-108.33200000000001,44.847,False,56,003,962800,56,56003,56003962800,1400000US56003962800,CETCO,92 HWY 37,LOVELL,WY,82431,"CETCO.92 HWY 37, LOVELL WYOMING 82431 (BIG HORN)",0,C,,110002339666
82431BNTNT789HW,-108.14399999999999,44.824,False,56,003,962800,56,56003,56003962800,1400000US56003962800,BENTONITE PERFORMANCE MINERALS LLC LOVELL,789 HWY 14A,LOVELL,WY,82431,"BENTONITE PERFORMANCE MINERALS LLC LOVELL.789 HWY 14A, LOVELL WYOMING 82431 (BIG HORN)",0,C,,110025331674
82432CWBYTBOX8X,-107.961,44.285,False,56,003,962600,56,56003,56003962600,1400000US56003962600,COWBOY TIMBER TREATING INC,1 MI N HWY 31,MANDERSON,WY,82432,"COWBOY TIMBER TREATING INC.1 MI N HWY 31, MANDERSON WYOMING 82432 (BIG HORN)",0,C,,
82501RVRTN140GO,-108.417,43.0,False,56,013,940202,56,56013,56013940202,1400000US56013940202,CHEMTRADE REFINERY SERVICES INC,140 GOES IN LODGE RD,RIVERTON,WY,82501,"CHEMTRADE REFINERY SERVICES INC.140 GOES IN LODGE RD, RIVERTON WYOMING 82501 (FREMONT)",0,C,281,110000468146
82602MCLCM1707W,-106.376,42.85,False,56,025,001200,56,56025,56025001200,1400000US56025001200,"AMOCO OIL CO, CASPER REFINERY",1707 W YELLOWSTONE HWY,CASPER,WY,82602,"AMOCO OIL CO, CASPER REFINERY.1707 W YELLOWSTONE HWY, CASPER WYOMING 82602 (NATRONA)",1,C,,
82604CLVRT7242W,-106.389,42.853,False,56,025,001200,56,56025,56025001200,1400000US56025001200,TRUENORTH STEEL-CASPER,7242 WEST YELLOWSTONE HWY,CASPER,WY,82604,"TRUENORTH STEEL-CASPER.7242 WEST YELLOWSTONE HWY, CASPER WYOMING 82604 (NATRONA)",0,C,,110002136224
82644XCLNCONEEX,-106.369,42.849,False,56,025,001200,56,56025,56025001200,1400000US56025001200,EXCAL INC,ONE EXCAL WAY,MILLS,WY,82644,"EXCAL INC.ONE EXCAL WAY, MILLS WYOMING 82644 (NATRONA)",0,C,,110000468217
82601NVDHT778CI,-106.34,42.858000000000004,False,56,025,001200,56,56025,56025001200,1400000US56025001200,NOV DOWNHOLE TOOLS CASPER,778 CIRCLE DR,CASPER,WY,82601,"NOV DOWNHOLE TOOLS CASPER.778 CIRCLE DR, CASPER WYOMING 82601 (NATRONA)",0,C,,110037148137
8260WBJCHM3416M,-106.365,42.857,False,56,025,001200,56,56025,56025001200,1400000US56025001200,BJ CHEMICAL SERVICES,3416 MIDWAY ROAD,CASPER,WY,82601,"BJ CHEMICAL SERVICES.3416 MIDWAY ROAD, CASPER WYOMING 82601 (NATRONA)",0,C,,110064152223
82602NTNLT6200E,-106.227,42.854,False,56,025,001800,56,56025,56025001800,1400000US56025001800,NATIONAL TANK CO,6200 E YELLOWSTONE HWY,CASPER,WY,82602,"NATIONAL TANK CO.6200 E YELLOWSTONE HWY, CASPER WYOMING 82602 (NATRONA)",0,C,,
82609LTTLM5700E,-106.14299999999999,42.513000000000005,False,56,025,001800,56,56025,56025001800,1400000US56025001800,SINCLAIR CASPER REFINING CO,5700 E HWY 20/26,CASPER,WY,82609,"SINCLAIR CASPER REFINING CO.5700 E HWY 20/26, CASPER WYOMING 82609 (NATRONA)",0,C,,110011942719
82644STHWS8240W,-106.45100000000001,42.958,False,56,025,001800,56,56025,56025001800,1400000US56025001800,AUSTIN POWDER CO,8420 W BISHOP RD,MILLS,WY,82644,"AUSTIN POWDER CO.8420 W BISHOP RD, MILLS WYOMING 82644 (NATRONA)",1,C,,
82636FLSCH6000E,-106.229,42.854,False,56,025,001800,56,56025,56025001800,1400000US56025001800,FLEISCHLI OIL EVANSVILLE,6000 E YELLOWSTONE,EVANSVILLE,WY,82636,"FLEISCHLI OIL EVANSVILLE.6000 E YELLOWSTONE, EVANSVILLE WYOMING 82636 (NATRONA)",0,C,,
8263WDRLNX679SA,-106.21700000000001,42.858000000000004,False,56,025,001800,56,56025,56025001800,1400000US56025001800,DURA-LINE,6790 SANTA FE CIR,EVANSVILLE,WY,82636,"DURA-LINE.6790 SANTA FE CIR, EVANSVILLE WYOMING 82636 (NATRONA)",0,C,,110070247031
82604NCHMN7040S,-106.335,42.935,False,56,025,001401,56,56025,56025001401,1400000US56025001401,UNICHEM INERNATIONAL INC,7040 SALT CREEK RD,CASPER,WY,82604,"UNICHEM INERNATIONAL INC.7040 SALT CREEK RD, CASPER WYOMING 82604 (NATRONA)",0,C,,
82601SDNVL907NO,-106.241,43.323,False,56,025,001401,56,56025,56025001401,1400000US56025001401,US DOE NAVAL PETROLEUM RESERVE NO 3,33250 N WY HWY 259,CASPER,WY,82643,"US DOE NAVAL PETROLEUM RESERVE NO 3.33250 N WY HWY 259, CASPER WYOMING 82643 (NATRONA)",0,F,,110064319562
82601DFNST9125N,-106.353,42.982,False,56,025,001401,56,56025,56025001401,1400000US56025001401,SAFARILAND/DEFENSE TECHNOLOGY,9125 NEOSHO RD,CASPER,WY,82601,"SAFARILAND/DEFENSE TECHNOLOGY.9125 NEOSHO RD, CASPER WYOMING 82601 (NATRONA)",0,C,,110005583261
82601KNFRV1461B,-106.29700000000001,42.867,False,56,025,001401,56,56025,56025001401,1400000US56025001401,KNIFE RIVER CASPER,1461 BRYAN STOCK TRL,CASPER,WY,82601,"KNIFE RIVER CASPER.1461 BRYAN STOCK TRL, CASPER WYOMING 82601 (NATRONA)",0,C,,110037148119
82601NVCSP2673N,-106.34200000000001,42.885,False,56,025,001401,56,56025,56025001401,1400000US56025001401,NOV RIG SOLUTIONS CASPER,2673 N POPLAR,CASPER,WY,82601,"NOV RIG SOLUTIONS CASPER.2673 N POPLAR, CASPER WYOMING 82601 (NATRONA)",0,C,,110037148128
8260WVLLRC351NP,-106.34,42.894,False,56,025,001401,56,56025,56025001401,1400000US56025001401,VALLOUREC TUBE-ALLOY LLC,3501 N POPLAR,CASPER,WY,82601,"VALLOUREC TUBE-ALLOY LLC.3501 N POPLAR, CASPER WYOMING 82601 (NATRONA)",0,C,,110005583920
8260WJTLGR1461B,-106.29700000000001,42.867,False,56,025,001401,56,56009,56025001401,1400000US56025001401,JTL GROUP INC - VR MINE,1461 BRYAN STOCK TRAIL,CASPER,WY,82601,"JTL GROUP INC - VR MINE.1461 BRYAN STOCK TRAIL, CASPER WYOMING 82601 (CONVERSE)",0,C,,110032664524
82636NLCCH4900E,-106.255,42.857,False,56,025,001602,56,56025,56025001602,1400000US56025001602,NALCO COMPANY-EVANSVILLE PLANT 108,4900 E YELLOWSTONE HWY,EVANSVILLE,WY,82636,"NALCO COMPANY-EVANSVILLE PLANT 108.4900 E YELLOWSTONE HWY, EVANSVILLE WYOMING 82636 (NATRONA)",0,C,,110000468182
82636NVRSX282NF,-106.275,42.861000000000004,False,56,025,001602,56,56025,56025001602,1400000US56025001602,UNIVAR USA INC CASPER,282 N FORGE,EVANSVILLE,WY,82636,"UNIVAR USA INC CASPER.282 N FORGE, EVANSVILLE WYOMING 82636 (NATRONA)",0,C,,110015679176
82636PHMNP118IR,-106.27600000000001,42.858999999999995,False,56,025,001602,56,56025,56025001602,1400000US56025001602,JOY GLOBAL EVANSVILLE WY,1180 IRON AVE,EVANSVILLE,WY,82636,"JOY GLOBAL EVANSVILLE WY.1180 IRON AVE, EVANSVILLE WYOMING 82636 (NATRONA)",0,C,,110005583939
8263WPHLLP59LAT,-106.25,42.854,False,56,025,001602,56,56025,56025001602,1400000US56025001602,PHILLIPS 66 CASPER TERMINAL,5090 LATHROP ROAD,EVANSVILLE,WY,82636,"PHILLIPS 66 CASPER TERMINAL.5090 LATHROP ROAD, EVANSVILLE WYOMING 82636 (NATRONA)",0,C,,110007899854
82644RCKYM6775W,-106.428,42.876000000000005,False,56,025,001700,56,56025,56025001700,1400000US56025001700,TUBOSCOPE INC ROCKY MOUNTAIN COATING PLANT,6775 W YELLOWSTONE,MILLS,WY,82644,"TUBOSCOPE INC ROCKY MOUNTAIN COATING PLANT.6775 W YELLOWSTONE, MILLS WYOMING 82644 (NATRONA)",0,C,,
82604CSTMF6750Z,-106.425,42.871,False,56,025,001700,56,56025,56025001700,1400000US56025001700,CUSTOM FIBERGLASS INC,6750 ZERO RD,CASPER,WY,82604,"CUSTOM FIBERGLASS INC.6750 ZERO RD, CASPER WYOMING 82604 (NATRONA)",0,C,,110000468173
8260WNVTBS1478N,-106.43,42.87,False,56,025,001700,56,56025,56025001700,1400000US56025001700,NOV TUBOSCOPE XL CASPER,1478 NORTH DERRICK DRIVE & 1500 NORTH DERRICK DRIV,CASPER,WY,82604,"NOV TUBOSCOPE XL CASPER.1478 NORTH DERRICK DRIVE & 1500 NORTH DERRICK DRIV, CASPER WYOMING 82604 (NATRONA)",0,C,,110055499866
8260WNVTBS741EL,-106.427,42.869,False,56,025,001700,56,56025,56025001700,1400000US56025001700,NOV TUBOSCOPE XL HARDBANDING CASPER,7041 ELTON COURT,CASPER,WY,82605,"NOV TUBOSCOPE XL HARDBANDING CASPER.7041 ELTON COURT, CASPER WYOMING 82605 (NATRONA)",0,C,,110055499875
82701WYMNG740WE,-104.215,43.851000000000006,False,56,045,951300,56,56045,56045951300,1400000US56045951300,WYOMING REFINING CO,10 STAMPEDE ST,NEWCASTLE,WY,82701,"WYOMING REFINING CO.10 STAMPEDE ST, NEWCASTLE WYOMING 82701 (WESTON)",0,C,,110000468226
82716TRRLN811ED,-105.491,44.268,False,56,005,000300,56,56005,56005000300,1400000US56005000300,TREE RELIANCE ELECTRIC,811 EDWARDS RD,GILLETTE,WY,82718,"TREE RELIANCE ELECTRIC.811 EDWARDS RD, GILLETTE WYOMING 82718 (CAMPBELL)",0,C,,
82718WYDKP48WYO,-105.38,44.292,False,56,005,000300,56,56005,56005000300,1400000US56005000300,PACIFICORP WYODAK PLANT,48 WYODAK RD,GILLETTE,WY,82718,"PACIFICORP WYODAK PLANT.48 WYODAK RD, GILLETTE WYOMING 82718 (CAMPBELL)",0,C,,110007334982
82716WSTRNEXIT2,-105.28399999999999,44.257,False,56,005,000100,56,56005,56005000100,1400000US56005000100,WESTERN STATES ENERGY,"EXIT 205, FAIRVIEW RD",GILLETTE,WY,82716,"WESTERN STATES ENERGY.EXIT 205, FAIRVIEW RD, GILLETTE WYOMING 82716 (CAMPBELL)",0,C,,
82732RCNCR121RI,-105.477,43.765,False,56,005,000100,56,56005,56005000100,1400000US56005000100,DYNO NOBEL INTERMOUNTAIN INC,121 RICHFIELD CT,WRIGHT,WY,82732,"DYNO NOBEL INTERMOUNTAIN INC.121 RICHFIELD CT, WRIGHT WYOMING 82732 (CAMPBELL)",0,C,,
82716NLSNB509T7,-105.318,44.103,False,56,005,000100,56,56005,56005000100,1400000US56005000100,NELSON BROTHERS MINING SERVICES LLC,2115 BISHOP RD,GILLETTE,WY,82717,"NELSON BROTHERS MINING SERVICES LLC.2115 BISHOP RD, GILLETTE WYOMING 82717 (CAMPBELL)",0,C,,110000600350
82716STNPW2178H,-105.37799999999999,43.943999999999996,False,56,005,000100,56,56005,56005000100,1400000US56005000100,VIKING EXPLOSIVES LLC,2178 HILITE RD,GILLETTE,WY,82718,"VIKING EXPLOSIVES LLC.2178 HILITE RD, GILLETTE WYOMING 82718 (CAMPBELL)",0,C,,110000468244
82717PWDRR2298B,-105.35700000000001,44.105,False,56,005,000100,56,56005,56005000100,1400000US56005000100,POWDER RIVER COAL CO CABALLO MINE,2298 BISHOP RD,GILLETTE,WY,82717,"POWDER RIVER COAL CO CABALLO MINE.2298 BISHOP RD, GILLETTE WYOMING 82717 (CAMPBELL)",0,C,,
82732NRTHN339AA,-105.272,43.527,False,56,005,000100,56,56005,56005000100,1400000US56005000100,NORTH ANTELOPE/ROCHELLE COMPLEX,339A ANTELOPE RD,WRIGHT,WY,82732,"NORTH ANTELOPE/ROCHELLE COMPLEX.339A ANTELOPE RD, WRIGHT WYOMING 82732 (CAMPBELL)",0,C,,
82717CRDRR748T7,-105.367,44.028999999999996,False,56,005,000100,56,56005,56005000100,1400000US56005000100,CORDERO ROJO MINE,748 T-7 RD,GILLETTE,WY,82718,"CORDERO ROJO MINE.748 T-7 RD, GILLETTE WYOMING 82718 (CAMPBELL)",0,C,,110011492900
82732KNNCT17MIL,-105.235,43.71,False,56,005,000100,56,56005,56005000100,1400000US56005000100,JACOBS RANCH MINE,17 MILES E OF RENO JUNCTION HWY 450,WRIGHT,WY,82732,"JACOBS RANCH MINE.17 MILES E OF RENO JUNCTION HWY 450, WRIGHT WYOMING 82732 (CAMPBELL)",0,C,,110008061051
82718TRTNC510RE,-105.26700000000001,43.631,False,56,005,000100,56,56005,56005000100,1400000US56005000100,TRITON COAL CO LLC  NORTH ROCHELLE MINE,510 RENO RD,GILLETTE,WY,82718,"TRITON COAL CO LLC  NORTH ROCHELLE MINE.510 RENO RD, GILLETTE WYOMING 82718 (CAMPBELL)",0,C,,
82901CHVRN525SH,-109.12799999999999,41.538000000000004,False,56,037,971200,56,56037,56037971200,1400000US56037971200,SIMPLOT PHOSPHATES LLC,515 S HWY 430,ROCK SPRINGS,WY,82901,"SIMPLOT PHOSPHATES LLC.515 S HWY 430, ROCK SPRINGS WYOMING 82901 (SWEETWATER)",0,C,,110000600369
82935CHRCH325AL,-109.758,41.589,False,56,037,970500,56,56037,56037970500,1400000US56037970500,CHURCH & DWIGHT CO INC,325 ALLIED CHEMICAL RD,GREEN RIVER,WY,82935,"CHURCH & DWIGHT CO INC.325 ALLIED CHEMICAL RD, GREEN RIVER WYOMING 82935 (SWEETWATER)",0,C,,
82935FMCCRWESTV,-109.802,41.619,False,56,037,970500,56,56037,56037970500,1400000US56037970500,FMC CORP,WESTVACO RD,GREEN RIVER,WY,82935,"FMC CORP.WESTVACO RD, GREEN RIVER WYOMING 82935 (SWEETWATER)",0,C,,
82939YRSBK1262N,-110.334,41.285,False,56,041,975200,56,56041,56041975200,1400000US56041975200,AYRES & BAKER POLE & POST INC,1262 N HWY 414,MOUNTAIN VIEW,WY,82939,"AYRES & BAKER POLE & POST INC.1262 N HWY 414, MOUNTAIN VIEW WYOMING 82939 (UINTA)",0,C,,110000600387
83101FMCCRELKOL,-110.537,41.777,False,56,023,978400,56,56023,56023978400,1400000US56023978400,ASTARIS LLC KEMMERER PLANT,ELKOL RD 7 MILES S OF KEMMERER,KEMMERER,WY,831011000,"ASTARIS LLC KEMMERER PLANT.ELKOL RD 7 MILES S OF KEMMERER, KEMMERER WYOMING 83101 (LINCOLN)",0,C,,
83110FTNNRNOUSH,-110.919,42.693999999999996,False,56,023,978100,56,56023,56023978100,1400000US56023978100,TRICON TIMBER INC,HWY 89 N,AFTON,WY,83110,"TRICON TIMBER INC.HWY 89 N, AFTON WYOMING 83110 (LINCOLN)",0,C,,
83110PLYGR167TW,-110.929,42.756,False,56,023,978100,56,56023,56023978100,1400000US56023978100,POLYGUARD,167 TWIN SPRUCE,AFTON,WY,83110,"POLYGUARD.167 TWIN SPRUCE, AFTON WYOMING 83110 (LINCOLN)",0,C,,110022448289
83127STRVLHIGHW,-111.00299999999999,42.922,False,56,023,978000,56,56023,56023978000,1400000US56023978000,STAR VALLEY CHEESE CORP,HWY 89,THAYNE,WY,83127,"STAR VALLEY CHEESE CORP.HWY 89, THAYNE WYOMING 83127 (LINCOLN)",0,C,,
83120FRDMR1FREE,-111.0,42.848,False,56,023,978000,56,56023,56023978000,1400000US56023978000,FREEDOM ARMS INC,314 HWY 239,FREEDOM,WY,83120,"FREEDOM ARMS INC.314 HWY 239, FREEDOM WYOMING 83120 (LINCOLN)",0,C,,110000468271
82602RSCNT601EA,-106.318,42.857,False,56,025,000200,56,56025,56025000200,1400000US56025000200,RESCON TECHNOLOGY CORP,601 E E ST,CASPER,WY,82602,"RESCON TECHNOLOGY CORP.601 E E ST, CASPER WYOMING 82602 (NATRONA)",0,C,,
82644WSTRN4151S,-106.366,42.841,False,56,025,001100,56,56025,56025001100,1400000US56025001100,WOTCO INC,415 1ST ST,MILLS,WY,82644,"WOTCO INC.415 1ST ST, MILLS WYOMING 82644 (NATRONA)",0,C,,
82801WYMNG2264I,-106.96799999999999,44.821000000000005,False,56,033,000400,56,56033,56033000400,1400000US56033000400,WYOMING FOREST PRODS INC,2264 INDL RD,SHERIDAN,WY,82801,"WYOMING FOREST PRODS INC.2264 INDL RD, SHERIDAN WYOMING 82801 (SHERIDAN)",0,C,,
82931XBWHYI80EX,-110.807,41.261,False,56,041,975300,56,56041,56041975300,1400000US56041975300,SILVER EAGLE REFINING-EVANSTON,2990 COUNTY RD 180,EVANSTON,WY,82930,"SILVER EAGLE REFINING-EVANSTON.2990 COUNTY RD 180, EVANSTON WYOMING 82930 (UINTA)",0,C,,110000600378
82007MRCNW1938W,-104.83,41.111000000000004,False,56,021,000300,56,56021,56021000300,1400000US56021000300,AMERICAN WYOTT CORP,1938 WYOTT DR,CHEYENNE,WY,82007,"AMERICAN WYOTT CORP.1938 WYOTT DR, CHEYENNE WYOMING 82007 (LARAMIE)",1,C,,110011680644
82520GLBRN130PO,-108.709,42.813,False,56,013,000300,56,56013,56013000300,1400000US56013000300,EAGLE BRONZE INC,130 POPPY ST,LANDER,WY,82520,"EAGLE BRONZE INC.130 POPPY ST, LANDER WYOMING 82520 (FREMONT)",0,C,,
82604CSTMF4351S,-106.381,42.806000000000004,False,56,025,001603,56,56025,56025001603,1400000US56025001603,CUSTOM FIBERGLASS INC,4351 SWINGLE ACRES RD,CASPER,WY,82604,"CUSTOM FIBERGLASS INC.4351 SWINGLE ACRES RD, CASPER WYOMING 82604 (NATRONA)",0,C,,
82190SDYLLBOX16,-110.698,44.976000000000006,False,56,029,965300,56,56029,56029965300,1400000US56029965300,US NATL PARK SERVICE YELLOWSTONE NATIONAL PARK,YELLOWSTONE NATIONAL PARK,YELLOWSTONE NATIONAL PARK,WY,82190,"US NATL PARK SERVICE YELLOWSTONE NATIONAL PARK.YELLOWSTONE NATIONAL PARK, YELLOWSTONE NATIONAL PARK WYOMING 82190 (PARK)",0,F,,110012343071
82414CRTNT88CUN,-109.05,44.545,False,56,029,965300,56,56029,56029965300,1400000US56029965300,CERTAINTEED CODY PLANT,88 COUNTY RD 2AB,CODY,WY,82414,"CERTAINTEED CODY PLANT.88 COUNTY RD 2AB, CODY WYOMING 82414 (PARK)",0,C,,110039498816
82414YTXCR1825B,-109.044,44.533,False,56,029,965400,56,56029,56029965400,1400000US56029965400,Y-TEX CORP,1825 BIG HORN AVE,CODY,WY,82414,"Y-TEX CORP.1825 BIG HORN AVE, CODY WYOMING 82414 (PARK)",0,C,,110011685140
82902MNSNTQUEAL,-109.22,41.523999999999994,False,56,037,971000,56,56037,56037971000,1400000US56037971000,P4 PRODUCTION LLC,2.5 MILES S COUNTY RD 50,ROCK SPRINGS,WY,82901,"P4 PRODUCTION LLC.2.5 MILES S COUNTY RD 50, ROCK SPRINGS WYOMING 82901 (SWEETWATER)",0,C,,110000859296
82716KFXFL3574G,-105.421,44.371,False,56,005,000700,56,56005,56005000700,1400000US56005000700,KFX PLANT #2,3574 GARNER LAKE RD,GILLETTE,WY,82717,"KFX PLANT #2.3574 GARNER LAKE RD, GILLETTE WYOMING 82717 (CAMPBELL)",0,C,,110000468235
82717PWDRR12433,-105.461,44.407,False,56,005,000700,56,56005,56005000700,1400000US56005000700,POWDER RIVER COAL CO RAWHIDE MINE,12433 N  HWY 59,GILLETTE,WY,82717,"POWDER RIVER COAL CO RAWHIDE MINE.12433 N  HWY 59, GILLETTE WYOMING 82717 (CAMPBELL)",0,C,,
82716WSTRN55MIL,-105.421,44.371,False,56,005,000700,56,56005,56005000700,1400000US56005000700,WESTERN FUELS-WYOMING INC.,3629 GARNER LAKE RD,GILLETTE,WY,82716,"WESTERN FUELS-WYOMING INC..3629 GARNER LAKE RD, GILLETTE WYOMING 82716 (CAMPBELL)",0,C,,110001933677
82717TRTNC9543N,-105.53200000000001,44.44,False,56,005,000700,56,56005,56005000700,1400000US56005000700,BUCKSKIN MINING CO GILLETTE WY,9543 N HWY 14-16,GILLETTE,WY,82716,"BUCKSKIN MINING CO GILLETTE WY.9543 N HWY 14-16, GILLETTE WYOMING 82716 (CAMPBELL)",0,C,,110012702263
8271WBSNLC1246N,-105.46,44.388000000000005,False,56,005,000700,56,56005,56005000700,1400000US56005000700,BASIN ELECTRIC  DRY FORK STATION,12460 N HIGHWAY 59,GILLETTE,WY,82716,"BASIN ELECTRIC  DRY FORK STATION.12460 N HIGHWAY 59, GILLETTE WYOMING 82716 (CAMPBELL)",0,C,,110039589585
82201LRMRV347GR,-104.887,42.104,False,56,031,959400,56,56031,56031959400,1400000US56031959400,BASIN ELECTRIC LARAMIE RIVER STATION,347 GRAYROCKS RD,WHEATLAND,WY,82201,"BASIN ELECTRIC LARAMIE RIVER STATION.347 GRAYROCKS RD, WHEATLAND WYOMING 82201 (PLATTE)",0,C,,110000468075
82201WHTLN30516,-104.963,42.051,False,56,031,959400,56,56031,56031959400,1400000US56031959400,WHEATLAND COOPERATIVE ASSOC,305 16TH ST,WHEATLAND,WY,82201,"WHEATLAND COOPERATIVE ASSOC.305 16TH ST, WHEATLAND WYOMING 82201 (PLATTE)",0,C,,
82637PCFCR1591T,-105.77600000000001,42.838,False,56,009,956600,56,56009,56009956600,1400000US56009956600,PACIFICORP DAVE JOHNSTON PLANT,1591 TANK FARM RD,GLENROCK,WY,82637,"PACIFICORP DAVE JOHNSTON PLANT.1591 TANK FARM RD, GLENROCK WYOMING 82637 (CONVERSE)",0,C,,110013320245
82633NTLPC55MIL,-105.345,43.474,False,56,009,956600,56,56009,56009956600,1400000US56009956600,ANTELOPE COAL LLC,55 MILES N OF DOUGLAS HWY 59,DOUGLAS,WY,82633,"ANTELOPE COAL LLC.55 MILES N OF DOUGLAS HWY 59, DOUGLAS WYOMING 82633 (CONVERSE)",0,C,,110008061033
8263WNTLPR27HIG,-105.274,43.02,False,56,009,956600,56,56009,56009956600,1400000US56009956600,ANTELOPE REFINING,2070 HIGHWAY 59,DOUGLAS,WY,82633,"ANTELOPE REFINING.2070 HIGHWAY 59, DOUGLAS WYOMING 82633 (CONVERSE)",1,C,,110042255234
82713BHPLS3363H,-104.412,43.97,False,56,045,951100,56,56045,56045951100,1400000US56045951100,BLACK HILLS CORP - OSAG E POWER PLANT,3363 HWY 16,OSAGE,WY,82723,"BLACK HILLS CORP - OSAG E POWER PLANT.3363 HWY 16, OSAGE WYOMING 82723 (WESTON)",0,C,,110007335605
82716NLSMP13151,-105.382,44.285,False,56,005,000200,56,56005,56005000200,1400000US56005000200,BLACK HILLS CORP - NEIL SIMPSON COMPLEX,13151 HWY 51,GILLETTE,WY,82718,"BLACK HILLS CORP - NEIL SIMPSON COMPLEX.13151 HWY 51, GILLETTE WYOMING 82718 (CAMPBELL)",0,C,,110000600341
82716PHMNP5834S,-105.476,44.244,False,56,005,000200,56,56005,56005000200,1400000US56005000200,JOY GLOBAL GILLETTE WY,5834 S WINLAND DR,GILLETTE,WY,82718,"JOY GLOBAL GILLETTE WY.5834 S WINLAND DR, GILLETTE WYOMING 82718 (CAMPBELL)",0,C,,110005584064
8271WCRLLR575SW,-105.479,44.24100000000001,False,56,005,000200,56,56005,56005000200,1400000US56005000200,CROELL 263,5750 SWANSON RD,GILLETTE,WY,82716,"CROELL 263.5750 SWANSON RD, GILLETTE WYOMING 82716 (CAMPBELL)",0,C,,110060258028
8271WNLCCM617SW,-105.479,44.239,False,56,005,000200,56,56005,56005000200,1400000US56005000200,NALCO COMPANY-GILLETTE,6170 SWANSON RD,GILLETTE,WY,82718,"NALCO COMPANY-GILLETTE.6170 SWANSON RD, GILLETTE WYOMING 82718 (CAMPBELL)",0,C,,110058912244
82942JMBRD9MILE,-108.78399999999999,41.733999999999995,False,56,037,971600,56,56037,56037971600,1400000US56037971600,PACIFICORP JIM BRIDGER PLANT & BRIDGER COAL CO,9 MILES N OF POINT OF ROCKS,POINT OF ROCKS,WY,82942,"PACIFICORP JIM BRIDGER PLANT & BRIDGER COAL CO.9 MILES N OF POINT OF ROCKS, POINT OF ROCKS WYOMING 82942 (SWEETWATER)",0,C,,110007899970
8294WBLCKBPBX98,-108.77,41.729,False,56,037,971600,56,56037,56037971600,1400000US56037971600,BLACK BUTTE COAL CO,12 MILES SE OF POINT OF ROCKS,POINT OF ROCKS,WY,82942,"BLACK BUTTE COAL CO.12 MILES SE OF POINT OF ROCKS, POINT OF ROCKS WYOMING 82942 (SWEETWATER)",0,C,,110010411731
83101NGHTN5MISO,-110.59700000000001,41.758,False,56,023,978200,56,56023,56023978200,1400000US56023978200,PACIFICORP NAUGHTON PLANT,HWY 189 S OF KEMMERER,KEMMERER,WY,83101,"PACIFICORP NAUGHTON PLANT.HWY 189 S OF KEMMERER, KEMMERER WYOMING 83101 (LINCOLN)",0,C,,110042054013
8310WRSHGS6MILE,-110.598,41.758,False,56,023,978200,56,56023,56023978200,1400000US56023978200,"ERSHIGS, INC. C/O PACIFIC CORP. ENERGY - NAUGHTON STATION",6 MILES SOUTH OF KEMMERER HIGHWAY 189,KEMMERER,WY,83101,"ERSHIGS, INC. C/O PACIFIC CORP. ENERGY - NAUGHTON STATION.6 MILES SOUTH OF KEMMERER HIGHWAY 189, KEMMERER WYOMING 83101 (LINCOLN)",1,C,,110042054013
82301CRWNS1523E,-107.211,41.788000000000004,False,56,007,967700,56,56007,56007967700,1400000US56007967700,PEAK ASPHALT LLC RAWLINS PLANT,1523 E RAILROAD ST,RAWLINS,WY,82301,"PEAK ASPHALT LLC RAWLINS PLANT.1523 E RAILROAD ST, RAWLINS WYOMING 82301 (CARBON)",0,C,,110002136171
82901FLSCH151NI,-109.234,41.618,False,56,037,970902,56,56037,56037970902,1400000US56037970902,WESTERN REFINING -DBA PILOT THOMAS LOGISTICS - ROCK SPRINGS,151 INDUSTRIAL DR,ROCK SPRINGS,WY,82901,"WESTERN REFINING -DBA PILOT THOMAS LOGISTICS - ROCK SPRINGS.151 INDUSTRIAL DR, ROCK SPRINGS WYOMING 82901 (SWEETWATER)",0,C,,110002136304
82070MNTNC5SAND,-105.603,41.261,False,56,001,962700,56,56001,56001962700,1400000US56001962700,MOUNTAIN CEMENT CO,5 SAND CREEK RD,LARAMIE,WY,82070,"MOUNTAIN CEMENT CO.5 SAND CREEK RD, LARAMIE WYOMING 82070 (ALBANY)",0,C,,110005580503
8207WKNFRV998HU,-105.584,41.278,False,56,001,962700,56,56001,56001962700,1400000US56001962700,KNIFE RIVER LARAMIE,998 HURON ST,LARAMIE,WY,82070,"KNIFE RIVER LARAMIE.998 HURON ST, LARAMIE WYOMING 82070 (ALBANY)",0,C,,110067670470
82423WYMNG30HWY,-108.625,44.996,False,56,029,965100,56,56029,56029965100,1400000US56029965100,WYOMING LIME PRODUCERS,30 HWY 310,FRANNIE,WY,82423,"WYOMING LIME PRODUCERS.30 HWY 310, FRANNIE WYOMING 82423 (PARK)",0,C,,110040969734
