TRIFID,LONGITUDE,LATITUDE,ESTIMATE,STATEFP,COUNTYFP,TRACTCE,STATEGEOID,COUNTYGEOID,TRACTGEOID,AFFGEOID,FACILITY_NAME,STREET,CITY,STUSPS,ZIP_CODE,FACILITY,FAC_CLOSED_IND,ASGN_FEDERAL_IND,BIA_CODE,EPA_REGISTRY_ID
82070LFRGW5050N,-105.59200000000001,41.328,False,56,001,963000,56,56001,56001963000,1400000US56001963000,LAFARGE WEST INC,5050 N 3RD,LARAMIE,WY,82070,"LAFARGE WEST INC.5050 N 3RD, LARAMIE WYOMING 82070 (ALBANY)",0,C,,
82331LSNPC507EB,-106.801,41.455,False,56,007,968000,56,56007,56007968000,1400000US56007968000,LOUISIANA-PACIFIC SARATOGA SAWMILL,507 E BRIDGE ST,SARATOGA,WY,82331,"LOUISIANA-PACIFIC SARATOGA SAWMILL.507 E BRIDGE ST, SARATOGA WYOMING 82331 (CARBON)",0,C,,
82005SRFRC300VE,-104.86200000000001,41.153,False,56,021,001100,56,56021,56021001100,1400000US56021001100,US DOD USAF FE WARREN AFB (PART),300 VESLE DR SUITE 600 90 CES CEIE,FE WARREN AFB,WY,82005,"US DOD USAF FE WARREN AFB (PART).300 VESLE DR SUITE 600 90 CES CEIE, FE WARREN AFB WYOMING 82005 (LARAMIE)",0,F,,110042050785
82009SRFRC217DE,-104.825,41.163999999999994,False,56,021,980801,56,56021,56021980801,1400000US56021980801,US DOD USAF WYOMING ANG,217 DELL RANGE BLVD.,CHEYENNE,WY,82009,"US DOD USAF WYOMING ANG.217 DELL RANGE BLVD., CHEYENNE WYOMING 82009 (LARAMIE)",0,F,,110015780305
82901NVRSX17TRI,-109.21700000000001,41.663999999999994,False,56,037,970800,56,56037,56037970800,1400000US56037970800,UNIVAR USA INC ROCK SPRINGS,17 TRI STATE RD W OF RELIANCE,ROCK SPRINGS,WY,82901,"UNIVAR USA INC ROCK SPRINGS.17 TRI STATE RD W OF RELIANCE, ROCK SPRINGS WYOMING 82901 (SWEETWATER)",1,C,,110021172167
83001STKRP7255S,-110.757,43.388999999999996,False,56,039,967800,56,56039,56039967800,1400000US56039967800,EVANS CONSTRUCTION,7255 S US HWY 89,JACKSON,WY,83001,"EVANS CONSTRUCTION.7255 S US HWY 89, JACKSON WYOMING 83001 (TETON)",0,C,,110015583037
82214SRMYCFREMN,-104.74,42.262,False,56,031,959100,56,56031,56031959100,1400000US56031959100,US ARMY CAMP GUERNSEY TRAINING AREAS,FREMONT AVE BLDG 015,GUERNSEY,WY,82214,"US ARMY CAMP GUERNSEY TRAINING AREAS.FREMONT AVE BLDG 015, GUERNSEY WYOMING 82214 (PLATTE)",0,F,,110020516020
82710BNTNT554US,-104.141,44.863,False,56,011,950200,56,56011,56011950200,1400000US56011950200,BENTONITE PERFORMANCE MINERALS LLC COLONY,554 US HWY 212,COLONY,WY,57717,"BENTONITE PERFORMANCE MINERALS LLC COLONY.554 US HWY 212, COLONY WYOMING 57717 (CROOK)",0,C,,110010411624
83012SNTLPPBX17,-110.71700000000001,43.656000000000006,False,56,039,967600,56,56039,56039967600,1400000US56039967600,US NATL PARK SERVICE GRAND TETON NATIONAL PARK (GRTE),GRAND TETON NATIONAL PARK,MOOSE,WY,83012,"US NATL PARK SERVICE GRAND TETON NATIONAL PARK (GRTE).GRAND TETON NATIONAL PARK, MOOSE WYOMING 83012 (TETON)",0,F,,110022411585
82007KNFRV4875S,-104.745,41.123000000000005,False,56,021,002000,56,56021,56021002000,1400000US56021002000,KNIFE RIVER CHEYENNE,4875 S INDUSTRIAL SERVICE RD,CHEYENNE,WY,82007,"KNIFE RIVER CHEYENNE.4875 S INDUSTRIAL SERVICE RD, CHEYENNE WYOMING 82007 (LARAMIE)",0,C,,110037148164
82930SGLCR1375U,-110.98299999999999,41.277,False,56,041,975400,56,56041,56041975400,1400000US56041975400,EVANSTON CARBON FIBER,1375 UNION RD,EVANSTON,WY,82930,"EVANSTON CARBON FIBER.1375 UNION RD, EVANSTON WYOMING 82930 (UINTA)",0,C,,110046371706
8293WRLDYN1ADMI,-111.00399999999999,41.354,False,56,041,975400,56,56041,56041975400,1400000US56041975400,RELADYNE WEST,1 ADMIRAL NIMITZ DR,EVANSTON,WY,82930,"RELADYNE WEST.1 ADMIRAL NIMITZ DR, EVANSTON WYOMING 82930 (UINTA)",0,C,,110070068337
8200WMNTNS4511S,-104.75399999999999,41.123999999999995,False,56,021,000402,56,56021,56021000402,1400000US56021000402,WESTERN STATES ASPHALT,4511 SOUTH INDUSTRIAL ROAD,CHEYENNE,WY,82007,"WESTERN STATES ASPHALT.4511 SOUTH INDUSTRIAL ROAD, CHEYENNE WYOMING 82007 (LARAMIE)",0,C,,110042003051
8200WCRFCN325RA,-104.749,41.12,False,56,021,000402,56,56021,56021000402,1400000US56021000402,CRAFCO INC - CHEYENNE,325 ROAD 128A,CHEYENNE,WY,82007,"CRAFCO INC - CHEYENNE.325 ROAD 128A, CHEYENNE WYOMING 82007 (LARAMIE)",0,C,,110043694794
8280WLHNDS199CM,-106.934,44.776,False,56,033,000500,56,56033,56033000500,1400000US56033000500,L&H INDUSTRIAL INC,1909 COMMERCIAL AVE.,SHERIDAN,WY,82801,"L&H INDUSTRIAL INC.1909 COMMERCIAL AVE., SHERIDAN WYOMING 82801 (SHERIDAN)",0,C,,110005578428
8280WPHLLP344US,-106.90299999999999,44.665,False,56,033,000500,56,56033,56033000500,1400000US56033000500,PHILLIPS 66 CO SHERIDAN TERMINAL,3404 US HWY 87,SHERIDAN,WY,82801,"PHILLIPS 66 CO SHERIDAN TERMINAL.3404 US HWY 87, SHERIDAN WYOMING 82801 (SHERIDAN)",0,C,,110024281123
8200WCRLLR819E1,-104.805,41.135,False,56,021,000700,56,56021,56021000700,1400000US56021000700,CROELL 303,819 E 15TH STREET,CHEYENNE,WY,82001,"CROELL 303.819 E 15TH STREET, CHEYENNE WYOMING 82001 (LARAMIE)",0,C,,110060258689
82414CDYLB61YEL,-109.08,44.516999999999996,False,56,029,965500,56,56029,56029965500,1400000US56029965500,CODY LABORATORIES INC,601 YELLOWSTONE AVE,CODY,WY,82414,"CODY LABORATORIES INC.601 YELLOWSTONE AVE, CODY WYOMING 82414 (PARK)",0,C,,110042053915
8290WSMNSP31KIL,-109.23899999999999,41.631,False,56,037,970901,56,56037,56037970901,1400000US56037970901,SIMONS PETROLEUM INC WYOMING BULK PLANT,3001 KILLPECKER DR,ROCK SPRINGS,WY,82901,"SIMONS PETROLEUM INC WYOMING BULK PLANT.3001 KILLPECKER DR, ROCK SPRINGS WYOMING 82901 (SWEETWATER)",1,C,,110031389922
8293WCHMPN15PLE,-109.463,41.515,False,56,037,970601,56,56037,56037970601,1400000US56037970601,"CHAMPION TECHNOLOGIES, INC.",15 PLEASANT WAY,GREEN RIVER,WY,82935,"CHAMPION TECHNOLOGIES, INC..15 PLEASANT WAY, GREEN RIVER WYOMING 82935 (SWEETWATER)",1,C,,110037450326
8311WRPRDC1HELI,-110.113,42.489,False,56,035,000101,56,56035,56035000101,1400000US56035000101,AIR PRODUCTS & CHEMICALS INC  APMTG FACILITY,1 HELIUM LANE,BIG PINEY,WY,831131109,"AIR PRODUCTS & CHEMICALS INC  APMTG FACILITY.1 HELIUM LANE, BIG PINEY WYOMING 83113 (SUBLETTE)",0,C,,110055499884
8290WSNRCC57SMI,-109.23100000000001,41.581,False,56,037,970903,56,56037,56037970903,1400000US56037970903,SUNROC CORP - ROCK SPRINGS FACILITY,507 SMITH STREET,ROCK SPRINGS,WY,82901,"SUNROC CORP - ROCK SPRINGS FACILITY.507 SMITH STREET, ROCK SPRINGS WYOMING 82901 (SWEETWATER)",0,C,,110060261657
8290WMLTCH1751B,-109.242,41.57,False,56,037,970903,56,56037,56037970903,1400000US56037970903,MULTI-CHEM GROUP LLC,1751 BLAIR TOWN RD,ROCK SPRINGS,WY,82901,"MULTI-CHEM GROUP LLC.1751 BLAIR TOWN RD, ROCK SPRINGS WYOMING 82901 (SWEETWATER)",1,C,,110037449008
8290WNLCCM359BL,-109.29799999999999,41.552,False,56,037,970903,56,56037,56037970903,1400000US56037970903,NALCO COMPANY-ROCK SPRINGS,359 BLAIRTOWN RD,ROCK SPRINGS,WY,82901,"NALCO COMPANY-ROCK SPRINGS.359 BLAIRTOWN RD, ROCK SPRINGS WYOMING 82901 (SWEETWATER)",1,C,,110063691296
8244WCHMPN169HW,-108.219,43.629,False,56,017,967900,56,56017,56017967900,1400000US56017967900,NALCO COMPANY-THERMOPOLIS,169 HWY 20 S,THERMOPOLIS,WY,82443,"NALCO COMPANY-THERMOPOLIS.169 HWY 20 S, THERMOPOLIS WYOMING 82443 (HOT SPRINGS)",0,C,,110043590156
8292WNLCCM4JAME,-109.631,42.603,False,56,035,000102,56,56035,56035000102,1400000US56035000102,NALCO COMPANY-BOULDER,40 JAMES FAIRBANKS LN,BOULDER,WY,82923,"NALCO COMPANY-BOULDER.40 JAMES FAIRBANKS LN, BOULDER WYOMING 82923 (SUBLETTE)",0,C,,110042255136
8207WPTLNS445JN,-105.541,41.473,False,56,001,963900,56,56001,56001963900,1400000US56001963900,PETE LIEN & SONS INC - JONATHON LIME PLANT,445 JONATHON QUARRY HAUL RD.,LARAMIE,WY,82072,"PETE LIEN & SONS INC - JONATHON LIME PLANT.445 JONATHON QUARRY HAUL RD., LARAMIE WYOMING 82072 (ALBANY)",0,C,,110070068089
